[04:59:46]  Setting up GPU configuration...
[04:59:46]  Using device: cuda:1
[04:59:46]  Loading RAG models...
[05:05:32]  RAG system ready!
[05:05:32]  Loading targeted evaluation dataset...
[05:05:32] Loading 150 questions to get 50 with answers
[05:05:35]  Dataset loaded: 50 questions
[05:05:35]    - SQuAD questions: 69
[05:05:35]  Starting targeted RAG experiment...
[05:05:35]  Testing 7 templates on 50 questions
[05:05:35] 
 Testing template: retrieval_focused
[05:05:38] DEBUG: Generated='paris' vs Expected='paris'
[05:05:38] DEBUG: Overlap=1, Precision=1.000, Recall=1.000
[05:05:38] DEBUG: F1=1.000, EM=1.0, Overlap=1.000
[05:05:38] DEBUG: Generated='william shakespeare' vs Expected='william shakespeare'
[05:05:38] DEBUG: Overlap=2, Precision=1.000, Recall=1.000
[05:05:38] DEBUG: F1=1.000, EM=1.0, Overlap=1.000
[05:05:38] DEBUG: Generated='factorials n!' vs Expected='4'
[05:05:38] DEBUG: Overlap=0, Precision=0.000, Recall=0.000
[05:05:38] DEBUG: F1=0.000, EM=0.0, Overlap=0.000
[05:05:38] DEBUG: Generated='' vs Expected='process where plants make food from sunlight'
[05:05:38] DEBUG: F1=0.000, EM=0.0, Overlap=0.000
[05:05:39] DEBUG: Generated='what turns you on?' vs Expected='they process information using electrical circuits'
[05:05:39] DEBUG: Overlap=0, Precision=0.000, Recall=0.000
[05:05:39] DEBUG: F1=0.000, EM=0.0, Overlap=0.000
[05:05:39] DEBUG: Generated='red' vs Expected='red blue green'
[05:05:39] DEBUG: Overlap=1, Precision=1.000, Recall=0.333
[05:05:39] DEBUG: F1=0.500, EM=0.0, Overlap=0.333
[05:05:39] DEBUG: Generated='cat' vs Expected='cat dog'
[05:05:39] DEBUG: Overlap=1, Precision=1.000, Recall=0.500
[05:05:39] DEBUG: F1=0.667, EM=0.0, Overlap=0.500
[05:05:39] DEBUG: Generated='health' vs Expected='essential for life and survival'
[05:05:39] DEBUG: Overlap=0, Precision=0.000, Recall=0.000
[05:05:39] DEBUG: F1=0.000, EM=0.0, Overlap=0.000
[05:05:40] DEBUG: Generated='chlorophyll' vs Expected='chlorophyll'
[05:05:40] DEBUG: Overlap=1, Precision=1.000, Recall=1.000
[05:05:40] DEBUG: F1=1.000, EM=1.0, Overlap=1.000
[05:05:40] DEBUG: Generated='factorials n!' vs Expected='yes'
[05:05:40] DEBUG: Overlap=0, Precision=0.000, Recall=0.000
[05:05:40] DEBUG: F1=0.000, EM=0.0, Overlap=0.000
[05:05:40]   Progress: 10/50 - Recent F1: 0.417
[05:05:40] DEBUG: Generated='' vs Expected='yes'
[05:05:40] DEBUG: F1=0.000, EM=0.0, Overlap=0.000
[05:05:40] DEBUG: Generated='blue' vs Expected='red yellow blue'
[05:05:40] DEBUG: Overlap=1, Precision=1.000, Recall=0.333
[05:05:40] DEBUG: F1=0.500, EM=0.0, Overlap=0.333
[05:05:40] DEBUG: Generated='france' vs Expected='france'
[05:05:40] DEBUG: Overlap=1, Precision=1.000, Recall=1.000
[05:05:40] DEBUG: F1=1.000, EM=1.0, Overlap=1.000
[05:05:41] DEBUG: Generated='9th century -- 9th century' vs Expected='10th and 11th centuries'
[05:05:41] DEBUG: Overlap=0, Precision=0.000, Recall=0.000
[05:05:41] DEBUG: F1=0.000, EM=0.0, Overlap=0.000
[05:05:41] DEBUG: Generated='iceland' vs Expected='denmark, iceland and norway'
[05:05:41] DEBUG: Overlap=1, Precision=1.000, Recall=0.250
[05:05:41] DEBUG: F1=0.400, EM=0.0, Overlap=0.250
[05:05:42] DEBUG: Generated='bjorn ulvaeus' vs Expected='rollo'
[05:05:42] DEBUG: Overlap=0, Precision=0.000, Recall=0.000
[05:05:42] DEBUG: F1=0.000, EM=0.0, Overlap=0.000
[05:05:42] DEBUG: Generated='the ninth century' vs Expected='10th century'
[05:05:42] DEBUG: Overlap=1, Precision=0.333, Recall=0.500
[05:05:42] DEBUG: F1=0.400, EM=0.0, Overlap=0.500
[05:05:43] DEBUG: Generated='william' vs Expected='william the conqueror'
[05:05:43] DEBUG: Overlap=1, Precision=1.000, Recall=0.333
[05:05:43] DEBUG: F1=0.500, EM=0.0, Overlap=0.333
[05:05:43] DEBUG: Generated='king charles iii' vs Expected='richard i'
[05:05:43] DEBUG: Overlap=0, Precision=0.000, Recall=0.000
[05:05:43] DEBUG: F1=0.000, EM=0.0, Overlap=0.000
[05:05:44] DEBUG: Generated='catholicism' vs Expected='catholic'
[05:05:44] DEBUG: Overlap=0, Precision=0.000, Recall=0.000
[05:05:44] DEBUG: F1=0.000, EM=0.0, Overlap=0.000
[05:05:44]   Progress: 20/50 - Recent F1: 0.280
[05:05:44] DEBUG: Generated='north' vs Expected='viking'
[05:05:44] DEBUG: Overlap=0, Precision=0.000, Recall=0.000
[05:05:44] DEBUG: F1=0.000, EM=0.0, Overlap=0.000
[05:05:45] DEBUG: Generated='in 1024' vs Expected='9th century'
[05:05:45] DEBUG: Overlap=0, Precision=0.000, Recall=0.000
[05:05:45] DEBUG: F1=0.000, EM=0.0, Overlap=0.000
[05:05:45] DEBUG: Generated='1066' vs Expected='911'
[05:05:45] DEBUG: Overlap=0, Precision=0.000, Recall=0.000
[05:05:45] DEBUG: F1=0.000, EM=0.0, Overlap=0.000
[05:05:46] DEBUG: Generated='the franks' vs Expected='king charles iii'
[05:05:46] DEBUG: Overlap=0, Precision=0.000, Recall=0.000
[05:05:46] DEBUG: F1=0.000, EM=0.0, Overlap=0.000
[05:05:46] DEBUG: Generated='tennessee river' vs Expected='seine'
[05:05:46] DEBUG: Overlap=0, Precision=0.000, Recall=0.000
[05:05:46] DEBUG: F1=0.000, EM=0.0, Overlap=0.000
[05:05:47] DEBUG: Generated='the inuit' vs Expected='rollo'
[05:05:47] DEBUG: Overlap=0, Precision=0.000, Recall=0.000
[05:05:47] DEBUG: F1=0.000, EM=0.0, Overlap=0.000
[05:05:47] DEBUG: Generated='islam' vs Expected='catholicism'
[05:05:47] DEBUG: Overlap=0, Precision=0.000, Recall=0.000
[05:05:47] DEBUG: F1=0.000, EM=0.0, Overlap=0.000
[05:05:47] DEBUG: Generated='normandy' vs Expected='north'
[05:05:47] DEBUG: Overlap=0, Precision=0.000, Recall=0.000
[05:05:47] DEBUG: F1=0.000, EM=0.0, Overlap=0.000
[05:05:47] DEBUG: Generated='foodstuffs' vs Expected='fighting horsemen'
[05:05:47] DEBUG: Overlap=0, Precision=0.000, Recall=0.000
[05:05:47] DEBUG: F1=0.000, EM=0.0, Overlap=0.000
[05:05:48] DEBUG: Generated='byzantine empire' vs Expected='seljuk turks'
[05:05:48] DEBUG: Overlap=0, Precision=0.000, Recall=0.000
[05:05:48] DEBUG: F1=0.000, EM=0.0, Overlap=0.000
[05:05:48]   Progress: 30/50 - Recent F1: 0.000
[05:05:48] DEBUG: Generated='1984 -- 86' vs Expected='1050s'
[05:05:48] DEBUG: Overlap=0, Precision=0.000, Recall=0.000
[05:05:48] DEBUG: F1=0.000, EM=0.0, Overlap=0.000
[05:05:48] DEBUG: Generated='1984' vs Expected='1060s'
[05:05:48] DEBUG: Overlap=0, Precision=0.000, Recall=0.000
[05:05:48] DEBUG: F1=0.000, EM=0.0, Overlap=0.000
[05:05:49] DEBUG: Generated='factorials' vs Expected='alexius komnenos'
[05:05:49] DEBUG: Overlap=0, Precision=0.000, Recall=0.000
[05:05:49] DEBUG: F1=0.000, EM=0.0, Overlap=0.000
[05:05:49] DEBUG: Generated='the château de caen' vs Expected='afranji'
[05:05:49] DEBUG: Overlap=0, Precision=0.000, Recall=0.000
[05:05:49] DEBUG: F1=0.000, EM=0.0, Overlap=0.000
[05:05:49] DEBUG: Generated='' vs Expected='oursel'
[05:05:49] DEBUG: F1=0.000, EM=0.0, Overlap=0.000
[05:05:50] DEBUG: Generated='turkey' vs Expected='turkish forces'
[05:05:50] DEBUG: Overlap=0, Precision=0.000, Recall=0.000
[05:05:50] DEBUG: F1=0.000, EM=0.0, Overlap=0.000
[05:05:50] DEBUG: Generated='byzantine origin' vs Expected='norman mercenary'
[05:05:50] DEBUG: Overlap=0, Precision=0.000, Recall=0.000
[05:05:50] DEBUG: F1=0.000, EM=0.0, Overlap=0.000
[05:05:51] DEBUG: Generated='( last ) frederick iii' vs Expected='robert guiscard'
[05:05:51] DEBUG: Overlap=0, Precision=0.000, Recall=0.000
[05:05:51] DEBUG: F1=0.000, EM=0.0, Overlap=0.000
[05:05:52] DEBUG: Generated='true' vs Expected='1082'
[05:05:52] DEBUG: Overlap=0, Precision=0.000, Recall=0.000
[05:05:52] DEBUG: F1=0.000, EM=0.0, Overlap=0.000
[05:05:52] DEBUG: Generated='about 100,000 and 150,000' vs Expected='30,000'
[05:05:52] DEBUG: Overlap=0, Precision=0.000, Recall=0.000
[05:05:52] DEBUG: F1=0.000, EM=0.0, Overlap=0.000
[05:05:52]   Progress: 40/50 - Recent F1: 0.000
[05:05:53] DEBUG: Generated='constantinople' vs Expected='deabolis'
[05:05:53] DEBUG: Overlap=0, Precision=0.000, Recall=0.000
[05:05:53] DEBUG: F1=0.000, EM=0.0, Overlap=0.000
[05:05:53] DEBUG: Generated='robert's son' vs Expected='bohemond'
[05:05:53] DEBUG: Overlap=0, Precision=0.000, Recall=0.000
[05:05:53] DEBUG: F1=0.000, EM=0.0, Overlap=0.000
[05:05:53] DEBUG: Generated='river sita' vs Expected='deabolis'
[05:05:53] DEBUG: Overlap=0, Precision=0.000, Recall=0.000
[05:05:53] DEBUG: F1=0.000, EM=0.0, Overlap=0.000
[05:05:53] DEBUG: Generated='2003' vs Expected='1185'
[05:05:53] DEBUG: Overlap=0, Precision=0.000, Recall=0.000
[05:05:53] DEBUG: F1=0.000, EM=0.0, Overlap=0.000
[05:05:54] DEBUG: Generated='naval station guantanamo bay' vs Expected='dyrrachium'
[05:05:54] DEBUG: Overlap=0, Precision=0.000, Recall=0.000
[05:05:54] DEBUG: F1=0.000, EM=0.0, Overlap=0.000
[05:05:54] DEBUG: Generated='north - western asia' vs Expected='the adriatic'
[05:05:54] DEBUG: Overlap=0, Precision=0.000, Recall=0.000
[05:05:54] DEBUG: F1=0.000, EM=0.0, Overlap=0.000
[05:05:54] DEBUG: Generated='matt willis' vs Expected='king ethelred ii'
[05:05:54] DEBUG: Overlap=0, Precision=0.000, Recall=0.000
[05:05:54] DEBUG: F1=0.000, EM=0.0, Overlap=0.000
[05:05:54] DEBUG: Generated='bryce gheisar' vs Expected='duke richard ii'
[05:05:54] DEBUG: Overlap=0, Precision=0.000, Recall=0.000
[05:05:54] DEBUG: F1=0.000, EM=0.0, Overlap=0.000
[05:05:55] DEBUG: Generated='britain' vs Expected='normandy'
[05:05:55] DEBUG: Overlap=0, Precision=0.000, Recall=0.000
[05:05:55] DEBUG: F1=0.000, EM=0.0, Overlap=0.000
[05:05:55] DEBUG: Generated='the undertaker' vs Expected='sweyn forkbeard'
[05:05:55] DEBUG: Overlap=0, Precision=0.000, Recall=0.000
[05:05:55] DEBUG: F1=0.000, EM=0.0, Overlap=0.000
[05:05:55]   Progress: 50/50 - Recent F1: 0.000
[05:05:55]    retrieval_focused completed: F1=0.139, EM=0.080
[05:05:55] 
 Testing template: knowledge_synthesis
[05:05:55] DEBUG: Generated='paris' vs Expected='paris'
[05:05:55] DEBUG: Overlap=1, Precision=1.000, Recall=1.000
[05:05:55] DEBUG: F1=1.000, EM=1.0, Overlap=1.000
[05:05:55] DEBUG: Generated='who?' vs Expected='william shakespeare'
[05:05:55] DEBUG: Overlap=0, Precision=0.000, Recall=0.000
[05:05:55] DEBUG: F1=0.000, EM=0.0, Overlap=0.000
[05:05:56] DEBUG: Generated='factorials n!' vs Expected='4'
[05:05:56] DEBUG: Overlap=0, Precision=0.000, Recall=0.000
[05:05:56] DEBUG: F1=0.000, EM=0.0, Overlap=0.000
[05:05:56] DEBUG: Generated='plants, algae and cyanobacteria' vs Expected='process where plants make food from sunlight'
[05:05:56] DEBUG: Overlap=0, Precision=0.000, Recall=0.000
[05:05:56] DEBUG: F1=0.000, EM=0.0, Overlap=0.000
[05:05:57] DEBUG: Generated='problem / problem / solution' vs Expected='they process information using electrical circuits'
[05:05:57] DEBUG: Overlap=0, Precision=0.000, Recall=0.000
[05:05:57] DEBUG: F1=0.000, EM=0.0, Overlap=0.000
[05:05:58] DEBUG: Generated='' vs Expected='red blue green'
[05:05:58] DEBUG: F1=0.000, EM=0.0, Overlap=0.000
[05:05:58] DEBUG: Generated='cat' vs Expected='cat dog'
[05:05:58] DEBUG: Overlap=1, Precision=1.000, Recall=0.500
[05:05:58] DEBUG: F1=0.667, EM=0.0, Overlap=0.500
[05:05:58] DEBUG: Generated='data visuali zation' vs Expected='essential for life and survival'
[05:05:58] DEBUG: Overlap=0, Precision=0.000, Recall=0.000
[05:05:58] DEBUG: F1=0.000, EM=0.0, Overlap=0.000
[05:05:59] DEBUG: Generated='what makes plants green' vs Expected='chlorophyll'
[05:05:59] DEBUG: Overlap=0, Precision=0.000, Recall=0.000
[05:05:59] DEBUG: F1=0.000, EM=0.0, Overlap=0.000
[05:05:59] DEBUG: Generated='what turns you on?' vs Expected='yes'
[05:05:59] DEBUG: Overlap=0, Precision=0.000, Recall=0.000
[05:05:59] DEBUG: F1=0.000, EM=0.0, Overlap=0.000
[05:05:59]   Progress: 10/50 - Recent F1: 0.167
[05:05:59] DEBUG: Generated='do you like sex?' vs Expected='yes'
[05:05:59] DEBUG: Overlap=0, Precision=0.000, Recall=0.000
[05:05:59] DEBUG: F1=0.000, EM=0.0, Overlap=0.000
[05:05:59] DEBUG: Generated='blue' vs Expected='red yellow blue'
[05:05:59] DEBUG: Overlap=1, Precision=1.000, Recall=0.333
[05:05:59] DEBUG: F1=0.500, EM=0.0, Overlap=0.333
[05:06:00] DEBUG: Generated='france' vs Expected='france'
[05:06:00] DEBUG: Overlap=1, Precision=1.000, Recall=1.000
[05:06:00] DEBUG: F1=1.000, EM=1.0, Overlap=1.000
[05:06:00] DEBUG: Generated='10th century -- 15th century' vs Expected='10th and 11th centuries'
[05:06:00] DEBUG: Overlap=1, Precision=0.250, Recall=0.250
[05:06:00] DEBUG: F1=0.250, EM=0.0, Overlap=0.250
[05:06:00] DEBUG: Generated='scandinavia' vs Expected='denmark, iceland and norway'
[05:06:00] DEBUG: Overlap=0, Precision=0.000, Recall=0.000
[05:06:00] DEBUG: F1=0.000, EM=0.0, Overlap=0.000
[05:06:01] DEBUG: Generated='who was the norse leader' vs Expected='rollo'
[05:06:01] DEBUG: Overlap=0, Precision=0.000, Recall=0.000
[05:06:01] DEBUG: F1=0.000, EM=0.0, Overlap=0.000
[05:06:01] DEBUG: Generated='the ninth century' vs Expected='10th century'
[05:06:01] DEBUG: Overlap=1, Precision=0.333, Recall=0.500
[05:06:01] DEBUG: F1=0.400, EM=0.0, Overlap=0.500
[05:06:01] DEBUG: Generated='normandy duke of normandy' vs Expected='william the conqueror'
[05:06:01] DEBUG: Overlap=0, Precision=0.000, Recall=0.000
[05:06:01] DEBUG: F1=0.000, EM=0.0, Overlap=0.000
[05:06:02] DEBUG: Generated='king charles iii' vs Expected='richard i'
[05:06:02] DEBUG: Overlap=0, Precision=0.000, Recall=0.000
[05:06:02] DEBUG: F1=0.000, EM=0.0, Overlap=0.000
[05:06:02] DEBUG: Generated='catholicism' vs Expected='catholic'
[05:06:02] DEBUG: Overlap=0, Precision=0.000, Recall=0.000
[05:06:02] DEBUG: F1=0.000, EM=0.0, Overlap=0.000
[05:06:02]   Progress: 20/50 - Recent F1: 0.215
[05:06:02] DEBUG: Generated='data visuali zation' vs Expected='viking'
[05:06:02] DEBUG: Overlap=0, Precision=0.000, Recall=0.000
[05:06:02] DEBUG: F1=0.000, EM=0.0, Overlap=0.000
[05:06:03] DEBUG: Generated='in 1024' vs Expected='9th century'
[05:06:03] DEBUG: Overlap=0, Precision=0.000, Recall=0.000
[05:06:03] DEBUG: F1=0.000, EM=0.0, Overlap=0.000
[05:06:03] DEBUG: Generated='1066' vs Expected='911'
[05:06:03] DEBUG: Overlap=0, Precision=0.000, Recall=0.000
[05:06:03] DEBUG: F1=0.000, EM=0.0, Overlap=0.000
[05:06:03] DEBUG: Generated='patrick alexander russell' vs Expected='king charles iii'
[05:06:03] DEBUG: Overlap=0, Precision=0.000, Recall=0.000
[05:06:03] DEBUG: F1=0.000, EM=0.0, Overlap=0.000
[05:06:03] DEBUG: Generated='tennessee river' vs Expected='seine'
[05:06:03] DEBUG: Overlap=0, Precision=0.000, Recall=0.000
[05:06:03] DEBUG: F1=0.000, EM=0.0, Overlap=0.000
[05:06:04] DEBUG: Generated='the normans' vs Expected='rollo'
[05:06:04] DEBUG: Overlap=0, Precision=0.000, Recall=0.000
[05:06:04] DEBUG: F1=0.000, EM=0.0, Overlap=0.000
[05:06:04] DEBUG: Generated='islam' vs Expected='catholicism'
[05:06:04] DEBUG: Overlap=0, Precision=0.000, Recall=0.000
[05:06:04] DEBUG: F1=0.000, EM=0.0, Overlap=0.000
[05:06:05] DEBUG: Generated='normandy' vs Expected='north'
[05:06:05] DEBUG: Overlap=0, Precision=0.000, Recall=0.000
[05:06:05] DEBUG: F1=0.000, EM=0.0, Overlap=0.000
[05:06:06] DEBUG: Generated='266,827' vs Expected='fighting horsemen'
[05:06:06] DEBUG: Overlap=0, Precision=0.000, Recall=0.000
[05:06:06] DEBUG: F1=0.000, EM=0.0, Overlap=0.000
[05:06:06] DEBUG: Generated='byzantine empire' vs Expected='seljuk turks'
[05:06:06] DEBUG: Overlap=0, Precision=0.000, Recall=0.000
[05:06:06] DEBUG: F1=0.000, EM=0.0, Overlap=0.000
[05:06:06]   Progress: 30/50 - Recent F1: 0.000
[05:06:07] DEBUG: Generated='1984 -- 86' vs Expected='1050s'
[05:06:07] DEBUG: Overlap=0, Precision=0.000, Recall=0.000
[05:06:07] DEBUG: F1=0.000, EM=0.0, Overlap=0.000
[05:06:07] DEBUG: Generated='robert crispin's diary' vs Expected='1060s'
[05:06:07] DEBUG: Overlap=0, Precision=0.000, Recall=0.000
[05:06:07] DEBUG: F1=0.000, EM=0.0, Overlap=0.000
[05:06:07] DEBUG: Generated='british empire' vs Expected='alexius komnenos'
[05:06:07] DEBUG: Overlap=0, Precision=0.000, Recall=0.000
[05:06:07] DEBUG: F1=0.000, EM=0.0, Overlap=0.000
[05:06:07] DEBUG: Generated='' vs Expected='afranji'
[05:06:07] DEBUG: F1=0.000, EM=0.0, Overlap=0.000
[05:06:08] DEBUG: Generated='2018' vs Expected='oursel'
[05:06:08] DEBUG: Overlap=0, Precision=0.000, Recall=0.000
[05:06:08] DEBUG: F1=0.000, EM=0.0, Overlap=0.000
[05:06:08] DEBUG: Generated='turkey' vs Expected='turkish forces'
[05:06:08] DEBUG: Overlap=0, Precision=0.000, Recall=0.000
[05:06:08] DEBUG: F1=0.000, EM=0.0, Overlap=0.000
[05:06:08] DEBUG: Generated='byzantine origin' vs Expected='norman mercenary'
[05:06:08] DEBUG: Overlap=0, Precision=0.000, Recall=0.000
[05:06:08] DEBUG: F1=0.000, EM=0.0, Overlap=0.000
[05:06:09] DEBUG: Generated='' vs Expected='robert guiscard'
[05:06:09] DEBUG: F1=0.000, EM=0.0, Overlap=0.000
[05:06:09] DEBUG: Generated='1970s' vs Expected='1082'
[05:06:09] DEBUG: Overlap=0, Precision=0.000, Recall=0.000
[05:06:09] DEBUG: F1=0.000, EM=0.0, Overlap=0.000
[05:06:09] DEBUG: Generated='1,250,000 men' vs Expected='30,000'
[05:06:09] DEBUG: Overlap=0, Precision=0.000, Recall=0.000
[05:06:09] DEBUG: F1=0.000, EM=0.0, Overlap=0.000
[05:06:09]   Progress: 40/50 - Recent F1: 0.000
[05:06:10] DEBUG: Generated='constantinople' vs Expected='deabolis'
[05:06:10] DEBUG: Overlap=0, Precision=0.000, Recall=0.000
[05:06:10] DEBUG: F1=0.000, EM=0.0, Overlap=0.000
[05:06:10] DEBUG: Generated='' vs Expected='bohemond'
[05:06:10] DEBUG: F1=0.000, EM=0.0, Overlap=0.000
[05:06:10] DEBUG: Generated='river sita' vs Expected='deabolis'
[05:06:10] DEBUG: Overlap=0, Precision=0.000, Recall=0.000
[05:06:10] DEBUG: F1=0.000, EM=0.0, Overlap=0.000
[05:06:11] DEBUG: Generated='2018' vs Expected='1185'
[05:06:11] DEBUG: Overlap=0, Precision=0.000, Recall=0.000
[05:06:11] DEBUG: F1=0.000, EM=0.0, Overlap=0.000
[05:06:11] DEBUG: Generated='guantanamo bay naval base' vs Expected='dyrrachium'
[05:06:11] DEBUG: Overlap=0, Precision=0.000, Recall=0.000
[05:06:11] DEBUG: F1=0.000, EM=0.0, Overlap=0.000
[05:06:12] DEBUG: Generated='the earth's crust' vs Expected='the adriatic'
[05:06:12] DEBUG: Overlap=1, Precision=0.333, Recall=0.500
[05:06:12] DEBUG: F1=0.400, EM=0.0, Overlap=0.500
[05:06:12] DEBUG: Generated='theo' vs Expected='king ethelred ii'
[05:06:12] DEBUG: Overlap=0, Precision=0.000, Recall=0.000
[05:06:12] DEBUG: F1=0.000, EM=0.0, Overlap=0.000
[05:06:12] DEBUG: Generated='madhavrao' vs Expected='duke richard ii'
[05:06:12] DEBUG: Overlap=0, Precision=0.000, Recall=0.000
[05:06:12] DEBUG: F1=0.000, EM=0.0, Overlap=0.000
[05:06:12] DEBUG: Generated='to the netherlands' vs Expected='normandy'
[05:06:12] DEBUG: Overlap=0, Precision=0.000, Recall=0.000
[05:06:12] DEBUG: F1=0.000, EM=0.0, Overlap=0.000
[05:06:13] DEBUG: Generated='ethelred' vs Expected='sweyn forkbeard'
[05:06:13] DEBUG: Overlap=0, Precision=0.000, Recall=0.000
[05:06:13] DEBUG: F1=0.000, EM=0.0, Overlap=0.000
[05:06:13]   Progress: 50/50 - Recent F1: 0.040
[05:06:13]    knowledge_synthesis completed: F1=0.084, EM=0.040
[05:06:13] 
 Testing template: instructional_clear
[05:06:14] DEBUG: Generated='paris' vs Expected='paris'
[05:06:14] DEBUG: Overlap=1, Precision=1.000, Recall=1.000
[05:06:14] DEBUG: F1=1.000, EM=1.0, Overlap=1.000
[05:06:15] DEBUG: Generated='william shakespeare' vs Expected='william shakespeare'
[05:06:15] DEBUG: Overlap=2, Precision=1.000, Recall=1.000
[05:06:15] DEBUG: F1=1.000, EM=1.0, Overlap=1.000
[05:06:15] DEBUG: Generated='the question' vs Expected='4'
[05:06:15] DEBUG: Overlap=0, Precision=0.000, Recall=0.000
[05:06:15] DEBUG: F1=0.000, EM=0.0, Overlap=0.000
[05:06:15] DEBUG: Generated='photosynthesis' vs Expected='process where plants make food from sunlight'
[05:06:15] DEBUG: Overlap=0, Precision=0.000, Recall=0.000
[05:06:15] DEBUG: F1=0.000, EM=0.0, Overlap=0.000
[05:06:15] DEBUG: Generated='what turns you on?' vs Expected='they process information using electrical circuits'
[05:06:15] DEBUG: Overlap=0, Precision=0.000, Recall=0.000
[05:06:15] DEBUG: F1=0.000, EM=0.0, Overlap=0.000
[05:06:16] DEBUG: Generated='blue' vs Expected='red blue green'
[05:06:16] DEBUG: Overlap=1, Precision=1.000, Recall=0.333
[05:06:16] DEBUG: F1=0.500, EM=0.0, Overlap=0.333
[05:06:16] DEBUG: Generated='cat' vs Expected='cat dog'
[05:06:16] DEBUG: Overlap=1, Precision=1.000, Recall=0.500
[05:06:16] DEBUG: F1=0.667, EM=0.0, Overlap=0.500
[05:06:16] DEBUG: Generated='for all known forms of life' vs Expected='essential for life and survival'
[05:06:16] DEBUG: Overlap=2, Precision=0.333, Recall=0.400
[05:06:16] DEBUG: F1=0.364, EM=0.0, Overlap=0.400
[05:06:16] DEBUG: Generated='what turns you on?' vs Expected='chlorophyll'
[05:06:16] DEBUG: Overlap=0, Precision=0.000, Recall=0.000
[05:06:16] DEBUG: F1=0.000, EM=0.0, Overlap=0.000
[05:06:17] DEBUG: Generated='the question' vs Expected='yes'
[05:06:17] DEBUG: Overlap=0, Precision=0.000, Recall=0.000
[05:06:17] DEBUG: F1=0.000, EM=0.0, Overlap=0.000
[05:06:17]   Progress: 10/50 - Recent F1: 0.353
[05:06:17] DEBUG: Generated='' vs Expected='yes'
[05:06:17] DEBUG: F1=0.000, EM=0.0, Overlap=0.000
[05:06:17] DEBUG: Generated='red' vs Expected='red yellow blue'
[05:06:17] DEBUG: Overlap=1, Precision=1.000, Recall=0.333
[05:06:17] DEBUG: F1=0.500, EM=0.0, Overlap=0.333
[05:06:17] DEBUG: Generated='france' vs Expected='france'
[05:06:17] DEBUG: Overlap=1, Precision=1.000, Recall=1.000
[05:06:17] DEBUG: F1=1.000, EM=1.0, Overlap=1.000
[05:06:18] DEBUG: Generated='during the trojan war' vs Expected='10th and 11th centuries'
[05:06:18] DEBUG: Overlap=0, Precision=0.000, Recall=0.000
[05:06:18] DEBUG: F1=0.000, EM=0.0, Overlap=0.000
[05:06:18] DEBUG: Generated='iceland' vs Expected='denmark, iceland and norway'
[05:06:18] DEBUG: Overlap=1, Precision=1.000, Recall=0.250
[05:06:18] DEBUG: F1=0.400, EM=0.0, Overlap=0.250
[05:06:18] DEBUG: Generated='the question' vs Expected='rollo'
[05:06:18] DEBUG: Overlap=0, Precision=0.000, Recall=0.000
[05:06:18] DEBUG: F1=0.000, EM=0.0, Overlap=0.000
[05:06:19] DEBUG: Generated='the ninth century' vs Expected='10th century'
[05:06:19] DEBUG: Overlap=1, Precision=0.333, Recall=0.500
[05:06:19] DEBUG: F1=0.400, EM=0.0, Overlap=0.500
[05:06:19] DEBUG: Generated='the duke of normandy' vs Expected='william the conqueror'
[05:06:19] DEBUG: Overlap=1, Precision=0.250, Recall=0.333
[05:06:19] DEBUG: F1=0.286, EM=0.0, Overlap=0.333
[05:06:19] DEBUG: Generated='king charles iii' vs Expected='richard i'
[05:06:19] DEBUG: Overlap=0, Precision=0.000, Recall=0.000
[05:06:19] DEBUG: F1=0.000, EM=0.0, Overlap=0.000
[05:06:19] DEBUG: Generated='islam' vs Expected='catholic'
[05:06:19] DEBUG: Overlap=0, Precision=0.000, Recall=0.000
[05:06:19] DEBUG: F1=0.000, EM=0.0, Overlap=0.000
[05:06:19]   Progress: 20/50 - Recent F1: 0.259
[05:06:20] DEBUG: Generated='norman' vs Expected='viking'
[05:06:20] DEBUG: Overlap=0, Precision=0.000, Recall=0.000
[05:06:20] DEBUG: F1=0.000, EM=0.0, Overlap=0.000
[05:06:20] DEBUG: Generated='in 1024' vs Expected='9th century'
[05:06:20] DEBUG: Overlap=0, Precision=0.000, Recall=0.000
[05:06:20] DEBUG: F1=0.000, EM=0.0, Overlap=0.000
[05:06:20] DEBUG: Generated='1066' vs Expected='911'
[05:06:20] DEBUG: Overlap=0, Precision=0.000, Recall=0.000
[05:06:20] DEBUG: F1=0.000, EM=0.0, Overlap=0.000
[05:06:21] DEBUG: Generated='charles' vs Expected='king charles iii'
[05:06:21] DEBUG: Overlap=1, Precision=1.000, Recall=0.333
[05:06:21] DEBUG: F1=0.500, EM=0.0, Overlap=0.333
[05:06:22] DEBUG: Generated='what turns you on?' vs Expected='seine'
[05:06:22] DEBUG: Overlap=0, Precision=0.000, Recall=0.000
[05:06:22] DEBUG: F1=0.000, EM=0.0, Overlap=0.000
[05:06:23] DEBUG: Generated='the normans' vs Expected='rollo'
[05:06:23] DEBUG: Overlap=0, Precision=0.000, Recall=0.000
[05:06:23] DEBUG: F1=0.000, EM=0.0, Overlap=0.000
[05:06:23] DEBUG: Generated='what turns you on?' vs Expected='catholicism'
[05:06:23] DEBUG: Overlap=0, Precision=0.000, Recall=0.000
[05:06:23] DEBUG: F1=0.000, EM=0.0, Overlap=0.000
[05:06:23] DEBUG: Generated='normandy' vs Expected='north'
[05:06:23] DEBUG: Overlap=0, Precision=0.000, Recall=0.000
[05:06:23] DEBUG: F1=0.000, EM=0.0, Overlap=0.000
[05:06:23] DEBUG: Generated='what turns you on?' vs Expected='fighting horsemen'
[05:06:23] DEBUG: Overlap=0, Precision=0.000, Recall=0.000
[05:06:23] DEBUG: F1=0.000, EM=0.0, Overlap=0.000
[05:06:24] DEBUG: Generated='byzantine empire' vs Expected='seljuk turks'
[05:06:24] DEBUG: Overlap=0, Precision=0.000, Recall=0.000
[05:06:24] DEBUG: F1=0.000, EM=0.0, Overlap=0.000
[05:06:24]   Progress: 30/50 - Recent F1: 0.050
[05:06:24] DEBUG: Generated='602 -- 603' vs Expected='1050s'
[05:06:24] DEBUG: Overlap=0, Precision=0.000, Recall=0.000
[05:06:24] DEBUG: F1=0.000, EM=0.0, Overlap=0.000
[05:06:25] DEBUG: Generated='robert crispin and the turks' vs Expected='1060s'
[05:06:25] DEBUG: Overlap=0, Precision=0.000, Recall=0.000
[05:06:25] DEBUG: F1=0.000, EM=0.0, Overlap=0.000
[05:06:26] DEBUG: Generated='can you please provide a clear answer' vs Expected='alexius komnenos'
[05:06:26] DEBUG: Overlap=0, Precision=0.000, Recall=0.000
[05:06:26] DEBUG: F1=0.000, EM=0.0, Overlap=0.000
[05:06:26] DEBUG: Generated='what turns you on?' vs Expected='afranji'
[05:06:26] DEBUG: Overlap=0, Precision=0.000, Recall=0.000
[05:06:26] DEBUG: F1=0.000, EM=0.0, Overlap=0.000
[05:06:26] DEBUG: Generated='roosevelt' vs Expected='oursel'
[05:06:26] DEBUG: Overlap=0, Precision=0.000, Recall=0.000
[05:06:26] DEBUG: F1=0.000, EM=0.0, Overlap=0.000
[05:06:27] DEBUG: Generated='turkey' vs Expected='turkish forces'
[05:06:27] DEBUG: Overlap=0, Precision=0.000, Recall=0.000
[05:06:27] DEBUG: F1=0.000, EM=0.0, Overlap=0.000
[05:06:27] DEBUG: Generated='normandy, france' vs Expected='norman mercenary'
[05:06:27] DEBUG: Overlap=0, Precision=0.000, Recall=0.000
[05:06:27] DEBUG: F1=0.000, EM=0.0, Overlap=0.000
[05:06:27] DEBUG: Generated='lord canning' vs Expected='robert guiscard'
[05:06:27] DEBUG: Overlap=0, Precision=0.000, Recall=0.000
[05:06:27] DEBUG: F1=0.000, EM=0.0, Overlap=0.000
[05:06:27] DEBUG: Generated='what happened to dyrrachium?' vs Expected='1082'
[05:06:27] DEBUG: Overlap=0, Precision=0.000, Recall=0.000
[05:06:27] DEBUG: F1=0.000, EM=0.0, Overlap=0.000
[05:06:28] DEBUG: Generated='1,000,000' vs Expected='30,000'
[05:06:28] DEBUG: Overlap=0, Precision=0.000, Recall=0.000
[05:06:28] DEBUG: F1=0.000, EM=0.0, Overlap=0.000
[05:06:28]   Progress: 40/50 - Recent F1: 0.000
[05:06:28] DEBUG: Generated='constantinople' vs Expected='deabolis'
[05:06:28] DEBUG: Overlap=0, Precision=0.000, Recall=0.000
[05:06:28] DEBUG: F1=0.000, EM=0.0, Overlap=0.000
[05:06:29] DEBUG: Generated=', andrew' vs Expected='bohemond'
[05:06:29] DEBUG: Overlap=0, Precision=0.000, Recall=0.000
[05:06:29] DEBUG: F1=0.000, EM=0.0, Overlap=0.000
[05:06:29] DEBUG: Generated='river sitka' vs Expected='deabolis'
[05:06:29] DEBUG: Overlap=0, Precision=0.000, Recall=0.000
[05:06:29] DEBUG: F1=0.000, EM=0.0, Overlap=0.000
[05:06:29] DEBUG: Generated='2003' vs Expected='1185'
[05:06:29] DEBUG: Overlap=0, Precision=0.000, Recall=0.000
[05:06:29] DEBUG: F1=0.000, EM=0.0, Overlap=0.000
[05:06:29] DEBUG: Generated='what turns you on?' vs Expected='dyrrachium'
[05:06:29] DEBUG: Overlap=0, Precision=0.000, Recall=0.000
[05:06:29] DEBUG: F1=0.000, EM=0.0, Overlap=0.000
[05:06:30] DEBUG: Generated='what turns you on?' vs Expected='the adriatic'
[05:06:30] DEBUG: Overlap=0, Precision=0.000, Recall=0.000
[05:06:30] DEBUG: F1=0.000, EM=0.0, Overlap=0.000
[05:06:31] DEBUG: Generated='admiral horatio nelson' vs Expected='king ethelred ii'
[05:06:31] DEBUG: Overlap=0, Precision=0.000, Recall=0.000
[05:06:31] DEBUG: F1=0.000, EM=0.0, Overlap=0.000
[05:06:31] DEBUG: Generated='the question' vs Expected='duke richard ii'
[05:06:31] DEBUG: Overlap=0, Precision=0.000, Recall=0.000
[05:06:31] DEBUG: F1=0.000, EM=0.0, Overlap=0.000
[05:06:32] DEBUG: Generated='to return to england' vs Expected='normandy'
[05:06:32] DEBUG: Overlap=0, Precision=0.000, Recall=0.000
[05:06:32] DEBUG: F1=0.000, EM=0.0, Overlap=0.000
[05:06:32] DEBUG: Generated='parliament' vs Expected='sweyn forkbeard'
[05:06:32] DEBUG: Overlap=0, Precision=0.000, Recall=0.000
[05:06:32] DEBUG: F1=0.000, EM=0.0, Overlap=0.000
[05:06:32]   Progress: 50/50 - Recent F1: 0.000
[05:06:32]    instructional_clear completed: F1=0.132, EM=0.060
[05:06:32] 
 Testing template: context_guided
[05:06:32] DEBUG: Generated='paris' vs Expected='paris'
[05:06:32] DEBUG: Overlap=1, Precision=1.000, Recall=1.000
[05:06:32] DEBUG: F1=1.000, EM=1.0, Overlap=1.000
[05:06:32] DEBUG: Generated='' vs Expected='william shakespeare'
[05:06:32] DEBUG: F1=0.000, EM=0.0, Overlap=0.000
[05:06:32] DEBUG: Generated='what turns you on?' vs Expected='4'
[05:06:32] DEBUG: Overlap=0, Precision=0.000, Recall=0.000
[05:06:32] DEBUG: F1=0.000, EM=0.0, Overlap=0.000
[05:06:33] DEBUG: Generated='' vs Expected='process where plants make food from sunlight'
[05:06:33] DEBUG: F1=0.000, EM=0.0, Overlap=0.000
[05:06:33] DEBUG: Generated='what turns you on?' vs Expected='they process information using electrical circuits'
[05:06:33] DEBUG: Overlap=0, Precision=0.000, Recall=0.000
[05:06:33] DEBUG: F1=0.000, EM=0.0, Overlap=0.000
[05:06:33] DEBUG: Generated='green' vs Expected='red blue green'
[05:06:33] DEBUG: Overlap=1, Precision=1.000, Recall=0.333
[05:06:33] DEBUG: F1=0.500, EM=0.0, Overlap=0.333
[05:06:33] DEBUG: Generated='cat' vs Expected='cat dog'
[05:06:33] DEBUG: Overlap=1, Precision=1.000, Recall=0.500
[05:06:33] DEBUG: F1=0.667, EM=0.0, Overlap=0.500
[05:06:34] DEBUG: Generated='why is water important?' vs Expected='essential for life and survival'
[05:06:34] DEBUG: Overlap=0, Precision=0.000, Recall=0.000
[05:06:34] DEBUG: F1=0.000, EM=0.0, Overlap=0.000
[05:06:34] DEBUG: Generated='what makes plants green' vs Expected='chlorophyll'
[05:06:34] DEBUG: Overlap=0, Precision=0.000, Recall=0.000
[05:06:34] DEBUG: F1=0.000, EM=0.0, Overlap=0.000
[05:06:35] DEBUG: Generated='what turns you on?' vs Expected='yes'
[05:06:35] DEBUG: Overlap=0, Precision=0.000, Recall=0.000
[05:06:35] DEBUG: F1=0.000, EM=0.0, Overlap=0.000
[05:06:35]   Progress: 10/50 - Recent F1: 0.217
[05:06:36] DEBUG: Generated='the basic question' vs Expected='yes'
[05:06:36] DEBUG: Overlap=0, Precision=0.000, Recall=0.000
[05:06:36] DEBUG: F1=0.000, EM=0.0, Overlap=0.000
[05:06:36] DEBUG: Generated='red' vs Expected='red yellow blue'
[05:06:36] DEBUG: Overlap=1, Precision=1.000, Recall=0.333
[05:06:36] DEBUG: F1=0.500, EM=0.0, Overlap=0.333
[05:06:36] DEBUG: Generated='france' vs Expected='france'
[05:06:36] DEBUG: Overlap=1, Precision=1.000, Recall=1.000
[05:06:36] DEBUG: F1=1.000, EM=1.0, Overlap=1.000
[05:06:36] DEBUG: Generated='the 10th and 13th centuries' vs Expected='10th and 11th centuries'
[05:06:36] DEBUG: Overlap=3, Precision=0.600, Recall=0.750
[05:06:36] DEBUG: F1=0.667, EM=0.0, Overlap=0.750
[05:06:37] DEBUG: Generated='scandinavia' vs Expected='denmark, iceland and norway'
[05:06:37] DEBUG: Overlap=0, Precision=0.000, Recall=0.000
[05:06:37] DEBUG: F1=0.000, EM=0.0, Overlap=0.000
[05:06:37] DEBUG: Generated='who was the norse leader' vs Expected='rollo'
[05:06:37] DEBUG: Overlap=0, Precision=0.000, Recall=0.000
[05:06:37] DEBUG: F1=0.000, EM=0.0, Overlap=0.000
[05:06:38] DEBUG: Generated='the ninth century' vs Expected='10th century'
[05:06:38] DEBUG: Overlap=1, Precision=0.333, Recall=0.500
[05:06:38] DEBUG: F1=0.400, EM=0.0, Overlap=0.500
[05:06:39] DEBUG: Generated='normandy duke of normandy' vs Expected='william the conqueror'
[05:06:39] DEBUG: Overlap=0, Precision=0.000, Recall=0.000
[05:06:39] DEBUG: F1=0.000, EM=0.0, Overlap=0.000
[05:06:39] DEBUG: Generated='king charles iii' vs Expected='richard i'
[05:06:39] DEBUG: Overlap=0, Precision=0.000, Recall=0.000
[05:06:39] DEBUG: F1=0.000, EM=0.0, Overlap=0.000
[05:06:39] DEBUG: Generated='catholicism' vs Expected='catholic'
[05:06:39] DEBUG: Overlap=0, Precision=0.000, Recall=0.000
[05:06:39] DEBUG: F1=0.000, EM=0.0, Overlap=0.000
[05:06:39]   Progress: 20/50 - Recent F1: 0.257
[05:06:40] DEBUG: Generated='norman' vs Expected='viking'
[05:06:40] DEBUG: Overlap=0, Precision=0.000, Recall=0.000
[05:06:40] DEBUG: F1=0.000, EM=0.0, Overlap=0.000
[05:06:40] DEBUG: Generated='in 1024' vs Expected='9th century'
[05:06:40] DEBUG: Overlap=0, Precision=0.000, Recall=0.000
[05:06:40] DEBUG: F1=0.000, EM=0.0, Overlap=0.000
[05:06:40] DEBUG: Generated='1066' vs Expected='911'
[05:06:40] DEBUG: Overlap=0, Precision=0.000, Recall=0.000
[05:06:40] DEBUG: F1=0.000, EM=0.0, Overlap=0.000
[05:06:40] DEBUG: Generated='charles the simple' vs Expected='king charles iii'
[05:06:40] DEBUG: Overlap=1, Precision=0.333, Recall=0.333
[05:06:40] DEBUG: F1=0.333, EM=0.0, Overlap=0.333
[05:06:41] DEBUG: Generated='tennessee river' vs Expected='seine'
[05:06:41] DEBUG: Overlap=0, Precision=0.000, Recall=0.000
[05:06:41] DEBUG: F1=0.000, EM=0.0, Overlap=0.000
[05:06:41] DEBUG: Generated='the normans' vs Expected='rollo'
[05:06:41] DEBUG: Overlap=0, Precision=0.000, Recall=0.000
[05:06:41] DEBUG: F1=0.000, EM=0.0, Overlap=0.000
[05:06:41] DEBUG: Generated='normanism' vs Expected='catholicism'
[05:06:41] DEBUG: Overlap=0, Precision=0.000, Recall=0.000
[05:06:41] DEBUG: F1=0.000, EM=0.0, Overlap=0.000
[05:06:42] DEBUG: Generated='normandy' vs Expected='north'
[05:06:42] DEBUG: Overlap=0, Precision=0.000, Recall=0.000
[05:06:42] DEBUG: F1=0.000, EM=0.0, Overlap=0.000
[05:06:42] DEBUG: Generated='foodstuffs' vs Expected='fighting horsemen'
[05:06:42] DEBUG: Overlap=0, Precision=0.000, Recall=0.000
[05:06:42] DEBUG: F1=0.000, EM=0.0, Overlap=0.000
[05:06:42] DEBUG: Generated='the byzantine empire' vs Expected='seljuk turks'
[05:06:42] DEBUG: Overlap=0, Precision=0.000, Recall=0.000
[05:06:42] DEBUG: F1=0.000, EM=0.0, Overlap=0.000
[05:06:42]   Progress: 30/50 - Recent F1: 0.033
[05:06:42] DEBUG: Generated='during the byzantine war' vs Expected='1050s'
[05:06:42] DEBUG: Overlap=0, Precision=0.000, Recall=0.000
[05:06:42] DEBUG: F1=0.000, EM=0.0, Overlap=0.000
[05:06:43] DEBUG: Generated='2003' vs Expected='1060s'
[05:06:43] DEBUG: Overlap=0, Precision=0.000, Recall=0.000
[05:06:43] DEBUG: F1=0.000, EM=0.0, Overlap=0.000
[05:06:43] DEBUG: Generated='ask the question' vs Expected='alexius komnenos'
[05:06:43] DEBUG: Overlap=0, Precision=0.000, Recall=0.000
[05:06:43] DEBUG: F1=0.000, EM=0.0, Overlap=0.000
[05:06:43] DEBUG: Generated='neuschwanstein castle' vs Expected='afranji'
[05:06:43] DEBUG: Overlap=0, Precision=0.000, Recall=0.000
[05:06:43] DEBUG: F1=0.000, EM=0.0, Overlap=0.000
[05:06:43] DEBUG: Generated='roosevelt' vs Expected='oursel'
[05:06:43] DEBUG: Overlap=0, Precision=0.000, Recall=0.000
[05:06:43] DEBUG: F1=0.000, EM=0.0, Overlap=0.000
[05:06:44] DEBUG: Generated='turkey' vs Expected='turkish forces'
[05:06:44] DEBUG: Overlap=0, Precision=0.000, Recall=0.000
[05:06:44] DEBUG: F1=0.000, EM=0.0, Overlap=0.000
[05:06:44] DEBUG: Generated='normandy' vs Expected='norman mercenary'
[05:06:44] DEBUG: Overlap=0, Precision=0.000, Recall=0.000
[05:06:44] DEBUG: F1=0.000, EM=0.0, Overlap=0.000
[05:06:44] DEBUG: Generated='( last ) frederick iii' vs Expected='robert guiscard'
[05:06:44] DEBUG: Overlap=0, Precision=0.000, Recall=0.000
[05:06:44] DEBUG: F1=0.000, EM=0.0, Overlap=0.000
[05:06:45] DEBUG: Generated='180 bc' vs Expected='1082'
[05:06:45] DEBUG: Overlap=0, Precision=0.000, Recall=0.000
[05:06:45] DEBUG: F1=0.000, EM=0.0, Overlap=0.000
[05:06:45] DEBUG: Generated='about a million men' vs Expected='30,000'
[05:06:45] DEBUG: Overlap=0, Precision=0.000, Recall=0.000
[05:06:45] DEBUG: F1=0.000, EM=0.0, Overlap=0.000
[05:06:45]   Progress: 40/50 - Recent F1: 0.000
[05:06:46] DEBUG: Generated='in jaffa' vs Expected='deabolis'
[05:06:46] DEBUG: Overlap=0, Precision=0.000, Recall=0.000
[05:06:46] DEBUG: F1=0.000, EM=0.0, Overlap=0.000
[05:06:46] DEBUG: Generated='robert's son' vs Expected='bohemond'
[05:06:46] DEBUG: Overlap=0, Precision=0.000, Recall=0.000
[05:06:46] DEBUG: F1=0.000, EM=0.0, Overlap=0.000
[05:06:46] DEBUG: Generated='river sita' vs Expected='deabolis'
[05:06:46] DEBUG: Overlap=0, Precision=0.000, Recall=0.000
[05:06:46] DEBUG: F1=0.000, EM=0.0, Overlap=0.000
[05:06:47] DEBUG: Generated='2018' vs Expected='1185'
[05:06:47] DEBUG: Overlap=0, Precision=0.000, Recall=0.000
[05:06:47] DEBUG: F1=0.000, EM=0.0, Overlap=0.000
[05:06:47] DEBUG: Generated='naval air station' vs Expected='dyrrachium'
[05:06:47] DEBUG: Overlap=0, Precision=0.000, Recall=0.000
[05:06:47] DEBUG: F1=0.000, EM=0.0, Overlap=0.000
[05:06:47] DEBUG: Generated='the fundamental question' vs Expected='the adriatic'
[05:06:47] DEBUG: Overlap=1, Precision=0.333, Recall=0.500
[05:06:47] DEBUG: F1=0.400, EM=0.0, Overlap=0.500
[05:06:47] DEBUG: Generated='mr. knightley' vs Expected='king ethelred ii'
[05:06:47] DEBUG: Overlap=0, Precision=0.000, Recall=0.000
[05:06:47] DEBUG: F1=0.000, EM=0.0, Overlap=0.000
[05:06:48] DEBUG: Generated='ellen' vs Expected='duke richard ii'
[05:06:48] DEBUG: Overlap=0, Precision=0.000, Recall=0.000
[05:06:48] DEBUG: F1=0.000, EM=0.0, Overlap=0.000
[05:06:48] DEBUG: Generated='to return to england' vs Expected='normandy'
[05:06:48] DEBUG: Overlap=0, Precision=0.000, Recall=0.000
[05:06:48] DEBUG: F1=0.000, EM=0.0, Overlap=0.000
[05:06:48] DEBUG: Generated='what turns you on?' vs Expected='sweyn forkbeard'
[05:06:48] DEBUG: Overlap=0, Precision=0.000, Recall=0.000
[05:06:48] DEBUG: F1=0.000, EM=0.0, Overlap=0.000
[05:06:48]   Progress: 50/50 - Recent F1: 0.040
[05:06:48]    context_guided completed: F1=0.109, EM=0.040
[05:06:48] 
 Testing template: confident_direct
[05:06:49] DEBUG: Generated='paris' vs Expected='paris'
[05:06:49] DEBUG: Overlap=1, Precision=1.000, Recall=1.000
[05:06:49] DEBUG: F1=1.000, EM=1.0, Overlap=1.000
[05:06:50] DEBUG: Generated='william shakespeare' vs Expected='william shakespeare'
[05:06:50] DEBUG: Overlap=2, Precision=1.000, Recall=1.000
[05:06:50] DEBUG: F1=1.000, EM=1.0, Overlap=1.000
[05:06:51] DEBUG: Generated='what turns you on?' vs Expected='4'
[05:06:51] DEBUG: Overlap=0, Precision=0.000, Recall=0.000
[05:06:51] DEBUG: F1=0.000, EM=0.0, Overlap=0.000
[05:06:51] DEBUG: Generated='to convert light energy into chemical energy' vs Expected='process where plants make food from sunlight'
[05:06:51] DEBUG: Overlap=0, Precision=0.000, Recall=0.000
[05:06:51] DEBUG: F1=0.000, EM=0.0, Overlap=0.000
[05:06:51] DEBUG: Generated='what turns you on?' vs Expected='they process information using electrical circuits'
[05:06:51] DEBUG: Overlap=0, Precision=0.000, Recall=0.000
[05:06:51] DEBUG: F1=0.000, EM=0.0, Overlap=0.000
[05:06:52] DEBUG: Generated='red' vs Expected='red blue green'
[05:06:52] DEBUG: Overlap=1, Precision=1.000, Recall=0.333
[05:06:52] DEBUG: F1=0.500, EM=0.0, Overlap=0.333
[05:06:52] DEBUG: Generated='rodents' vs Expected='cat dog'
[05:06:52] DEBUG: Overlap=0, Precision=0.000, Recall=0.000
[05:06:52] DEBUG: F1=0.000, EM=0.0, Overlap=0.000
[05:06:52] DEBUG: Generated='why is water important?' vs Expected='essential for life and survival'
[05:06:52] DEBUG: Overlap=0, Precision=0.000, Recall=0.000
[05:06:52] DEBUG: F1=0.000, EM=0.0, Overlap=0.000
[05:06:53] DEBUG: Generated='chlorophyll' vs Expected='chlorophyll'
[05:06:53] DEBUG: Overlap=1, Precision=1.000, Recall=1.000
[05:06:53] DEBUG: F1=1.000, EM=1.0, Overlap=1.000
[05:06:53] DEBUG: Generated='is the earth round' vs Expected='yes'
[05:06:53] DEBUG: Overlap=0, Precision=0.000, Recall=0.000
[05:06:53] DEBUG: F1=0.000, EM=0.0, Overlap=0.000
[05:06:53]   Progress: 10/50 - Recent F1: 0.350
[05:06:53] DEBUG: Generated='' vs Expected='yes'
[05:06:53] DEBUG: F1=0.000, EM=0.0, Overlap=0.000
[05:06:54] DEBUG: Generated='red' vs Expected='red yellow blue'
[05:06:54] DEBUG: Overlap=1, Precision=1.000, Recall=0.333
[05:06:54] DEBUG: F1=0.500, EM=0.0, Overlap=0.333
[05:06:54] DEBUG: Generated='france' vs Expected='france'
[05:06:54] DEBUG: Overlap=1, Precision=1.000, Recall=1.000
[05:06:54] DEBUG: F1=1.000, EM=1.0, Overlap=1.000
[05:06:54] DEBUG: Generated='10th century -- 15th century' vs Expected='10th and 11th centuries'
[05:06:54] DEBUG: Overlap=1, Precision=0.250, Recall=0.250
[05:06:54] DEBUG: F1=0.250, EM=0.0, Overlap=0.250
[05:06:55] DEBUG: Generated='iceland' vs Expected='denmark, iceland and norway'
[05:06:55] DEBUG: Overlap=1, Precision=1.000, Recall=0.250
[05:06:55] DEBUG: F1=0.400, EM=0.0, Overlap=0.250
[05:06:55] DEBUG: Generated='who was the norse leader' vs Expected='rollo'
[05:06:55] DEBUG: Overlap=0, Precision=0.000, Recall=0.000
[05:06:55] DEBUG: F1=0.000, EM=0.0, Overlap=0.000
[05:06:55] DEBUG: Generated='the ninth century' vs Expected='10th century'
[05:06:55] DEBUG: Overlap=1, Precision=0.333, Recall=0.500
[05:06:55] DEBUG: F1=0.400, EM=0.0, Overlap=0.500
[05:06:56] DEBUG: Generated='william' vs Expected='william the conqueror'
[05:06:56] DEBUG: Overlap=1, Precision=1.000, Recall=0.333
[05:06:56] DEBUG: F1=0.500, EM=0.0, Overlap=0.333
[05:06:56] DEBUG: Generated='the king of england' vs Expected='richard i'
[05:06:56] DEBUG: Overlap=0, Precision=0.000, Recall=0.000
[05:06:56] DEBUG: F1=0.000, EM=0.0, Overlap=0.000
[05:06:56] DEBUG: Generated='catholicism' vs Expected='catholic'
[05:06:56] DEBUG: Overlap=0, Precision=0.000, Recall=0.000
[05:06:56] DEBUG: F1=0.000, EM=0.0, Overlap=0.000
[05:06:56]   Progress: 20/50 - Recent F1: 0.305
[05:06:56] DEBUG: Generated='north' vs Expected='viking'
[05:06:56] DEBUG: Overlap=0, Precision=0.000, Recall=0.000
[05:06:56] DEBUG: F1=0.000, EM=0.0, Overlap=0.000
[05:06:57] DEBUG: Generated='in 1024' vs Expected='9th century'
[05:06:57] DEBUG: Overlap=0, Precision=0.000, Recall=0.000
[05:06:57] DEBUG: F1=0.000, EM=0.0, Overlap=0.000
[05:06:57] DEBUG: Generated='1066' vs Expected='911'
[05:06:57] DEBUG: Overlap=0, Precision=0.000, Recall=0.000
[05:06:57] DEBUG: F1=0.000, EM=0.0, Overlap=0.000
[05:06:57] DEBUG: Generated='charles the simple' vs Expected='king charles iii'
[05:06:57] DEBUG: Overlap=1, Precision=0.333, Recall=0.333
[05:06:57] DEBUG: F1=0.333, EM=0.0, Overlap=0.333
[05:06:58] DEBUG: Generated='river of british columbia' vs Expected='seine'
[05:06:58] DEBUG: Overlap=0, Precision=0.000, Recall=0.000
[05:06:58] DEBUG: F1=0.000, EM=0.0, Overlap=0.000
[05:06:58] DEBUG: Generated='the normans' vs Expected='rollo'
[05:06:58] DEBUG: Overlap=0, Precision=0.000, Recall=0.000
[05:06:58] DEBUG: F1=0.000, EM=0.0, Overlap=0.000
[05:06:58] DEBUG: Generated='islam' vs Expected='catholicism'
[05:06:58] DEBUG: Overlap=0, Precision=0.000, Recall=0.000
[05:06:58] DEBUG: F1=0.000, EM=0.0, Overlap=0.000
[05:06:59] DEBUG: Generated='normandy' vs Expected='north'
[05:06:59] DEBUG: Overlap=0, Precision=0.000, Recall=0.000
[05:06:59] DEBUG: F1=0.000, EM=0.0, Overlap=0.000
[05:06:59] DEBUG: Generated='cloth' vs Expected='fighting horsemen'
[05:06:59] DEBUG: Overlap=0, Precision=0.000, Recall=0.000
[05:06:59] DEBUG: F1=0.000, EM=0.0, Overlap=0.000
[05:06:59] DEBUG: Generated='byzantine empire' vs Expected='seljuk turks'
[05:06:59] DEBUG: Overlap=0, Precision=0.000, Recall=0.000
[05:06:59] DEBUG: F1=0.000, EM=0.0, Overlap=0.000
[05:06:59]   Progress: 30/50 - Recent F1: 0.033
[05:06:59] DEBUG: Generated='during the byzantine war' vs Expected='1050s'
[05:06:59] DEBUG: Overlap=0, Precision=0.000, Recall=0.000
[05:06:59] DEBUG: F1=0.000, EM=0.0, Overlap=0.000
[05:07:00] DEBUG: Generated='2003' vs Expected='1060s'
[05:07:00] DEBUG: Overlap=0, Precision=0.000, Recall=0.000
[05:07:00] DEBUG: F1=0.000, EM=0.0, Overlap=0.000
[05:07:00] DEBUG: Generated='oliver cromwell' vs Expected='alexius komnenos'
[05:07:00] DEBUG: Overlap=0, Precision=0.000, Recall=0.000
[05:07:00] DEBUG: F1=0.000, EM=0.0, Overlap=0.000
[05:07:01] DEBUG: Generated='château paris' vs Expected='afranji'
[05:07:01] DEBUG: Overlap=0, Precision=0.000, Recall=0.000
[05:07:01] DEBUG: F1=0.000, EM=0.0, Overlap=0.000
[05:07:01] DEBUG: Generated='theudebert i' vs Expected='oursel'
[05:07:01] DEBUG: Overlap=0, Precision=0.000, Recall=0.000
[05:07:01] DEBUG: F1=0.000, EM=0.0, Overlap=0.000
[05:07:02] DEBUG: Generated='turkey' vs Expected='turkish forces'
[05:07:02] DEBUG: Overlap=0, Precision=0.000, Recall=0.000
[05:07:02] DEBUG: F1=0.000, EM=0.0, Overlap=0.000
[05:07:03] DEBUG: Generated='answers the question' vs Expected='norman mercenary'
[05:07:03] DEBUG: Overlap=0, Precision=0.000, Recall=0.000
[05:07:03] DEBUG: F1=0.000, EM=0.0, Overlap=0.000
[05:07:03] DEBUG: Generated='tobey' vs Expected='robert guiscard'
[05:07:03] DEBUG: Overlap=0, Precision=0.000, Recall=0.000
[05:07:03] DEBUG: F1=0.000, EM=0.0, Overlap=0.000
[05:07:03] DEBUG: Generated='2011' vs Expected='1082'
[05:07:03] DEBUG: Overlap=0, Precision=0.000, Recall=0.000
[05:07:03] DEBUG: F1=0.000, EM=0.0, Overlap=0.000
[05:07:04] DEBUG: Generated='350,000 and 150,000' vs Expected='30,000'
[05:07:04] DEBUG: Overlap=0, Precision=0.000, Recall=0.000
[05:07:04] DEBUG: F1=0.000, EM=0.0, Overlap=0.000
[05:07:04]   Progress: 40/50 - Recent F1: 0.000
[05:07:04] DEBUG: Generated='constantinople' vs Expected='deabolis'
[05:07:04] DEBUG: Overlap=0, Precision=0.000, Recall=0.000
[05:07:04] DEBUG: F1=0.000, EM=0.0, Overlap=0.000
[05:07:05] DEBUG: Generated='steffon' vs Expected='bohemond'
[05:07:05] DEBUG: Overlap=0, Precision=0.000, Recall=0.000
[05:07:05] DEBUG: F1=0.000, EM=0.0, Overlap=0.000
[05:07:05] DEBUG: Generated='river sita' vs Expected='deabolis'
[05:07:05] DEBUG: Overlap=0, Precision=0.000, Recall=0.000
[05:07:05] DEBUG: F1=0.000, EM=0.0, Overlap=0.000
[05:07:05] DEBUG: Generated='2014' vs Expected='1185'
[05:07:05] DEBUG: Overlap=0, Precision=0.000, Recall=0.000
[05:07:05] DEBUG: F1=0.000, EM=0.0, Overlap=0.000
[05:07:05] DEBUG: Generated='guantanamo bay' vs Expected='dyrrachium'
[05:07:05] DEBUG: Overlap=0, Precision=0.000, Recall=0.000
[05:07:05] DEBUG: F1=0.000, EM=0.0, Overlap=0.000
[05:07:06] DEBUG: Generated='north america' vs Expected='the adriatic'
[05:07:06] DEBUG: Overlap=0, Precision=0.000, Recall=0.000
[05:07:06] DEBUG: F1=0.000, EM=0.0, Overlap=0.000
[05:07:06] DEBUG: Generated='matt willis' vs Expected='king ethelred ii'
[05:07:06] DEBUG: Overlap=0, Precision=0.000, Recall=0.000
[05:07:06] DEBUG: F1=0.000, EM=0.0, Overlap=0.000
[05:07:06] DEBUG: Generated='elliot reeve' vs Expected='duke richard ii'
[05:07:06] DEBUG: Overlap=0, Precision=0.000, Recall=0.000
[05:07:06] DEBUG: F1=0.000, EM=0.0, Overlap=0.000
[05:07:07] DEBUG: Generated='to return to england' vs Expected='normandy'
[05:07:07] DEBUG: Overlap=0, Precision=0.000, Recall=0.000
[05:07:07] DEBUG: F1=0.000, EM=0.0, Overlap=0.000
[05:07:07] DEBUG: Generated='the old man' vs Expected='sweyn forkbeard'
[05:07:07] DEBUG: Overlap=0, Precision=0.000, Recall=0.000
[05:07:07] DEBUG: F1=0.000, EM=0.0, Overlap=0.000
[05:07:07]   Progress: 50/50 - Recent F1: 0.000
[05:07:07]    confident_direct completed: F1=0.138, EM=0.080
[05:07:07] 
 Testing template: structured_response
[05:07:08] DEBUG: Generated='paris' vs Expected='paris'
[05:07:08] DEBUG: Overlap=1, Precision=1.000, Recall=1.000
[05:07:08] DEBUG: F1=1.000, EM=1.0, Overlap=1.000
[05:07:08] DEBUG: Generated='william shakespeare' vs Expected='william shakespeare'
[05:07:08] DEBUG: Overlap=2, Precision=1.000, Recall=1.000
[05:07:08] DEBUG: F1=1.000, EM=1.0, Overlap=1.000
[05:07:08] DEBUG: Generated='the binary interpretation of the numbers' vs Expected='4'
[05:07:08] DEBUG: Overlap=0, Precision=0.000, Recall=0.000
[05:07:08] DEBUG: F1=0.000, EM=0.0, Overlap=0.000
[05:07:09] DEBUG: Generated='what turns you on?' vs Expected='process where plants make food from sunlight'
[05:07:09] DEBUG: Overlap=0, Precision=0.000, Recall=0.000
[05:07:09] DEBUG: F1=0.000, EM=0.0, Overlap=0.000
[05:07:09] DEBUG: Generated='what turns you on?' vs Expected='they process information using electrical circuits'
[05:07:09] DEBUG: Overlap=0, Precision=0.000, Recall=0.000
[05:07:09] DEBUG: F1=0.000, EM=0.0, Overlap=0.000
[05:07:10] DEBUG: Generated='red' vs Expected='red blue green'
[05:07:10] DEBUG: Overlap=1, Precision=1.000, Recall=0.333
[05:07:10] DEBUG: F1=0.500, EM=0.0, Overlap=0.333
[05:07:10] DEBUG: Generated='cat' vs Expected='cat dog'
[05:07:10] DEBUG: Overlap=1, Precision=1.000, Recall=0.500
[05:07:10] DEBUG: F1=0.667, EM=0.0, Overlap=0.500
[05:07:10] DEBUG: Generated='water infinity' vs Expected='essential for life and survival'
[05:07:10] DEBUG: Overlap=0, Precision=0.000, Recall=0.000
[05:07:10] DEBUG: F1=0.000, EM=0.0, Overlap=0.000
[05:07:11] DEBUG: Generated='what turns you on' vs Expected='chlorophyll'
[05:07:11] DEBUG: Overlap=0, Precision=0.000, Recall=0.000
[05:07:11] DEBUG: F1=0.000, EM=0.0, Overlap=0.000
[05:07:11] DEBUG: Generated='the question' vs Expected='yes'
[05:07:11] DEBUG: Overlap=0, Precision=0.000, Recall=0.000
[05:07:11] DEBUG: F1=0.000, EM=0.0, Overlap=0.000
[05:07:11]   Progress: 10/50 - Recent F1: 0.317
[05:07:11] DEBUG: Generated='' vs Expected='yes'
[05:07:11] DEBUG: F1=0.000, EM=0.0, Overlap=0.000
[05:07:11] DEBUG: Generated='blue' vs Expected='red yellow blue'
[05:07:11] DEBUG: Overlap=1, Precision=1.000, Recall=0.333
[05:07:11] DEBUG: F1=0.500, EM=0.0, Overlap=0.333
[05:07:12] DEBUG: Generated='france' vs Expected='france'
[05:07:12] DEBUG: Overlap=1, Precision=1.000, Recall=1.000
[05:07:12] DEBUG: F1=1.000, EM=1.0, Overlap=1.000
[05:07:12] DEBUG: Generated='between the 10th and 13th centuries' vs Expected='10th and 11th centuries'
[05:07:12] DEBUG: Overlap=3, Precision=0.500, Recall=0.750
[05:07:12] DEBUG: F1=0.600, EM=0.0, Overlap=0.750
[05:07:12] DEBUG: Generated='iceland' vs Expected='denmark, iceland and norway'
[05:07:12] DEBUG: Overlap=1, Precision=1.000, Recall=0.250
[05:07:12] DEBUG: F1=0.400, EM=0.0, Overlap=0.250
[05:07:12] DEBUG: Generated='the norse leader' vs Expected='rollo'
[05:07:12] DEBUG: Overlap=0, Precision=0.000, Recall=0.000
[05:07:12] DEBUG: F1=0.000, EM=0.0, Overlap=0.000
[05:07:13] DEBUG: Generated='the european renaissance' vs Expected='10th century'
[05:07:13] DEBUG: Overlap=0, Precision=0.000, Recall=0.000
[05:07:13] DEBUG: F1=0.000, EM=0.0, Overlap=0.000
[05:07:13] DEBUG: Generated='the duke of normandy' vs Expected='william the conqueror'
[05:07:13] DEBUG: Overlap=1, Precision=0.250, Recall=0.333
[05:07:13] DEBUG: F1=0.286, EM=0.0, Overlap=0.333
[05:07:13] DEBUG: Generated='king' vs Expected='richard i'
[05:07:13] DEBUG: Overlap=0, Precision=0.000, Recall=0.000
[05:07:13] DEBUG: F1=0.000, EM=0.0, Overlap=0.000
[05:07:13] DEBUG: Generated='islam' vs Expected='catholic'
[05:07:13] DEBUG: Overlap=0, Precision=0.000, Recall=0.000
[05:07:13] DEBUG: F1=0.000, EM=0.0, Overlap=0.000
[05:07:13]   Progress: 20/50 - Recent F1: 0.279
[05:07:14] DEBUG: Generated='what turns you on?' vs Expected='viking'
[05:07:14] DEBUG: Overlap=0, Precision=0.000, Recall=0.000
[05:07:14] DEBUG: F1=0.000, EM=0.0, Overlap=0.000
[05:07:14] DEBUG: Generated='in 1024' vs Expected='9th century'
[05:07:14] DEBUG: Overlap=0, Precision=0.000, Recall=0.000
[05:07:14] DEBUG: F1=0.000, EM=0.0, Overlap=0.000
[05:07:14] DEBUG: Generated='987' vs Expected='911'
[05:07:14] DEBUG: Overlap=0, Precision=0.000, Recall=0.000
[05:07:14] DEBUG: F1=0.000, EM=0.0, Overlap=0.000
[05:07:14] DEBUG: Generated='the franks' vs Expected='king charles iii'
[05:07:14] DEBUG: Overlap=0, Precision=0.000, Recall=0.000
[05:07:14] DEBUG: F1=0.000, EM=0.0, Overlap=0.000
[05:07:15] DEBUG: Generated='the rio de janeiro' vs Expected='seine'
[05:07:15] DEBUG: Overlap=0, Precision=0.000, Recall=0.000
[05:07:15] DEBUG: F1=0.000, EM=0.0, Overlap=0.000
[05:07:15] DEBUG: Generated='the question' vs Expected='rollo'
[05:07:15] DEBUG: Overlap=0, Precision=0.000, Recall=0.000
[05:07:15] DEBUG: F1=0.000, EM=0.0, Overlap=0.000
[05:07:15] DEBUG: Generated='islam' vs Expected='catholicism'
[05:07:15] DEBUG: Overlap=0, Precision=0.000, Recall=0.000
[05:07:15] DEBUG: F1=0.000, EM=0.0, Overlap=0.000
[05:07:15] DEBUG: Generated='northern france' vs Expected='north'
[05:07:15] DEBUG: Overlap=0, Precision=0.000, Recall=0.000
[05:07:15] DEBUG: F1=0.000, EM=0.0, Overlap=0.000
[05:07:16] DEBUG: Generated='foodstuffs' vs Expected='fighting horsemen'
[05:07:16] DEBUG: Overlap=0, Precision=0.000, Recall=0.000
[05:07:16] DEBUG: F1=0.000, EM=0.0, Overlap=0.000
[05:07:16] DEBUG: Generated='byzantine empire' vs Expected='seljuk turks'
[05:07:16] DEBUG: Overlap=0, Precision=0.000, Recall=0.000
[05:07:16] DEBUG: F1=0.000, EM=0.0, Overlap=0.000
[05:07:16]   Progress: 30/50 - Recent F1: 0.000
[05:07:18] DEBUG: Generated='1984 -- 86' vs Expected='1050s'
[05:07:18] DEBUG: Overlap=0, Precision=0.000, Recall=0.000
[05:07:18] DEBUG: F1=0.000, EM=0.0, Overlap=0.000
[05:07:19] DEBUG: Generated='2017' vs Expected='1060s'
[05:07:19] DEBUG: Overlap=0, Precision=0.000, Recall=0.000
[05:07:19] DEBUG: F1=0.000, EM=0.0, Overlap=0.000
[05:07:19] DEBUG: Generated='his idea of kingship' vs Expected='alexius komnenos'
[05:07:19] DEBUG: Overlap=0, Precision=0.000, Recall=0.000
[05:07:19] DEBUG: F1=0.000, EM=0.0, Overlap=0.000
[05:07:19] DEBUG: Generated='the classic roman republic' vs Expected='afranji'
[05:07:19] DEBUG: Overlap=0, Precision=0.000, Recall=0.000
[05:07:19] DEBUG: F1=0.000, EM=0.0, Overlap=0.000
[05:07:20] DEBUG: Generated='charles martel' vs Expected='oursel'
[05:07:20] DEBUG: Overlap=0, Precision=0.000, Recall=0.000
[05:07:20] DEBUG: F1=0.000, EM=0.0, Overlap=0.000
[05:07:20] DEBUG: Generated='turkey' vs Expected='turkish forces'
[05:07:20] DEBUG: Overlap=0, Precision=0.000, Recall=0.000
[05:07:20] DEBUG: F1=0.000, EM=0.0, Overlap=0.000
[05:07:20] DEBUG: Generated='norman origin' vs Expected='norman mercenary'
[05:07:20] DEBUG: Overlap=1, Precision=0.500, Recall=0.500
[05:07:20] DEBUG: F1=0.500, EM=0.0, Overlap=0.500
[05:07:20] DEBUG: Generated='( last ) frederick iii' vs Expected='robert guiscard'
[05:07:20] DEBUG: Overlap=0, Precision=0.000, Recall=0.000
[05:07:20] DEBUG: F1=0.000, EM=0.0, Overlap=0.000
[05:07:21] DEBUG: Generated='what turns you on?' vs Expected='1082'
[05:07:21] DEBUG: Overlap=0, Precision=0.000, Recall=0.000
[05:07:21] DEBUG: F1=0.000, EM=0.0, Overlap=0.000
[05:07:21] DEBUG: Generated='3,000 infantry and 300 horsemen' vs Expected='30,000'
[05:07:21] DEBUG: Overlap=0, Precision=0.000, Recall=0.000
[05:07:21] DEBUG: F1=0.000, EM=0.0, Overlap=0.000
[05:07:21]   Progress: 40/50 - Recent F1: 0.050
[05:07:21] DEBUG: Generated='constantinople' vs Expected='deabolis'
[05:07:21] DEBUG: Overlap=0, Precision=0.000, Recall=0.000
[05:07:21] DEBUG: F1=0.000, EM=0.0, Overlap=0.000
[05:07:22] DEBUG: Generated='robert's son' vs Expected='bohemond'
[05:07:22] DEBUG: Overlap=0, Precision=0.000, Recall=0.000
[05:07:22] DEBUG: F1=0.000, EM=0.0, Overlap=0.000
[05:07:22] DEBUG: Generated='river sitka' vs Expected='deabolis'
[05:07:22] DEBUG: Overlap=0, Precision=0.000, Recall=0.000
[05:07:22] DEBUG: F1=0.000, EM=0.0, Overlap=0.000
[05:07:22] DEBUG: Generated='the battle of dyrrachium' vs Expected='1185'
[05:07:22] DEBUG: Overlap=0, Precision=0.000, Recall=0.000
[05:07:22] DEBUG: F1=0.000, EM=0.0, Overlap=0.000
[05:07:23] DEBUG: Generated='naval base or fort' vs Expected='dyrrachium'
[05:07:23] DEBUG: Overlap=0, Precision=0.000, Recall=0.000
[05:07:23] DEBUG: F1=0.000, EM=0.0, Overlap=0.000
[05:07:23] DEBUG: Generated='the fundamental question' vs Expected='the adriatic'
[05:07:23] DEBUG: Overlap=1, Precision=0.333, Recall=0.500
[05:07:23] DEBUG: F1=0.400, EM=0.0, Overlap=0.500
[05:07:23] DEBUG: Generated='the question' vs Expected='king ethelred ii'
[05:07:23] DEBUG: Overlap=0, Precision=0.000, Recall=0.000
[05:07:23] DEBUG: F1=0.000, EM=0.0, Overlap=0.000
[05:07:23] DEBUG: Generated='the fundamental question' vs Expected='duke richard ii'
[05:07:23] DEBUG: Overlap=0, Precision=0.000, Recall=0.000
[05:07:23] DEBUG: F1=0.000, EM=0.0, Overlap=0.000
[05:07:24] DEBUG: Generated='the king's question' vs Expected='normandy'
[05:07:24] DEBUG: Overlap=0, Precision=0.000, Recall=0.000
[05:07:24] DEBUG: F1=0.000, EM=0.0, Overlap=0.000
[05:07:24] DEBUG: Generated='ethelred' vs Expected='sweyn forkbeard'
[05:07:24] DEBUG: Overlap=0, Precision=0.000, Recall=0.000
[05:07:24] DEBUG: F1=0.000, EM=0.0, Overlap=0.000
[05:07:24]   Progress: 50/50 - Recent F1: 0.040
[05:07:24]    structured_response completed: F1=0.137, EM=0.060
[05:07:24] 
 Testing template: basic
[05:07:24] DEBUG: Generated='paris' vs Expected='paris'
[05:07:24] DEBUG: Overlap=1, Precision=1.000, Recall=1.000
[05:07:24] DEBUG: F1=1.000, EM=1.0, Overlap=1.000
[05:07:25] DEBUG: Generated='william shakespeare' vs Expected='william shakespeare'
[05:07:25] DEBUG: Overlap=2, Precision=1.000, Recall=1.000
[05:07:25] DEBUG: F1=1.000, EM=1.0, Overlap=1.000
[05:07:26] DEBUG: Generated='factorials n!' vs Expected='4'
[05:07:26] DEBUG: Overlap=0, Precision=0.000, Recall=0.000
[05:07:26] DEBUG: F1=0.000, EM=0.0, Overlap=0.000
[05:07:26] DEBUG: Generated='to convert light energy into chemical energy' vs Expected='process where plants make food from sunlight'
[05:07:26] DEBUG: Overlap=0, Precision=0.000, Recall=0.000
[05:07:26] DEBUG: F1=0.000, EM=0.0, Overlap=0.000
[05:07:26] DEBUG: Generated='numerical interpretation of numbers' vs Expected='they process information using electrical circuits'
[05:07:26] DEBUG: Overlap=0, Precision=0.000, Recall=0.000
[05:07:26] DEBUG: F1=0.000, EM=0.0, Overlap=0.000
[05:07:27] DEBUG: Generated='white' vs Expected='red blue green'
[05:07:27] DEBUG: Overlap=0, Precision=0.000, Recall=0.000
[05:07:27] DEBUG: F1=0.000, EM=0.0, Overlap=0.000
[05:07:27] DEBUG: Generated='amphibians' vs Expected='cat dog'
[05:07:27] DEBUG: Overlap=0, Precision=0.000, Recall=0.000
[05:07:27] DEBUG: F1=0.000, EM=0.0, Overlap=0.000
[05:07:27] DEBUG: Generated='all living things require water' vs Expected='essential for life and survival'
[05:07:27] DEBUG: Overlap=0, Precision=0.000, Recall=0.000
[05:07:27] DEBUG: F1=0.000, EM=0.0, Overlap=0.000
[05:07:27] DEBUG: Generated='chlorophyll' vs Expected='chlorophyll'
[05:07:27] DEBUG: Overlap=1, Precision=1.000, Recall=1.000
[05:07:27] DEBUG: F1=1.000, EM=1.0, Overlap=1.000
[05:07:28] DEBUG: Generated='ellipse' vs Expected='yes'
[05:07:28] DEBUG: Overlap=0, Precision=0.000, Recall=0.000
[05:07:28] DEBUG: F1=0.000, EM=0.0, Overlap=0.000
[05:07:28]   Progress: 10/50 - Recent F1: 0.300
[05:07:28] DEBUG: Generated='bird flight' vs Expected='yes'
[05:07:28] DEBUG: Overlap=0, Precision=0.000, Recall=0.000
[05:07:28] DEBUG: F1=0.000, EM=0.0, Overlap=0.000
[05:07:28] DEBUG: Generated='blue' vs Expected='red yellow blue'
[05:07:28] DEBUG: Overlap=1, Precision=1.000, Recall=0.333
[05:07:28] DEBUG: F1=0.500, EM=0.0, Overlap=0.333
[05:07:29] DEBUG: Generated='france' vs Expected='france'
[05:07:29] DEBUG: Overlap=1, Precision=1.000, Recall=1.000
[05:07:29] DEBUG: F1=1.000, EM=1.0, Overlap=1.000
[05:07:29] DEBUG: Generated='9th century -- 9th century' vs Expected='10th and 11th centuries'
[05:07:29] DEBUG: Overlap=0, Precision=0.000, Recall=0.000
[05:07:29] DEBUG: F1=0.000, EM=0.0, Overlap=0.000
[05:07:29] DEBUG: Generated='sweden' vs Expected='denmark, iceland and norway'
[05:07:29] DEBUG: Overlap=0, Precision=0.000, Recall=0.000
[05:07:29] DEBUG: F1=0.000, EM=0.0, Overlap=0.000
[05:07:30] DEBUG: Generated='cnut' vs Expected='rollo'
[05:07:30] DEBUG: Overlap=0, Precision=0.000, Recall=0.000
[05:07:30] DEBUG: F1=0.000, EM=0.0, Overlap=0.000
[05:07:30] DEBUG: Generated='the ninth century' vs Expected='10th century'
[05:07:30] DEBUG: Overlap=1, Precision=0.333, Recall=0.500
[05:07:30] DEBUG: F1=0.400, EM=0.0, Overlap=0.500
[05:07:30] DEBUG: Generated='william' vs Expected='william the conqueror'
[05:07:30] DEBUG: Overlap=1, Precision=1.000, Recall=0.333
[05:07:30] DEBUG: F1=0.500, EM=0.0, Overlap=0.333
[05:07:31] DEBUG: Generated='king charles iii of west francia' vs Expected='richard i'
[05:07:31] DEBUG: Overlap=0, Precision=0.000, Recall=0.000
[05:07:31] DEBUG: F1=0.000, EM=0.0, Overlap=0.000
[05:07:31] DEBUG: Generated='catholicism' vs Expected='catholic'
[05:07:31] DEBUG: Overlap=0, Precision=0.000, Recall=0.000
[05:07:31] DEBUG: F1=0.000, EM=0.0, Overlap=0.000
[05:07:31]   Progress: 20/50 - Recent F1: 0.240
[05:07:32] DEBUG: Generated='north' vs Expected='viking'
[05:07:32] DEBUG: Overlap=0, Precision=0.000, Recall=0.000
[05:07:32] DEBUG: F1=0.000, EM=0.0, Overlap=0.000
[05:07:32] DEBUG: Generated='1024' vs Expected='9th century'
[05:07:32] DEBUG: Overlap=0, Precision=0.000, Recall=0.000
[05:07:32] DEBUG: F1=0.000, EM=0.0, Overlap=0.000
[05:07:32] DEBUG: Generated='1066' vs Expected='911'
[05:07:32] DEBUG: Overlap=0, Precision=0.000, Recall=0.000
[05:07:32] DEBUG: F1=0.000, EM=0.0, Overlap=0.000
[05:07:33] DEBUG: Generated='charles the simple' vs Expected='king charles iii'
[05:07:33] DEBUG: Overlap=1, Precision=0.333, Recall=0.333
[05:07:33] DEBUG: F1=0.333, EM=0.0, Overlap=0.333
[05:07:33] DEBUG: Generated='elbe' vs Expected='seine'
[05:07:33] DEBUG: Overlap=0, Precision=0.000, Recall=0.000
[05:07:33] DEBUG: F1=0.000, EM=0.0, Overlap=0.000
[05:07:34] DEBUG: Generated='the byzantines' vs Expected='rollo'
[05:07:34] DEBUG: Overlap=0, Precision=0.000, Recall=0.000
[05:07:34] DEBUG: F1=0.000, EM=0.0, Overlap=0.000
[05:07:34] DEBUG: Generated='catholicism' vs Expected='catholicism'
[05:07:34] DEBUG: Overlap=1, Precision=1.000, Recall=1.000
[05:07:34] DEBUG: F1=1.000, EM=1.0, Overlap=1.000
[05:07:34] DEBUG: Generated='west france' vs Expected='north'
[05:07:34] DEBUG: Overlap=0, Precision=0.000, Recall=0.000
[05:07:34] DEBUG: F1=0.000, EM=0.0, Overlap=0.000
[05:07:35] DEBUG: Generated='cloth' vs Expected='fighting horsemen'
[05:07:35] DEBUG: Overlap=0, Precision=0.000, Recall=0.000
[05:07:35] DEBUG: F1=0.000, EM=0.0, Overlap=0.000
[05:07:35] DEBUG: Generated='hohenstaufen' vs Expected='seljuk turks'
[05:07:35] DEBUG: Overlap=0, Precision=0.000, Recall=0.000
[05:07:35] DEBUG: F1=0.000, EM=0.0, Overlap=0.000
[05:07:35]   Progress: 30/50 - Recent F1: 0.133
[05:07:35] DEBUG: Generated='1984 -- 86' vs Expected='1050s'
[05:07:35] DEBUG: Overlap=0, Precision=0.000, Recall=0.000
[05:07:35] DEBUG: F1=0.000, EM=0.0, Overlap=0.000
[05:07:36] DEBUG: Generated='862' vs Expected='1060s'
[05:07:36] DEBUG: Overlap=0, Precision=0.000, Recall=0.000
[05:07:36] DEBUG: F1=0.000, EM=0.0, Overlap=0.000
[05:07:36] DEBUG: Generated='henshaw' vs Expected='alexius komnenos'
[05:07:36] DEBUG: Overlap=0, Precision=0.000, Recall=0.000
[05:07:36] DEBUG: F1=0.000, EM=0.0, Overlap=0.000
[05:07:36] DEBUG: Generated='neath castle' vs Expected='afranji'
[05:07:36] DEBUG: Overlap=0, Precision=0.000, Recall=0.000
[05:07:36] DEBUG: F1=0.000, EM=0.0, Overlap=0.000
[05:07:37] DEBUG: Generated='theudebert i' vs Expected='oursel'
[05:07:37] DEBUG: Overlap=0, Precision=0.000, Recall=0.000
[05:07:37] DEBUG: F1=0.000, EM=0.0, Overlap=0.000
[05:07:37] DEBUG: Generated='turkey' vs Expected='turkish forces'
[05:07:37] DEBUG: Overlap=0, Precision=0.000, Recall=0.000
[05:07:37] DEBUG: F1=0.000, EM=0.0, Overlap=0.000
[05:07:37] DEBUG: Generated='english' vs Expected='norman mercenary'
[05:07:37] DEBUG: Overlap=0, Precision=0.000, Recall=0.000
[05:07:37] DEBUG: F1=0.000, EM=0.0, Overlap=0.000
[05:07:37] DEBUG: Generated='( last ) frederick iii' vs Expected='robert guiscard'
[05:07:37] DEBUG: Overlap=0, Precision=0.000, Recall=0.000
[05:07:37] DEBUG: F1=0.000, EM=0.0, Overlap=0.000
[05:07:38] DEBUG: Generated='10th century' vs Expected='1082'
[05:07:38] DEBUG: Overlap=0, Precision=0.000, Recall=0.000
[05:07:38] DEBUG: F1=0.000, EM=0.0, Overlap=0.000
[05:07:38] DEBUG: Generated='1,000,000' vs Expected='30,000'
[05:07:38] DEBUG: Overlap=0, Precision=0.000, Recall=0.000
[05:07:38] DEBUG: F1=0.000, EM=0.0, Overlap=0.000
[05:07:38]   Progress: 40/50 - Recent F1: 0.000
[05:07:39] DEBUG: Generated='constantinople' vs Expected='deabolis'
[05:07:39] DEBUG: Overlap=0, Precision=0.000, Recall=0.000
[05:07:39] DEBUG: F1=0.000, EM=0.0, Overlap=0.000
[05:07:39] DEBUG: Generated='steffon' vs Expected='bohemond'
[05:07:39] DEBUG: Overlap=0, Precision=0.000, Recall=0.000
[05:07:39] DEBUG: F1=0.000, EM=0.0, Overlap=0.000
[05:07:39] DEBUG: Generated='river irwell' vs Expected='deabolis'
[05:07:39] DEBUG: Overlap=0, Precision=0.000, Recall=0.000
[05:07:39] DEBUG: F1=0.000, EM=0.0, Overlap=0.000
[05:07:39] DEBUG: Generated='october 1174' vs Expected='1185'
[05:07:39] DEBUG: Overlap=0, Precision=0.000, Recall=0.000
[05:07:39] DEBUG: F1=0.000, EM=0.0, Overlap=0.000
[05:07:40] DEBUG: Generated='guantanamo bay naval base' vs Expected='dyrrachium'
[05:07:40] DEBUG: Overlap=0, Precision=0.000, Recall=0.000
[05:07:40] DEBUG: F1=0.000, EM=0.0, Overlap=0.000
[05:07:40] DEBUG: Generated='canada' vs Expected='the adriatic'
[05:07:40] DEBUG: Overlap=0, Precision=0.000, Recall=0.000
[05:07:40] DEBUG: F1=0.000, EM=0.0, Overlap=0.000
[05:07:40] DEBUG: Generated='will arnett' vs Expected='king ethelred ii'
[05:07:40] DEBUG: Overlap=0, Precision=0.000, Recall=0.000
[05:07:40] DEBUG: F1=0.000, EM=0.0, Overlap=0.000
[05:07:41] DEBUG: Generated='bradley spencer' vs Expected='duke richard ii'
[05:07:41] DEBUG: Overlap=0, Precision=0.000, Recall=0.000
[05:07:41] DEBUG: F1=0.000, EM=0.0, Overlap=0.000
[05:07:42] DEBUG: Generated='fled to be with ethelred' vs Expected='normandy'
[05:07:42] DEBUG: Overlap=0, Precision=0.000, Recall=0.000
[05:07:42] DEBUG: F1=0.000, EM=0.0, Overlap=0.000
[05:07:42] DEBUG: Generated='howard' vs Expected='sweyn forkbeard'
[05:07:42] DEBUG: Overlap=0, Precision=0.000, Recall=0.000
[05:07:42] DEBUG: F1=0.000, EM=0.0, Overlap=0.000
[05:07:42]   Progress: 50/50 - Recent F1: 0.000
[05:07:42]    basic completed: F1=0.135, EM=0.100
[05:07:42] 
 Experiment completed! Total results: 350
[05:07:42] 
 ANALYZING RESULTS...
[05:07:42] 
 TEMPLATE PERFORMANCE RANKING:
[05:07:42] --------------------------------------------------------------------------------
[05:07:42] Template             F1 Score   EM Score   Samples  Improvement 
[05:07:42] --------------------------------------------------------------------------------
[05:07:42] retrieval_focused    0.139     0.080     50       ++3.5%      
[05:07:42] confident_direct     0.138     0.080     50       ++2.2%      
[05:07:42] structured_response  0.137     0.060     50       ++1.8%      
[05:07:42] basic                0.135     0.100     50       BASELINE    
[05:07:42] instructional_clear  0.132     0.060     50       +-1.7%      
[05:07:42] context_guided       0.109     0.040     50       +-18.8%     
[05:07:42] knowledge_synthesis  0.084     0.040     50       +-37.4%     
[05:07:42] 
 SUCCESS ANALYSIS:
[05:07:42]    Best Template: retrieval_focused (F1: 0.139)
[05:07:42]    SUCCESS! Basic template relegated to rank 4
[05:07:42]    Template engineering shows measurable impact!
[05:07:42] 
 SAMPLE RESULTS:
[05:07:42] ======================================================================
[05:07:42] 
 Template: retrieval_focused (Rank 1)
[05:07:42]    Q: What is the capital of France?...
[05:07:42]    Expected: Paris
[05:07:42]    Generated: paris
[05:07:42]    Score: F1=1.000
[05:07:42]    Q: Who wrote Romeo and Juliet?...
[05:07:42]    Expected: William Shakespeare
[05:07:42]    Generated: william shakespeare
[05:07:42]    Score: F1=1.000
[05:07:42] 
 Template: confident_direct (Rank 2)
[05:07:42]    Q: What is the capital of France?...
[05:07:42]    Expected: Paris
[05:07:42]    Generated: paris
[05:07:42]    Score: F1=1.000
[05:07:42]    Q: Who wrote Romeo and Juliet?...
[05:07:42]    Expected: William Shakespeare
[05:07:42]    Generated: william shakespeare
[05:07:42]    Score: F1=1.000
[05:07:42] 
 Template: structured_response (Rank 3)
[05:07:42]    Q: What is the capital of France?...
[05:07:42]    Expected: Paris
[05:07:42]    Generated: paris
[05:07:42]    Score: F1=1.000
[05:07:42]    Q: Who wrote Romeo and Juliet?...
[05:07:42]    Expected: William Shakespeare
[05:07:42]    Generated: william shakespeare
[05:07:42]    Score: F1=1.000
[05:07:42] 
 TARGETED EXPERIMENT COMPLETED!
