[06:51:27] 🔥 Setting up GPU configuration...
[06:51:28] 🎯 Using device: cuda:0
[06:51:28] 📦 Loading RAG models...
[06:54:52] 🚀 RAG system ready!
[06:54:52] 📚 Loading targeted evaluation dataset...
[06:54:55] 📊 Dataset loaded: 42 questions
[06:54:55]    - Targeted questions: 12
[06:54:55]    - SQuAD questions: 30
[06:54:55] 🧪 Starting targeted RAG experiment...
[06:54:55] 📋 Testing 7 templates on 42 questions
[06:54:55] 
🔄 Testing template: retrieval_focused
[06:54:56] DEBUG: Generated='paris' vs Expected='paris'
[06:54:56] DEBUG: Overlap=1, Precision=1.000, Recall=1.000
[06:54:56] DEBUG: F1=1.000, EM=1.0, Overlap=1.000
[06:54:56] DEBUG: Generated='william shakespeare' vs Expected='william shakespeare'
[06:54:56] DEBUG: Overlap=2, Precision=1.000, Recall=1.000
[06:54:56] DEBUG: F1=1.000, EM=1.0, Overlap=1.000
[06:54:57] DEBUG: Generated='factorials n!' vs Expected='4'
[06:54:57] DEBUG: Overlap=0, Precision=0.000, Recall=0.000
[06:54:57] DEBUG: F1=0.000, EM=0.0, Overlap=0.000
[06:54:57] DEBUG: Generated='' vs Expected='process where plants make food from sunlight'
[06:54:57] DEBUG: F1=0.000, EM=0.0, Overlap=0.000
[06:54:57] DEBUG: Generated='what turns you on?' vs Expected='they process information using electrical circuits'
[06:54:57] DEBUG: Overlap=0, Precision=0.000, Recall=0.000
[06:54:57] DEBUG: F1=0.000, EM=0.0, Overlap=0.000
[06:54:57] DEBUG: Generated='red' vs Expected='red blue green'
[06:54:57] DEBUG: Overlap=1, Precision=1.000, Recall=0.333
[06:54:57] DEBUG: F1=0.500, EM=0.0, Overlap=0.333
[06:54:57] DEBUG: Generated='cat' vs Expected='cat dog'
[06:54:57] DEBUG: Overlap=1, Precision=1.000, Recall=0.500
[06:54:57] DEBUG: F1=0.667, EM=0.0, Overlap=0.500
[06:54:57] DEBUG: Generated='health' vs Expected='essential for life and survival'
[06:54:57] DEBUG: Overlap=0, Precision=0.000, Recall=0.000
[06:54:57] DEBUG: F1=0.000, EM=0.0, Overlap=0.000
[06:54:57] DEBUG: Generated='chlorophyll' vs Expected='chlorophyll'
[06:54:57] DEBUG: Overlap=1, Precision=1.000, Recall=1.000
[06:54:57] DEBUG: F1=1.000, EM=1.0, Overlap=1.000
[06:54:58] DEBUG: Generated='factorials n!' vs Expected='yes'
[06:54:58] DEBUG: Overlap=0, Precision=0.000, Recall=0.000
[06:54:58] DEBUG: F1=0.000, EM=0.0, Overlap=0.000
[06:54:58]   Progress: 10/42 - Recent F1: 0.417
[06:54:58] DEBUG: Generated='' vs Expected='yes'
[06:54:58] DEBUG: F1=0.000, EM=0.0, Overlap=0.000
[06:54:58] DEBUG: Generated='blue' vs Expected='red yellow blue'
[06:54:58] DEBUG: Overlap=1, Precision=1.000, Recall=0.333
[06:54:58] DEBUG: F1=0.500, EM=0.0, Overlap=0.333
[06:54:58] DEBUG: Generated='france' vs Expected='france'
[06:54:58] DEBUG: Overlap=1, Precision=1.000, Recall=1.000
[06:54:58] DEBUG: F1=1.000, EM=1.0, Overlap=1.000
[06:54:58] DEBUG: Generated='9th century -- 9th century' vs Expected='10th and 11th centuries'
[06:54:58] DEBUG: Overlap=0, Precision=0.000, Recall=0.000
[06:54:58] DEBUG: F1=0.000, EM=0.0, Overlap=0.000
[06:54:58] DEBUG: Generated='iceland' vs Expected='denmark, iceland and norway'
[06:54:58] DEBUG: Overlap=1, Precision=1.000, Recall=0.250
[06:54:58] DEBUG: F1=0.400, EM=0.0, Overlap=0.250
[06:54:58] DEBUG: Generated='bjorn ulvaeus' vs Expected='rollo'
[06:54:58] DEBUG: Overlap=0, Precision=0.000, Recall=0.000
[06:54:58] DEBUG: F1=0.000, EM=0.0, Overlap=0.000
[06:54:59] DEBUG: Generated='the ninth century' vs Expected='10th century'
[06:54:59] DEBUG: Overlap=1, Precision=0.333, Recall=0.500
[06:54:59] DEBUG: F1=0.400, EM=0.0, Overlap=0.500
[06:54:59] DEBUG: Generated='william' vs Expected='william the conqueror'
[06:54:59] DEBUG: Overlap=1, Precision=1.000, Recall=0.333
[06:54:59] DEBUG: F1=0.500, EM=0.0, Overlap=0.333
[06:54:59] DEBUG: Generated='king charles iii' vs Expected='richard i'
[06:54:59] DEBUG: Overlap=0, Precision=0.000, Recall=0.000
[06:54:59] DEBUG: F1=0.000, EM=0.0, Overlap=0.000
[06:54:59] DEBUG: Generated='catholicism' vs Expected='catholic'
[06:54:59] DEBUG: Overlap=0, Precision=0.000, Recall=0.000
[06:54:59] DEBUG: F1=0.000, EM=0.0, Overlap=0.000
[06:54:59]   Progress: 20/42 - Recent F1: 0.280
[06:54:59] DEBUG: Generated='north' vs Expected='viking'
[06:54:59] DEBUG: Overlap=0, Precision=0.000, Recall=0.000
[06:54:59] DEBUG: F1=0.000, EM=0.0, Overlap=0.000
[06:54:59] DEBUG: Generated='in 1024' vs Expected='9th century'
[06:54:59] DEBUG: Overlap=0, Precision=0.000, Recall=0.000
[06:54:59] DEBUG: F1=0.000, EM=0.0, Overlap=0.000
[06:55:00] DEBUG: Generated='1066' vs Expected='911'
[06:55:00] DEBUG: Overlap=0, Precision=0.000, Recall=0.000
[06:55:00] DEBUG: F1=0.000, EM=0.0, Overlap=0.000
[06:55:00] DEBUG: Generated='the franks' vs Expected='king charles iii'
[06:55:00] DEBUG: Overlap=0, Precision=0.000, Recall=0.000
[06:55:00] DEBUG: F1=0.000, EM=0.0, Overlap=0.000
[06:55:00] DEBUG: Generated='tennessee river' vs Expected='seine'
[06:55:00] DEBUG: Overlap=0, Precision=0.000, Recall=0.000
[06:55:00] DEBUG: F1=0.000, EM=0.0, Overlap=0.000
[06:55:00] DEBUG: Generated='the inuit' vs Expected='rollo'
[06:55:00] DEBUG: Overlap=0, Precision=0.000, Recall=0.000
[06:55:00] DEBUG: F1=0.000, EM=0.0, Overlap=0.000
[06:55:00] DEBUG: Generated='islam' vs Expected='catholicism'
[06:55:00] DEBUG: Overlap=0, Precision=0.000, Recall=0.000
[06:55:00] DEBUG: F1=0.000, EM=0.0, Overlap=0.000
[06:55:00] DEBUG: Generated='normandy' vs Expected='north'
[06:55:00] DEBUG: Overlap=0, Precision=0.000, Recall=0.000
[06:55:00] DEBUG: F1=0.000, EM=0.0, Overlap=0.000
[06:55:01] DEBUG: Generated='foodstuffs' vs Expected='fighting horsemen'
[06:55:01] DEBUG: Overlap=0, Precision=0.000, Recall=0.000
[06:55:01] DEBUG: F1=0.000, EM=0.0, Overlap=0.000
[06:55:01] DEBUG: Generated='byzantine empire' vs Expected='seljuk turks'
[06:55:01] DEBUG: Overlap=0, Precision=0.000, Recall=0.000
[06:55:01] DEBUG: F1=0.000, EM=0.0, Overlap=0.000
[06:55:01]   Progress: 30/42 - Recent F1: 0.000
[06:55:01] DEBUG: Generated='1984 -- 86' vs Expected='1050s'
[06:55:01] DEBUG: Overlap=0, Precision=0.000, Recall=0.000
[06:55:01] DEBUG: F1=0.000, EM=0.0, Overlap=0.000
[06:55:01] DEBUG: Generated='1984' vs Expected='1060s'
[06:55:01] DEBUG: Overlap=0, Precision=0.000, Recall=0.000
[06:55:01] DEBUG: F1=0.000, EM=0.0, Overlap=0.000
[06:55:01] DEBUG: Generated='factorials' vs Expected='alexius komnenos'
[06:55:01] DEBUG: Overlap=0, Precision=0.000, Recall=0.000
[06:55:01] DEBUG: F1=0.000, EM=0.0, Overlap=0.000
[06:55:01] DEBUG: Generated='the château de caen' vs Expected='afranji'
[06:55:01] DEBUG: Overlap=0, Precision=0.000, Recall=0.000
[06:55:01] DEBUG: F1=0.000, EM=0.0, Overlap=0.000
[06:55:02] DEBUG: Generated='' vs Expected='oursel'
[06:55:02] DEBUG: F1=0.000, EM=0.0, Overlap=0.000
[06:55:02] DEBUG: Generated='turkey' vs Expected='turkish forces'
[06:55:02] DEBUG: Overlap=0, Precision=0.000, Recall=0.000
[06:55:02] DEBUG: F1=0.000, EM=0.0, Overlap=0.000
[06:55:02] DEBUG: Generated='byzantine origin' vs Expected='norman mercenary'
[06:55:02] DEBUG: Overlap=0, Precision=0.000, Recall=0.000
[06:55:02] DEBUG: F1=0.000, EM=0.0, Overlap=0.000
[06:55:02] DEBUG: Generated='( last ) frederick iii' vs Expected='robert guiscard'
[06:55:02] DEBUG: Overlap=0, Precision=0.000, Recall=0.000
[06:55:02] DEBUG: F1=0.000, EM=0.0, Overlap=0.000
[06:55:02] DEBUG: Generated='true' vs Expected='1082'
[06:55:02] DEBUG: Overlap=0, Precision=0.000, Recall=0.000
[06:55:02] DEBUG: F1=0.000, EM=0.0, Overlap=0.000
[06:55:02] DEBUG: Generated='about 100,000 and 150,000' vs Expected='30,000'
[06:55:02] DEBUG: Overlap=0, Precision=0.000, Recall=0.000
[06:55:02] DEBUG: F1=0.000, EM=0.0, Overlap=0.000
[06:55:02]   Progress: 40/42 - Recent F1: 0.000
[06:55:03] DEBUG: Generated='constantinople' vs Expected='deabolis'
[06:55:03] DEBUG: Overlap=0, Precision=0.000, Recall=0.000
[06:55:03] DEBUG: F1=0.000, EM=0.0, Overlap=0.000
[06:55:03] DEBUG: Generated='robert's son' vs Expected='bohemond'
[06:55:03] DEBUG: Overlap=0, Precision=0.000, Recall=0.000
[06:55:03] DEBUG: F1=0.000, EM=0.0, Overlap=0.000
[06:55:03]    retrieval_focused completed: F1=0.166, EM=0.095
[06:55:03] 
🔄 Testing template: knowledge_synthesis
[06:55:03] DEBUG: Generated='paris' vs Expected='paris'
[06:55:03] DEBUG: Overlap=1, Precision=1.000, Recall=1.000
[06:55:03] DEBUG: F1=1.000, EM=1.0, Overlap=1.000
[06:55:03] DEBUG: Generated='who?' vs Expected='william shakespeare'
[06:55:03] DEBUG: Overlap=0, Precision=0.000, Recall=0.000
[06:55:03] DEBUG: F1=0.000, EM=0.0, Overlap=0.000
[06:55:03] DEBUG: Generated='factorials n!' vs Expected='4'
[06:55:03] DEBUG: Overlap=0, Precision=0.000, Recall=0.000
[06:55:03] DEBUG: F1=0.000, EM=0.0, Overlap=0.000
[06:55:03] DEBUG: Generated='plants, algae and cyanobacteria' vs Expected='process where plants make food from sunlight'
[06:55:03] DEBUG: Overlap=0, Precision=0.000, Recall=0.000
[06:55:03] DEBUG: F1=0.000, EM=0.0, Overlap=0.000
[06:55:04] DEBUG: Generated='problem / problem / solution' vs Expected='they process information using electrical circuits'
[06:55:04] DEBUG: Overlap=0, Precision=0.000, Recall=0.000
[06:55:04] DEBUG: F1=0.000, EM=0.0, Overlap=0.000
[06:55:04] DEBUG: Generated='' vs Expected='red blue green'
[06:55:04] DEBUG: F1=0.000, EM=0.0, Overlap=0.000
[06:55:04] DEBUG: Generated='cat' vs Expected='cat dog'
[06:55:04] DEBUG: Overlap=1, Precision=1.000, Recall=0.500
[06:55:04] DEBUG: F1=0.667, EM=0.0, Overlap=0.500
[06:55:04] DEBUG: Generated='data visuali zation' vs Expected='essential for life and survival'
[06:55:04] DEBUG: Overlap=0, Precision=0.000, Recall=0.000
[06:55:04] DEBUG: F1=0.000, EM=0.0, Overlap=0.000
[06:55:04] DEBUG: Generated='what makes plants green' vs Expected='chlorophyll'
[06:55:04] DEBUG: Overlap=0, Precision=0.000, Recall=0.000
[06:55:04] DEBUG: F1=0.000, EM=0.0, Overlap=0.000
[06:55:04] DEBUG: Generated='what turns you on?' vs Expected='yes'
[06:55:04] DEBUG: Overlap=0, Precision=0.000, Recall=0.000
[06:55:04] DEBUG: F1=0.000, EM=0.0, Overlap=0.000
[06:55:04]   Progress: 10/42 - Recent F1: 0.167
[06:55:05] DEBUG: Generated='do you like sex?' vs Expected='yes'
[06:55:05] DEBUG: Overlap=0, Precision=0.000, Recall=0.000
[06:55:05] DEBUG: F1=0.000, EM=0.0, Overlap=0.000
[06:55:05] DEBUG: Generated='blue' vs Expected='red yellow blue'
[06:55:05] DEBUG: Overlap=1, Precision=1.000, Recall=0.333
[06:55:05] DEBUG: F1=0.500, EM=0.0, Overlap=0.333
[06:55:05] DEBUG: Generated='france' vs Expected='france'
[06:55:05] DEBUG: Overlap=1, Precision=1.000, Recall=1.000
[06:55:05] DEBUG: F1=1.000, EM=1.0, Overlap=1.000
[06:55:05] DEBUG: Generated='10th century -- 15th century' vs Expected='10th and 11th centuries'
[06:55:05] DEBUG: Overlap=1, Precision=0.250, Recall=0.250
[06:55:05] DEBUG: F1=0.250, EM=0.0, Overlap=0.250
[06:55:05] DEBUG: Generated='scandinavia' vs Expected='denmark, iceland and norway'
[06:55:05] DEBUG: Overlap=0, Precision=0.000, Recall=0.000
[06:55:05] DEBUG: F1=0.000, EM=0.0, Overlap=0.000
[06:55:05] DEBUG: Generated='who was the norse leader' vs Expected='rollo'
[06:55:05] DEBUG: Overlap=0, Precision=0.000, Recall=0.000
[06:55:05] DEBUG: F1=0.000, EM=0.0, Overlap=0.000
[06:55:06] DEBUG: Generated='the ninth century' vs Expected='10th century'
[06:55:06] DEBUG: Overlap=1, Precision=0.333, Recall=0.500
[06:55:06] DEBUG: F1=0.400, EM=0.0, Overlap=0.500
[06:55:06] DEBUG: Generated='normandy duke of normandy' vs Expected='william the conqueror'
[06:55:06] DEBUG: Overlap=0, Precision=0.000, Recall=0.000
[06:55:06] DEBUG: F1=0.000, EM=0.0, Overlap=0.000
[06:55:06] DEBUG: Generated='king charles iii' vs Expected='richard i'
[06:55:06] DEBUG: Overlap=0, Precision=0.000, Recall=0.000
[06:55:06] DEBUG: F1=0.000, EM=0.0, Overlap=0.000
[06:55:06] DEBUG: Generated='catholicism' vs Expected='catholic'
[06:55:06] DEBUG: Overlap=0, Precision=0.000, Recall=0.000
[06:55:06] DEBUG: F1=0.000, EM=0.0, Overlap=0.000
[06:55:06]   Progress: 20/42 - Recent F1: 0.215
[06:55:06] DEBUG: Generated='data visuali zation' vs Expected='viking'
[06:55:06] DEBUG: Overlap=0, Precision=0.000, Recall=0.000
[06:55:06] DEBUG: F1=0.000, EM=0.0, Overlap=0.000
[06:55:06] DEBUG: Generated='in 1024' vs Expected='9th century'
[06:55:06] DEBUG: Overlap=0, Precision=0.000, Recall=0.000
[06:55:06] DEBUG: F1=0.000, EM=0.0, Overlap=0.000
[06:55:07] DEBUG: Generated='1066' vs Expected='911'
[06:55:07] DEBUG: Overlap=0, Precision=0.000, Recall=0.000
[06:55:07] DEBUG: F1=0.000, EM=0.0, Overlap=0.000
[06:55:07] DEBUG: Generated='patrick alexander russell' vs Expected='king charles iii'
[06:55:07] DEBUG: Overlap=0, Precision=0.000, Recall=0.000
[06:55:07] DEBUG: F1=0.000, EM=0.0, Overlap=0.000
[06:55:07] DEBUG: Generated='tennessee river' vs Expected='seine'
[06:55:07] DEBUG: Overlap=0, Precision=0.000, Recall=0.000
[06:55:07] DEBUG: F1=0.000, EM=0.0, Overlap=0.000
[06:55:07] DEBUG: Generated='the normans' vs Expected='rollo'
[06:55:07] DEBUG: Overlap=0, Precision=0.000, Recall=0.000
[06:55:07] DEBUG: F1=0.000, EM=0.0, Overlap=0.000
[06:55:07] DEBUG: Generated='islam' vs Expected='catholicism'
[06:55:07] DEBUG: Overlap=0, Precision=0.000, Recall=0.000
[06:55:07] DEBUG: F1=0.000, EM=0.0, Overlap=0.000
[06:55:07] DEBUG: Generated='normandy' vs Expected='north'
[06:55:07] DEBUG: Overlap=0, Precision=0.000, Recall=0.000
[06:55:07] DEBUG: F1=0.000, EM=0.0, Overlap=0.000
[06:55:08] DEBUG: Generated='266,827' vs Expected='fighting horsemen'
[06:55:08] DEBUG: Overlap=0, Precision=0.000, Recall=0.000
[06:55:08] DEBUG: F1=0.000, EM=0.0, Overlap=0.000
[06:55:08] DEBUG: Generated='byzantine empire' vs Expected='seljuk turks'
[06:55:08] DEBUG: Overlap=0, Precision=0.000, Recall=0.000
[06:55:08] DEBUG: F1=0.000, EM=0.0, Overlap=0.000
[06:55:08]   Progress: 30/42 - Recent F1: 0.000
[06:55:08] DEBUG: Generated='1984 -- 86' vs Expected='1050s'
[06:55:08] DEBUG: Overlap=0, Precision=0.000, Recall=0.000
[06:55:08] DEBUG: F1=0.000, EM=0.0, Overlap=0.000
[06:55:08] DEBUG: Generated='robert crispin's diary' vs Expected='1060s'
[06:55:08] DEBUG: Overlap=0, Precision=0.000, Recall=0.000
[06:55:08] DEBUG: F1=0.000, EM=0.0, Overlap=0.000
[06:55:08] DEBUG: Generated='british empire' vs Expected='alexius komnenos'
[06:55:08] DEBUG: Overlap=0, Precision=0.000, Recall=0.000
[06:55:08] DEBUG: F1=0.000, EM=0.0, Overlap=0.000
[06:55:08] DEBUG: Generated='' vs Expected='afranji'
[06:55:08] DEBUG: F1=0.000, EM=0.0, Overlap=0.000
[06:55:08] DEBUG: Generated='2018' vs Expected='oursel'
[06:55:08] DEBUG: Overlap=0, Precision=0.000, Recall=0.000
[06:55:08] DEBUG: F1=0.000, EM=0.0, Overlap=0.000
[06:55:09] DEBUG: Generated='turkey' vs Expected='turkish forces'
[06:55:09] DEBUG: Overlap=0, Precision=0.000, Recall=0.000
[06:55:09] DEBUG: F1=0.000, EM=0.0, Overlap=0.000
[06:55:09] DEBUG: Generated='byzantine origin' vs Expected='norman mercenary'
[06:55:09] DEBUG: Overlap=0, Precision=0.000, Recall=0.000
[06:55:09] DEBUG: F1=0.000, EM=0.0, Overlap=0.000
[06:55:09] DEBUG: Generated='' vs Expected='robert guiscard'
[06:55:09] DEBUG: F1=0.000, EM=0.0, Overlap=0.000
[06:55:09] DEBUG: Generated='1970s' vs Expected='1082'
[06:55:09] DEBUG: Overlap=0, Precision=0.000, Recall=0.000
[06:55:09] DEBUG: F1=0.000, EM=0.0, Overlap=0.000
[06:55:09] DEBUG: Generated='1,250,000 men' vs Expected='30,000'
[06:55:09] DEBUG: Overlap=0, Precision=0.000, Recall=0.000
[06:55:09] DEBUG: F1=0.000, EM=0.0, Overlap=0.000
[06:55:09]   Progress: 40/42 - Recent F1: 0.000
[06:55:09] DEBUG: Generated='constantinople' vs Expected='deabolis'
[06:55:09] DEBUG: Overlap=0, Precision=0.000, Recall=0.000
[06:55:09] DEBUG: F1=0.000, EM=0.0, Overlap=0.000
[06:55:10] DEBUG: Generated='' vs Expected='bohemond'
[06:55:10] DEBUG: F1=0.000, EM=0.0, Overlap=0.000
[06:55:10]    knowledge_synthesis completed: F1=0.091, EM=0.048
[06:55:10] 
🔄 Testing template: instructional_clear
[06:55:10] DEBUG: Generated='paris' vs Expected='paris'
[06:55:10] DEBUG: Overlap=1, Precision=1.000, Recall=1.000
[06:55:10] DEBUG: F1=1.000, EM=1.0, Overlap=1.000
[06:55:10] DEBUG: Generated='william shakespeare' vs Expected='william shakespeare'
[06:55:10] DEBUG: Overlap=2, Precision=1.000, Recall=1.000
[06:55:10] DEBUG: F1=1.000, EM=1.0, Overlap=1.000
[06:55:10] DEBUG: Generated='the question' vs Expected='4'
[06:55:10] DEBUG: Overlap=0, Precision=0.000, Recall=0.000
[06:55:10] DEBUG: F1=0.000, EM=0.0, Overlap=0.000
[06:55:10] DEBUG: Generated='photosynthesis' vs Expected='process where plants make food from sunlight'
[06:55:10] DEBUG: Overlap=0, Precision=0.000, Recall=0.000
[06:55:10] DEBUG: F1=0.000, EM=0.0, Overlap=0.000
[06:55:10] DEBUG: Generated='what turns you on?' vs Expected='they process information using electrical circuits'
[06:55:10] DEBUG: Overlap=0, Precision=0.000, Recall=0.000
[06:55:10] DEBUG: F1=0.000, EM=0.0, Overlap=0.000
[06:55:11] DEBUG: Generated='blue' vs Expected='red blue green'
[06:55:11] DEBUG: Overlap=1, Precision=1.000, Recall=0.333
[06:55:11] DEBUG: F1=0.500, EM=0.0, Overlap=0.333
[06:55:11] DEBUG: Generated='cat' vs Expected='cat dog'
[06:55:11] DEBUG: Overlap=1, Precision=1.000, Recall=0.500
[06:55:11] DEBUG: F1=0.667, EM=0.0, Overlap=0.500
[06:55:11] DEBUG: Generated='for all known forms of life' vs Expected='essential for life and survival'
[06:55:11] DEBUG: Overlap=2, Precision=0.333, Recall=0.400
[06:55:11] DEBUG: F1=0.364, EM=0.0, Overlap=0.400
[06:55:11] DEBUG: Generated='what turns you on?' vs Expected='chlorophyll'
[06:55:11] DEBUG: Overlap=0, Precision=0.000, Recall=0.000
[06:55:11] DEBUG: F1=0.000, EM=0.0, Overlap=0.000
[06:55:11] DEBUG: Generated='the question' vs Expected='yes'
[06:55:11] DEBUG: Overlap=0, Precision=0.000, Recall=0.000
[06:55:11] DEBUG: F1=0.000, EM=0.0, Overlap=0.000
[06:55:11]   Progress: 10/42 - Recent F1: 0.353
[06:55:11] DEBUG: Generated='' vs Expected='yes'
[06:55:11] DEBUG: F1=0.000, EM=0.0, Overlap=0.000
[06:55:11] DEBUG: Generated='red' vs Expected='red yellow blue'
[06:55:11] DEBUG: Overlap=1, Precision=1.000, Recall=0.333
[06:55:11] DEBUG: F1=0.500, EM=0.0, Overlap=0.333
[06:55:12] DEBUG: Generated='france' vs Expected='france'
[06:55:12] DEBUG: Overlap=1, Precision=1.000, Recall=1.000
[06:55:12] DEBUG: F1=1.000, EM=1.0, Overlap=1.000
[06:55:12] DEBUG: Generated='during the trojan war' vs Expected='10th and 11th centuries'
[06:55:12] DEBUG: Overlap=0, Precision=0.000, Recall=0.000
[06:55:12] DEBUG: F1=0.000, EM=0.0, Overlap=0.000
[06:55:12] DEBUG: Generated='iceland' vs Expected='denmark, iceland and norway'
[06:55:12] DEBUG: Overlap=1, Precision=1.000, Recall=0.250
[06:55:12] DEBUG: F1=0.400, EM=0.0, Overlap=0.250
[06:55:12] DEBUG: Generated='the question' vs Expected='rollo'
[06:55:12] DEBUG: Overlap=0, Precision=0.000, Recall=0.000
[06:55:12] DEBUG: F1=0.000, EM=0.0, Overlap=0.000
[06:55:12] DEBUG: Generated='the ninth century' vs Expected='10th century'
[06:55:12] DEBUG: Overlap=1, Precision=0.333, Recall=0.500
[06:55:12] DEBUG: F1=0.400, EM=0.0, Overlap=0.500
[06:55:12] DEBUG: Generated='the duke of normandy' vs Expected='william the conqueror'
[06:55:12] DEBUG: Overlap=1, Precision=0.250, Recall=0.333
[06:55:12] DEBUG: F1=0.286, EM=0.0, Overlap=0.333
[06:55:13] DEBUG: Generated='king charles iii' vs Expected='richard i'
[06:55:13] DEBUG: Overlap=0, Precision=0.000, Recall=0.000
[06:55:13] DEBUG: F1=0.000, EM=0.0, Overlap=0.000
[06:55:13] DEBUG: Generated='islam' vs Expected='catholic'
[06:55:13] DEBUG: Overlap=0, Precision=0.000, Recall=0.000
[06:55:13] DEBUG: F1=0.000, EM=0.0, Overlap=0.000
[06:55:13]   Progress: 20/42 - Recent F1: 0.259
[06:55:13] DEBUG: Generated='norman' vs Expected='viking'
[06:55:13] DEBUG: Overlap=0, Precision=0.000, Recall=0.000
[06:55:13] DEBUG: F1=0.000, EM=0.0, Overlap=0.000
[06:55:13] DEBUG: Generated='in 1024' vs Expected='9th century'
[06:55:13] DEBUG: Overlap=0, Precision=0.000, Recall=0.000
[06:55:13] DEBUG: F1=0.000, EM=0.0, Overlap=0.000
[06:55:13] DEBUG: Generated='1066' vs Expected='911'
[06:55:13] DEBUG: Overlap=0, Precision=0.000, Recall=0.000
[06:55:13] DEBUG: F1=0.000, EM=0.0, Overlap=0.000
[06:55:13] DEBUG: Generated='charles' vs Expected='king charles iii'
[06:55:13] DEBUG: Overlap=1, Precision=1.000, Recall=0.333
[06:55:13] DEBUG: F1=0.500, EM=0.0, Overlap=0.333
[06:55:14] DEBUG: Generated='what turns you on?' vs Expected='seine'
[06:55:14] DEBUG: Overlap=0, Precision=0.000, Recall=0.000
[06:55:14] DEBUG: F1=0.000, EM=0.0, Overlap=0.000
[06:55:14] DEBUG: Generated='the normans' vs Expected='rollo'
[06:55:14] DEBUG: Overlap=0, Precision=0.000, Recall=0.000
[06:55:14] DEBUG: F1=0.000, EM=0.0, Overlap=0.000
[06:55:14] DEBUG: Generated='what turns you on?' vs Expected='catholicism'
[06:55:14] DEBUG: Overlap=0, Precision=0.000, Recall=0.000
[06:55:14] DEBUG: F1=0.000, EM=0.0, Overlap=0.000
[06:55:14] DEBUG: Generated='normandy' vs Expected='north'
[06:55:14] DEBUG: Overlap=0, Precision=0.000, Recall=0.000
[06:55:14] DEBUG: F1=0.000, EM=0.0, Overlap=0.000
[06:55:14] DEBUG: Generated='what turns you on?' vs Expected='fighting horsemen'
[06:55:14] DEBUG: Overlap=0, Precision=0.000, Recall=0.000
[06:55:14] DEBUG: F1=0.000, EM=0.0, Overlap=0.000
[06:55:14] DEBUG: Generated='byzantine empire' vs Expected='seljuk turks'
[06:55:14] DEBUG: Overlap=0, Precision=0.000, Recall=0.000
[06:55:14] DEBUG: F1=0.000, EM=0.0, Overlap=0.000
[06:55:14]   Progress: 30/42 - Recent F1: 0.050
[06:55:14] DEBUG: Generated='602 -- 603' vs Expected='1050s'
[06:55:14] DEBUG: Overlap=0, Precision=0.000, Recall=0.000
[06:55:14] DEBUG: F1=0.000, EM=0.0, Overlap=0.000
[06:55:15] DEBUG: Generated='robert crispin and the turks' vs Expected='1060s'
[06:55:15] DEBUG: Overlap=0, Precision=0.000, Recall=0.000
[06:55:15] DEBUG: F1=0.000, EM=0.0, Overlap=0.000
[06:55:15] DEBUG: Generated='can you please provide a clear answer' vs Expected='alexius komnenos'
[06:55:15] DEBUG: Overlap=0, Precision=0.000, Recall=0.000
[06:55:15] DEBUG: F1=0.000, EM=0.0, Overlap=0.000
[06:55:15] DEBUG: Generated='what turns you on?' vs Expected='afranji'
[06:55:15] DEBUG: Overlap=0, Precision=0.000, Recall=0.000
[06:55:15] DEBUG: F1=0.000, EM=0.0, Overlap=0.000
[06:55:15] DEBUG: Generated='roosevelt' vs Expected='oursel'
[06:55:15] DEBUG: Overlap=0, Precision=0.000, Recall=0.000
[06:55:15] DEBUG: F1=0.000, EM=0.0, Overlap=0.000
[06:55:15] DEBUG: Generated='turkey' vs Expected='turkish forces'
[06:55:15] DEBUG: Overlap=0, Precision=0.000, Recall=0.000
[06:55:15] DEBUG: F1=0.000, EM=0.0, Overlap=0.000
[06:55:16] DEBUG: Generated='normandy, france' vs Expected='norman mercenary'
[06:55:16] DEBUG: Overlap=0, Precision=0.000, Recall=0.000
[06:55:16] DEBUG: F1=0.000, EM=0.0, Overlap=0.000
[06:55:16] DEBUG: Generated='lord canning' vs Expected='robert guiscard'
[06:55:16] DEBUG: Overlap=0, Precision=0.000, Recall=0.000
[06:55:16] DEBUG: F1=0.000, EM=0.0, Overlap=0.000
[06:55:16] DEBUG: Generated='what happened to dyrrachium?' vs Expected='1082'
[06:55:16] DEBUG: Overlap=0, Precision=0.000, Recall=0.000
[06:55:16] DEBUG: F1=0.000, EM=0.0, Overlap=0.000
[06:55:16] DEBUG: Generated='1,000,000' vs Expected='30,000'
[06:55:16] DEBUG: Overlap=0, Precision=0.000, Recall=0.000
[06:55:16] DEBUG: F1=0.000, EM=0.0, Overlap=0.000
[06:55:16]   Progress: 40/42 - Recent F1: 0.000
[06:55:16] DEBUG: Generated='constantinople' vs Expected='deabolis'
[06:55:16] DEBUG: Overlap=0, Precision=0.000, Recall=0.000
[06:55:16] DEBUG: F1=0.000, EM=0.0, Overlap=0.000
[06:55:16] DEBUG: Generated=', andrew' vs Expected='bohemond'
[06:55:16] DEBUG: Overlap=0, Precision=0.000, Recall=0.000
[06:55:16] DEBUG: F1=0.000, EM=0.0, Overlap=0.000
[06:55:16]    instructional_clear completed: F1=0.158, EM=0.071
[06:55:16] 
🔄 Testing template: context_guided
[06:55:16] DEBUG: Generated='paris' vs Expected='paris'
[06:55:16] DEBUG: Overlap=1, Precision=1.000, Recall=1.000
[06:55:16] DEBUG: F1=1.000, EM=1.0, Overlap=1.000
[06:55:17] DEBUG: Generated='' vs Expected='william shakespeare'
[06:55:17] DEBUG: F1=0.000, EM=0.0, Overlap=0.000
[06:55:17] DEBUG: Generated='what turns you on?' vs Expected='4'
[06:55:17] DEBUG: Overlap=0, Precision=0.000, Recall=0.000
[06:55:17] DEBUG: F1=0.000, EM=0.0, Overlap=0.000
[06:55:17] DEBUG: Generated='' vs Expected='process where plants make food from sunlight'
[06:55:17] DEBUG: F1=0.000, EM=0.0, Overlap=0.000
[06:55:17] DEBUG: Generated='what turns you on?' vs Expected='they process information using electrical circuits'
[06:55:17] DEBUG: Overlap=0, Precision=0.000, Recall=0.000
[06:55:17] DEBUG: F1=0.000, EM=0.0, Overlap=0.000
[06:55:17] DEBUG: Generated='green' vs Expected='red blue green'
[06:55:17] DEBUG: Overlap=1, Precision=1.000, Recall=0.333
[06:55:17] DEBUG: F1=0.500, EM=0.0, Overlap=0.333
[06:55:17] DEBUG: Generated='cat' vs Expected='cat dog'
[06:55:17] DEBUG: Overlap=1, Precision=1.000, Recall=0.500
[06:55:17] DEBUG: F1=0.667, EM=0.0, Overlap=0.500
[06:55:18] DEBUG: Generated='why is water important?' vs Expected='essential for life and survival'
[06:55:18] DEBUG: Overlap=0, Precision=0.000, Recall=0.000
[06:55:18] DEBUG: F1=0.000, EM=0.0, Overlap=0.000
[06:55:18] DEBUG: Generated='what makes plants green' vs Expected='chlorophyll'
[06:55:18] DEBUG: Overlap=0, Precision=0.000, Recall=0.000
[06:55:18] DEBUG: F1=0.000, EM=0.0, Overlap=0.000
[06:55:18] DEBUG: Generated='what turns you on?' vs Expected='yes'
[06:55:18] DEBUG: Overlap=0, Precision=0.000, Recall=0.000
[06:55:18] DEBUG: F1=0.000, EM=0.0, Overlap=0.000
[06:55:18]   Progress: 10/42 - Recent F1: 0.217
[06:55:18] DEBUG: Generated='the basic question' vs Expected='yes'
[06:55:18] DEBUG: Overlap=0, Precision=0.000, Recall=0.000
[06:55:18] DEBUG: F1=0.000, EM=0.0, Overlap=0.000
[06:55:18] DEBUG: Generated='red' vs Expected='red yellow blue'
[06:55:18] DEBUG: Overlap=1, Precision=1.000, Recall=0.333
[06:55:18] DEBUG: F1=0.500, EM=0.0, Overlap=0.333
[06:55:18] DEBUG: Generated='france' vs Expected='france'
[06:55:18] DEBUG: Overlap=1, Precision=1.000, Recall=1.000
[06:55:18] DEBUG: F1=1.000, EM=1.0, Overlap=1.000
[06:55:18] DEBUG: Generated='the 10th and 13th centuries' vs Expected='10th and 11th centuries'
[06:55:18] DEBUG: Overlap=3, Precision=0.600, Recall=0.750
[06:55:18] DEBUG: F1=0.667, EM=0.0, Overlap=0.750
[06:55:19] DEBUG: Generated='scandinavia' vs Expected='denmark, iceland and norway'
[06:55:19] DEBUG: Overlap=0, Precision=0.000, Recall=0.000
[06:55:19] DEBUG: F1=0.000, EM=0.0, Overlap=0.000
[06:55:19] DEBUG: Generated='who was the norse leader' vs Expected='rollo'
[06:55:19] DEBUG: Overlap=0, Precision=0.000, Recall=0.000
[06:55:19] DEBUG: F1=0.000, EM=0.0, Overlap=0.000
[06:55:19] DEBUG: Generated='the ninth century' vs Expected='10th century'
[06:55:19] DEBUG: Overlap=1, Precision=0.333, Recall=0.500
[06:55:19] DEBUG: F1=0.400, EM=0.0, Overlap=0.500
[06:55:19] DEBUG: Generated='normandy duke of normandy' vs Expected='william the conqueror'
[06:55:19] DEBUG: Overlap=0, Precision=0.000, Recall=0.000
[06:55:19] DEBUG: F1=0.000, EM=0.0, Overlap=0.000
[06:55:19] DEBUG: Generated='king charles iii' vs Expected='richard i'
[06:55:19] DEBUG: Overlap=0, Precision=0.000, Recall=0.000
[06:55:19] DEBUG: F1=0.000, EM=0.0, Overlap=0.000
[06:55:20] DEBUG: Generated='catholicism' vs Expected='catholic'
[06:55:20] DEBUG: Overlap=0, Precision=0.000, Recall=0.000
[06:55:20] DEBUG: F1=0.000, EM=0.0, Overlap=0.000
[06:55:20]   Progress: 20/42 - Recent F1: 0.257
[06:55:20] DEBUG: Generated='norman' vs Expected='viking'
[06:55:20] DEBUG: Overlap=0, Precision=0.000, Recall=0.000
[06:55:20] DEBUG: F1=0.000, EM=0.0, Overlap=0.000
[06:55:20] DEBUG: Generated='in 1024' vs Expected='9th century'
[06:55:20] DEBUG: Overlap=0, Precision=0.000, Recall=0.000
[06:55:20] DEBUG: F1=0.000, EM=0.0, Overlap=0.000
[06:55:20] DEBUG: Generated='1066' vs Expected='911'
[06:55:20] DEBUG: Overlap=0, Precision=0.000, Recall=0.000
[06:55:20] DEBUG: F1=0.000, EM=0.0, Overlap=0.000
[06:55:20] DEBUG: Generated='charles the simple' vs Expected='king charles iii'
[06:55:20] DEBUG: Overlap=1, Precision=0.333, Recall=0.333
[06:55:20] DEBUG: F1=0.333, EM=0.0, Overlap=0.333
[06:55:20] DEBUG: Generated='tennessee river' vs Expected='seine'
[06:55:20] DEBUG: Overlap=0, Precision=0.000, Recall=0.000
[06:55:20] DEBUG: F1=0.000, EM=0.0, Overlap=0.000
[06:55:20] DEBUG: Generated='the normans' vs Expected='rollo'
[06:55:20] DEBUG: Overlap=0, Precision=0.000, Recall=0.000
[06:55:20] DEBUG: F1=0.000, EM=0.0, Overlap=0.000
[06:55:21] DEBUG: Generated='normanism' vs Expected='catholicism'
[06:55:21] DEBUG: Overlap=0, Precision=0.000, Recall=0.000
[06:55:21] DEBUG: F1=0.000, EM=0.0, Overlap=0.000
[06:55:21] DEBUG: Generated='normandy' vs Expected='north'
[06:55:21] DEBUG: Overlap=0, Precision=0.000, Recall=0.000
[06:55:21] DEBUG: F1=0.000, EM=0.0, Overlap=0.000
[06:55:21] DEBUG: Generated='foodstuffs' vs Expected='fighting horsemen'
[06:55:21] DEBUG: Overlap=0, Precision=0.000, Recall=0.000
[06:55:21] DEBUG: F1=0.000, EM=0.0, Overlap=0.000
[06:55:21] DEBUG: Generated='the byzantine empire' vs Expected='seljuk turks'
[06:55:21] DEBUG: Overlap=0, Precision=0.000, Recall=0.000
[06:55:21] DEBUG: F1=0.000, EM=0.0, Overlap=0.000
[06:55:21]   Progress: 30/42 - Recent F1: 0.033
[06:55:21] DEBUG: Generated='during the byzantine war' vs Expected='1050s'
[06:55:21] DEBUG: Overlap=0, Precision=0.000, Recall=0.000
[06:55:21] DEBUG: F1=0.000, EM=0.0, Overlap=0.000
[06:55:21] DEBUG: Generated='2003' vs Expected='1060s'
[06:55:21] DEBUG: Overlap=0, Precision=0.000, Recall=0.000
[06:55:21] DEBUG: F1=0.000, EM=0.0, Overlap=0.000
[06:55:21] DEBUG: Generated='ask the question' vs Expected='alexius komnenos'
[06:55:21] DEBUG: Overlap=0, Precision=0.000, Recall=0.000
[06:55:21] DEBUG: F1=0.000, EM=0.0, Overlap=0.000
[06:55:22] DEBUG: Generated='neuschwanstein castle' vs Expected='afranji'
[06:55:22] DEBUG: Overlap=0, Precision=0.000, Recall=0.000
[06:55:22] DEBUG: F1=0.000, EM=0.0, Overlap=0.000
[06:55:22] DEBUG: Generated='roosevelt' vs Expected='oursel'
[06:55:22] DEBUG: Overlap=0, Precision=0.000, Recall=0.000
[06:55:22] DEBUG: F1=0.000, EM=0.0, Overlap=0.000
[06:55:22] DEBUG: Generated='turkey' vs Expected='turkish forces'
[06:55:22] DEBUG: Overlap=0, Precision=0.000, Recall=0.000
[06:55:22] DEBUG: F1=0.000, EM=0.0, Overlap=0.000
[06:55:22] DEBUG: Generated='normandy' vs Expected='norman mercenary'
[06:55:22] DEBUG: Overlap=0, Precision=0.000, Recall=0.000
[06:55:22] DEBUG: F1=0.000, EM=0.0, Overlap=0.000
[06:55:22] DEBUG: Generated='( last ) frederick iii' vs Expected='robert guiscard'
[06:55:22] DEBUG: Overlap=0, Precision=0.000, Recall=0.000
[06:55:22] DEBUG: F1=0.000, EM=0.0, Overlap=0.000
[06:55:22] DEBUG: Generated='180 bc' vs Expected='1082'
[06:55:22] DEBUG: Overlap=0, Precision=0.000, Recall=0.000
[06:55:22] DEBUG: F1=0.000, EM=0.0, Overlap=0.000
[06:55:23] DEBUG: Generated='about a million men' vs Expected='30,000'
[06:55:23] DEBUG: Overlap=0, Precision=0.000, Recall=0.000
[06:55:23] DEBUG: F1=0.000, EM=0.0, Overlap=0.000
[06:55:23]   Progress: 40/42 - Recent F1: 0.000
[06:55:23] DEBUG: Generated='in jaffa' vs Expected='deabolis'
[06:55:23] DEBUG: Overlap=0, Precision=0.000, Recall=0.000
[06:55:23] DEBUG: F1=0.000, EM=0.0, Overlap=0.000
[06:55:23] DEBUG: Generated='robert's son' vs Expected='bohemond'
[06:55:23] DEBUG: Overlap=0, Precision=0.000, Recall=0.000
[06:55:23] DEBUG: F1=0.000, EM=0.0, Overlap=0.000
[06:55:23]    context_guided completed: F1=0.121, EM=0.048
[06:55:23] 
🔄 Testing template: confident_direct
[06:55:23] DEBUG: Generated='paris' vs Expected='paris'
[06:55:23] DEBUG: Overlap=1, Precision=1.000, Recall=1.000
[06:55:23] DEBUG: F1=1.000, EM=1.0, Overlap=1.000
[06:55:23] DEBUG: Generated='william shakespeare' vs Expected='william shakespeare'
[06:55:23] DEBUG: Overlap=2, Precision=1.000, Recall=1.000
[06:55:23] DEBUG: F1=1.000, EM=1.0, Overlap=1.000
[06:55:23] DEBUG: Generated='what turns you on?' vs Expected='4'
[06:55:23] DEBUG: Overlap=0, Precision=0.000, Recall=0.000
[06:55:23] DEBUG: F1=0.000, EM=0.0, Overlap=0.000
[06:55:24] DEBUG: Generated='to convert light energy into chemical energy' vs Expected='process where plants make food from sunlight'
[06:55:24] DEBUG: Overlap=0, Precision=0.000, Recall=0.000
[06:55:24] DEBUG: F1=0.000, EM=0.0, Overlap=0.000
[06:55:24] DEBUG: Generated='what turns you on?' vs Expected='they process information using electrical circuits'
[06:55:24] DEBUG: Overlap=0, Precision=0.000, Recall=0.000
[06:55:24] DEBUG: F1=0.000, EM=0.0, Overlap=0.000
[06:55:24] DEBUG: Generated='red' vs Expected='red blue green'
[06:55:24] DEBUG: Overlap=1, Precision=1.000, Recall=0.333
[06:55:24] DEBUG: F1=0.500, EM=0.0, Overlap=0.333
[06:55:24] DEBUG: Generated='rodents' vs Expected='cat dog'
[06:55:24] DEBUG: Overlap=0, Precision=0.000, Recall=0.000
[06:55:24] DEBUG: F1=0.000, EM=0.0, Overlap=0.000
[06:55:24] DEBUG: Generated='why is water important?' vs Expected='essential for life and survival'
[06:55:24] DEBUG: Overlap=0, Precision=0.000, Recall=0.000
[06:55:24] DEBUG: F1=0.000, EM=0.0, Overlap=0.000
[06:55:24] DEBUG: Generated='chlorophyll' vs Expected='chlorophyll'
[06:55:24] DEBUG: Overlap=1, Precision=1.000, Recall=1.000
[06:55:24] DEBUG: F1=1.000, EM=1.0, Overlap=1.000
[06:55:25] DEBUG: Generated='is the earth round' vs Expected='yes'
[06:55:25] DEBUG: Overlap=0, Precision=0.000, Recall=0.000
[06:55:25] DEBUG: F1=0.000, EM=0.0, Overlap=0.000
[06:55:25]   Progress: 10/42 - Recent F1: 0.350
[06:55:25] DEBUG: Generated='' vs Expected='yes'
[06:55:25] DEBUG: F1=0.000, EM=0.0, Overlap=0.000
[06:55:25] DEBUG: Generated='red' vs Expected='red yellow blue'
[06:55:25] DEBUG: Overlap=1, Precision=1.000, Recall=0.333
[06:55:25] DEBUG: F1=0.500, EM=0.0, Overlap=0.333
[06:55:25] DEBUG: Generated='france' vs Expected='france'
[06:55:25] DEBUG: Overlap=1, Precision=1.000, Recall=1.000
[06:55:25] DEBUG: F1=1.000, EM=1.0, Overlap=1.000
[06:55:25] DEBUG: Generated='10th century -- 15th century' vs Expected='10th and 11th centuries'
[06:55:25] DEBUG: Overlap=1, Precision=0.250, Recall=0.250
[06:55:25] DEBUG: F1=0.250, EM=0.0, Overlap=0.250
[06:55:25] DEBUG: Generated='iceland' vs Expected='denmark, iceland and norway'
[06:55:25] DEBUG: Overlap=1, Precision=1.000, Recall=0.250
[06:55:25] DEBUG: F1=0.400, EM=0.0, Overlap=0.250
[06:55:25] DEBUG: Generated='who was the norse leader' vs Expected='rollo'
[06:55:25] DEBUG: Overlap=0, Precision=0.000, Recall=0.000
[06:55:25] DEBUG: F1=0.000, EM=0.0, Overlap=0.000
[06:55:26] DEBUG: Generated='the ninth century' vs Expected='10th century'
[06:55:26] DEBUG: Overlap=1, Precision=0.333, Recall=0.500
[06:55:26] DEBUG: F1=0.400, EM=0.0, Overlap=0.500
[06:55:26] DEBUG: Generated='william' vs Expected='william the conqueror'
[06:55:26] DEBUG: Overlap=1, Precision=1.000, Recall=0.333
[06:55:26] DEBUG: F1=0.500, EM=0.0, Overlap=0.333
[06:55:26] DEBUG: Generated='the king of england' vs Expected='richard i'
[06:55:26] DEBUG: Overlap=0, Precision=0.000, Recall=0.000
[06:55:26] DEBUG: F1=0.000, EM=0.0, Overlap=0.000
[06:55:26] DEBUG: Generated='catholicism' vs Expected='catholic'
[06:55:26] DEBUG: Overlap=0, Precision=0.000, Recall=0.000
[06:55:26] DEBUG: F1=0.000, EM=0.0, Overlap=0.000
[06:55:26]   Progress: 20/42 - Recent F1: 0.305
[06:55:26] DEBUG: Generated='north' vs Expected='viking'
[06:55:26] DEBUG: Overlap=0, Precision=0.000, Recall=0.000
[06:55:26] DEBUG: F1=0.000, EM=0.0, Overlap=0.000
[06:55:26] DEBUG: Generated='in 1024' vs Expected='9th century'
[06:55:26] DEBUG: Overlap=0, Precision=0.000, Recall=0.000
[06:55:26] DEBUG: F1=0.000, EM=0.0, Overlap=0.000
[06:55:27] DEBUG: Generated='1066' vs Expected='911'
[06:55:27] DEBUG: Overlap=0, Precision=0.000, Recall=0.000
[06:55:27] DEBUG: F1=0.000, EM=0.0, Overlap=0.000
[06:55:27] DEBUG: Generated='charles the simple' vs Expected='king charles iii'
[06:55:27] DEBUG: Overlap=1, Precision=0.333, Recall=0.333
[06:55:27] DEBUG: F1=0.333, EM=0.0, Overlap=0.333
[06:55:27] DEBUG: Generated='river of british columbia' vs Expected='seine'
[06:55:27] DEBUG: Overlap=0, Precision=0.000, Recall=0.000
[06:55:27] DEBUG: F1=0.000, EM=0.0, Overlap=0.000
[06:55:27] DEBUG: Generated='the normans' vs Expected='rollo'
[06:55:27] DEBUG: Overlap=0, Precision=0.000, Recall=0.000
[06:55:27] DEBUG: F1=0.000, EM=0.0, Overlap=0.000
[06:55:27] DEBUG: Generated='islam' vs Expected='catholicism'
[06:55:27] DEBUG: Overlap=0, Precision=0.000, Recall=0.000
[06:55:27] DEBUG: F1=0.000, EM=0.0, Overlap=0.000
[06:55:27] DEBUG: Generated='normandy' vs Expected='north'
[06:55:27] DEBUG: Overlap=0, Precision=0.000, Recall=0.000
[06:55:27] DEBUG: F1=0.000, EM=0.0, Overlap=0.000
[06:55:27] DEBUG: Generated='cloth' vs Expected='fighting horsemen'
[06:55:27] DEBUG: Overlap=0, Precision=0.000, Recall=0.000
[06:55:27] DEBUG: F1=0.000, EM=0.0, Overlap=0.000
[06:55:28] DEBUG: Generated='byzantine empire' vs Expected='seljuk turks'
[06:55:28] DEBUG: Overlap=0, Precision=0.000, Recall=0.000
[06:55:28] DEBUG: F1=0.000, EM=0.0, Overlap=0.000
[06:55:28]   Progress: 30/42 - Recent F1: 0.033
[06:55:28] DEBUG: Generated='during the byzantine war' vs Expected='1050s'
[06:55:28] DEBUG: Overlap=0, Precision=0.000, Recall=0.000
[06:55:28] DEBUG: F1=0.000, EM=0.0, Overlap=0.000
[06:55:28] DEBUG: Generated='2003' vs Expected='1060s'
[06:55:28] DEBUG: Overlap=0, Precision=0.000, Recall=0.000
[06:55:28] DEBUG: F1=0.000, EM=0.0, Overlap=0.000
[06:55:28] DEBUG: Generated='oliver cromwell' vs Expected='alexius komnenos'
[06:55:28] DEBUG: Overlap=0, Precision=0.000, Recall=0.000
[06:55:28] DEBUG: F1=0.000, EM=0.0, Overlap=0.000
[06:55:28] DEBUG: Generated='château paris' vs Expected='afranji'
[06:55:28] DEBUG: Overlap=0, Precision=0.000, Recall=0.000
[06:55:28] DEBUG: F1=0.000, EM=0.0, Overlap=0.000
[06:55:28] DEBUG: Generated='theudebert i' vs Expected='oursel'
[06:55:28] DEBUG: Overlap=0, Precision=0.000, Recall=0.000
[06:55:28] DEBUG: F1=0.000, EM=0.0, Overlap=0.000
[06:55:29] DEBUG: Generated='turkey' vs Expected='turkish forces'
[06:55:29] DEBUG: Overlap=0, Precision=0.000, Recall=0.000
[06:55:29] DEBUG: F1=0.000, EM=0.0, Overlap=0.000
[06:55:29] DEBUG: Generated='answers the question' vs Expected='norman mercenary'
[06:55:29] DEBUG: Overlap=0, Precision=0.000, Recall=0.000
[06:55:29] DEBUG: F1=0.000, EM=0.0, Overlap=0.000
[06:55:29] DEBUG: Generated='tobey' vs Expected='robert guiscard'
[06:55:29] DEBUG: Overlap=0, Precision=0.000, Recall=0.000
[06:55:29] DEBUG: F1=0.000, EM=0.0, Overlap=0.000
[06:55:29] DEBUG: Generated='2011' vs Expected='1082'
[06:55:29] DEBUG: Overlap=0, Precision=0.000, Recall=0.000
[06:55:29] DEBUG: F1=0.000, EM=0.0, Overlap=0.000
[06:55:29] DEBUG: Generated='350,000 and 150,000' vs Expected='30,000'
[06:55:29] DEBUG: Overlap=0, Precision=0.000, Recall=0.000
[06:55:29] DEBUG: F1=0.000, EM=0.0, Overlap=0.000
[06:55:29]   Progress: 40/42 - Recent F1: 0.000
[06:55:29] DEBUG: Generated='constantinople' vs Expected='deabolis'
[06:55:29] DEBUG: Overlap=0, Precision=0.000, Recall=0.000
[06:55:29] DEBUG: F1=0.000, EM=0.0, Overlap=0.000
[06:55:30] DEBUG: Generated='steffon' vs Expected='bohemond'
[06:55:30] DEBUG: Overlap=0, Precision=0.000, Recall=0.000
[06:55:30] DEBUG: F1=0.000, EM=0.0, Overlap=0.000
[06:55:30]    confident_direct completed: F1=0.164, EM=0.095
[06:55:30] 
🔄 Testing template: structured_response
[06:55:30] DEBUG: Generated='paris' vs Expected='paris'
[06:55:30] DEBUG: Overlap=1, Precision=1.000, Recall=1.000
[06:55:30] DEBUG: F1=1.000, EM=1.0, Overlap=1.000
[06:55:30] DEBUG: Generated='william shakespeare' vs Expected='william shakespeare'
[06:55:30] DEBUG: Overlap=2, Precision=1.000, Recall=1.000
[06:55:30] DEBUG: F1=1.000, EM=1.0, Overlap=1.000
[06:55:30] DEBUG: Generated='the binary interpretation of the numbers' vs Expected='4'
[06:55:30] DEBUG: Overlap=0, Precision=0.000, Recall=0.000
[06:55:30] DEBUG: F1=0.000, EM=0.0, Overlap=0.000
[06:55:30] DEBUG: Generated='what turns you on?' vs Expected='process where plants make food from sunlight'
[06:55:30] DEBUG: Overlap=0, Precision=0.000, Recall=0.000
[06:55:30] DEBUG: F1=0.000, EM=0.0, Overlap=0.000
[06:55:30] DEBUG: Generated='what turns you on?' vs Expected='they process information using electrical circuits'
[06:55:30] DEBUG: Overlap=0, Precision=0.000, Recall=0.000
[06:55:30] DEBUG: F1=0.000, EM=0.0, Overlap=0.000
[06:55:30] DEBUG: Generated='red' vs Expected='red blue green'
[06:55:30] DEBUG: Overlap=1, Precision=1.000, Recall=0.333
[06:55:30] DEBUG: F1=0.500, EM=0.0, Overlap=0.333
[06:55:31] DEBUG: Generated='cat' vs Expected='cat dog'
[06:55:31] DEBUG: Overlap=1, Precision=1.000, Recall=0.500
[06:55:31] DEBUG: F1=0.667, EM=0.0, Overlap=0.500
[06:55:31] DEBUG: Generated='water infinity' vs Expected='essential for life and survival'
[06:55:31] DEBUG: Overlap=0, Precision=0.000, Recall=0.000
[06:55:31] DEBUG: F1=0.000, EM=0.0, Overlap=0.000
[06:55:31] DEBUG: Generated='what turns you on' vs Expected='chlorophyll'
[06:55:31] DEBUG: Overlap=0, Precision=0.000, Recall=0.000
[06:55:31] DEBUG: F1=0.000, EM=0.0, Overlap=0.000
[06:55:31] DEBUG: Generated='the question' vs Expected='yes'
[06:55:31] DEBUG: Overlap=0, Precision=0.000, Recall=0.000
[06:55:31] DEBUG: F1=0.000, EM=0.0, Overlap=0.000
[06:55:31]   Progress: 10/42 - Recent F1: 0.317
[06:55:31] DEBUG: Generated='' vs Expected='yes'
[06:55:31] DEBUG: F1=0.000, EM=0.0, Overlap=0.000
[06:55:31] DEBUG: Generated='blue' vs Expected='red yellow blue'
[06:55:31] DEBUG: Overlap=1, Precision=1.000, Recall=0.333
[06:55:31] DEBUG: F1=0.500, EM=0.0, Overlap=0.333
[06:55:31] DEBUG: Generated='france' vs Expected='france'
[06:55:31] DEBUG: Overlap=1, Precision=1.000, Recall=1.000
[06:55:31] DEBUG: F1=1.000, EM=1.0, Overlap=1.000
[06:55:32] DEBUG: Generated='between the 10th and 13th centuries' vs Expected='10th and 11th centuries'
[06:55:32] DEBUG: Overlap=3, Precision=0.500, Recall=0.750
[06:55:32] DEBUG: F1=0.600, EM=0.0, Overlap=0.750
[06:55:32] DEBUG: Generated='iceland' vs Expected='denmark, iceland and norway'
[06:55:32] DEBUG: Overlap=1, Precision=1.000, Recall=0.250
[06:55:32] DEBUG: F1=0.400, EM=0.0, Overlap=0.250
[06:55:32] DEBUG: Generated='the norse leader' vs Expected='rollo'
[06:55:32] DEBUG: Overlap=0, Precision=0.000, Recall=0.000
[06:55:32] DEBUG: F1=0.000, EM=0.0, Overlap=0.000
[06:55:32] DEBUG: Generated='the european renaissance' vs Expected='10th century'
[06:55:32] DEBUG: Overlap=0, Precision=0.000, Recall=0.000
[06:55:32] DEBUG: F1=0.000, EM=0.0, Overlap=0.000
[06:55:32] DEBUG: Generated='the duke of normandy' vs Expected='william the conqueror'
[06:55:32] DEBUG: Overlap=1, Precision=0.250, Recall=0.333
[06:55:32] DEBUG: F1=0.286, EM=0.0, Overlap=0.333
[06:55:32] DEBUG: Generated='king' vs Expected='richard i'
[06:55:32] DEBUG: Overlap=0, Precision=0.000, Recall=0.000
[06:55:32] DEBUG: F1=0.000, EM=0.0, Overlap=0.000
[06:55:33] DEBUG: Generated='islam' vs Expected='catholic'
[06:55:33] DEBUG: Overlap=0, Precision=0.000, Recall=0.000
[06:55:33] DEBUG: F1=0.000, EM=0.0, Overlap=0.000
[06:55:33]   Progress: 20/42 - Recent F1: 0.279
[06:55:33] DEBUG: Generated='what turns you on?' vs Expected='viking'
[06:55:33] DEBUG: Overlap=0, Precision=0.000, Recall=0.000
[06:55:33] DEBUG: F1=0.000, EM=0.0, Overlap=0.000
[06:55:33] DEBUG: Generated='in 1024' vs Expected='9th century'
[06:55:33] DEBUG: Overlap=0, Precision=0.000, Recall=0.000
[06:55:33] DEBUG: F1=0.000, EM=0.0, Overlap=0.000
[06:55:33] DEBUG: Generated='987' vs Expected='911'
[06:55:33] DEBUG: Overlap=0, Precision=0.000, Recall=0.000
[06:55:33] DEBUG: F1=0.000, EM=0.0, Overlap=0.000
[06:55:33] DEBUG: Generated='the franks' vs Expected='king charles iii'
[06:55:33] DEBUG: Overlap=0, Precision=0.000, Recall=0.000
[06:55:33] DEBUG: F1=0.000, EM=0.0, Overlap=0.000
[06:55:33] DEBUG: Generated='the rio de janeiro' vs Expected='seine'
[06:55:33] DEBUG: Overlap=0, Precision=0.000, Recall=0.000
[06:55:33] DEBUG: F1=0.000, EM=0.0, Overlap=0.000
[06:55:34] DEBUG: Generated='the question' vs Expected='rollo'
[06:55:34] DEBUG: Overlap=0, Precision=0.000, Recall=0.000
[06:55:34] DEBUG: F1=0.000, EM=0.0, Overlap=0.000
[06:55:34] DEBUG: Generated='islam' vs Expected='catholicism'
[06:55:34] DEBUG: Overlap=0, Precision=0.000, Recall=0.000
[06:55:34] DEBUG: F1=0.000, EM=0.0, Overlap=0.000
[06:55:34] DEBUG: Generated='northern france' vs Expected='north'
[06:55:34] DEBUG: Overlap=0, Precision=0.000, Recall=0.000
[06:55:34] DEBUG: F1=0.000, EM=0.0, Overlap=0.000
[06:55:34] DEBUG: Generated='foodstuffs' vs Expected='fighting horsemen'
[06:55:34] DEBUG: Overlap=0, Precision=0.000, Recall=0.000
[06:55:34] DEBUG: F1=0.000, EM=0.0, Overlap=0.000
[06:55:34] DEBUG: Generated='byzantine empire' vs Expected='seljuk turks'
[06:55:34] DEBUG: Overlap=0, Precision=0.000, Recall=0.000
[06:55:34] DEBUG: F1=0.000, EM=0.0, Overlap=0.000
[06:55:34]   Progress: 30/42 - Recent F1: 0.000
[06:55:34] DEBUG: Generated='1984 -- 86' vs Expected='1050s'
[06:55:34] DEBUG: Overlap=0, Precision=0.000, Recall=0.000
[06:55:34] DEBUG: F1=0.000, EM=0.0, Overlap=0.000
[06:55:34] DEBUG: Generated='2017' vs Expected='1060s'
[06:55:34] DEBUG: Overlap=0, Precision=0.000, Recall=0.000
[06:55:34] DEBUG: F1=0.000, EM=0.0, Overlap=0.000
[06:55:35] DEBUG: Generated='his idea of kingship' vs Expected='alexius komnenos'
[06:55:35] DEBUG: Overlap=0, Precision=0.000, Recall=0.000
[06:55:35] DEBUG: F1=0.000, EM=0.0, Overlap=0.000
[06:55:35] DEBUG: Generated='the classic roman republic' vs Expected='afranji'
[06:55:35] DEBUG: Overlap=0, Precision=0.000, Recall=0.000
[06:55:35] DEBUG: F1=0.000, EM=0.0, Overlap=0.000
[06:55:35] DEBUG: Generated='charles martel' vs Expected='oursel'
[06:55:35] DEBUG: Overlap=0, Precision=0.000, Recall=0.000
[06:55:35] DEBUG: F1=0.000, EM=0.0, Overlap=0.000
[06:55:35] DEBUG: Generated='turkey' vs Expected='turkish forces'
[06:55:35] DEBUG: Overlap=0, Precision=0.000, Recall=0.000
[06:55:35] DEBUG: F1=0.000, EM=0.0, Overlap=0.000
[06:55:35] DEBUG: Generated='norman origin' vs Expected='norman mercenary'
[06:55:35] DEBUG: Overlap=1, Precision=0.500, Recall=0.500
[06:55:35] DEBUG: F1=0.500, EM=0.0, Overlap=0.500
[06:55:35] DEBUG: Generated='( last ) frederick iii' vs Expected='robert guiscard'
[06:55:35] DEBUG: Overlap=0, Precision=0.000, Recall=0.000
[06:55:35] DEBUG: F1=0.000, EM=0.0, Overlap=0.000
[06:55:36] DEBUG: Generated='what turns you on?' vs Expected='1082'
[06:55:36] DEBUG: Overlap=0, Precision=0.000, Recall=0.000
[06:55:36] DEBUG: F1=0.000, EM=0.0, Overlap=0.000
[06:55:36] DEBUG: Generated='3,000 infantry and 300 horsemen' vs Expected='30,000'
[06:55:36] DEBUG: Overlap=0, Precision=0.000, Recall=0.000
[06:55:36] DEBUG: F1=0.000, EM=0.0, Overlap=0.000
[06:55:36]   Progress: 40/42 - Recent F1: 0.050
[06:55:36] DEBUG: Generated='constantinople' vs Expected='deabolis'
[06:55:36] DEBUG: Overlap=0, Precision=0.000, Recall=0.000
[06:55:36] DEBUG: F1=0.000, EM=0.0, Overlap=0.000
[06:55:36] DEBUG: Generated='robert's son' vs Expected='bohemond'
[06:55:36] DEBUG: Overlap=0, Precision=0.000, Recall=0.000
[06:55:36] DEBUG: F1=0.000, EM=0.0, Overlap=0.000
[06:55:36]    structured_response completed: F1=0.154, EM=0.071
[06:55:36] 
🔄 Testing template: basic
[06:55:36] DEBUG: Generated='paris' vs Expected='paris'
[06:55:36] DEBUG: Overlap=1, Precision=1.000, Recall=1.000
[06:55:36] DEBUG: F1=1.000, EM=1.0, Overlap=1.000
[06:55:36] DEBUG: Generated='william shakespeare' vs Expected='william shakespeare'
[06:55:36] DEBUG: Overlap=2, Precision=1.000, Recall=1.000
[06:55:36] DEBUG: F1=1.000, EM=1.0, Overlap=1.000
[06:55:37] DEBUG: Generated='factorials n!' vs Expected='4'
[06:55:37] DEBUG: Overlap=0, Precision=0.000, Recall=0.000
[06:55:37] DEBUG: F1=0.000, EM=0.0, Overlap=0.000
[06:55:37] DEBUG: Generated='to convert light energy into chemical energy' vs Expected='process where plants make food from sunlight'
[06:55:37] DEBUG: Overlap=0, Precision=0.000, Recall=0.000
[06:55:37] DEBUG: F1=0.000, EM=0.0, Overlap=0.000
[06:55:37] DEBUG: Generated='numerical interpretation of numbers' vs Expected='they process information using electrical circuits'
[06:55:37] DEBUG: Overlap=0, Precision=0.000, Recall=0.000
[06:55:37] DEBUG: F1=0.000, EM=0.0, Overlap=0.000
[06:55:37] DEBUG: Generated='white' vs Expected='red blue green'
[06:55:37] DEBUG: Overlap=0, Precision=0.000, Recall=0.000
[06:55:37] DEBUG: F1=0.000, EM=0.0, Overlap=0.000
[06:55:37] DEBUG: Generated='amphibians' vs Expected='cat dog'
[06:55:37] DEBUG: Overlap=0, Precision=0.000, Recall=0.000
[06:55:37] DEBUG: F1=0.000, EM=0.0, Overlap=0.000
[06:55:37] DEBUG: Generated='all living things require water' vs Expected='essential for life and survival'
[06:55:37] DEBUG: Overlap=0, Precision=0.000, Recall=0.000
[06:55:37] DEBUG: F1=0.000, EM=0.0, Overlap=0.000
[06:55:37] DEBUG: Generated='chlorophyll' vs Expected='chlorophyll'
[06:55:37] DEBUG: Overlap=1, Precision=1.000, Recall=1.000
[06:55:37] DEBUG: F1=1.000, EM=1.0, Overlap=1.000
[06:55:38] DEBUG: Generated='ellipse' vs Expected='yes'
[06:55:38] DEBUG: Overlap=0, Precision=0.000, Recall=0.000
[06:55:38] DEBUG: F1=0.000, EM=0.0, Overlap=0.000
[06:55:38]   Progress: 10/42 - Recent F1: 0.300
[06:55:38] DEBUG: Generated='bird flight' vs Expected='yes'
[06:55:38] DEBUG: Overlap=0, Precision=0.000, Recall=0.000
[06:55:38] DEBUG: F1=0.000, EM=0.0, Overlap=0.000
[06:55:38] DEBUG: Generated='blue' vs Expected='red yellow blue'
[06:55:38] DEBUG: Overlap=1, Precision=1.000, Recall=0.333
[06:55:38] DEBUG: F1=0.500, EM=0.0, Overlap=0.333
[06:55:38] DEBUG: Generated='france' vs Expected='france'
[06:55:38] DEBUG: Overlap=1, Precision=1.000, Recall=1.000
[06:55:38] DEBUG: F1=1.000, EM=1.0, Overlap=1.000
[06:55:38] DEBUG: Generated='9th century -- 9th century' vs Expected='10th and 11th centuries'
[06:55:38] DEBUG: Overlap=0, Precision=0.000, Recall=0.000
[06:55:38] DEBUG: F1=0.000, EM=0.0, Overlap=0.000
[06:55:38] DEBUG: Generated='sweden' vs Expected='denmark, iceland and norway'
[06:55:38] DEBUG: Overlap=0, Precision=0.000, Recall=0.000
[06:55:38] DEBUG: F1=0.000, EM=0.0, Overlap=0.000
[06:55:39] DEBUG: Generated='cnut' vs Expected='rollo'
[06:55:39] DEBUG: Overlap=0, Precision=0.000, Recall=0.000
[06:55:39] DEBUG: F1=0.000, EM=0.0, Overlap=0.000
[06:55:39] DEBUG: Generated='the ninth century' vs Expected='10th century'
[06:55:39] DEBUG: Overlap=1, Precision=0.333, Recall=0.500
[06:55:39] DEBUG: F1=0.400, EM=0.0, Overlap=0.500
[06:55:39] DEBUG: Generated='william' vs Expected='william the conqueror'
[06:55:39] DEBUG: Overlap=1, Precision=1.000, Recall=0.333
[06:55:39] DEBUG: F1=0.500, EM=0.0, Overlap=0.333
[06:55:39] DEBUG: Generated='king charles iii of west francia' vs Expected='richard i'
[06:55:39] DEBUG: Overlap=0, Precision=0.000, Recall=0.000
[06:55:39] DEBUG: F1=0.000, EM=0.0, Overlap=0.000
[06:55:39] DEBUG: Generated='catholicism' vs Expected='catholic'
[06:55:39] DEBUG: Overlap=0, Precision=0.000, Recall=0.000
[06:55:39] DEBUG: F1=0.000, EM=0.0, Overlap=0.000
[06:55:39]   Progress: 20/42 - Recent F1: 0.240
[06:55:39] DEBUG: Generated='north' vs Expected='viking'
[06:55:39] DEBUG: Overlap=0, Precision=0.000, Recall=0.000
[06:55:39] DEBUG: F1=0.000, EM=0.0, Overlap=0.000
[06:55:40] DEBUG: Generated='1024' vs Expected='9th century'
[06:55:40] DEBUG: Overlap=0, Precision=0.000, Recall=0.000
[06:55:40] DEBUG: F1=0.000, EM=0.0, Overlap=0.000
[06:55:40] DEBUG: Generated='1066' vs Expected='911'
[06:55:40] DEBUG: Overlap=0, Precision=0.000, Recall=0.000
[06:55:40] DEBUG: F1=0.000, EM=0.0, Overlap=0.000
[06:55:40] DEBUG: Generated='charles the simple' vs Expected='king charles iii'
[06:55:40] DEBUG: Overlap=1, Precision=0.333, Recall=0.333
[06:55:40] DEBUG: F1=0.333, EM=0.0, Overlap=0.333
[06:55:40] DEBUG: Generated='elbe' vs Expected='seine'
[06:55:40] DEBUG: Overlap=0, Precision=0.000, Recall=0.000
[06:55:40] DEBUG: F1=0.000, EM=0.0, Overlap=0.000
[06:55:40] DEBUG: Generated='the byzantines' vs Expected='rollo'
[06:55:40] DEBUG: Overlap=0, Precision=0.000, Recall=0.000
[06:55:40] DEBUG: F1=0.000, EM=0.0, Overlap=0.000
[06:55:40] DEBUG: Generated='catholicism' vs Expected='catholicism'
[06:55:40] DEBUG: Overlap=1, Precision=1.000, Recall=1.000
[06:55:40] DEBUG: F1=1.000, EM=1.0, Overlap=1.000
[06:55:41] DEBUG: Generated='west france' vs Expected='north'
[06:55:41] DEBUG: Overlap=0, Precision=0.000, Recall=0.000
[06:55:41] DEBUG: F1=0.000, EM=0.0, Overlap=0.000
[06:55:41] DEBUG: Generated='cloth' vs Expected='fighting horsemen'
[06:55:41] DEBUG: Overlap=0, Precision=0.000, Recall=0.000
[06:55:41] DEBUG: F1=0.000, EM=0.0, Overlap=0.000
[06:55:41] DEBUG: Generated='hohenstaufen' vs Expected='seljuk turks'
[06:55:41] DEBUG: Overlap=0, Precision=0.000, Recall=0.000
[06:55:41] DEBUG: F1=0.000, EM=0.0, Overlap=0.000
[06:55:41]   Progress: 30/42 - Recent F1: 0.133
[06:55:41] DEBUG: Generated='1984 -- 86' vs Expected='1050s'
[06:55:41] DEBUG: Overlap=0, Precision=0.000, Recall=0.000
[06:55:41] DEBUG: F1=0.000, EM=0.0, Overlap=0.000
[06:55:41] DEBUG: Generated='862' vs Expected='1060s'
[06:55:41] DEBUG: Overlap=0, Precision=0.000, Recall=0.000
[06:55:41] DEBUG: F1=0.000, EM=0.0, Overlap=0.000
[06:55:41] DEBUG: Generated='henshaw' vs Expected='alexius komnenos'
[06:55:41] DEBUG: Overlap=0, Precision=0.000, Recall=0.000
[06:55:41] DEBUG: F1=0.000, EM=0.0, Overlap=0.000
[06:55:41] DEBUG: Generated='neath castle' vs Expected='afranji'
[06:55:41] DEBUG: Overlap=0, Precision=0.000, Recall=0.000
[06:55:41] DEBUG: F1=0.000, EM=0.0, Overlap=0.000
[06:55:42] DEBUG: Generated='theudebert i' vs Expected='oursel'
[06:55:42] DEBUG: Overlap=0, Precision=0.000, Recall=0.000
[06:55:42] DEBUG: F1=0.000, EM=0.0, Overlap=0.000
[06:55:42] DEBUG: Generated='turkey' vs Expected='turkish forces'
[06:55:42] DEBUG: Overlap=0, Precision=0.000, Recall=0.000
[06:55:42] DEBUG: F1=0.000, EM=0.0, Overlap=0.000
[06:55:42] DEBUG: Generated='english' vs Expected='norman mercenary'
[06:55:42] DEBUG: Overlap=0, Precision=0.000, Recall=0.000
[06:55:42] DEBUG: F1=0.000, EM=0.0, Overlap=0.000
[06:55:42] DEBUG: Generated='( last ) frederick iii' vs Expected='robert guiscard'
[06:55:42] DEBUG: Overlap=0, Precision=0.000, Recall=0.000
[06:55:42] DEBUG: F1=0.000, EM=0.0, Overlap=0.000
[06:55:42] DEBUG: Generated='10th century' vs Expected='1082'
[06:55:42] DEBUG: Overlap=0, Precision=0.000, Recall=0.000
[06:55:42] DEBUG: F1=0.000, EM=0.0, Overlap=0.000
[06:55:42] DEBUG: Generated='1,000,000' vs Expected='30,000'
[06:55:42] DEBUG: Overlap=0, Precision=0.000, Recall=0.000
[06:55:42] DEBUG: F1=0.000, EM=0.0, Overlap=0.000
[06:55:42]   Progress: 40/42 - Recent F1: 0.000
[06:55:43] DEBUG: Generated='constantinople' vs Expected='deabolis'
[06:55:43] DEBUG: Overlap=0, Precision=0.000, Recall=0.000
[06:55:43] DEBUG: F1=0.000, EM=0.0, Overlap=0.000
[06:55:43] DEBUG: Generated='steffon' vs Expected='bohemond'
[06:55:43] DEBUG: Overlap=0, Precision=0.000, Recall=0.000
[06:55:43] DEBUG: F1=0.000, EM=0.0, Overlap=0.000
[06:55:43]    basic completed: F1=0.160, EM=0.119
[06:55:43] 
🎉 Experiment completed! Total results: 294
[06:55:43] 
 ANALYZING RESULTS...
[06:55:43] 
 TEMPLATE PERFORMANCE RANKING:
[06:55:43] --------------------------------------------------------------------------------
[06:55:43] Template             F1 Score   EM Score   Samples  Improvement 
[06:55:43] --------------------------------------------------------------------------------
[06:55:43] retrieval_focused    0.166     0.095     42       ++3.5%      
[06:55:43] confident_direct     0.164     0.095     42       ++2.2%      
[06:55:43] basic                0.160     0.119     42       BASELINE    
[06:55:43] instructional_clear  0.158     0.071     42       +-1.7%      
[06:55:43] structured_response  0.154     0.071     42       +-4.2%      
[06:55:43] context_guided       0.121     0.048     42       +-24.8%     
[06:55:43] knowledge_synthesis  0.091     0.048     42       +-43.3%     
[06:55:43] 
📊 SUCCESS ANALYSIS:
[06:55:43]   🥇 Best Template: retrieval_focused (F1: 0.166)
[06:55:43]   ✅ SUCCESS! Basic template relegated to rank 3
[06:55:43]   🎯 Template engineering shows measurable impact!
[06:55:43] 
📋 SAMPLE RESULTS:
[06:55:43] ======================================================================
[06:55:43] 
🔸 Template: retrieval_focused (Rank 1)
[06:55:43]    Q: What is the capital of France?...
[06:55:43]    Expected: Paris
[06:55:43]    Generated: paris
[06:55:43]    Score: F1=1.000
[06:55:43]    Q: Who wrote Romeo and Juliet?...
[06:55:43]    Expected: William Shakespeare
[06:55:43]    Generated: william shakespeare
[06:55:43]    Score: F1=1.000
[06:55:43] 
🔸 Template: confident_direct (Rank 2)
[06:55:43]    Q: What is the capital of France?...
[06:55:43]    Expected: Paris
[06:55:43]    Generated: paris
[06:55:43]    Score: F1=1.000
[06:55:43]    Q: Who wrote Romeo and Juliet?...
[06:55:43]    Expected: William Shakespeare
[06:55:43]    Generated: william shakespeare
[06:55:43]    Score: F1=1.000
[06:55:43] 
🔸 Template: basic (Rank 3)
[06:55:43]    Q: What is the capital of France?...
[06:55:43]    Expected: Paris
[06:55:43]    Generated: paris
[06:55:43]    Score: F1=1.000
[06:55:43]    Q: Who wrote Romeo and Juliet?...
[06:55:43]    Expected: William Shakespeare
[06:55:43]    Generated: william shakespeare
[06:55:43]    Score: F1=1.000
[06:55:43] 
🎉 TARGETED EXPERIMENT COMPLETED!
