[18:09:46] 🔥 Setting up GPU configuration...
[18:09:46] 🎯 Using device: cuda:0
[18:09:46] 📦 Loading RAG models...
[18:14:36] 🚀 RAG system ready!
[18:14:36] 📚 Loading targeted evaluation dataset...
[18:14:39] 📊 Dataset loaded: 42 questions
[18:14:39]    - Targeted questions: 12
[18:14:39]    - SQuAD questions: 30
[18:14:39] 🧪 Starting targeted RAG experiment...
[18:14:39] 📋 Testing 7 templates on 42 questions
[18:14:39] 
🔄 Testing template: retrieval_focused
[18:14:41] DEBUG: Generated='paris' vs Expected='paris'
[18:14:41] DEBUG: Overlap=1, Precision=1.000, Recall=1.000
[18:14:41] DEBUG: F1=1.000, EM=1.0, Overlap=1.000
[18:14:41] DEBUG: Generated='william shakespeare' vs Expected='william shakespeare'
[18:14:41] DEBUG: Overlap=2, Precision=1.000, Recall=1.000
[18:14:41] DEBUG: F1=1.000, EM=1.0, Overlap=1.000
[18:14:41] DEBUG: Generated='factorials n!' vs Expected='4'
[18:14:41] DEBUG: Overlap=0, Precision=0.000, Recall=0.000
[18:14:41] DEBUG: F1=0.000, EM=0.0, Overlap=0.000
[18:14:41] DEBUG: Generated='' vs Expected='process where plants make food from sunlight'
[18:14:41] DEBUG: F1=0.000, EM=0.0, Overlap=0.000
[18:14:42] DEBUG: Generated='what turns you on?' vs Expected='they process information using electrical circuits'
[18:14:42] DEBUG: Overlap=0, Precision=0.000, Recall=0.000
[18:14:42] DEBUG: F1=0.000, EM=0.0, Overlap=0.000
[18:14:42] DEBUG: Generated='red' vs Expected='red blue green'
[18:14:42] DEBUG: Overlap=1, Precision=1.000, Recall=0.333
[18:14:42] DEBUG: F1=0.500, EM=0.0, Overlap=0.333
[18:14:42] DEBUG: Generated='cat' vs Expected='cat dog'
[18:14:42] DEBUG: Overlap=1, Precision=1.000, Recall=0.500
[18:14:42] DEBUG: F1=0.667, EM=0.0, Overlap=0.500
[18:14:42] DEBUG: Generated='health' vs Expected='essential for life and survival'
[18:14:42] DEBUG: Overlap=0, Precision=0.000, Recall=0.000
[18:14:42] DEBUG: F1=0.000, EM=0.0, Overlap=0.000
[18:14:43] DEBUG: Generated='chlorophyll' vs Expected='chlorophyll'
[18:14:43] DEBUG: Overlap=1, Precision=1.000, Recall=1.000
[18:14:43] DEBUG: F1=1.000, EM=1.0, Overlap=1.000
[18:14:43] DEBUG: Generated='factorials n!' vs Expected='yes'
[18:14:43] DEBUG: Overlap=0, Precision=0.000, Recall=0.000
[18:14:43] DEBUG: F1=0.000, EM=0.0, Overlap=0.000
[18:14:43]   Progress: 10/42 - Recent F1: 0.417
[18:14:43] DEBUG: Generated='' vs Expected='yes'
[18:14:43] DEBUG: F1=0.000, EM=0.0, Overlap=0.000
[18:14:43] DEBUG: Generated='blue' vs Expected='red yellow blue'
[18:14:43] DEBUG: Overlap=1, Precision=1.000, Recall=0.333
[18:14:43] DEBUG: F1=0.500, EM=0.0, Overlap=0.333
[18:14:44] DEBUG: Generated='france' vs Expected='france'
[18:14:44] DEBUG: Overlap=1, Precision=1.000, Recall=1.000
[18:14:44] DEBUG: F1=1.000, EM=1.0, Overlap=1.000
[18:14:44] DEBUG: Generated='9th century -- 9th century' vs Expected='10th and 11th centuries'
[18:14:44] DEBUG: Overlap=0, Precision=0.000, Recall=0.000
[18:14:44] DEBUG: F1=0.000, EM=0.0, Overlap=0.000
[18:14:44] DEBUG: Generated='iceland' vs Expected='denmark, iceland and norway'
[18:14:44] DEBUG: Overlap=1, Precision=1.000, Recall=0.250
[18:14:44] DEBUG: F1=0.400, EM=0.0, Overlap=0.250
[18:14:44] DEBUG: Generated='bjorn ulvaeus' vs Expected='rollo'
[18:14:44] DEBUG: Overlap=0, Precision=0.000, Recall=0.000
[18:14:44] DEBUG: F1=0.000, EM=0.0, Overlap=0.000
[18:14:45] DEBUG: Generated='the ninth century' vs Expected='10th century'
[18:14:45] DEBUG: Overlap=1, Precision=0.333, Recall=0.500
[18:14:45] DEBUG: F1=0.400, EM=0.0, Overlap=0.500
[18:14:45] DEBUG: Generated='william' vs Expected='william the conqueror'
[18:14:45] DEBUG: Overlap=1, Precision=1.000, Recall=0.333
[18:14:45] DEBUG: F1=0.500, EM=0.0, Overlap=0.333
[18:14:45] DEBUG: Generated='king charles iii' vs Expected='richard i'
[18:14:45] DEBUG: Overlap=0, Precision=0.000, Recall=0.000
[18:14:45] DEBUG: F1=0.000, EM=0.0, Overlap=0.000
[18:14:46] DEBUG: Generated='catholicism' vs Expected='catholic'
[18:14:46] DEBUG: Overlap=0, Precision=0.000, Recall=0.000
[18:14:46] DEBUG: F1=0.000, EM=0.0, Overlap=0.000
[18:14:46]   Progress: 20/42 - Recent F1: 0.280
[18:14:46] DEBUG: Generated='north' vs Expected='viking'
[18:14:46] DEBUG: Overlap=0, Precision=0.000, Recall=0.000
[18:14:46] DEBUG: F1=0.000, EM=0.0, Overlap=0.000
[18:14:46] DEBUG: Generated='in 1024' vs Expected='9th century'
[18:14:46] DEBUG: Overlap=0, Precision=0.000, Recall=0.000
[18:14:46] DEBUG: F1=0.000, EM=0.0, Overlap=0.000
[18:14:46] DEBUG: Generated='1066' vs Expected='911'
[18:14:46] DEBUG: Overlap=0, Precision=0.000, Recall=0.000
[18:14:46] DEBUG: F1=0.000, EM=0.0, Overlap=0.000
[18:14:47] DEBUG: Generated='the franks' vs Expected='king charles iii'
[18:14:47] DEBUG: Overlap=0, Precision=0.000, Recall=0.000
[18:14:47] DEBUG: F1=0.000, EM=0.0, Overlap=0.000
[18:14:47] DEBUG: Generated='tennessee river' vs Expected='seine'
[18:14:47] DEBUG: Overlap=0, Precision=0.000, Recall=0.000
[18:14:47] DEBUG: F1=0.000, EM=0.0, Overlap=0.000
[18:14:47] DEBUG: Generated='the inuit' vs Expected='rollo'
[18:14:47] DEBUG: Overlap=0, Precision=0.000, Recall=0.000
[18:14:47] DEBUG: F1=0.000, EM=0.0, Overlap=0.000
[18:14:47] DEBUG: Generated='islam' vs Expected='catholicism'
[18:14:47] DEBUG: Overlap=0, Precision=0.000, Recall=0.000
[18:14:47] DEBUG: F1=0.000, EM=0.0, Overlap=0.000
[18:14:48] DEBUG: Generated='normandy' vs Expected='north'
[18:14:48] DEBUG: Overlap=0, Precision=0.000, Recall=0.000
[18:14:48] DEBUG: F1=0.000, EM=0.0, Overlap=0.000
[18:14:48] DEBUG: Generated='foodstuffs' vs Expected='fighting horsemen'
[18:14:48] DEBUG: Overlap=0, Precision=0.000, Recall=0.000
[18:14:48] DEBUG: F1=0.000, EM=0.0, Overlap=0.000
[18:14:48] DEBUG: Generated='byzantine empire' vs Expected='seljuk turks'
[18:14:48] DEBUG: Overlap=0, Precision=0.000, Recall=0.000
[18:14:48] DEBUG: F1=0.000, EM=0.0, Overlap=0.000
[18:14:48]   Progress: 30/42 - Recent F1: 0.000
[18:14:48] DEBUG: Generated='1984 -- 86' vs Expected='1050s'
[18:14:48] DEBUG: Overlap=0, Precision=0.000, Recall=0.000
[18:14:48] DEBUG: F1=0.000, EM=0.0, Overlap=0.000
[18:14:49] DEBUG: Generated='1984' vs Expected='1060s'
[18:14:49] DEBUG: Overlap=0, Precision=0.000, Recall=0.000
[18:14:49] DEBUG: F1=0.000, EM=0.0, Overlap=0.000
[18:14:49] DEBUG: Generated='factorials' vs Expected='alexius komnenos'
[18:14:49] DEBUG: Overlap=0, Precision=0.000, Recall=0.000
[18:14:49] DEBUG: F1=0.000, EM=0.0, Overlap=0.000
[18:14:49] DEBUG: Generated='the château de caen' vs Expected='afranji'
[18:14:49] DEBUG: Overlap=0, Precision=0.000, Recall=0.000
[18:14:49] DEBUG: F1=0.000, EM=0.0, Overlap=0.000
[18:14:49] DEBUG: Generated='' vs Expected='oursel'
[18:14:49] DEBUG: F1=0.000, EM=0.0, Overlap=0.000
[18:14:50] DEBUG: Generated='turkey' vs Expected='turkish forces'
[18:14:50] DEBUG: Overlap=0, Precision=0.000, Recall=0.000
[18:14:50] DEBUG: F1=0.000, EM=0.0, Overlap=0.000
[18:14:50] DEBUG: Generated='byzantine origin' vs Expected='norman mercenary'
[18:14:50] DEBUG: Overlap=0, Precision=0.000, Recall=0.000
[18:14:50] DEBUG: F1=0.000, EM=0.0, Overlap=0.000
[18:14:50] DEBUG: Generated='( last ) frederick iii' vs Expected='robert guiscard'
[18:14:50] DEBUG: Overlap=0, Precision=0.000, Recall=0.000
[18:14:50] DEBUG: F1=0.000, EM=0.0, Overlap=0.000
[18:14:51] DEBUG: Generated='true' vs Expected='1082'
[18:14:51] DEBUG: Overlap=0, Precision=0.000, Recall=0.000
[18:14:51] DEBUG: F1=0.000, EM=0.0, Overlap=0.000
[18:14:51] DEBUG: Generated='about 100,000 and 150,000' vs Expected='30,000'
[18:14:51] DEBUG: Overlap=0, Precision=0.000, Recall=0.000
[18:14:51] DEBUG: F1=0.000, EM=0.0, Overlap=0.000
[18:14:51]   Progress: 40/42 - Recent F1: 0.000
[18:14:51] DEBUG: Generated='constantinople' vs Expected='deabolis'
[18:14:51] DEBUG: Overlap=0, Precision=0.000, Recall=0.000
[18:14:51] DEBUG: F1=0.000, EM=0.0, Overlap=0.000
[18:14:52] DEBUG: Generated='robert's son' vs Expected='bohemond'
[18:14:52] DEBUG: Overlap=0, Precision=0.000, Recall=0.000
[18:14:52] DEBUG: F1=0.000, EM=0.0, Overlap=0.000
[18:14:52]    retrieval_focused completed: F1=0.166, EM=0.095
[18:14:52] 
🔄 Testing template: knowledge_synthesis
[18:14:52] DEBUG: Generated='paris' vs Expected='paris'
[18:14:52] DEBUG: Overlap=1, Precision=1.000, Recall=1.000
[18:14:52] DEBUG: F1=1.000, EM=1.0, Overlap=1.000
[18:14:52] DEBUG: Generated='who?' vs Expected='william shakespeare'
[18:14:52] DEBUG: Overlap=0, Precision=0.000, Recall=0.000
[18:14:52] DEBUG: F1=0.000, EM=0.0, Overlap=0.000
[18:14:52] DEBUG: Generated='factorials n!' vs Expected='4'
[18:14:52] DEBUG: Overlap=0, Precision=0.000, Recall=0.000
[18:14:52] DEBUG: F1=0.000, EM=0.0, Overlap=0.000
[18:14:53] DEBUG: Generated='plants, algae and cyanobacteria' vs Expected='process where plants make food from sunlight'
[18:14:53] DEBUG: Overlap=0, Precision=0.000, Recall=0.000
[18:14:53] DEBUG: F1=0.000, EM=0.0, Overlap=0.000
[18:14:53] DEBUG: Generated='problem / problem / solution' vs Expected='they process information using electrical circuits'
[18:14:53] DEBUG: Overlap=0, Precision=0.000, Recall=0.000
[18:14:53] DEBUG: F1=0.000, EM=0.0, Overlap=0.000
[18:14:53] DEBUG: Generated='' vs Expected='red blue green'
[18:14:53] DEBUG: F1=0.000, EM=0.0, Overlap=0.000
[18:14:53] DEBUG: Generated='cat' vs Expected='cat dog'
[18:14:53] DEBUG: Overlap=1, Precision=1.000, Recall=0.500
[18:14:53] DEBUG: F1=0.667, EM=0.0, Overlap=0.500
[18:14:54] DEBUG: Generated='data visuali zation' vs Expected='essential for life and survival'
[18:14:54] DEBUG: Overlap=0, Precision=0.000, Recall=0.000
[18:14:54] DEBUG: F1=0.000, EM=0.0, Overlap=0.000
[18:14:54] DEBUG: Generated='what makes plants green' vs Expected='chlorophyll'
[18:14:54] DEBUG: Overlap=0, Precision=0.000, Recall=0.000
[18:14:54] DEBUG: F1=0.000, EM=0.0, Overlap=0.000
[18:14:54] DEBUG: Generated='what turns you on?' vs Expected='yes'
[18:14:54] DEBUG: Overlap=0, Precision=0.000, Recall=0.000
[18:14:54] DEBUG: F1=0.000, EM=0.0, Overlap=0.000
[18:14:54]   Progress: 10/42 - Recent F1: 0.167
[18:14:55] DEBUG: Generated='do you like sex?' vs Expected='yes'
[18:14:55] DEBUG: Overlap=0, Precision=0.000, Recall=0.000
[18:14:55] DEBUG: F1=0.000, EM=0.0, Overlap=0.000
[18:14:55] DEBUG: Generated='blue' vs Expected='red yellow blue'
[18:14:55] DEBUG: Overlap=1, Precision=1.000, Recall=0.333
[18:14:55] DEBUG: F1=0.500, EM=0.0, Overlap=0.333
[18:14:55] DEBUG: Generated='france' vs Expected='france'
[18:14:55] DEBUG: Overlap=1, Precision=1.000, Recall=1.000
[18:14:55] DEBUG: F1=1.000, EM=1.0, Overlap=1.000
[18:14:55] DEBUG: Generated='10th century -- 15th century' vs Expected='10th and 11th centuries'
[18:14:55] DEBUG: Overlap=1, Precision=0.250, Recall=0.250
[18:14:55] DEBUG: F1=0.250, EM=0.0, Overlap=0.250
[18:14:56] DEBUG: Generated='scandinavia' vs Expected='denmark, iceland and norway'
[18:14:56] DEBUG: Overlap=0, Precision=0.000, Recall=0.000
[18:14:56] DEBUG: F1=0.000, EM=0.0, Overlap=0.000
[18:14:56] DEBUG: Generated='who was the norse leader' vs Expected='rollo'
[18:14:56] DEBUG: Overlap=0, Precision=0.000, Recall=0.000
[18:14:56] DEBUG: F1=0.000, EM=0.0, Overlap=0.000
[18:14:56] DEBUG: Generated='the ninth century' vs Expected='10th century'
[18:14:56] DEBUG: Overlap=1, Precision=0.333, Recall=0.500
[18:14:56] DEBUG: F1=0.400, EM=0.0, Overlap=0.500
[18:14:57] DEBUG: Generated='normandy duke of normandy' vs Expected='william the conqueror'
[18:14:57] DEBUG: Overlap=0, Precision=0.000, Recall=0.000
[18:14:57] DEBUG: F1=0.000, EM=0.0, Overlap=0.000
[18:14:57] DEBUG: Generated='king charles iii' vs Expected='richard i'
[18:14:57] DEBUG: Overlap=0, Precision=0.000, Recall=0.000
[18:14:57] DEBUG: F1=0.000, EM=0.0, Overlap=0.000
[18:14:57] DEBUG: Generated='catholicism' vs Expected='catholic'
[18:14:57] DEBUG: Overlap=0, Precision=0.000, Recall=0.000
[18:14:57] DEBUG: F1=0.000, EM=0.0, Overlap=0.000
[18:14:57]   Progress: 20/42 - Recent F1: 0.215
[18:14:57] DEBUG: Generated='data visuali zation' vs Expected='viking'
[18:14:57] DEBUG: Overlap=0, Precision=0.000, Recall=0.000
[18:14:57] DEBUG: F1=0.000, EM=0.0, Overlap=0.000
[18:14:58] DEBUG: Generated='in 1024' vs Expected='9th century'
[18:14:58] DEBUG: Overlap=0, Precision=0.000, Recall=0.000
[18:14:58] DEBUG: F1=0.000, EM=0.0, Overlap=0.000
[18:14:58] DEBUG: Generated='1066' vs Expected='911'
[18:14:58] DEBUG: Overlap=0, Precision=0.000, Recall=0.000
[18:14:58] DEBUG: F1=0.000, EM=0.0, Overlap=0.000
[18:14:58] DEBUG: Generated='patrick alexander russell' vs Expected='king charles iii'
[18:14:58] DEBUG: Overlap=0, Precision=0.000, Recall=0.000
[18:14:58] DEBUG: F1=0.000, EM=0.0, Overlap=0.000
[18:14:58] DEBUG: Generated='tennessee river' vs Expected='seine'
[18:14:58] DEBUG: Overlap=0, Precision=0.000, Recall=0.000
[18:14:58] DEBUG: F1=0.000, EM=0.0, Overlap=0.000
[18:14:59] DEBUG: Generated='the normans' vs Expected='rollo'
[18:14:59] DEBUG: Overlap=0, Precision=0.000, Recall=0.000
[18:14:59] DEBUG: F1=0.000, EM=0.0, Overlap=0.000
[18:14:59] DEBUG: Generated='islam' vs Expected='catholicism'
[18:14:59] DEBUG: Overlap=0, Precision=0.000, Recall=0.000
[18:14:59] DEBUG: F1=0.000, EM=0.0, Overlap=0.000
[18:14:59] DEBUG: Generated='normandy' vs Expected='north'
[18:14:59] DEBUG: Overlap=0, Precision=0.000, Recall=0.000
[18:14:59] DEBUG: F1=0.000, EM=0.0, Overlap=0.000
[18:14:59] DEBUG: Generated='266,827' vs Expected='fighting horsemen'
[18:14:59] DEBUG: Overlap=0, Precision=0.000, Recall=0.000
[18:14:59] DEBUG: F1=0.000, EM=0.0, Overlap=0.000
[18:15:00] DEBUG: Generated='byzantine empire' vs Expected='seljuk turks'
[18:15:00] DEBUG: Overlap=0, Precision=0.000, Recall=0.000
[18:15:00] DEBUG: F1=0.000, EM=0.0, Overlap=0.000
[18:15:00]   Progress: 30/42 - Recent F1: 0.000
[18:15:00] DEBUG: Generated='1984 -- 86' vs Expected='1050s'
[18:15:00] DEBUG: Overlap=0, Precision=0.000, Recall=0.000
[18:15:00] DEBUG: F1=0.000, EM=0.0, Overlap=0.000
[18:15:00] DEBUG: Generated='robert crispin's diary' vs Expected='1060s'
[18:15:00] DEBUG: Overlap=0, Precision=0.000, Recall=0.000
[18:15:00] DEBUG: F1=0.000, EM=0.0, Overlap=0.000
[18:15:01] DEBUG: Generated='british empire' vs Expected='alexius komnenos'
[18:15:01] DEBUG: Overlap=0, Precision=0.000, Recall=0.000
[18:15:01] DEBUG: F1=0.000, EM=0.0, Overlap=0.000
[18:15:01] DEBUG: Generated='' vs Expected='afranji'
[18:15:01] DEBUG: F1=0.000, EM=0.0, Overlap=0.000
[18:15:01] DEBUG: Generated='2018' vs Expected='oursel'
[18:15:01] DEBUG: Overlap=0, Precision=0.000, Recall=0.000
[18:15:01] DEBUG: F1=0.000, EM=0.0, Overlap=0.000
[18:15:01] DEBUG: Generated='turkey' vs Expected='turkish forces'
[18:15:01] DEBUG: Overlap=0, Precision=0.000, Recall=0.000
[18:15:01] DEBUG: F1=0.000, EM=0.0, Overlap=0.000
[18:15:01] DEBUG: Generated='byzantine origin' vs Expected='norman mercenary'
[18:15:01] DEBUG: Overlap=0, Precision=0.000, Recall=0.000
[18:15:01] DEBUG: F1=0.000, EM=0.0, Overlap=0.000
[18:15:02] DEBUG: Generated='' vs Expected='robert guiscard'
[18:15:02] DEBUG: F1=0.000, EM=0.0, Overlap=0.000
[18:15:02] DEBUG: Generated='1970s' vs Expected='1082'
[18:15:02] DEBUG: Overlap=0, Precision=0.000, Recall=0.000
[18:15:02] DEBUG: F1=0.000, EM=0.0, Overlap=0.000
[18:15:02] DEBUG: Generated='1,250,000 men' vs Expected='30,000'
[18:15:02] DEBUG: Overlap=0, Precision=0.000, Recall=0.000
[18:15:02] DEBUG: F1=0.000, EM=0.0, Overlap=0.000
[18:15:02]   Progress: 40/42 - Recent F1: 0.000
[18:15:03] DEBUG: Generated='constantinople' vs Expected='deabolis'
[18:15:03] DEBUG: Overlap=0, Precision=0.000, Recall=0.000
[18:15:03] DEBUG: F1=0.000, EM=0.0, Overlap=0.000
[18:15:03] DEBUG: Generated='' vs Expected='bohemond'
[18:15:03] DEBUG: F1=0.000, EM=0.0, Overlap=0.000
[18:15:03]    knowledge_synthesis completed: F1=0.091, EM=0.048
[18:15:03] 
🔄 Testing template: instructional_clear
[18:15:03] DEBUG: Generated='paris' vs Expected='paris'
[18:15:03] DEBUG: Overlap=1, Precision=1.000, Recall=1.000
[18:15:03] DEBUG: F1=1.000, EM=1.0, Overlap=1.000
[18:15:03] DEBUG: Generated='william shakespeare' vs Expected='william shakespeare'
[18:15:03] DEBUG: Overlap=2, Precision=1.000, Recall=1.000
[18:15:03] DEBUG: F1=1.000, EM=1.0, Overlap=1.000
[18:15:04] DEBUG: Generated='the question' vs Expected='4'
[18:15:04] DEBUG: Overlap=0, Precision=0.000, Recall=0.000
[18:15:04] DEBUG: F1=0.000, EM=0.0, Overlap=0.000
[18:15:04] DEBUG: Generated='photosynthesis' vs Expected='process where plants make food from sunlight'
[18:15:04] DEBUG: Overlap=0, Precision=0.000, Recall=0.000
[18:15:04] DEBUG: F1=0.000, EM=0.0, Overlap=0.000
[18:15:04] DEBUG: Generated='what turns you on?' vs Expected='they process information using electrical circuits'
[18:15:04] DEBUG: Overlap=0, Precision=0.000, Recall=0.000
[18:15:04] DEBUG: F1=0.000, EM=0.0, Overlap=0.000
[18:15:04] DEBUG: Generated='blue' vs Expected='red blue green'
[18:15:04] DEBUG: Overlap=1, Precision=1.000, Recall=0.333
[18:15:04] DEBUG: F1=0.500, EM=0.0, Overlap=0.333
[18:15:05] DEBUG: Generated='cat' vs Expected='cat dog'
[18:15:05] DEBUG: Overlap=1, Precision=1.000, Recall=0.500
[18:15:05] DEBUG: F1=0.667, EM=0.0, Overlap=0.500
[18:15:05] DEBUG: Generated='for all known forms of life' vs Expected='essential for life and survival'
[18:15:05] DEBUG: Overlap=2, Precision=0.333, Recall=0.400
[18:15:05] DEBUG: F1=0.364, EM=0.0, Overlap=0.400
[18:15:05] DEBUG: Generated='what turns you on?' vs Expected='chlorophyll'
[18:15:05] DEBUG: Overlap=0, Precision=0.000, Recall=0.000
[18:15:05] DEBUG: F1=0.000, EM=0.0, Overlap=0.000
[18:15:06] DEBUG: Generated='the question' vs Expected='yes'
[18:15:06] DEBUG: Overlap=0, Precision=0.000, Recall=0.000
[18:15:06] DEBUG: F1=0.000, EM=0.0, Overlap=0.000
[18:15:06]   Progress: 10/42 - Recent F1: 0.353
[18:15:06] DEBUG: Generated='' vs Expected='yes'
[18:15:06] DEBUG: F1=0.000, EM=0.0, Overlap=0.000
[18:15:06] DEBUG: Generated='red' vs Expected='red yellow blue'
[18:15:06] DEBUG: Overlap=1, Precision=1.000, Recall=0.333
[18:15:06] DEBUG: F1=0.500, EM=0.0, Overlap=0.333
[18:15:06] DEBUG: Generated='france' vs Expected='france'
[18:15:06] DEBUG: Overlap=1, Precision=1.000, Recall=1.000
[18:15:06] DEBUG: F1=1.000, EM=1.0, Overlap=1.000
[18:15:07] DEBUG: Generated='during the trojan war' vs Expected='10th and 11th centuries'
[18:15:07] DEBUG: Overlap=0, Precision=0.000, Recall=0.000
[18:15:07] DEBUG: F1=0.000, EM=0.0, Overlap=0.000
[18:15:07] DEBUG: Generated='iceland' vs Expected='denmark, iceland and norway'
[18:15:07] DEBUG: Overlap=1, Precision=1.000, Recall=0.250
[18:15:07] DEBUG: F1=0.400, EM=0.0, Overlap=0.250
[18:15:07] DEBUG: Generated='the question' vs Expected='rollo'
[18:15:07] DEBUG: Overlap=0, Precision=0.000, Recall=0.000
[18:15:07] DEBUG: F1=0.000, EM=0.0, Overlap=0.000
[18:15:07] DEBUG: Generated='the ninth century' vs Expected='10th century'
[18:15:07] DEBUG: Overlap=1, Precision=0.333, Recall=0.500
[18:15:07] DEBUG: F1=0.400, EM=0.0, Overlap=0.500
[18:15:08] DEBUG: Generated='the duke of normandy' vs Expected='william the conqueror'
[18:15:08] DEBUG: Overlap=1, Precision=0.250, Recall=0.333
[18:15:08] DEBUG: F1=0.286, EM=0.0, Overlap=0.333
[18:15:08] DEBUG: Generated='king charles iii' vs Expected='richard i'
[18:15:08] DEBUG: Overlap=0, Precision=0.000, Recall=0.000
[18:15:08] DEBUG: F1=0.000, EM=0.0, Overlap=0.000
[18:15:08] DEBUG: Generated='islam' vs Expected='catholic'
[18:15:08] DEBUG: Overlap=0, Precision=0.000, Recall=0.000
[18:15:08] DEBUG: F1=0.000, EM=0.0, Overlap=0.000
[18:15:08]   Progress: 20/42 - Recent F1: 0.259
[18:15:09] DEBUG: Generated='norman' vs Expected='viking'
[18:15:09] DEBUG: Overlap=0, Precision=0.000, Recall=0.000
[18:15:09] DEBUG: F1=0.000, EM=0.0, Overlap=0.000
[18:15:09] DEBUG: Generated='in 1024' vs Expected='9th century'
[18:15:09] DEBUG: Overlap=0, Precision=0.000, Recall=0.000
[18:15:09] DEBUG: F1=0.000, EM=0.0, Overlap=0.000
[18:15:09] DEBUG: Generated='1066' vs Expected='911'
[18:15:09] DEBUG: Overlap=0, Precision=0.000, Recall=0.000
[18:15:09] DEBUG: F1=0.000, EM=0.0, Overlap=0.000
[18:15:09] DEBUG: Generated='charles' vs Expected='king charles iii'
[18:15:09] DEBUG: Overlap=1, Precision=1.000, Recall=0.333
[18:15:09] DEBUG: F1=0.500, EM=0.0, Overlap=0.333
[18:15:09] DEBUG: Generated='what turns you on?' vs Expected='seine'
[18:15:09] DEBUG: Overlap=0, Precision=0.000, Recall=0.000
[18:15:09] DEBUG: F1=0.000, EM=0.0, Overlap=0.000
[18:15:10] DEBUG: Generated='the normans' vs Expected='rollo'
[18:15:10] DEBUG: Overlap=0, Precision=0.000, Recall=0.000
[18:15:10] DEBUG: F1=0.000, EM=0.0, Overlap=0.000
[18:15:10] DEBUG: Generated='what turns you on?' vs Expected='catholicism'
[18:15:10] DEBUG: Overlap=0, Precision=0.000, Recall=0.000
[18:15:10] DEBUG: F1=0.000, EM=0.0, Overlap=0.000
[18:15:10] DEBUG: Generated='normandy' vs Expected='north'
[18:15:10] DEBUG: Overlap=0, Precision=0.000, Recall=0.000
[18:15:10] DEBUG: F1=0.000, EM=0.0, Overlap=0.000
[18:15:11] DEBUG: Generated='what turns you on?' vs Expected='fighting horsemen'
[18:15:11] DEBUG: Overlap=0, Precision=0.000, Recall=0.000
[18:15:11] DEBUG: F1=0.000, EM=0.0, Overlap=0.000
[18:15:11] DEBUG: Generated='byzantine empire' vs Expected='seljuk turks'
[18:15:11] DEBUG: Overlap=0, Precision=0.000, Recall=0.000
[18:15:11] DEBUG: F1=0.000, EM=0.0, Overlap=0.000
[18:15:11]   Progress: 30/42 - Recent F1: 0.050
[18:15:11] DEBUG: Generated='602 -- 603' vs Expected='1050s'
[18:15:11] DEBUG: Overlap=0, Precision=0.000, Recall=0.000
[18:15:11] DEBUG: F1=0.000, EM=0.0, Overlap=0.000
[18:15:11] DEBUG: Generated='robert crispin and the turks' vs Expected='1060s'
[18:15:11] DEBUG: Overlap=0, Precision=0.000, Recall=0.000
[18:15:11] DEBUG: F1=0.000, EM=0.0, Overlap=0.000
[18:15:12] DEBUG: Generated='can you please provide a clear answer' vs Expected='alexius komnenos'
[18:15:12] DEBUG: Overlap=0, Precision=0.000, Recall=0.000
[18:15:12] DEBUG: F1=0.000, EM=0.0, Overlap=0.000
[18:15:12] DEBUG: Generated='what turns you on?' vs Expected='afranji'
[18:15:12] DEBUG: Overlap=0, Precision=0.000, Recall=0.000
[18:15:12] DEBUG: F1=0.000, EM=0.0, Overlap=0.000
[18:15:12] DEBUG: Generated='roosevelt' vs Expected='oursel'
[18:15:12] DEBUG: Overlap=0, Precision=0.000, Recall=0.000
[18:15:12] DEBUG: F1=0.000, EM=0.0, Overlap=0.000
[18:15:13] DEBUG: Generated='turkey' vs Expected='turkish forces'
[18:15:13] DEBUG: Overlap=0, Precision=0.000, Recall=0.000
[18:15:13] DEBUG: F1=0.000, EM=0.0, Overlap=0.000
[18:15:13] DEBUG: Generated='normandy, france' vs Expected='norman mercenary'
[18:15:13] DEBUG: Overlap=0, Precision=0.000, Recall=0.000
[18:15:13] DEBUG: F1=0.000, EM=0.0, Overlap=0.000
[18:15:13] DEBUG: Generated='lord canning' vs Expected='robert guiscard'
[18:15:13] DEBUG: Overlap=0, Precision=0.000, Recall=0.000
[18:15:13] DEBUG: F1=0.000, EM=0.0, Overlap=0.000
[18:15:13] DEBUG: Generated='what happened to dyrrachium?' vs Expected='1082'
[18:15:13] DEBUG: Overlap=0, Precision=0.000, Recall=0.000
[18:15:13] DEBUG: F1=0.000, EM=0.0, Overlap=0.000
[18:15:14] DEBUG: Generated='1,000,000' vs Expected='30,000'
[18:15:14] DEBUG: Overlap=0, Precision=0.000, Recall=0.000
[18:15:14] DEBUG: F1=0.000, EM=0.0, Overlap=0.000
[18:15:14]   Progress: 40/42 - Recent F1: 0.000
[18:15:14] DEBUG: Generated='constantinople' vs Expected='deabolis'
[18:15:14] DEBUG: Overlap=0, Precision=0.000, Recall=0.000
[18:15:14] DEBUG: F1=0.000, EM=0.0, Overlap=0.000
[18:15:14] DEBUG: Generated=', andrew' vs Expected='bohemond'
[18:15:14] DEBUG: Overlap=0, Precision=0.000, Recall=0.000
[18:15:14] DEBUG: F1=0.000, EM=0.0, Overlap=0.000
[18:15:14]    instructional_clear completed: F1=0.158, EM=0.071
[18:15:14] 
🔄 Testing template: context_guided
[18:15:15] DEBUG: Generated='paris' vs Expected='paris'
[18:15:15] DEBUG: Overlap=1, Precision=1.000, Recall=1.000
[18:15:15] DEBUG: F1=1.000, EM=1.0, Overlap=1.000
[18:15:15] DEBUG: Generated='' vs Expected='william shakespeare'
[18:15:15] DEBUG: F1=0.000, EM=0.0, Overlap=0.000
[18:15:15] DEBUG: Generated='what turns you on?' vs Expected='4'
[18:15:15] DEBUG: Overlap=0, Precision=0.000, Recall=0.000
[18:15:15] DEBUG: F1=0.000, EM=0.0, Overlap=0.000
[18:15:15] DEBUG: Generated='' vs Expected='process where plants make food from sunlight'
[18:15:15] DEBUG: F1=0.000, EM=0.0, Overlap=0.000
[18:15:15] DEBUG: Generated='what turns you on?' vs Expected='they process information using electrical circuits'
[18:15:15] DEBUG: Overlap=0, Precision=0.000, Recall=0.000
[18:15:15] DEBUG: F1=0.000, EM=0.0, Overlap=0.000
[18:15:16] DEBUG: Generated='green' vs Expected='red blue green'
[18:15:16] DEBUG: Overlap=1, Precision=1.000, Recall=0.333
[18:15:16] DEBUG: F1=0.500, EM=0.0, Overlap=0.333
[18:15:16] DEBUG: Generated='cat' vs Expected='cat dog'
[18:15:16] DEBUG: Overlap=1, Precision=1.000, Recall=0.500
[18:15:16] DEBUG: F1=0.667, EM=0.0, Overlap=0.500
[18:15:16] DEBUG: Generated='why is water important?' vs Expected='essential for life and survival'
[18:15:16] DEBUG: Overlap=0, Precision=0.000, Recall=0.000
[18:15:16] DEBUG: F1=0.000, EM=0.0, Overlap=0.000
[18:15:17] DEBUG: Generated='what makes plants green' vs Expected='chlorophyll'
[18:15:17] DEBUG: Overlap=0, Precision=0.000, Recall=0.000
[18:15:17] DEBUG: F1=0.000, EM=0.0, Overlap=0.000
[18:15:17] DEBUG: Generated='what turns you on?' vs Expected='yes'
[18:15:17] DEBUG: Overlap=0, Precision=0.000, Recall=0.000
[18:15:17] DEBUG: F1=0.000, EM=0.0, Overlap=0.000
[18:15:17]   Progress: 10/42 - Recent F1: 0.217
[18:15:17] DEBUG: Generated='the basic question' vs Expected='yes'
[18:15:17] DEBUG: Overlap=0, Precision=0.000, Recall=0.000
[18:15:17] DEBUG: F1=0.000, EM=0.0, Overlap=0.000
[18:15:17] DEBUG: Generated='red' vs Expected='red yellow blue'
[18:15:17] DEBUG: Overlap=1, Precision=1.000, Recall=0.333
[18:15:17] DEBUG: F1=0.500, EM=0.0, Overlap=0.333
[18:15:18] DEBUG: Generated='france' vs Expected='france'
[18:15:18] DEBUG: Overlap=1, Precision=1.000, Recall=1.000
[18:15:18] DEBUG: F1=1.000, EM=1.0, Overlap=1.000
[18:15:18] DEBUG: Generated='the 10th and 13th centuries' vs Expected='10th and 11th centuries'
[18:15:18] DEBUG: Overlap=3, Precision=0.600, Recall=0.750
[18:15:18] DEBUG: F1=0.667, EM=0.0, Overlap=0.750
[18:15:18] DEBUG: Generated='scandinavia' vs Expected='denmark, iceland and norway'
[18:15:18] DEBUG: Overlap=0, Precision=0.000, Recall=0.000
[18:15:18] DEBUG: F1=0.000, EM=0.0, Overlap=0.000
[18:15:18] DEBUG: Generated='who was the norse leader' vs Expected='rollo'
[18:15:18] DEBUG: Overlap=0, Precision=0.000, Recall=0.000
[18:15:18] DEBUG: F1=0.000, EM=0.0, Overlap=0.000
[18:15:19] DEBUG: Generated='the ninth century' vs Expected='10th century'
[18:15:19] DEBUG: Overlap=1, Precision=0.333, Recall=0.500
[18:15:19] DEBUG: F1=0.400, EM=0.0, Overlap=0.500
[18:15:19] DEBUG: Generated='normandy duke of normandy' vs Expected='william the conqueror'
[18:15:19] DEBUG: Overlap=0, Precision=0.000, Recall=0.000
[18:15:19] DEBUG: F1=0.000, EM=0.0, Overlap=0.000
[18:15:19] DEBUG: Generated='king charles iii' vs Expected='richard i'
[18:15:19] DEBUG: Overlap=0, Precision=0.000, Recall=0.000
[18:15:19] DEBUG: F1=0.000, EM=0.0, Overlap=0.000
[18:15:20] DEBUG: Generated='catholicism' vs Expected='catholic'
[18:15:20] DEBUG: Overlap=0, Precision=0.000, Recall=0.000
[18:15:20] DEBUG: F1=0.000, EM=0.0, Overlap=0.000
[18:15:20]   Progress: 20/42 - Recent F1: 0.257
[18:15:20] DEBUG: Generated='norman' vs Expected='viking'
[18:15:20] DEBUG: Overlap=0, Precision=0.000, Recall=0.000
[18:15:20] DEBUG: F1=0.000, EM=0.0, Overlap=0.000
[18:15:20] DEBUG: Generated='in 1024' vs Expected='9th century'
[18:15:20] DEBUG: Overlap=0, Precision=0.000, Recall=0.000
[18:15:20] DEBUG: F1=0.000, EM=0.0, Overlap=0.000
[18:15:20] DEBUG: Generated='1066' vs Expected='911'
[18:15:20] DEBUG: Overlap=0, Precision=0.000, Recall=0.000
[18:15:20] DEBUG: F1=0.000, EM=0.0, Overlap=0.000
[18:15:21] DEBUG: Generated='charles the simple' vs Expected='king charles iii'
[18:15:21] DEBUG: Overlap=1, Precision=0.333, Recall=0.333
[18:15:21] DEBUG: F1=0.333, EM=0.0, Overlap=0.333
[18:15:21] DEBUG: Generated='tennessee river' vs Expected='seine'
[18:15:21] DEBUG: Overlap=0, Precision=0.000, Recall=0.000
[18:15:21] DEBUG: F1=0.000, EM=0.0, Overlap=0.000
[18:15:21] DEBUG: Generated='the normans' vs Expected='rollo'
[18:15:21] DEBUG: Overlap=0, Precision=0.000, Recall=0.000
[18:15:21] DEBUG: F1=0.000, EM=0.0, Overlap=0.000
[18:15:22] DEBUG: Generated='normanism' vs Expected='catholicism'
[18:15:22] DEBUG: Overlap=0, Precision=0.000, Recall=0.000
[18:15:22] DEBUG: F1=0.000, EM=0.0, Overlap=0.000
[18:15:22] DEBUG: Generated='normandy' vs Expected='north'
[18:15:22] DEBUG: Overlap=0, Precision=0.000, Recall=0.000
[18:15:22] DEBUG: F1=0.000, EM=0.0, Overlap=0.000
[18:15:22] DEBUG: Generated='foodstuffs' vs Expected='fighting horsemen'
[18:15:22] DEBUG: Overlap=0, Precision=0.000, Recall=0.000
[18:15:22] DEBUG: F1=0.000, EM=0.0, Overlap=0.000
[18:15:22] DEBUG: Generated='the byzantine empire' vs Expected='seljuk turks'
[18:15:22] DEBUG: Overlap=0, Precision=0.000, Recall=0.000
[18:15:22] DEBUG: F1=0.000, EM=0.0, Overlap=0.000
[18:15:22]   Progress: 30/42 - Recent F1: 0.033
[18:15:23] DEBUG: Generated='during the byzantine war' vs Expected='1050s'
[18:15:23] DEBUG: Overlap=0, Precision=0.000, Recall=0.000
[18:15:23] DEBUG: F1=0.000, EM=0.0, Overlap=0.000
[18:15:23] DEBUG: Generated='2003' vs Expected='1060s'
[18:15:23] DEBUG: Overlap=0, Precision=0.000, Recall=0.000
[18:15:23] DEBUG: F1=0.000, EM=0.0, Overlap=0.000
[18:15:23] DEBUG: Generated='ask the question' vs Expected='alexius komnenos'
[18:15:23] DEBUG: Overlap=0, Precision=0.000, Recall=0.000
[18:15:23] DEBUG: F1=0.000, EM=0.0, Overlap=0.000
[18:15:23] DEBUG: Generated='neuschwanstein castle' vs Expected='afranji'
[18:15:23] DEBUG: Overlap=0, Precision=0.000, Recall=0.000
[18:15:23] DEBUG: F1=0.000, EM=0.0, Overlap=0.000
[18:15:23] DEBUG: Generated='roosevelt' vs Expected='oursel'
[18:15:23] DEBUG: Overlap=0, Precision=0.000, Recall=0.000
[18:15:23] DEBUG: F1=0.000, EM=0.0, Overlap=0.000
[18:15:24] DEBUG: Generated='turkey' vs Expected='turkish forces'
[18:15:24] DEBUG: Overlap=0, Precision=0.000, Recall=0.000
[18:15:24] DEBUG: F1=0.000, EM=0.0, Overlap=0.000
[18:15:24] DEBUG: Generated='normandy' vs Expected='norman mercenary'
[18:15:24] DEBUG: Overlap=0, Precision=0.000, Recall=0.000
[18:15:24] DEBUG: F1=0.000, EM=0.0, Overlap=0.000
[18:15:24] DEBUG: Generated='( last ) frederick iii' vs Expected='robert guiscard'
[18:15:24] DEBUG: Overlap=0, Precision=0.000, Recall=0.000
[18:15:24] DEBUG: F1=0.000, EM=0.0, Overlap=0.000
[18:15:25] DEBUG: Generated='180 bc' vs Expected='1082'
[18:15:25] DEBUG: Overlap=0, Precision=0.000, Recall=0.000
[18:15:25] DEBUG: F1=0.000, EM=0.0, Overlap=0.000
[18:15:25] DEBUG: Generated='about a million men' vs Expected='30,000'
[18:15:25] DEBUG: Overlap=0, Precision=0.000, Recall=0.000
[18:15:25] DEBUG: F1=0.000, EM=0.0, Overlap=0.000
[18:15:25]   Progress: 40/42 - Recent F1: 0.000
[18:15:25] DEBUG: Generated='in jaffa' vs Expected='deabolis'
[18:15:25] DEBUG: Overlap=0, Precision=0.000, Recall=0.000
[18:15:25] DEBUG: F1=0.000, EM=0.0, Overlap=0.000
[18:15:25] DEBUG: Generated='robert's son' vs Expected='bohemond'
[18:15:25] DEBUG: Overlap=0, Precision=0.000, Recall=0.000
[18:15:25] DEBUG: F1=0.000, EM=0.0, Overlap=0.000
[18:15:25]    context_guided completed: F1=0.121, EM=0.048
[18:15:25] 
🔄 Testing template: confident_direct
[18:15:26] DEBUG: Generated='paris' vs Expected='paris'
[18:15:26] DEBUG: Overlap=1, Precision=1.000, Recall=1.000
[18:15:26] DEBUG: F1=1.000, EM=1.0, Overlap=1.000
[18:15:26] DEBUG: Generated='william shakespeare' vs Expected='william shakespeare'
[18:15:26] DEBUG: Overlap=2, Precision=1.000, Recall=1.000
[18:15:26] DEBUG: F1=1.000, EM=1.0, Overlap=1.000
[18:15:26] DEBUG: Generated='what turns you on?' vs Expected='4'
[18:15:26] DEBUG: Overlap=0, Precision=0.000, Recall=0.000
[18:15:26] DEBUG: F1=0.000, EM=0.0, Overlap=0.000
[18:15:26] DEBUG: Generated='to convert light energy into chemical energy' vs Expected='process where plants make food from sunlight'
[18:15:26] DEBUG: Overlap=0, Precision=0.000, Recall=0.000
[18:15:26] DEBUG: F1=0.000, EM=0.0, Overlap=0.000
[18:15:27] DEBUG: Generated='what turns you on?' vs Expected='they process information using electrical circuits'
[18:15:27] DEBUG: Overlap=0, Precision=0.000, Recall=0.000
[18:15:27] DEBUG: F1=0.000, EM=0.0, Overlap=0.000
[18:15:27] DEBUG: Generated='red' vs Expected='red blue green'
[18:15:27] DEBUG: Overlap=1, Precision=1.000, Recall=0.333
[18:15:27] DEBUG: F1=0.500, EM=0.0, Overlap=0.333
[18:15:27] DEBUG: Generated='rodents' vs Expected='cat dog'
[18:15:27] DEBUG: Overlap=0, Precision=0.000, Recall=0.000
[18:15:27] DEBUG: F1=0.000, EM=0.0, Overlap=0.000
[18:15:27] DEBUG: Generated='why is water important?' vs Expected='essential for life and survival'
[18:15:27] DEBUG: Overlap=0, Precision=0.000, Recall=0.000
[18:15:27] DEBUG: F1=0.000, EM=0.0, Overlap=0.000
[18:15:28] DEBUG: Generated='chlorophyll' vs Expected='chlorophyll'
[18:15:28] DEBUG: Overlap=1, Precision=1.000, Recall=1.000
[18:15:28] DEBUG: F1=1.000, EM=1.0, Overlap=1.000
[18:15:28] DEBUG: Generated='is the earth round' vs Expected='yes'
[18:15:28] DEBUG: Overlap=0, Precision=0.000, Recall=0.000
[18:15:28] DEBUG: F1=0.000, EM=0.0, Overlap=0.000
[18:15:28]   Progress: 10/42 - Recent F1: 0.350
[18:15:28] DEBUG: Generated='' vs Expected='yes'
[18:15:28] DEBUG: F1=0.000, EM=0.0, Overlap=0.000
[18:15:28] DEBUG: Generated='red' vs Expected='red yellow blue'
[18:15:28] DEBUG: Overlap=1, Precision=1.000, Recall=0.333
[18:15:28] DEBUG: F1=0.500, EM=0.0, Overlap=0.333
[18:15:28] DEBUG: Generated='france' vs Expected='france'
[18:15:28] DEBUG: Overlap=1, Precision=1.000, Recall=1.000
[18:15:28] DEBUG: F1=1.000, EM=1.0, Overlap=1.000
[18:15:29] DEBUG: Generated='10th century -- 15th century' vs Expected='10th and 11th centuries'
[18:15:29] DEBUG: Overlap=1, Precision=0.250, Recall=0.250
[18:15:29] DEBUG: F1=0.250, EM=0.0, Overlap=0.250
[18:15:29] DEBUG: Generated='iceland' vs Expected='denmark, iceland and norway'
[18:15:29] DEBUG: Overlap=1, Precision=1.000, Recall=0.250
[18:15:29] DEBUG: F1=0.400, EM=0.0, Overlap=0.250
[18:15:29] DEBUG: Generated='who was the norse leader' vs Expected='rollo'
[18:15:29] DEBUG: Overlap=0, Precision=0.000, Recall=0.000
[18:15:29] DEBUG: F1=0.000, EM=0.0, Overlap=0.000
[18:15:30] DEBUG: Generated='the ninth century' vs Expected='10th century'
[18:15:30] DEBUG: Overlap=1, Precision=0.333, Recall=0.500
[18:15:30] DEBUG: F1=0.400, EM=0.0, Overlap=0.500
[18:15:30] DEBUG: Generated='william' vs Expected='william the conqueror'
[18:15:30] DEBUG: Overlap=1, Precision=1.000, Recall=0.333
[18:15:30] DEBUG: F1=0.500, EM=0.0, Overlap=0.333
[18:15:30] DEBUG: Generated='the king of england' vs Expected='richard i'
[18:15:30] DEBUG: Overlap=0, Precision=0.000, Recall=0.000
[18:15:30] DEBUG: F1=0.000, EM=0.0, Overlap=0.000
[18:15:30] DEBUG: Generated='catholicism' vs Expected='catholic'
[18:15:30] DEBUG: Overlap=0, Precision=0.000, Recall=0.000
[18:15:31] DEBUG: F1=0.000, EM=0.0, Overlap=0.000
[18:15:31]   Progress: 20/42 - Recent F1: 0.305
[18:15:31] DEBUG: Generated='north' vs Expected='viking'
[18:15:31] DEBUG: Overlap=0, Precision=0.000, Recall=0.000
[18:15:31] DEBUG: F1=0.000, EM=0.0, Overlap=0.000
[18:15:31] DEBUG: Generated='in 1024' vs Expected='9th century'
[18:15:31] DEBUG: Overlap=0, Precision=0.000, Recall=0.000
[18:15:31] DEBUG: F1=0.000, EM=0.0, Overlap=0.000
[18:15:31] DEBUG: Generated='1066' vs Expected='911'
[18:15:31] DEBUG: Overlap=0, Precision=0.000, Recall=0.000
[18:15:31] DEBUG: F1=0.000, EM=0.0, Overlap=0.000
[18:15:31] DEBUG: Generated='charles the simple' vs Expected='king charles iii'
[18:15:31] DEBUG: Overlap=1, Precision=0.333, Recall=0.333
[18:15:31] DEBUG: F1=0.333, EM=0.0, Overlap=0.333
[18:15:32] DEBUG: Generated='river of british columbia' vs Expected='seine'
[18:15:32] DEBUG: Overlap=0, Precision=0.000, Recall=0.000
[18:15:32] DEBUG: F1=0.000, EM=0.0, Overlap=0.000
[18:15:32] DEBUG: Generated='the normans' vs Expected='rollo'
[18:15:32] DEBUG: Overlap=0, Precision=0.000, Recall=0.000
[18:15:32] DEBUG: F1=0.000, EM=0.0, Overlap=0.000
[18:15:32] DEBUG: Generated='islam' vs Expected='catholicism'
[18:15:32] DEBUG: Overlap=0, Precision=0.000, Recall=0.000
[18:15:32] DEBUG: F1=0.000, EM=0.0, Overlap=0.000
[18:15:33] DEBUG: Generated='normandy' vs Expected='north'
[18:15:33] DEBUG: Overlap=0, Precision=0.000, Recall=0.000
[18:15:33] DEBUG: F1=0.000, EM=0.0, Overlap=0.000
[18:15:33] DEBUG: Generated='cloth' vs Expected='fighting horsemen'
[18:15:33] DEBUG: Overlap=0, Precision=0.000, Recall=0.000
[18:15:33] DEBUG: F1=0.000, EM=0.0, Overlap=0.000
[18:15:33] DEBUG: Generated='byzantine empire' vs Expected='seljuk turks'
[18:15:33] DEBUG: Overlap=0, Precision=0.000, Recall=0.000
[18:15:33] DEBUG: F1=0.000, EM=0.0, Overlap=0.000
[18:15:33]   Progress: 30/42 - Recent F1: 0.033
[18:15:33] DEBUG: Generated='during the byzantine war' vs Expected='1050s'
[18:15:33] DEBUG: Overlap=0, Precision=0.000, Recall=0.000
[18:15:33] DEBUG: F1=0.000, EM=0.0, Overlap=0.000
[18:15:34] DEBUG: Generated='2003' vs Expected='1060s'
[18:15:34] DEBUG: Overlap=0, Precision=0.000, Recall=0.000
[18:15:34] DEBUG: F1=0.000, EM=0.0, Overlap=0.000
[18:15:34] DEBUG: Generated='oliver cromwell' vs Expected='alexius komnenos'
[18:15:34] DEBUG: Overlap=0, Precision=0.000, Recall=0.000
[18:15:34] DEBUG: F1=0.000, EM=0.0, Overlap=0.000
[18:15:34] DEBUG: Generated='château paris' vs Expected='afranji'
[18:15:34] DEBUG: Overlap=0, Precision=0.000, Recall=0.000
[18:15:34] DEBUG: F1=0.000, EM=0.0, Overlap=0.000
[18:15:34] DEBUG: Generated='theudebert i' vs Expected='oursel'
[18:15:34] DEBUG: Overlap=0, Precision=0.000, Recall=0.000
[18:15:34] DEBUG: F1=0.000, EM=0.0, Overlap=0.000
[18:15:35] DEBUG: Generated='turkey' vs Expected='turkish forces'
[18:15:35] DEBUG: Overlap=0, Precision=0.000, Recall=0.000
[18:15:35] DEBUG: F1=0.000, EM=0.0, Overlap=0.000
[18:15:35] DEBUG: Generated='answers the question' vs Expected='norman mercenary'
[18:15:35] DEBUG: Overlap=0, Precision=0.000, Recall=0.000
[18:15:35] DEBUG: F1=0.000, EM=0.0, Overlap=0.000
[18:15:35] DEBUG: Generated='tobey' vs Expected='robert guiscard'
[18:15:35] DEBUG: Overlap=0, Precision=0.000, Recall=0.000
[18:15:35] DEBUG: F1=0.000, EM=0.0, Overlap=0.000
[18:15:35] DEBUG: Generated='2011' vs Expected='1082'
[18:15:35] DEBUG: Overlap=0, Precision=0.000, Recall=0.000
[18:15:35] DEBUG: F1=0.000, EM=0.0, Overlap=0.000
[18:15:36] DEBUG: Generated='350,000 and 150,000' vs Expected='30,000'
[18:15:36] DEBUG: Overlap=0, Precision=0.000, Recall=0.000
[18:15:36] DEBUG: F1=0.000, EM=0.0, Overlap=0.000
[18:15:36]   Progress: 40/42 - Recent F1: 0.000
[18:15:36] DEBUG: Generated='constantinople' vs Expected='deabolis'
[18:15:36] DEBUG: Overlap=0, Precision=0.000, Recall=0.000
[18:15:36] DEBUG: F1=0.000, EM=0.0, Overlap=0.000
[18:15:36] DEBUG: Generated='steffon' vs Expected='bohemond'
[18:15:36] DEBUG: Overlap=0, Precision=0.000, Recall=0.000
[18:15:36] DEBUG: F1=0.000, EM=0.0, Overlap=0.000
[18:15:36]    confident_direct completed: F1=0.164, EM=0.095
[18:15:36] 
🔄 Testing template: structured_response
[18:15:37] DEBUG: Generated='paris' vs Expected='paris'
[18:15:37] DEBUG: Overlap=1, Precision=1.000, Recall=1.000
[18:15:37] DEBUG: F1=1.000, EM=1.0, Overlap=1.000
[18:15:37] DEBUG: Generated='william shakespeare' vs Expected='william shakespeare'
[18:15:37] DEBUG: Overlap=2, Precision=1.000, Recall=1.000
[18:15:37] DEBUG: F1=1.000, EM=1.0, Overlap=1.000
[18:15:37] DEBUG: Generated='the binary interpretation of the numbers' vs Expected='4'
[18:15:37] DEBUG: Overlap=0, Precision=0.000, Recall=0.000
[18:15:37] DEBUG: F1=0.000, EM=0.0, Overlap=0.000
[18:15:37] DEBUG: Generated='what turns you on?' vs Expected='process where plants make food from sunlight'
[18:15:37] DEBUG: Overlap=0, Precision=0.000, Recall=0.000
[18:15:37] DEBUG: F1=0.000, EM=0.0, Overlap=0.000
[18:15:38] DEBUG: Generated='what turns you on?' vs Expected='they process information using electrical circuits'
[18:15:38] DEBUG: Overlap=0, Precision=0.000, Recall=0.000
[18:15:38] DEBUG: F1=0.000, EM=0.0, Overlap=0.000
[18:15:38] DEBUG: Generated='red' vs Expected='red blue green'
[18:15:38] DEBUG: Overlap=1, Precision=1.000, Recall=0.333
[18:15:38] DEBUG: F1=0.500, EM=0.0, Overlap=0.333
[18:15:38] DEBUG: Generated='cat' vs Expected='cat dog'
[18:15:38] DEBUG: Overlap=1, Precision=1.000, Recall=0.500
[18:15:38] DEBUG: F1=0.667, EM=0.0, Overlap=0.500
[18:15:38] DEBUG: Generated='water infinity' vs Expected='essential for life and survival'
[18:15:38] DEBUG: Overlap=0, Precision=0.000, Recall=0.000
[18:15:38] DEBUG: F1=0.000, EM=0.0, Overlap=0.000
[18:15:39] DEBUG: Generated='what turns you on' vs Expected='chlorophyll'
[18:15:39] DEBUG: Overlap=0, Precision=0.000, Recall=0.000
[18:15:39] DEBUG: F1=0.000, EM=0.0, Overlap=0.000
[18:15:39] DEBUG: Generated='the question' vs Expected='yes'
[18:15:39] DEBUG: Overlap=0, Precision=0.000, Recall=0.000
[18:15:39] DEBUG: F1=0.000, EM=0.0, Overlap=0.000
[18:15:39]   Progress: 10/42 - Recent F1: 0.317
[18:15:39] DEBUG: Generated='' vs Expected='yes'
[18:15:39] DEBUG: F1=0.000, EM=0.0, Overlap=0.000
[18:15:39] DEBUG: Generated='blue' vs Expected='red yellow blue'
[18:15:39] DEBUG: Overlap=1, Precision=1.000, Recall=0.333
[18:15:39] DEBUG: F1=0.500, EM=0.0, Overlap=0.333
[18:15:39] DEBUG: Generated='france' vs Expected='france'
[18:15:39] DEBUG: Overlap=1, Precision=1.000, Recall=1.000
[18:15:39] DEBUG: F1=1.000, EM=1.0, Overlap=1.000
[18:15:40] DEBUG: Generated='between the 10th and 13th centuries' vs Expected='10th and 11th centuries'
[18:15:40] DEBUG: Overlap=3, Precision=0.500, Recall=0.750
[18:15:40] DEBUG: F1=0.600, EM=0.0, Overlap=0.750
[18:15:40] DEBUG: Generated='iceland' vs Expected='denmark, iceland and norway'
[18:15:40] DEBUG: Overlap=1, Precision=1.000, Recall=0.250
[18:15:40] DEBUG: F1=0.400, EM=0.0, Overlap=0.250
[18:15:40] DEBUG: Generated='the norse leader' vs Expected='rollo'
[18:15:40] DEBUG: Overlap=0, Precision=0.000, Recall=0.000
[18:15:40] DEBUG: F1=0.000, EM=0.0, Overlap=0.000
[18:15:41] DEBUG: Generated='the european renaissance' vs Expected='10th century'
[18:15:41] DEBUG: Overlap=0, Precision=0.000, Recall=0.000
[18:15:41] DEBUG: F1=0.000, EM=0.0, Overlap=0.000
[18:15:41] DEBUG: Generated='the duke of normandy' vs Expected='william the conqueror'
[18:15:41] DEBUG: Overlap=1, Precision=0.250, Recall=0.333
[18:15:41] DEBUG: F1=0.286, EM=0.0, Overlap=0.333
[18:15:41] DEBUG: Generated='king' vs Expected='richard i'
[18:15:41] DEBUG: Overlap=0, Precision=0.000, Recall=0.000
[18:15:41] DEBUG: F1=0.000, EM=0.0, Overlap=0.000
[18:15:41] DEBUG: Generated='islam' vs Expected='catholic'
[18:15:41] DEBUG: Overlap=0, Precision=0.000, Recall=0.000
[18:15:41] DEBUG: F1=0.000, EM=0.0, Overlap=0.000
[18:15:41]   Progress: 20/42 - Recent F1: 0.279
[18:15:42] DEBUG: Generated='what turns you on?' vs Expected='viking'
[18:15:42] DEBUG: Overlap=0, Precision=0.000, Recall=0.000
[18:15:42] DEBUG: F1=0.000, EM=0.0, Overlap=0.000
[18:15:42] DEBUG: Generated='in 1024' vs Expected='9th century'
[18:15:42] DEBUG: Overlap=0, Precision=0.000, Recall=0.000
[18:15:42] DEBUG: F1=0.000, EM=0.0, Overlap=0.000
[18:15:42] DEBUG: Generated='987' vs Expected='911'
[18:15:42] DEBUG: Overlap=0, Precision=0.000, Recall=0.000
[18:15:42] DEBUG: F1=0.000, EM=0.0, Overlap=0.000
[18:15:43] DEBUG: Generated='the franks' vs Expected='king charles iii'
[18:15:43] DEBUG: Overlap=0, Precision=0.000, Recall=0.000
[18:15:43] DEBUG: F1=0.000, EM=0.0, Overlap=0.000
[18:15:43] DEBUG: Generated='the rio de janeiro' vs Expected='seine'
[18:15:43] DEBUG: Overlap=0, Precision=0.000, Recall=0.000
[18:15:43] DEBUG: F1=0.000, EM=0.0, Overlap=0.000
[18:15:43] DEBUG: Generated='the question' vs Expected='rollo'
[18:15:43] DEBUG: Overlap=0, Precision=0.000, Recall=0.000
[18:15:43] DEBUG: F1=0.000, EM=0.0, Overlap=0.000
[18:15:43] DEBUG: Generated='islam' vs Expected='catholicism'
[18:15:43] DEBUG: Overlap=0, Precision=0.000, Recall=0.000
[18:15:43] DEBUG: F1=0.000, EM=0.0, Overlap=0.000
[18:15:44] DEBUG: Generated='northern france' vs Expected='north'
[18:15:44] DEBUG: Overlap=0, Precision=0.000, Recall=0.000
[18:15:44] DEBUG: F1=0.000, EM=0.0, Overlap=0.000
[18:15:44] DEBUG: Generated='foodstuffs' vs Expected='fighting horsemen'
[18:15:44] DEBUG: Overlap=0, Precision=0.000, Recall=0.000
[18:15:44] DEBUG: F1=0.000, EM=0.0, Overlap=0.000
[18:15:44] DEBUG: Generated='byzantine empire' vs Expected='seljuk turks'
[18:15:44] DEBUG: Overlap=0, Precision=0.000, Recall=0.000
[18:15:44] DEBUG: F1=0.000, EM=0.0, Overlap=0.000
[18:15:44]   Progress: 30/42 - Recent F1: 0.000
[18:15:44] DEBUG: Generated='1984 -- 86' vs Expected='1050s'
[18:15:44] DEBUG: Overlap=0, Precision=0.000, Recall=0.000
[18:15:44] DEBUG: F1=0.000, EM=0.0, Overlap=0.000
[18:15:45] DEBUG: Generated='2017' vs Expected='1060s'
[18:15:45] DEBUG: Overlap=0, Precision=0.000, Recall=0.000
[18:15:45] DEBUG: F1=0.000, EM=0.0, Overlap=0.000
[18:15:45] DEBUG: Generated='his idea of kingship' vs Expected='alexius komnenos'
[18:15:45] DEBUG: Overlap=0, Precision=0.000, Recall=0.000
[18:15:45] DEBUG: F1=0.000, EM=0.0, Overlap=0.000
[18:15:45] DEBUG: Generated='the classic roman republic' vs Expected='afranji'
[18:15:45] DEBUG: Overlap=0, Precision=0.000, Recall=0.000
[18:15:45] DEBUG: F1=0.000, EM=0.0, Overlap=0.000
[18:15:45] DEBUG: Generated='charles martel' vs Expected='oursel'
[18:15:45] DEBUG: Overlap=0, Precision=0.000, Recall=0.000
[18:15:45] DEBUG: F1=0.000, EM=0.0, Overlap=0.000
[18:15:46] DEBUG: Generated='turkey' vs Expected='turkish forces'
[18:15:46] DEBUG: Overlap=0, Precision=0.000, Recall=0.000
[18:15:46] DEBUG: F1=0.000, EM=0.0, Overlap=0.000
[18:15:46] DEBUG: Generated='norman origin' vs Expected='norman mercenary'
[18:15:46] DEBUG: Overlap=1, Precision=0.500, Recall=0.500
[18:15:46] DEBUG: F1=0.500, EM=0.0, Overlap=0.500
[18:15:46] DEBUG: Generated='( last ) frederick iii' vs Expected='robert guiscard'
[18:15:46] DEBUG: Overlap=0, Precision=0.000, Recall=0.000
[18:15:46] DEBUG: F1=0.000, EM=0.0, Overlap=0.000
[18:15:47] DEBUG: Generated='what turns you on?' vs Expected='1082'
[18:15:47] DEBUG: Overlap=0, Precision=0.000, Recall=0.000
[18:15:47] DEBUG: F1=0.000, EM=0.0, Overlap=0.000
[18:15:47] DEBUG: Generated='3,000 infantry and 300 horsemen' vs Expected='30,000'
[18:15:47] DEBUG: Overlap=0, Precision=0.000, Recall=0.000
[18:15:47] DEBUG: F1=0.000, EM=0.0, Overlap=0.000
[18:15:47]   Progress: 40/42 - Recent F1: 0.050
[18:15:47] DEBUG: Generated='constantinople' vs Expected='deabolis'
[18:15:47] DEBUG: Overlap=0, Precision=0.000, Recall=0.000
[18:15:47] DEBUG: F1=0.000, EM=0.0, Overlap=0.000
[18:15:47] DEBUG: Generated='robert's son' vs Expected='bohemond'
[18:15:47] DEBUG: Overlap=0, Precision=0.000, Recall=0.000
[18:15:47] DEBUG: F1=0.000, EM=0.0, Overlap=0.000
[18:15:47]    structured_response completed: F1=0.154, EM=0.071
[18:15:47] 
🔄 Testing template: basic
[18:15:48] DEBUG: Generated='paris' vs Expected='paris'
[18:15:48] DEBUG: Overlap=1, Precision=1.000, Recall=1.000
[18:15:48] DEBUG: F1=1.000, EM=1.0, Overlap=1.000
[18:15:48] DEBUG: Generated='william shakespeare' vs Expected='william shakespeare'
[18:15:48] DEBUG: Overlap=2, Precision=1.000, Recall=1.000
[18:15:48] DEBUG: F1=1.000, EM=1.0, Overlap=1.000
[18:15:48] DEBUG: Generated='factorials n!' vs Expected='4'
[18:15:48] DEBUG: Overlap=0, Precision=0.000, Recall=0.000
[18:15:48] DEBUG: F1=0.000, EM=0.0, Overlap=0.000
[18:15:48] DEBUG: Generated='to convert light energy into chemical energy' vs Expected='process where plants make food from sunlight'
[18:15:48] DEBUG: Overlap=0, Precision=0.000, Recall=0.000
[18:15:48] DEBUG: F1=0.000, EM=0.0, Overlap=0.000
[18:15:49] DEBUG: Generated='numerical interpretation of numbers' vs Expected='they process information using electrical circuits'
[18:15:49] DEBUG: Overlap=0, Precision=0.000, Recall=0.000
[18:15:49] DEBUG: F1=0.000, EM=0.0, Overlap=0.000
[18:15:49] DEBUG: Generated='white' vs Expected='red blue green'
[18:15:49] DEBUG: Overlap=0, Precision=0.000, Recall=0.000
[18:15:49] DEBUG: F1=0.000, EM=0.0, Overlap=0.000
[18:15:49] DEBUG: Generated='amphibians' vs Expected='cat dog'
[18:15:49] DEBUG: Overlap=0, Precision=0.000, Recall=0.000
[18:15:49] DEBUG: F1=0.000, EM=0.0, Overlap=0.000
[18:15:49] DEBUG: Generated='all living things require water' vs Expected='essential for life and survival'
[18:15:49] DEBUG: Overlap=0, Precision=0.000, Recall=0.000
[18:15:50] DEBUG: F1=0.000, EM=0.0, Overlap=0.000
[18:15:50] DEBUG: Generated='chlorophyll' vs Expected='chlorophyll'
[18:15:50] DEBUG: Overlap=1, Precision=1.000, Recall=1.000
[18:15:50] DEBUG: F1=1.000, EM=1.0, Overlap=1.000
[18:15:50] DEBUG: Generated='ellipse' vs Expected='yes'
[18:15:50] DEBUG: Overlap=0, Precision=0.000, Recall=0.000
[18:15:50] DEBUG: F1=0.000, EM=0.0, Overlap=0.000
[18:15:50]   Progress: 10/42 - Recent F1: 0.300
[18:15:50] DEBUG: Generated='bird flight' vs Expected='yes'
[18:15:50] DEBUG: Overlap=0, Precision=0.000, Recall=0.000
[18:15:50] DEBUG: F1=0.000, EM=0.0, Overlap=0.000
[18:15:51] DEBUG: Generated='blue' vs Expected='red yellow blue'
[18:15:51] DEBUG: Overlap=1, Precision=1.000, Recall=0.333
[18:15:51] DEBUG: F1=0.500, EM=0.0, Overlap=0.333
[18:15:51] DEBUG: Generated='france' vs Expected='france'
[18:15:51] DEBUG: Overlap=1, Precision=1.000, Recall=1.000
[18:15:51] DEBUG: F1=1.000, EM=1.0, Overlap=1.000
[18:15:51] DEBUG: Generated='9th century -- 9th century' vs Expected='10th and 11th centuries'
[18:15:51] DEBUG: Overlap=0, Precision=0.000, Recall=0.000
[18:15:51] DEBUG: F1=0.000, EM=0.0, Overlap=0.000
[18:15:51] DEBUG: Generated='sweden' vs Expected='denmark, iceland and norway'
[18:15:51] DEBUG: Overlap=0, Precision=0.000, Recall=0.000
[18:15:51] DEBUG: F1=0.000, EM=0.0, Overlap=0.000
[18:15:52] DEBUG: Generated='cnut' vs Expected='rollo'
[18:15:52] DEBUG: Overlap=0, Precision=0.000, Recall=0.000
[18:15:52] DEBUG: F1=0.000, EM=0.0, Overlap=0.000
[18:15:52] DEBUG: Generated='the ninth century' vs Expected='10th century'
[18:15:52] DEBUG: Overlap=1, Precision=0.333, Recall=0.500
[18:15:52] DEBUG: F1=0.400, EM=0.0, Overlap=0.500
[18:15:52] DEBUG: Generated='william' vs Expected='william the conqueror'
[18:15:52] DEBUG: Overlap=1, Precision=1.000, Recall=0.333
[18:15:52] DEBUG: F1=0.500, EM=0.0, Overlap=0.333
[18:15:52] DEBUG: Generated='king charles iii of west francia' vs Expected='richard i'
[18:15:52] DEBUG: Overlap=0, Precision=0.000, Recall=0.000
[18:15:52] DEBUG: F1=0.000, EM=0.0, Overlap=0.000
[18:15:53] DEBUG: Generated='catholicism' vs Expected='catholic'
[18:15:53] DEBUG: Overlap=0, Precision=0.000, Recall=0.000
[18:15:53] DEBUG: F1=0.000, EM=0.0, Overlap=0.000
[18:15:53]   Progress: 20/42 - Recent F1: 0.240
[18:15:53] DEBUG: Generated='north' vs Expected='viking'
[18:15:53] DEBUG: Overlap=0, Precision=0.000, Recall=0.000
[18:15:53] DEBUG: F1=0.000, EM=0.0, Overlap=0.000
[18:15:53] DEBUG: Generated='1024' vs Expected='9th century'
[18:15:53] DEBUG: Overlap=0, Precision=0.000, Recall=0.000
[18:15:53] DEBUG: F1=0.000, EM=0.0, Overlap=0.000
[18:15:54] DEBUG: Generated='1066' vs Expected='911'
[18:15:54] DEBUG: Overlap=0, Precision=0.000, Recall=0.000
[18:15:54] DEBUG: F1=0.000, EM=0.0, Overlap=0.000
[18:15:54] DEBUG: Generated='charles the simple' vs Expected='king charles iii'
[18:15:54] DEBUG: Overlap=1, Precision=0.333, Recall=0.333
[18:15:54] DEBUG: F1=0.333, EM=0.0, Overlap=0.333
[18:15:54] DEBUG: Generated='elbe' vs Expected='seine'
[18:15:54] DEBUG: Overlap=0, Precision=0.000, Recall=0.000
[18:15:54] DEBUG: F1=0.000, EM=0.0, Overlap=0.000
[18:15:54] DEBUG: Generated='the byzantines' vs Expected='rollo'
[18:15:54] DEBUG: Overlap=0, Precision=0.000, Recall=0.000
[18:15:54] DEBUG: F1=0.000, EM=0.0, Overlap=0.000
[18:15:55] DEBUG: Generated='catholicism' vs Expected='catholicism'
[18:15:55] DEBUG: Overlap=1, Precision=1.000, Recall=1.000
[18:15:55] DEBUG: F1=1.000, EM=1.0, Overlap=1.000
[18:15:55] DEBUG: Generated='west france' vs Expected='north'
[18:15:55] DEBUG: Overlap=0, Precision=0.000, Recall=0.000
[18:15:55] DEBUG: F1=0.000, EM=0.0, Overlap=0.000
[18:15:55] DEBUG: Generated='cloth' vs Expected='fighting horsemen'
[18:15:55] DEBUG: Overlap=0, Precision=0.000, Recall=0.000
[18:15:55] DEBUG: F1=0.000, EM=0.0, Overlap=0.000
[18:15:55] DEBUG: Generated='hohenstaufen' vs Expected='seljuk turks'
[18:15:55] DEBUG: Overlap=0, Precision=0.000, Recall=0.000
[18:15:55] DEBUG: F1=0.000, EM=0.0, Overlap=0.000
[18:15:55]   Progress: 30/42 - Recent F1: 0.133
[18:15:56] DEBUG: Generated='1984 -- 86' vs Expected='1050s'
[18:15:56] DEBUG: Overlap=0, Precision=0.000, Recall=0.000
[18:15:56] DEBUG: F1=0.000, EM=0.0, Overlap=0.000
[18:15:56] DEBUG: Generated='862' vs Expected='1060s'
[18:15:56] DEBUG: Overlap=0, Precision=0.000, Recall=0.000
[18:15:56] DEBUG: F1=0.000, EM=0.0, Overlap=0.000
[18:15:56] DEBUG: Generated='henshaw' vs Expected='alexius komnenos'
[18:15:56] DEBUG: Overlap=0, Precision=0.000, Recall=0.000
[18:15:56] DEBUG: F1=0.000, EM=0.0, Overlap=0.000
[18:15:56] DEBUG: Generated='neath castle' vs Expected='afranji'
[18:15:56] DEBUG: Overlap=0, Precision=0.000, Recall=0.000
[18:15:56] DEBUG: F1=0.000, EM=0.0, Overlap=0.000
[18:15:57] DEBUG: Generated='theudebert i' vs Expected='oursel'
[18:15:57] DEBUG: Overlap=0, Precision=0.000, Recall=0.000
[18:15:57] DEBUG: F1=0.000, EM=0.0, Overlap=0.000
[18:15:57] DEBUG: Generated='turkey' vs Expected='turkish forces'
[18:15:57] DEBUG: Overlap=0, Precision=0.000, Recall=0.000
[18:15:57] DEBUG: F1=0.000, EM=0.0, Overlap=0.000
[18:15:57] DEBUG: Generated='english' vs Expected='norman mercenary'
[18:15:57] DEBUG: Overlap=0, Precision=0.000, Recall=0.000
[18:15:57] DEBUG: F1=0.000, EM=0.0, Overlap=0.000
[18:15:58] DEBUG: Generated='( last ) frederick iii' vs Expected='robert guiscard'
[18:15:58] DEBUG: Overlap=0, Precision=0.000, Recall=0.000
[18:15:58] DEBUG: F1=0.000, EM=0.0, Overlap=0.000
[18:15:58] DEBUG: Generated='10th century' vs Expected='1082'
[18:15:58] DEBUG: Overlap=0, Precision=0.000, Recall=0.000
[18:15:58] DEBUG: F1=0.000, EM=0.0, Overlap=0.000
[18:15:58] DEBUG: Generated='1,000,000' vs Expected='30,000'
[18:15:58] DEBUG: Overlap=0, Precision=0.000, Recall=0.000
[18:15:58] DEBUG: F1=0.000, EM=0.0, Overlap=0.000
[18:15:58]   Progress: 40/42 - Recent F1: 0.000
[18:15:58] DEBUG: Generated='constantinople' vs Expected='deabolis'
[18:15:58] DEBUG: Overlap=0, Precision=0.000, Recall=0.000
[18:15:58] DEBUG: F1=0.000, EM=0.0, Overlap=0.000
[18:15:59] DEBUG: Generated='steffon' vs Expected='bohemond'
[18:15:59] DEBUG: Overlap=0, Precision=0.000, Recall=0.000
[18:15:59] DEBUG: F1=0.000, EM=0.0, Overlap=0.000
[18:15:59]    basic completed: F1=0.160, EM=0.119
[18:15:59] 
🎉 Experiment completed! Total results: 294
[18:15:59] 
 ANALYZING RESULTS...
[18:15:59] 
 TEMPLATE PERFORMANCE RANKING:
[18:15:59] --------------------------------------------------------------------------------
[18:15:59] Template             F1 Score   EM Score   Samples  Improvement 
[18:15:59] --------------------------------------------------------------------------------
[18:15:59] retrieval_focused    0.166     0.095     42       ++3.5%      
[18:15:59] confident_direct     0.164     0.095     42       ++2.2%      
[18:15:59] basic                0.160     0.119     42       BASELINE    
[18:15:59] instructional_clear  0.158     0.071     42       +-1.7%      
[18:15:59] structured_response  0.154     0.071     42       +-4.2%      
[18:15:59] context_guided       0.121     0.048     42       +-24.8%     
[18:15:59] knowledge_synthesis  0.091     0.048     42       +-43.3%     
[18:15:59] 
📊 SUCCESS ANALYSIS:
[18:15:59]   🥇 Best Template: retrieval_focused (F1: 0.166)
[18:15:59]   ✅ SUCCESS! Basic template relegated to rank 3
[18:15:59]   🎯 Template engineering shows measurable impact!
[18:15:59] 
📋 SAMPLE RESULTS:
[18:15:59] ======================================================================
[18:15:59] 
🔸 Template: retrieval_focused (Rank 1)
[18:15:59]    Q: What is the capital of France?...
[18:15:59]    Expected: Paris
[18:15:59]    Generated: paris
[18:15:59]    Score: F1=1.000
[18:15:59]    Q: Who wrote Romeo and Juliet?...
[18:15:59]    Expected: William Shakespeare
[18:15:59]    Generated: william shakespeare
[18:15:59]    Score: F1=1.000
[18:15:59] 
🔸 Template: confident_direct (Rank 2)
[18:15:59]    Q: What is the capital of France?...
[18:15:59]    Expected: Paris
[18:15:59]    Generated: paris
[18:15:59]    Score: F1=1.000
[18:15:59]    Q: Who wrote Romeo and Juliet?...
[18:15:59]    Expected: William Shakespeare
[18:15:59]    Generated: william shakespeare
[18:15:59]    Score: F1=1.000
[18:15:59] 
🔸 Template: basic (Rank 3)
[18:15:59]    Q: What is the capital of France?...
[18:15:59]    Expected: Paris
[18:15:59]    Generated: paris
[18:15:59]    Score: F1=1.000
[18:15:59]    Q: Who wrote Romeo and Juliet?...
[18:15:59]    Expected: William Shakespeare
[18:15:59]    Generated: william shakespeare
[18:15:59]    Score: F1=1.000
[18:15:59] 
🎉 TARGETED EXPERIMENT COMPLETED!
