[05:09:11]  Setting up GPU configuration...
[05:09:12]  Using device: cuda:1
[05:09:12]  Loading RAG models...
[05:14:52]  RAG system ready!
[05:14:52]  Loading targeted evaluation dataset...
[05:14:52] Loading 150 questions to get 50 with answers
[05:14:55]  Dataset loaded: 50 questions
[05:14:55]    - SQuAD questions: 69
[05:14:55]  Starting targeted RAG experiment...
[05:14:55]  Testing 7 templates on 50 questions
[05:14:55] 
 Testing template: retrieval_focused
[05:14:57] DEBUG: Generated='paris' vs Expected='paris'
[05:14:57] DEBUG: Overlap=1, Precision=1.000, Recall=1.000
[05:14:57] DEBUG: F1=1.000, EM=1.0, Overlap=1.000
[05:14:58] DEBUG: Generated='william shakespeare' vs Expected='william shakespeare'
[05:14:58] DEBUG: Overlap=2, Precision=1.000, Recall=1.000
[05:14:58] DEBUG: F1=1.000, EM=1.0, Overlap=1.000
[05:14:58] DEBUG: Generated='factorials n!' vs Expected='4'
[05:14:58] DEBUG: Overlap=0, Precision=0.000, Recall=0.000
[05:14:58] DEBUG: F1=0.000, EM=0.0, Overlap=0.000
[05:14:58] DEBUG: Generated='' vs Expected='process where plants make food from sunlight'
[05:14:58] DEBUG: F1=0.000, EM=0.0, Overlap=0.000
[05:14:59] DEBUG: Generated='what turns you on?' vs Expected='they process information using electrical circuits'
[05:14:59] DEBUG: Overlap=0, Precision=0.000, Recall=0.000
[05:14:59] DEBUG: F1=0.000, EM=0.0, Overlap=0.000
[05:14:59] DEBUG: Generated='red' vs Expected='red blue green'
[05:14:59] DEBUG: Overlap=1, Precision=1.000, Recall=0.333
[05:14:59] DEBUG: F1=0.500, EM=0.0, Overlap=0.333
[05:15:00] DEBUG: Generated='cat' vs Expected='cat dog'
[05:15:00] DEBUG: Overlap=1, Precision=1.000, Recall=0.500
[05:15:00] DEBUG: F1=0.667, EM=0.0, Overlap=0.500
[05:15:00] DEBUG: Generated='health' vs Expected='essential for life and survival'
[05:15:00] DEBUG: Overlap=0, Precision=0.000, Recall=0.000
[05:15:00] DEBUG: F1=0.000, EM=0.0, Overlap=0.000
[05:15:00] DEBUG: Generated='chlorophyll' vs Expected='chlorophyll'
[05:15:00] DEBUG: Overlap=1, Precision=1.000, Recall=1.000
[05:15:00] DEBUG: F1=1.000, EM=1.0, Overlap=1.000
[05:15:00] DEBUG: Generated='factorials n!' vs Expected='yes'
[05:15:00] DEBUG: Overlap=0, Precision=0.000, Recall=0.000
[05:15:00] DEBUG: F1=0.000, EM=0.0, Overlap=0.000
[05:15:00]   Progress: 10/50 - Recent F1: 0.417
[05:15:01] DEBUG: Generated='' vs Expected='yes'
[05:15:01] DEBUG: F1=0.000, EM=0.0, Overlap=0.000
[05:15:01] DEBUG: Generated='blue' vs Expected='red yellow blue'
[05:15:01] DEBUG: Overlap=1, Precision=1.000, Recall=0.333
[05:15:01] DEBUG: F1=0.500, EM=0.0, Overlap=0.333
[05:15:02] DEBUG: Generated='france' vs Expected='france'
[05:15:02] DEBUG: Overlap=1, Precision=1.000, Recall=1.000
[05:15:02] DEBUG: F1=1.000, EM=1.0, Overlap=1.000
[05:15:02] DEBUG: Generated='9th century -- 9th century' vs Expected='10th and 11th centuries'
[05:15:02] DEBUG: Overlap=0, Precision=0.000, Recall=0.000
[05:15:02] DEBUG: F1=0.000, EM=0.0, Overlap=0.000
[05:15:03] DEBUG: Generated='iceland' vs Expected='denmark, iceland and norway'
[05:15:03] DEBUG: Overlap=1, Precision=1.000, Recall=0.250
[05:15:03] DEBUG: F1=0.400, EM=0.0, Overlap=0.250
[05:15:03] DEBUG: Generated='bjorn ulvaeus' vs Expected='rollo'
[05:15:03] DEBUG: Overlap=0, Precision=0.000, Recall=0.000
[05:15:03] DEBUG: F1=0.000, EM=0.0, Overlap=0.000
[05:15:04] DEBUG: Generated='the ninth century' vs Expected='10th century'
[05:15:04] DEBUG: Overlap=1, Precision=0.333, Recall=0.500
[05:15:04] DEBUG: F1=0.400, EM=0.0, Overlap=0.500
[05:15:04] DEBUG: Generated='william' vs Expected='william the conqueror'
[05:15:04] DEBUG: Overlap=1, Precision=1.000, Recall=0.333
[05:15:04] DEBUG: F1=0.500, EM=0.0, Overlap=0.333
[05:15:04] DEBUG: Generated='king charles iii' vs Expected='richard i'
[05:15:04] DEBUG: Overlap=0, Precision=0.000, Recall=0.000
[05:15:04] DEBUG: F1=0.000, EM=0.0, Overlap=0.000
[05:15:05] DEBUG: Generated='catholicism' vs Expected='catholic'
[05:15:05] DEBUG: Overlap=0, Precision=0.000, Recall=0.000
[05:15:05] DEBUG: F1=0.000, EM=0.0, Overlap=0.000
[05:15:05]   Progress: 20/50 - Recent F1: 0.280
[05:15:05] DEBUG: Generated='north' vs Expected='viking'
[05:15:05] DEBUG: Overlap=0, Precision=0.000, Recall=0.000
[05:15:05] DEBUG: F1=0.000, EM=0.0, Overlap=0.000
[05:15:05] DEBUG: Generated='in 1024' vs Expected='9th century'
[05:15:05] DEBUG: Overlap=0, Precision=0.000, Recall=0.000
[05:15:05] DEBUG: F1=0.000, EM=0.0, Overlap=0.000
[05:15:05] DEBUG: Generated='1066' vs Expected='911'
[05:15:05] DEBUG: Overlap=0, Precision=0.000, Recall=0.000
[05:15:05] DEBUG: F1=0.000, EM=0.0, Overlap=0.000
[05:15:06] DEBUG: Generated='the franks' vs Expected='king charles iii'
[05:15:06] DEBUG: Overlap=0, Precision=0.000, Recall=0.000
[05:15:06] DEBUG: F1=0.000, EM=0.0, Overlap=0.000
[05:15:06] DEBUG: Generated='tennessee river' vs Expected='seine'
[05:15:06] DEBUG: Overlap=0, Precision=0.000, Recall=0.000
[05:15:06] DEBUG: F1=0.000, EM=0.0, Overlap=0.000
[05:15:06] DEBUG: Generated='the inuit' vs Expected='rollo'
[05:15:06] DEBUG: Overlap=0, Precision=0.000, Recall=0.000
[05:15:06] DEBUG: F1=0.000, EM=0.0, Overlap=0.000
[05:15:07] DEBUG: Generated='islam' vs Expected='catholicism'
[05:15:07] DEBUG: Overlap=0, Precision=0.000, Recall=0.000
[05:15:07] DEBUG: F1=0.000, EM=0.0, Overlap=0.000
[05:15:07] DEBUG: Generated='normandy' vs Expected='north'
[05:15:07] DEBUG: Overlap=0, Precision=0.000, Recall=0.000
[05:15:07] DEBUG: F1=0.000, EM=0.0, Overlap=0.000
[05:15:07] DEBUG: Generated='foodstuffs' vs Expected='fighting horsemen'
[05:15:07] DEBUG: Overlap=0, Precision=0.000, Recall=0.000
[05:15:07] DEBUG: F1=0.000, EM=0.0, Overlap=0.000
[05:15:07] DEBUG: Generated='byzantine empire' vs Expected='seljuk turks'
[05:15:07] DEBUG: Overlap=0, Precision=0.000, Recall=0.000
[05:15:07] DEBUG: F1=0.000, EM=0.0, Overlap=0.000
[05:15:07]   Progress: 30/50 - Recent F1: 0.000
[05:15:08] DEBUG: Generated='1984 -- 86' vs Expected='1050s'
[05:15:08] DEBUG: Overlap=0, Precision=0.000, Recall=0.000
[05:15:08] DEBUG: F1=0.000, EM=0.0, Overlap=0.000
[05:15:08] DEBUG: Generated='1984' vs Expected='1060s'
[05:15:08] DEBUG: Overlap=0, Precision=0.000, Recall=0.000
[05:15:08] DEBUG: F1=0.000, EM=0.0, Overlap=0.000
[05:15:08] DEBUG: Generated='factorials' vs Expected='alexius komnenos'
[05:15:08] DEBUG: Overlap=0, Precision=0.000, Recall=0.000
[05:15:08] DEBUG: F1=0.000, EM=0.0, Overlap=0.000
[05:15:09] DEBUG: Generated='the château de caen' vs Expected='afranji'
[05:15:09] DEBUG: Overlap=0, Precision=0.000, Recall=0.000
[05:15:09] DEBUG: F1=0.000, EM=0.0, Overlap=0.000
[05:15:09] DEBUG: Generated='' vs Expected='oursel'
[05:15:09] DEBUG: F1=0.000, EM=0.0, Overlap=0.000
[05:15:10] DEBUG: Generated='turkey' vs Expected='turkish forces'
[05:15:10] DEBUG: Overlap=0, Precision=0.000, Recall=0.000
[05:15:10] DEBUG: F1=0.000, EM=0.0, Overlap=0.000
[05:15:10] DEBUG: Generated='byzantine origin' vs Expected='norman mercenary'
[05:15:10] DEBUG: Overlap=0, Precision=0.000, Recall=0.000
[05:15:10] DEBUG: F1=0.000, EM=0.0, Overlap=0.000
[05:15:11] DEBUG: Generated='( last ) frederick iii' vs Expected='robert guiscard'
[05:15:11] DEBUG: Overlap=0, Precision=0.000, Recall=0.000
[05:15:11] DEBUG: F1=0.000, EM=0.0, Overlap=0.000
[05:15:12] DEBUG: Generated='true' vs Expected='1082'
[05:15:12] DEBUG: Overlap=0, Precision=0.000, Recall=0.000
[05:15:12] DEBUG: F1=0.000, EM=0.0, Overlap=0.000
[05:15:12] DEBUG: Generated='about 100,000 and 150,000' vs Expected='30,000'
[05:15:12] DEBUG: Overlap=0, Precision=0.000, Recall=0.000
[05:15:12] DEBUG: F1=0.000, EM=0.0, Overlap=0.000
[05:15:12]   Progress: 40/50 - Recent F1: 0.000
[05:15:12] DEBUG: Generated='constantinople' vs Expected='deabolis'
[05:15:12] DEBUG: Overlap=0, Precision=0.000, Recall=0.000
[05:15:12] DEBUG: F1=0.000, EM=0.0, Overlap=0.000
[05:15:13] DEBUG: Generated='robert's son' vs Expected='bohemond'
[05:15:13] DEBUG: Overlap=0, Precision=0.000, Recall=0.000
[05:15:13] DEBUG: F1=0.000, EM=0.0, Overlap=0.000
[05:15:13] DEBUG: Generated='river sita' vs Expected='deabolis'
[05:15:13] DEBUG: Overlap=0, Precision=0.000, Recall=0.000
[05:15:13] DEBUG: F1=0.000, EM=0.0, Overlap=0.000
[05:15:13] DEBUG: Generated='2003' vs Expected='1185'
[05:15:13] DEBUG: Overlap=0, Precision=0.000, Recall=0.000
[05:15:13] DEBUG: F1=0.000, EM=0.0, Overlap=0.000
[05:15:13] DEBUG: Generated='naval station guantanamo bay' vs Expected='dyrrachium'
[05:15:13] DEBUG: Overlap=0, Precision=0.000, Recall=0.000
[05:15:13] DEBUG: F1=0.000, EM=0.0, Overlap=0.000
[05:15:14] DEBUG: Generated='north - western asia' vs Expected='the adriatic'
[05:15:14] DEBUG: Overlap=0, Precision=0.000, Recall=0.000
[05:15:14] DEBUG: F1=0.000, EM=0.0, Overlap=0.000
[05:15:14] DEBUG: Generated='matt willis' vs Expected='king ethelred ii'
[05:15:14] DEBUG: Overlap=0, Precision=0.000, Recall=0.000
[05:15:14] DEBUG: F1=0.000, EM=0.0, Overlap=0.000
[05:15:14] DEBUG: Generated='bryce gheisar' vs Expected='duke richard ii'
[05:15:14] DEBUG: Overlap=0, Precision=0.000, Recall=0.000
[05:15:14] DEBUG: F1=0.000, EM=0.0, Overlap=0.000
[05:15:15] DEBUG: Generated='britain' vs Expected='normandy'
[05:15:15] DEBUG: Overlap=0, Precision=0.000, Recall=0.000
[05:15:15] DEBUG: F1=0.000, EM=0.0, Overlap=0.000
[05:15:15] DEBUG: Generated='the undertaker' vs Expected='sweyn forkbeard'
[05:15:15] DEBUG: Overlap=0, Precision=0.000, Recall=0.000
[05:15:15] DEBUG: F1=0.000, EM=0.0, Overlap=0.000
[05:15:15]   Progress: 50/50 - Recent F1: 0.000
[05:15:15]    retrieval_focused completed: F1=0.139, EM=0.080
[05:15:15] 
 Testing template: knowledge_synthesis
[05:15:15] DEBUG: Generated='paris' vs Expected='paris'
[05:15:15] DEBUG: Overlap=1, Precision=1.000, Recall=1.000
[05:15:15] DEBUG: F1=1.000, EM=1.0, Overlap=1.000
[05:15:16] DEBUG: Generated='who?' vs Expected='william shakespeare'
[05:15:16] DEBUG: Overlap=0, Precision=0.000, Recall=0.000
[05:15:16] DEBUG: F1=0.000, EM=0.0, Overlap=0.000
[05:15:16] DEBUG: Generated='factorials n!' vs Expected='4'
[05:15:16] DEBUG: Overlap=0, Precision=0.000, Recall=0.000
[05:15:16] DEBUG: F1=0.000, EM=0.0, Overlap=0.000
[05:15:16] DEBUG: Generated='plants, algae and cyanobacteria' vs Expected='process where plants make food from sunlight'
[05:15:16] DEBUG: Overlap=0, Precision=0.000, Recall=0.000
[05:15:16] DEBUG: F1=0.000, EM=0.0, Overlap=0.000
[05:15:17] DEBUG: Generated='problem / problem / solution' vs Expected='they process information using electrical circuits'
[05:15:17] DEBUG: Overlap=0, Precision=0.000, Recall=0.000
[05:15:17] DEBUG: F1=0.000, EM=0.0, Overlap=0.000
[05:15:17] DEBUG: Generated='' vs Expected='red blue green'
[05:15:17] DEBUG: F1=0.000, EM=0.0, Overlap=0.000
[05:15:17] DEBUG: Generated='cat' vs Expected='cat dog'
[05:15:17] DEBUG: Overlap=1, Precision=1.000, Recall=0.500
[05:15:17] DEBUG: F1=0.667, EM=0.0, Overlap=0.500
[05:15:17] DEBUG: Generated='data visuali zation' vs Expected='essential for life and survival'
[05:15:17] DEBUG: Overlap=0, Precision=0.000, Recall=0.000
[05:15:17] DEBUG: F1=0.000, EM=0.0, Overlap=0.000
[05:15:18] DEBUG: Generated='what makes plants green' vs Expected='chlorophyll'
[05:15:18] DEBUG: Overlap=0, Precision=0.000, Recall=0.000
[05:15:18] DEBUG: F1=0.000, EM=0.0, Overlap=0.000
[05:15:19] DEBUG: Generated='what turns you on?' vs Expected='yes'
[05:15:19] DEBUG: Overlap=0, Precision=0.000, Recall=0.000
[05:15:19] DEBUG: F1=0.000, EM=0.0, Overlap=0.000
[05:15:19]   Progress: 10/50 - Recent F1: 0.167
[05:15:20] DEBUG: Generated='do you like sex?' vs Expected='yes'
[05:15:20] DEBUG: Overlap=0, Precision=0.000, Recall=0.000
[05:15:20] DEBUG: F1=0.000, EM=0.0, Overlap=0.000
[05:15:20] DEBUG: Generated='blue' vs Expected='red yellow blue'
[05:15:20] DEBUG: Overlap=1, Precision=1.000, Recall=0.333
[05:15:20] DEBUG: F1=0.500, EM=0.0, Overlap=0.333
[05:15:20] DEBUG: Generated='france' vs Expected='france'
[05:15:20] DEBUG: Overlap=1, Precision=1.000, Recall=1.000
[05:15:20] DEBUG: F1=1.000, EM=1.0, Overlap=1.000
[05:15:20] DEBUG: Generated='10th century -- 15th century' vs Expected='10th and 11th centuries'
[05:15:20] DEBUG: Overlap=1, Precision=0.250, Recall=0.250
[05:15:20] DEBUG: F1=0.250, EM=0.0, Overlap=0.250
[05:15:21] DEBUG: Generated='scandinavia' vs Expected='denmark, iceland and norway'
[05:15:21] DEBUG: Overlap=0, Precision=0.000, Recall=0.000
[05:15:21] DEBUG: F1=0.000, EM=0.0, Overlap=0.000
[05:15:21] DEBUG: Generated='who was the norse leader' vs Expected='rollo'
[05:15:21] DEBUG: Overlap=0, Precision=0.000, Recall=0.000
[05:15:21] DEBUG: F1=0.000, EM=0.0, Overlap=0.000
[05:15:21] DEBUG: Generated='the ninth century' vs Expected='10th century'
[05:15:21] DEBUG: Overlap=1, Precision=0.333, Recall=0.500
[05:15:21] DEBUG: F1=0.400, EM=0.0, Overlap=0.500
[05:15:22] DEBUG: Generated='normandy duke of normandy' vs Expected='william the conqueror'
[05:15:22] DEBUG: Overlap=0, Precision=0.000, Recall=0.000
[05:15:22] DEBUG: F1=0.000, EM=0.0, Overlap=0.000
[05:15:22] DEBUG: Generated='king charles iii' vs Expected='richard i'
[05:15:22] DEBUG: Overlap=0, Precision=0.000, Recall=0.000
[05:15:22] DEBUG: F1=0.000, EM=0.0, Overlap=0.000
[05:15:22] DEBUG: Generated='catholicism' vs Expected='catholic'
[05:15:22] DEBUG: Overlap=0, Precision=0.000, Recall=0.000
[05:15:22] DEBUG: F1=0.000, EM=0.0, Overlap=0.000
[05:15:22]   Progress: 20/50 - Recent F1: 0.215
[05:15:22] DEBUG: Generated='data visuali zation' vs Expected='viking'
[05:15:22] DEBUG: Overlap=0, Precision=0.000, Recall=0.000
[05:15:22] DEBUG: F1=0.000, EM=0.0, Overlap=0.000
[05:15:22] DEBUG: Generated='in 1024' vs Expected='9th century'
[05:15:22] DEBUG: Overlap=0, Precision=0.000, Recall=0.000
[05:15:22] DEBUG: F1=0.000, EM=0.0, Overlap=0.000
[05:15:23] DEBUG: Generated='1066' vs Expected='911'
[05:15:23] DEBUG: Overlap=0, Precision=0.000, Recall=0.000
[05:15:23] DEBUG: F1=0.000, EM=0.0, Overlap=0.000
[05:15:23] DEBUG: Generated='patrick alexander russell' vs Expected='king charles iii'
[05:15:23] DEBUG: Overlap=0, Precision=0.000, Recall=0.000
[05:15:23] DEBUG: F1=0.000, EM=0.0, Overlap=0.000
[05:15:24] DEBUG: Generated='tennessee river' vs Expected='seine'
[05:15:24] DEBUG: Overlap=0, Precision=0.000, Recall=0.000
[05:15:24] DEBUG: F1=0.000, EM=0.0, Overlap=0.000
[05:15:24] DEBUG: Generated='the normans' vs Expected='rollo'
[05:15:24] DEBUG: Overlap=0, Precision=0.000, Recall=0.000
[05:15:24] DEBUG: F1=0.000, EM=0.0, Overlap=0.000
[05:15:25] DEBUG: Generated='islam' vs Expected='catholicism'
[05:15:25] DEBUG: Overlap=0, Precision=0.000, Recall=0.000
[05:15:25] DEBUG: F1=0.000, EM=0.0, Overlap=0.000
[05:15:25] DEBUG: Generated='normandy' vs Expected='north'
[05:15:25] DEBUG: Overlap=0, Precision=0.000, Recall=0.000
[05:15:25] DEBUG: F1=0.000, EM=0.0, Overlap=0.000
[05:15:25] DEBUG: Generated='266,827' vs Expected='fighting horsemen'
[05:15:25] DEBUG: Overlap=0, Precision=0.000, Recall=0.000
[05:15:25] DEBUG: F1=0.000, EM=0.0, Overlap=0.000
[05:15:26] DEBUG: Generated='byzantine empire' vs Expected='seljuk turks'
[05:15:26] DEBUG: Overlap=0, Precision=0.000, Recall=0.000
[05:15:26] DEBUG: F1=0.000, EM=0.0, Overlap=0.000
[05:15:26]   Progress: 30/50 - Recent F1: 0.000
[05:15:27] DEBUG: Generated='1984 -- 86' vs Expected='1050s'
[05:15:27] DEBUG: Overlap=0, Precision=0.000, Recall=0.000
[05:15:27] DEBUG: F1=0.000, EM=0.0, Overlap=0.000
[05:15:28] DEBUG: Generated='robert crispin's diary' vs Expected='1060s'
[05:15:28] DEBUG: Overlap=0, Precision=0.000, Recall=0.000
[05:15:28] DEBUG: F1=0.000, EM=0.0, Overlap=0.000
[05:15:28] DEBUG: Generated='british empire' vs Expected='alexius komnenos'
[05:15:28] DEBUG: Overlap=0, Precision=0.000, Recall=0.000
[05:15:28] DEBUG: F1=0.000, EM=0.0, Overlap=0.000
[05:15:28] DEBUG: Generated='' vs Expected='afranji'
[05:15:28] DEBUG: F1=0.000, EM=0.0, Overlap=0.000
[05:15:29] DEBUG: Generated='2018' vs Expected='oursel'
[05:15:29] DEBUG: Overlap=0, Precision=0.000, Recall=0.000
[05:15:29] DEBUG: F1=0.000, EM=0.0, Overlap=0.000
[05:15:29] DEBUG: Generated='turkey' vs Expected='turkish forces'
[05:15:29] DEBUG: Overlap=0, Precision=0.000, Recall=0.000
[05:15:29] DEBUG: F1=0.000, EM=0.0, Overlap=0.000
[05:15:29] DEBUG: Generated='byzantine origin' vs Expected='norman mercenary'
[05:15:29] DEBUG: Overlap=0, Precision=0.000, Recall=0.000
[05:15:29] DEBUG: F1=0.000, EM=0.0, Overlap=0.000
[05:15:29] DEBUG: Generated='' vs Expected='robert guiscard'
[05:15:29] DEBUG: F1=0.000, EM=0.0, Overlap=0.000
[05:15:30] DEBUG: Generated='1970s' vs Expected='1082'
[05:15:30] DEBUG: Overlap=0, Precision=0.000, Recall=0.000
[05:15:30] DEBUG: F1=0.000, EM=0.0, Overlap=0.000
[05:15:31] DEBUG: Generated='1,250,000 men' vs Expected='30,000'
[05:15:31] DEBUG: Overlap=0, Precision=0.000, Recall=0.000
[05:15:31] DEBUG: F1=0.000, EM=0.0, Overlap=0.000
[05:15:31]   Progress: 40/50 - Recent F1: 0.000
[05:15:31] DEBUG: Generated='constantinople' vs Expected='deabolis'
[05:15:31] DEBUG: Overlap=0, Precision=0.000, Recall=0.000
[05:15:31] DEBUG: F1=0.000, EM=0.0, Overlap=0.000
[05:15:31] DEBUG: Generated='' vs Expected='bohemond'
[05:15:31] DEBUG: F1=0.000, EM=0.0, Overlap=0.000
[05:15:32] DEBUG: Generated='river sita' vs Expected='deabolis'
[05:15:32] DEBUG: Overlap=0, Precision=0.000, Recall=0.000
[05:15:32] DEBUG: F1=0.000, EM=0.0, Overlap=0.000
[05:15:32] DEBUG: Generated='2018' vs Expected='1185'
[05:15:32] DEBUG: Overlap=0, Precision=0.000, Recall=0.000
[05:15:32] DEBUG: F1=0.000, EM=0.0, Overlap=0.000
[05:15:32] DEBUG: Generated='guantanamo bay naval base' vs Expected='dyrrachium'
[05:15:32] DEBUG: Overlap=0, Precision=0.000, Recall=0.000
[05:15:32] DEBUG: F1=0.000, EM=0.0, Overlap=0.000
[05:15:32] DEBUG: Generated='the earth's crust' vs Expected='the adriatic'
[05:15:32] DEBUG: Overlap=1, Precision=0.333, Recall=0.500
[05:15:32] DEBUG: F1=0.400, EM=0.0, Overlap=0.500
[05:15:33] DEBUG: Generated='theo' vs Expected='king ethelred ii'
[05:15:33] DEBUG: Overlap=0, Precision=0.000, Recall=0.000
[05:15:33] DEBUG: F1=0.000, EM=0.0, Overlap=0.000
[05:15:33] DEBUG: Generated='madhavrao' vs Expected='duke richard ii'
[05:15:33] DEBUG: Overlap=0, Precision=0.000, Recall=0.000
[05:15:33] DEBUG: F1=0.000, EM=0.0, Overlap=0.000
[05:15:33] DEBUG: Generated='to the netherlands' vs Expected='normandy'
[05:15:33] DEBUG: Overlap=0, Precision=0.000, Recall=0.000
[05:15:33] DEBUG: F1=0.000, EM=0.0, Overlap=0.000
[05:15:33] DEBUG: Generated='ethelred' vs Expected='sweyn forkbeard'
[05:15:33] DEBUG: Overlap=0, Precision=0.000, Recall=0.000
[05:15:33] DEBUG: F1=0.000, EM=0.0, Overlap=0.000
[05:15:33]   Progress: 50/50 - Recent F1: 0.040
[05:15:33]    knowledge_synthesis completed: F1=0.084, EM=0.040
[05:15:33] 
 Testing template: instructional_clear
[05:15:34] DEBUG: Generated='paris' vs Expected='paris'
[05:15:34] DEBUG: Overlap=1, Precision=1.000, Recall=1.000
[05:15:34] DEBUG: F1=1.000, EM=1.0, Overlap=1.000
[05:15:34] DEBUG: Generated='william shakespeare' vs Expected='william shakespeare'
[05:15:34] DEBUG: Overlap=2, Precision=1.000, Recall=1.000
[05:15:34] DEBUG: F1=1.000, EM=1.0, Overlap=1.000
[05:15:34] DEBUG: Generated='the question' vs Expected='4'
[05:15:34] DEBUG: Overlap=0, Precision=0.000, Recall=0.000
[05:15:34] DEBUG: F1=0.000, EM=0.0, Overlap=0.000
[05:15:34] DEBUG: Generated='photosynthesis' vs Expected='process where plants make food from sunlight'
[05:15:34] DEBUG: Overlap=0, Precision=0.000, Recall=0.000
[05:15:34] DEBUG: F1=0.000, EM=0.0, Overlap=0.000
[05:15:35] DEBUG: Generated='what turns you on?' vs Expected='they process information using electrical circuits'
[05:15:35] DEBUG: Overlap=0, Precision=0.000, Recall=0.000
[05:15:35] DEBUG: F1=0.000, EM=0.0, Overlap=0.000
[05:15:35] DEBUG: Generated='blue' vs Expected='red blue green'
[05:15:35] DEBUG: Overlap=1, Precision=1.000, Recall=0.333
[05:15:35] DEBUG: F1=0.500, EM=0.0, Overlap=0.333
[05:15:35] DEBUG: Generated='cat' vs Expected='cat dog'
[05:15:35] DEBUG: Overlap=1, Precision=1.000, Recall=0.500
[05:15:35] DEBUG: F1=0.667, EM=0.0, Overlap=0.500
[05:15:35] DEBUG: Generated='for all known forms of life' vs Expected='essential for life and survival'
[05:15:35] DEBUG: Overlap=2, Precision=0.333, Recall=0.400
[05:15:35] DEBUG: F1=0.364, EM=0.0, Overlap=0.400
[05:15:36] DEBUG: Generated='what turns you on?' vs Expected='chlorophyll'
[05:15:36] DEBUG: Overlap=0, Precision=0.000, Recall=0.000
[05:15:36] DEBUG: F1=0.000, EM=0.0, Overlap=0.000
[05:15:36] DEBUG: Generated='the question' vs Expected='yes'
[05:15:36] DEBUG: Overlap=0, Precision=0.000, Recall=0.000
[05:15:36] DEBUG: F1=0.000, EM=0.0, Overlap=0.000
[05:15:36]   Progress: 10/50 - Recent F1: 0.353
[05:15:36] DEBUG: Generated='' vs Expected='yes'
[05:15:36] DEBUG: F1=0.000, EM=0.0, Overlap=0.000
[05:15:36] DEBUG: Generated='red' vs Expected='red yellow blue'
[05:15:36] DEBUG: Overlap=1, Precision=1.000, Recall=0.333
[05:15:36] DEBUG: F1=0.500, EM=0.0, Overlap=0.333
[05:15:37] DEBUG: Generated='france' vs Expected='france'
[05:15:37] DEBUG: Overlap=1, Precision=1.000, Recall=1.000
[05:15:37] DEBUG: F1=1.000, EM=1.0, Overlap=1.000
[05:15:37] DEBUG: Generated='during the trojan war' vs Expected='10th and 11th centuries'
[05:15:37] DEBUG: Overlap=0, Precision=0.000, Recall=0.000
[05:15:37] DEBUG: F1=0.000, EM=0.0, Overlap=0.000
[05:15:37] DEBUG: Generated='iceland' vs Expected='denmark, iceland and norway'
[05:15:37] DEBUG: Overlap=1, Precision=1.000, Recall=0.250
[05:15:37] DEBUG: F1=0.400, EM=0.0, Overlap=0.250
[05:15:38] DEBUG: Generated='the question' vs Expected='rollo'
[05:15:38] DEBUG: Overlap=0, Precision=0.000, Recall=0.000
[05:15:38] DEBUG: F1=0.000, EM=0.0, Overlap=0.000
[05:15:38] DEBUG: Generated='the ninth century' vs Expected='10th century'
[05:15:38] DEBUG: Overlap=1, Precision=0.333, Recall=0.500
[05:15:38] DEBUG: F1=0.400, EM=0.0, Overlap=0.500
[05:15:38] DEBUG: Generated='the duke of normandy' vs Expected='william the conqueror'
[05:15:38] DEBUG: Overlap=1, Precision=0.250, Recall=0.333
[05:15:38] DEBUG: F1=0.286, EM=0.0, Overlap=0.333
[05:15:39] DEBUG: Generated='king charles iii' vs Expected='richard i'
[05:15:39] DEBUG: Overlap=0, Precision=0.000, Recall=0.000
[05:15:39] DEBUG: F1=0.000, EM=0.0, Overlap=0.000
[05:15:39] DEBUG: Generated='islam' vs Expected='catholic'
[05:15:39] DEBUG: Overlap=0, Precision=0.000, Recall=0.000
[05:15:39] DEBUG: F1=0.000, EM=0.0, Overlap=0.000
[05:15:39]   Progress: 20/50 - Recent F1: 0.259
[05:15:40] DEBUG: Generated='norman' vs Expected='viking'
[05:15:40] DEBUG: Overlap=0, Precision=0.000, Recall=0.000
[05:15:40] DEBUG: F1=0.000, EM=0.0, Overlap=0.000
[05:15:40] DEBUG: Generated='in 1024' vs Expected='9th century'
[05:15:40] DEBUG: Overlap=0, Precision=0.000, Recall=0.000
[05:15:40] DEBUG: F1=0.000, EM=0.0, Overlap=0.000
[05:15:40] DEBUG: Generated='1066' vs Expected='911'
[05:15:40] DEBUG: Overlap=0, Precision=0.000, Recall=0.000
[05:15:40] DEBUG: F1=0.000, EM=0.0, Overlap=0.000
[05:15:40] DEBUG: Generated='charles' vs Expected='king charles iii'
[05:15:40] DEBUG: Overlap=1, Precision=1.000, Recall=0.333
[05:15:40] DEBUG: F1=0.500, EM=0.0, Overlap=0.333
[05:15:41] DEBUG: Generated='what turns you on?' vs Expected='seine'
[05:15:41] DEBUG: Overlap=0, Precision=0.000, Recall=0.000
[05:15:41] DEBUG: F1=0.000, EM=0.0, Overlap=0.000
[05:15:42] DEBUG: Generated='the normans' vs Expected='rollo'
[05:15:42] DEBUG: Overlap=0, Precision=0.000, Recall=0.000
[05:15:42] DEBUG: F1=0.000, EM=0.0, Overlap=0.000
[05:15:42] DEBUG: Generated='what turns you on?' vs Expected='catholicism'
[05:15:42] DEBUG: Overlap=0, Precision=0.000, Recall=0.000
[05:15:42] DEBUG: F1=0.000, EM=0.0, Overlap=0.000
[05:15:43] DEBUG: Generated='normandy' vs Expected='north'
[05:15:43] DEBUG: Overlap=0, Precision=0.000, Recall=0.000
[05:15:43] DEBUG: F1=0.000, EM=0.0, Overlap=0.000
[05:15:43] DEBUG: Generated='what turns you on?' vs Expected='fighting horsemen'
[05:15:43] DEBUG: Overlap=0, Precision=0.000, Recall=0.000
[05:15:43] DEBUG: F1=0.000, EM=0.0, Overlap=0.000
[05:15:44] DEBUG: Generated='byzantine empire' vs Expected='seljuk turks'
[05:15:44] DEBUG: Overlap=0, Precision=0.000, Recall=0.000
[05:15:44] DEBUG: F1=0.000, EM=0.0, Overlap=0.000
[05:15:44]   Progress: 30/50 - Recent F1: 0.050
[05:15:44] DEBUG: Generated='602 -- 603' vs Expected='1050s'
[05:15:44] DEBUG: Overlap=0, Precision=0.000, Recall=0.000
[05:15:44] DEBUG: F1=0.000, EM=0.0, Overlap=0.000
[05:15:44] DEBUG: Generated='robert crispin and the turks' vs Expected='1060s'
[05:15:44] DEBUG: Overlap=0, Precision=0.000, Recall=0.000
[05:15:44] DEBUG: F1=0.000, EM=0.0, Overlap=0.000
[05:15:45] DEBUG: Generated='can you please provide a clear answer' vs Expected='alexius komnenos'
[05:15:45] DEBUG: Overlap=0, Precision=0.000, Recall=0.000
[05:15:45] DEBUG: F1=0.000, EM=0.0, Overlap=0.000
[05:15:45] DEBUG: Generated='what turns you on?' vs Expected='afranji'
[05:15:45] DEBUG: Overlap=0, Precision=0.000, Recall=0.000
[05:15:45] DEBUG: F1=0.000, EM=0.0, Overlap=0.000
[05:15:45] DEBUG: Generated='roosevelt' vs Expected='oursel'
[05:15:45] DEBUG: Overlap=0, Precision=0.000, Recall=0.000
[05:15:45] DEBUG: F1=0.000, EM=0.0, Overlap=0.000
[05:15:46] DEBUG: Generated='turkey' vs Expected='turkish forces'
[05:15:46] DEBUG: Overlap=0, Precision=0.000, Recall=0.000
[05:15:46] DEBUG: F1=0.000, EM=0.0, Overlap=0.000
[05:15:46] DEBUG: Generated='normandy, france' vs Expected='norman mercenary'
[05:15:46] DEBUG: Overlap=0, Precision=0.000, Recall=0.000
[05:15:46] DEBUG: F1=0.000, EM=0.0, Overlap=0.000
[05:15:46] DEBUG: Generated='lord canning' vs Expected='robert guiscard'
[05:15:46] DEBUG: Overlap=0, Precision=0.000, Recall=0.000
[05:15:46] DEBUG: F1=0.000, EM=0.0, Overlap=0.000
[05:15:47] DEBUG: Generated='what happened to dyrrachium?' vs Expected='1082'
[05:15:47] DEBUG: Overlap=0, Precision=0.000, Recall=0.000
[05:15:47] DEBUG: F1=0.000, EM=0.0, Overlap=0.000
[05:15:47] DEBUG: Generated='1,000,000' vs Expected='30,000'
[05:15:47] DEBUG: Overlap=0, Precision=0.000, Recall=0.000
[05:15:47] DEBUG: F1=0.000, EM=0.0, Overlap=0.000
[05:15:47]   Progress: 40/50 - Recent F1: 0.000
[05:15:47] DEBUG: Generated='constantinople' vs Expected='deabolis'
[05:15:47] DEBUG: Overlap=0, Precision=0.000, Recall=0.000
[05:15:47] DEBUG: F1=0.000, EM=0.0, Overlap=0.000
[05:15:48] DEBUG: Generated=', andrew' vs Expected='bohemond'
[05:15:48] DEBUG: Overlap=0, Precision=0.000, Recall=0.000
[05:15:48] DEBUG: F1=0.000, EM=0.0, Overlap=0.000
[05:15:48] DEBUG: Generated='river sitka' vs Expected='deabolis'
[05:15:48] DEBUG: Overlap=0, Precision=0.000, Recall=0.000
[05:15:48] DEBUG: F1=0.000, EM=0.0, Overlap=0.000
[05:15:48] DEBUG: Generated='2003' vs Expected='1185'
[05:15:48] DEBUG: Overlap=0, Precision=0.000, Recall=0.000
[05:15:48] DEBUG: F1=0.000, EM=0.0, Overlap=0.000
[05:15:48] DEBUG: Generated='what turns you on?' vs Expected='dyrrachium'
[05:15:48] DEBUG: Overlap=0, Precision=0.000, Recall=0.000
[05:15:48] DEBUG: F1=0.000, EM=0.0, Overlap=0.000
[05:15:49] DEBUG: Generated='what turns you on?' vs Expected='the adriatic'
[05:15:49] DEBUG: Overlap=0, Precision=0.000, Recall=0.000
[05:15:49] DEBUG: F1=0.000, EM=0.0, Overlap=0.000
[05:15:49] DEBUG: Generated='admiral horatio nelson' vs Expected='king ethelred ii'
[05:15:49] DEBUG: Overlap=0, Precision=0.000, Recall=0.000
[05:15:49] DEBUG: F1=0.000, EM=0.0, Overlap=0.000
[05:15:50] DEBUG: Generated='the question' vs Expected='duke richard ii'
[05:15:50] DEBUG: Overlap=0, Precision=0.000, Recall=0.000
[05:15:50] DEBUG: F1=0.000, EM=0.0, Overlap=0.000
[05:15:51] DEBUG: Generated='to return to england' vs Expected='normandy'
[05:15:51] DEBUG: Overlap=0, Precision=0.000, Recall=0.000
[05:15:51] DEBUG: F1=0.000, EM=0.0, Overlap=0.000
[05:15:51] DEBUG: Generated='parliament' vs Expected='sweyn forkbeard'
[05:15:51] DEBUG: Overlap=0, Precision=0.000, Recall=0.000
[05:15:51] DEBUG: F1=0.000, EM=0.0, Overlap=0.000
[05:15:51]   Progress: 50/50 - Recent F1: 0.000
[05:15:51]    instructional_clear completed: F1=0.132, EM=0.060
[05:15:51] 
 Testing template: context_guided
[05:15:51] DEBUG: Generated='paris' vs Expected='paris'
[05:15:51] DEBUG: Overlap=1, Precision=1.000, Recall=1.000
[05:15:51] DEBUG: F1=1.000, EM=1.0, Overlap=1.000
[05:15:51] DEBUG: Generated='' vs Expected='william shakespeare'
[05:15:51] DEBUG: F1=0.000, EM=0.0, Overlap=0.000
[05:15:52] DEBUG: Generated='what turns you on?' vs Expected='4'
[05:15:52] DEBUG: Overlap=0, Precision=0.000, Recall=0.000
[05:15:52] DEBUG: F1=0.000, EM=0.0, Overlap=0.000
[05:15:52] DEBUG: Generated='' vs Expected='process where plants make food from sunlight'
[05:15:52] DEBUG: F1=0.000, EM=0.0, Overlap=0.000
[05:15:53] DEBUG: Generated='what turns you on?' vs Expected='they process information using electrical circuits'
[05:15:53] DEBUG: Overlap=0, Precision=0.000, Recall=0.000
[05:15:53] DEBUG: F1=0.000, EM=0.0, Overlap=0.000
[05:15:53] DEBUG: Generated='green' vs Expected='red blue green'
[05:15:53] DEBUG: Overlap=1, Precision=1.000, Recall=0.333
[05:15:53] DEBUG: F1=0.500, EM=0.0, Overlap=0.333
[05:15:54] DEBUG: Generated='cat' vs Expected='cat dog'
[05:15:54] DEBUG: Overlap=1, Precision=1.000, Recall=0.500
[05:15:54] DEBUG: F1=0.667, EM=0.0, Overlap=0.500
[05:15:54] DEBUG: Generated='why is water important?' vs Expected='essential for life and survival'
[05:15:54] DEBUG: Overlap=0, Precision=0.000, Recall=0.000
[05:15:54] DEBUG: F1=0.000, EM=0.0, Overlap=0.000
[05:15:54] DEBUG: Generated='what makes plants green' vs Expected='chlorophyll'
[05:15:54] DEBUG: Overlap=0, Precision=0.000, Recall=0.000
[05:15:54] DEBUG: F1=0.000, EM=0.0, Overlap=0.000
[05:15:54] DEBUG: Generated='what turns you on?' vs Expected='yes'
[05:15:54] DEBUG: Overlap=0, Precision=0.000, Recall=0.000
[05:15:54] DEBUG: F1=0.000, EM=0.0, Overlap=0.000
[05:15:54]   Progress: 10/50 - Recent F1: 0.217
[05:15:55] DEBUG: Generated='the basic question' vs Expected='yes'
[05:15:55] DEBUG: Overlap=0, Precision=0.000, Recall=0.000
[05:15:55] DEBUG: F1=0.000, EM=0.0, Overlap=0.000
[05:15:55] DEBUG: Generated='red' vs Expected='red yellow blue'
[05:15:55] DEBUG: Overlap=1, Precision=1.000, Recall=0.333
[05:15:55] DEBUG: F1=0.500, EM=0.0, Overlap=0.333
[05:15:55] DEBUG: Generated='france' vs Expected='france'
[05:15:55] DEBUG: Overlap=1, Precision=1.000, Recall=1.000
[05:15:55] DEBUG: F1=1.000, EM=1.0, Overlap=1.000
[05:15:55] DEBUG: Generated='the 10th and 13th centuries' vs Expected='10th and 11th centuries'
[05:15:55] DEBUG: Overlap=3, Precision=0.600, Recall=0.750
[05:15:55] DEBUG: F1=0.667, EM=0.0, Overlap=0.750
[05:15:56] DEBUG: Generated='scandinavia' vs Expected='denmark, iceland and norway'
[05:15:56] DEBUG: Overlap=0, Precision=0.000, Recall=0.000
[05:15:56] DEBUG: F1=0.000, EM=0.0, Overlap=0.000
[05:15:56] DEBUG: Generated='who was the norse leader' vs Expected='rollo'
[05:15:56] DEBUG: Overlap=0, Precision=0.000, Recall=0.000
[05:15:56] DEBUG: F1=0.000, EM=0.0, Overlap=0.000
[05:15:56] DEBUG: Generated='the ninth century' vs Expected='10th century'
[05:15:56] DEBUG: Overlap=1, Precision=0.333, Recall=0.500
[05:15:56] DEBUG: F1=0.400, EM=0.0, Overlap=0.500
[05:15:57] DEBUG: Generated='normandy duke of normandy' vs Expected='william the conqueror'
[05:15:57] DEBUG: Overlap=0, Precision=0.000, Recall=0.000
[05:15:57] DEBUG: F1=0.000, EM=0.0, Overlap=0.000
[05:15:58] DEBUG: Generated='king charles iii' vs Expected='richard i'
[05:15:58] DEBUG: Overlap=0, Precision=0.000, Recall=0.000
[05:15:58] DEBUG: F1=0.000, EM=0.0, Overlap=0.000
[05:15:58] DEBUG: Generated='catholicism' vs Expected='catholic'
[05:15:58] DEBUG: Overlap=0, Precision=0.000, Recall=0.000
[05:15:58] DEBUG: F1=0.000, EM=0.0, Overlap=0.000
[05:15:58]   Progress: 20/50 - Recent F1: 0.257
[05:15:59] DEBUG: Generated='norman' vs Expected='viking'
[05:15:59] DEBUG: Overlap=0, Precision=0.000, Recall=0.000
[05:15:59] DEBUG: F1=0.000, EM=0.0, Overlap=0.000
[05:15:59] DEBUG: Generated='in 1024' vs Expected='9th century'
[05:15:59] DEBUG: Overlap=0, Precision=0.000, Recall=0.000
[05:15:59] DEBUG: F1=0.000, EM=0.0, Overlap=0.000
[05:15:59] DEBUG: Generated='1066' vs Expected='911'
[05:15:59] DEBUG: Overlap=0, Precision=0.000, Recall=0.000
[05:15:59] DEBUG: F1=0.000, EM=0.0, Overlap=0.000
[05:15:59] DEBUG: Generated='charles the simple' vs Expected='king charles iii'
[05:15:59] DEBUG: Overlap=1, Precision=0.333, Recall=0.333
[05:15:59] DEBUG: F1=0.333, EM=0.0, Overlap=0.333
[05:16:00] DEBUG: Generated='tennessee river' vs Expected='seine'
[05:16:00] DEBUG: Overlap=0, Precision=0.000, Recall=0.000
[05:16:00] DEBUG: F1=0.000, EM=0.0, Overlap=0.000
[05:16:00] DEBUG: Generated='the normans' vs Expected='rollo'
[05:16:00] DEBUG: Overlap=0, Precision=0.000, Recall=0.000
[05:16:00] DEBUG: F1=0.000, EM=0.0, Overlap=0.000
[05:16:00] DEBUG: Generated='normanism' vs Expected='catholicism'
[05:16:00] DEBUG: Overlap=0, Precision=0.000, Recall=0.000
[05:16:00] DEBUG: F1=0.000, EM=0.0, Overlap=0.000
[05:16:01] DEBUG: Generated='normandy' vs Expected='north'
[05:16:01] DEBUG: Overlap=0, Precision=0.000, Recall=0.000
[05:16:01] DEBUG: F1=0.000, EM=0.0, Overlap=0.000
[05:16:01] DEBUG: Generated='foodstuffs' vs Expected='fighting horsemen'
[05:16:01] DEBUG: Overlap=0, Precision=0.000, Recall=0.000
[05:16:01] DEBUG: F1=0.000, EM=0.0, Overlap=0.000
[05:16:01] DEBUG: Generated='the byzantine empire' vs Expected='seljuk turks'
[05:16:01] DEBUG: Overlap=0, Precision=0.000, Recall=0.000
[05:16:01] DEBUG: F1=0.000, EM=0.0, Overlap=0.000
[05:16:01]   Progress: 30/50 - Recent F1: 0.033
[05:16:01] DEBUG: Generated='during the byzantine war' vs Expected='1050s'
[05:16:01] DEBUG: Overlap=0, Precision=0.000, Recall=0.000
[05:16:01] DEBUG: F1=0.000, EM=0.0, Overlap=0.000
[05:16:02] DEBUG: Generated='2003' vs Expected='1060s'
[05:16:02] DEBUG: Overlap=0, Precision=0.000, Recall=0.000
[05:16:02] DEBUG: F1=0.000, EM=0.0, Overlap=0.000
[05:16:02] DEBUG: Generated='ask the question' vs Expected='alexius komnenos'
[05:16:02] DEBUG: Overlap=0, Precision=0.000, Recall=0.000
[05:16:02] DEBUG: F1=0.000, EM=0.0, Overlap=0.000
[05:16:02] DEBUG: Generated='neuschwanstein castle' vs Expected='afranji'
[05:16:02] DEBUG: Overlap=0, Precision=0.000, Recall=0.000
[05:16:02] DEBUG: F1=0.000, EM=0.0, Overlap=0.000
[05:16:02] DEBUG: Generated='roosevelt' vs Expected='oursel'
[05:16:02] DEBUG: Overlap=0, Precision=0.000, Recall=0.000
[05:16:02] DEBUG: F1=0.000, EM=0.0, Overlap=0.000
[05:16:03] DEBUG: Generated='turkey' vs Expected='turkish forces'
[05:16:03] DEBUG: Overlap=0, Precision=0.000, Recall=0.000
[05:16:03] DEBUG: F1=0.000, EM=0.0, Overlap=0.000
[05:16:03] DEBUG: Generated='normandy' vs Expected='norman mercenary'
[05:16:03] DEBUG: Overlap=0, Precision=0.000, Recall=0.000
[05:16:03] DEBUG: F1=0.000, EM=0.0, Overlap=0.000
[05:16:03] DEBUG: Generated='( last ) frederick iii' vs Expected='robert guiscard'
[05:16:03] DEBUG: Overlap=0, Precision=0.000, Recall=0.000
[05:16:03] DEBUG: F1=0.000, EM=0.0, Overlap=0.000
[05:16:03] DEBUG: Generated='180 bc' vs Expected='1082'
[05:16:03] DEBUG: Overlap=0, Precision=0.000, Recall=0.000
[05:16:03] DEBUG: F1=0.000, EM=0.0, Overlap=0.000
[05:16:04] DEBUG: Generated='about a million men' vs Expected='30,000'
[05:16:04] DEBUG: Overlap=0, Precision=0.000, Recall=0.000
[05:16:04] DEBUG: F1=0.000, EM=0.0, Overlap=0.000
[05:16:04]   Progress: 40/50 - Recent F1: 0.000
[05:16:04] DEBUG: Generated='in jaffa' vs Expected='deabolis'
[05:16:04] DEBUG: Overlap=0, Precision=0.000, Recall=0.000
[05:16:04] DEBUG: F1=0.000, EM=0.0, Overlap=0.000
[05:16:04] DEBUG: Generated='robert's son' vs Expected='bohemond'
[05:16:04] DEBUG: Overlap=0, Precision=0.000, Recall=0.000
[05:16:04] DEBUG: F1=0.000, EM=0.0, Overlap=0.000
[05:16:05] DEBUG: Generated='river sita' vs Expected='deabolis'
[05:16:05] DEBUG: Overlap=0, Precision=0.000, Recall=0.000
[05:16:05] DEBUG: F1=0.000, EM=0.0, Overlap=0.000
[05:16:05] DEBUG: Generated='2018' vs Expected='1185'
[05:16:05] DEBUG: Overlap=0, Precision=0.000, Recall=0.000
[05:16:05] DEBUG: F1=0.000, EM=0.0, Overlap=0.000
[05:16:06] DEBUG: Generated='naval air station' vs Expected='dyrrachium'
[05:16:06] DEBUG: Overlap=0, Precision=0.000, Recall=0.000
[05:16:06] DEBUG: F1=0.000, EM=0.0, Overlap=0.000
[05:16:06] DEBUG: Generated='the fundamental question' vs Expected='the adriatic'
[05:16:06] DEBUG: Overlap=1, Precision=0.333, Recall=0.500
[05:16:06] DEBUG: F1=0.400, EM=0.0, Overlap=0.500
[05:16:07] DEBUG: Generated='mr. knightley' vs Expected='king ethelred ii'
[05:16:07] DEBUG: Overlap=0, Precision=0.000, Recall=0.000
[05:16:07] DEBUG: F1=0.000, EM=0.0, Overlap=0.000
[05:16:07] DEBUG: Generated='ellen' vs Expected='duke richard ii'
[05:16:07] DEBUG: Overlap=0, Precision=0.000, Recall=0.000
[05:16:07] DEBUG: F1=0.000, EM=0.0, Overlap=0.000
[05:16:08] DEBUG: Generated='to return to england' vs Expected='normandy'
[05:16:08] DEBUG: Overlap=0, Precision=0.000, Recall=0.000
[05:16:08] DEBUG: F1=0.000, EM=0.0, Overlap=0.000
[05:16:08] DEBUG: Generated='what turns you on?' vs Expected='sweyn forkbeard'
[05:16:08] DEBUG: Overlap=0, Precision=0.000, Recall=0.000
[05:16:08] DEBUG: F1=0.000, EM=0.0, Overlap=0.000
[05:16:08]   Progress: 50/50 - Recent F1: 0.040
[05:16:08]    context_guided completed: F1=0.109, EM=0.040
[05:16:08] 
 Testing template: confident_direct
[05:16:08] DEBUG: Generated='paris' vs Expected='paris'
[05:16:08] DEBUG: Overlap=1, Precision=1.000, Recall=1.000
[05:16:08] DEBUG: F1=1.000, EM=1.0, Overlap=1.000
[05:16:08] DEBUG: Generated='william shakespeare' vs Expected='william shakespeare'
[05:16:08] DEBUG: Overlap=2, Precision=1.000, Recall=1.000
[05:16:08] DEBUG: F1=1.000, EM=1.0, Overlap=1.000
[05:16:09] DEBUG: Generated='what turns you on?' vs Expected='4'
[05:16:09] DEBUG: Overlap=0, Precision=0.000, Recall=0.000
[05:16:09] DEBUG: F1=0.000, EM=0.0, Overlap=0.000
[05:16:09] DEBUG: Generated='to convert light energy into chemical energy' vs Expected='process where plants make food from sunlight'
[05:16:09] DEBUG: Overlap=0, Precision=0.000, Recall=0.000
[05:16:09] DEBUG: F1=0.000, EM=0.0, Overlap=0.000
[05:16:09] DEBUG: Generated='what turns you on?' vs Expected='they process information using electrical circuits'
[05:16:09] DEBUG: Overlap=0, Precision=0.000, Recall=0.000
[05:16:09] DEBUG: F1=0.000, EM=0.0, Overlap=0.000
[05:16:09] DEBUG: Generated='red' vs Expected='red blue green'
[05:16:09] DEBUG: Overlap=1, Precision=1.000, Recall=0.333
[05:16:09] DEBUG: F1=0.500, EM=0.0, Overlap=0.333
[05:16:10] DEBUG: Generated='rodents' vs Expected='cat dog'
[05:16:10] DEBUG: Overlap=0, Precision=0.000, Recall=0.000
[05:16:10] DEBUG: F1=0.000, EM=0.0, Overlap=0.000
[05:16:10] DEBUG: Generated='why is water important?' vs Expected='essential for life and survival'
[05:16:10] DEBUG: Overlap=0, Precision=0.000, Recall=0.000
[05:16:10] DEBUG: F1=0.000, EM=0.0, Overlap=0.000
[05:16:10] DEBUG: Generated='chlorophyll' vs Expected='chlorophyll'
[05:16:10] DEBUG: Overlap=1, Precision=1.000, Recall=1.000
[05:16:10] DEBUG: F1=1.000, EM=1.0, Overlap=1.000
[05:16:12] DEBUG: Generated='is the earth round' vs Expected='yes'
[05:16:12] DEBUG: Overlap=0, Precision=0.000, Recall=0.000
[05:16:12] DEBUG: F1=0.000, EM=0.0, Overlap=0.000
[05:16:12]   Progress: 10/50 - Recent F1: 0.350
[05:16:12] DEBUG: Generated='' vs Expected='yes'
[05:16:12] DEBUG: F1=0.000, EM=0.0, Overlap=0.000
[05:16:13] DEBUG: Generated='red' vs Expected='red yellow blue'
[05:16:13] DEBUG: Overlap=1, Precision=1.000, Recall=0.333
[05:16:13] DEBUG: F1=0.500, EM=0.0, Overlap=0.333
[05:16:13] DEBUG: Generated='france' vs Expected='france'
[05:16:13] DEBUG: Overlap=1, Precision=1.000, Recall=1.000
[05:16:13] DEBUG: F1=1.000, EM=1.0, Overlap=1.000
[05:16:13] DEBUG: Generated='10th century -- 15th century' vs Expected='10th and 11th centuries'
[05:16:13] DEBUG: Overlap=1, Precision=0.250, Recall=0.250
[05:16:13] DEBUG: F1=0.250, EM=0.0, Overlap=0.250
[05:16:13] DEBUG: Generated='iceland' vs Expected='denmark, iceland and norway'
[05:16:13] DEBUG: Overlap=1, Precision=1.000, Recall=0.250
[05:16:13] DEBUG: F1=0.400, EM=0.0, Overlap=0.250
[05:16:13] DEBUG: Generated='who was the norse leader' vs Expected='rollo'
[05:16:13] DEBUG: Overlap=0, Precision=0.000, Recall=0.000
[05:16:13] DEBUG: F1=0.000, EM=0.0, Overlap=0.000
[05:16:14] DEBUG: Generated='the ninth century' vs Expected='10th century'
[05:16:14] DEBUG: Overlap=1, Precision=0.333, Recall=0.500
[05:16:14] DEBUG: F1=0.400, EM=0.0, Overlap=0.500
[05:16:14] DEBUG: Generated='william' vs Expected='william the conqueror'
[05:16:14] DEBUG: Overlap=1, Precision=1.000, Recall=0.333
[05:16:14] DEBUG: F1=0.500, EM=0.0, Overlap=0.333
[05:16:14] DEBUG: Generated='the king of england' vs Expected='richard i'
[05:16:14] DEBUG: Overlap=0, Precision=0.000, Recall=0.000
[05:16:14] DEBUG: F1=0.000, EM=0.0, Overlap=0.000
[05:16:14] DEBUG: Generated='catholicism' vs Expected='catholic'
[05:16:14] DEBUG: Overlap=0, Precision=0.000, Recall=0.000
[05:16:14] DEBUG: F1=0.000, EM=0.0, Overlap=0.000
[05:16:14]   Progress: 20/50 - Recent F1: 0.305
[05:16:14] DEBUG: Generated='north' vs Expected='viking'
[05:16:14] DEBUG: Overlap=0, Precision=0.000, Recall=0.000
[05:16:14] DEBUG: F1=0.000, EM=0.0, Overlap=0.000
[05:16:14] DEBUG: Generated='in 1024' vs Expected='9th century'
[05:16:14] DEBUG: Overlap=0, Precision=0.000, Recall=0.000
[05:16:14] DEBUG: F1=0.000, EM=0.0, Overlap=0.000
[05:16:15] DEBUG: Generated='1066' vs Expected='911'
[05:16:15] DEBUG: Overlap=0, Precision=0.000, Recall=0.000
[05:16:15] DEBUG: F1=0.000, EM=0.0, Overlap=0.000
[05:16:15] DEBUG: Generated='charles the simple' vs Expected='king charles iii'
[05:16:15] DEBUG: Overlap=1, Precision=0.333, Recall=0.333
[05:16:15] DEBUG: F1=0.333, EM=0.0, Overlap=0.333
[05:16:15] DEBUG: Generated='river of british columbia' vs Expected='seine'
[05:16:15] DEBUG: Overlap=0, Precision=0.000, Recall=0.000
[05:16:15] DEBUG: F1=0.000, EM=0.0, Overlap=0.000
[05:16:15] DEBUG: Generated='the normans' vs Expected='rollo'
[05:16:15] DEBUG: Overlap=0, Precision=0.000, Recall=0.000
[05:16:15] DEBUG: F1=0.000, EM=0.0, Overlap=0.000
[05:16:15] DEBUG: Generated='islam' vs Expected='catholicism'
[05:16:15] DEBUG: Overlap=0, Precision=0.000, Recall=0.000
[05:16:15] DEBUG: F1=0.000, EM=0.0, Overlap=0.000
[05:16:16] DEBUG: Generated='normandy' vs Expected='north'
[05:16:16] DEBUG: Overlap=0, Precision=0.000, Recall=0.000
[05:16:16] DEBUG: F1=0.000, EM=0.0, Overlap=0.000
[05:16:16] DEBUG: Generated='cloth' vs Expected='fighting horsemen'
[05:16:16] DEBUG: Overlap=0, Precision=0.000, Recall=0.000
[05:16:16] DEBUG: F1=0.000, EM=0.0, Overlap=0.000
[05:16:17] DEBUG: Generated='byzantine empire' vs Expected='seljuk turks'
[05:16:17] DEBUG: Overlap=0, Precision=0.000, Recall=0.000
[05:16:17] DEBUG: F1=0.000, EM=0.0, Overlap=0.000
[05:16:17]   Progress: 30/50 - Recent F1: 0.033
[05:16:18] DEBUG: Generated='during the byzantine war' vs Expected='1050s'
[05:16:18] DEBUG: Overlap=0, Precision=0.000, Recall=0.000
[05:16:18] DEBUG: F1=0.000, EM=0.0, Overlap=0.000
[05:16:18] DEBUG: Generated='2003' vs Expected='1060s'
[05:16:18] DEBUG: Overlap=0, Precision=0.000, Recall=0.000
[05:16:18] DEBUG: F1=0.000, EM=0.0, Overlap=0.000
[05:16:19] DEBUG: Generated='oliver cromwell' vs Expected='alexius komnenos'
[05:16:19] DEBUG: Overlap=0, Precision=0.000, Recall=0.000
[05:16:19] DEBUG: F1=0.000, EM=0.0, Overlap=0.000
[05:16:19] DEBUG: Generated='château paris' vs Expected='afranji'
[05:16:19] DEBUG: Overlap=0, Precision=0.000, Recall=0.000
[05:16:19] DEBUG: F1=0.000, EM=0.0, Overlap=0.000
[05:16:19] DEBUG: Generated='theudebert i' vs Expected='oursel'
[05:16:19] DEBUG: Overlap=0, Precision=0.000, Recall=0.000
[05:16:19] DEBUG: F1=0.000, EM=0.0, Overlap=0.000
[05:16:20] DEBUG: Generated='turkey' vs Expected='turkish forces'
[05:16:20] DEBUG: Overlap=0, Precision=0.000, Recall=0.000
[05:16:20] DEBUG: F1=0.000, EM=0.0, Overlap=0.000
[05:16:20] DEBUG: Generated='answers the question' vs Expected='norman mercenary'
[05:16:20] DEBUG: Overlap=0, Precision=0.000, Recall=0.000
[05:16:20] DEBUG: F1=0.000, EM=0.0, Overlap=0.000
[05:16:21] DEBUG: Generated='tobey' vs Expected='robert guiscard'
[05:16:21] DEBUG: Overlap=0, Precision=0.000, Recall=0.000
[05:16:21] DEBUG: F1=0.000, EM=0.0, Overlap=0.000
[05:16:21] DEBUG: Generated='2011' vs Expected='1082'
[05:16:21] DEBUG: Overlap=0, Precision=0.000, Recall=0.000
[05:16:21] DEBUG: F1=0.000, EM=0.0, Overlap=0.000
[05:16:22] DEBUG: Generated='350,000 and 150,000' vs Expected='30,000'
[05:16:22] DEBUG: Overlap=0, Precision=0.000, Recall=0.000
[05:16:22] DEBUG: F1=0.000, EM=0.0, Overlap=0.000
[05:16:22]   Progress: 40/50 - Recent F1: 0.000
[05:16:22] DEBUG: Generated='constantinople' vs Expected='deabolis'
[05:16:22] DEBUG: Overlap=0, Precision=0.000, Recall=0.000
[05:16:22] DEBUG: F1=0.000, EM=0.0, Overlap=0.000
[05:16:22] DEBUG: Generated='steffon' vs Expected='bohemond'
[05:16:22] DEBUG: Overlap=0, Precision=0.000, Recall=0.000
[05:16:22] DEBUG: F1=0.000, EM=0.0, Overlap=0.000
[05:16:22] DEBUG: Generated='river sita' vs Expected='deabolis'
[05:16:22] DEBUG: Overlap=0, Precision=0.000, Recall=0.000
[05:16:22] DEBUG: F1=0.000, EM=0.0, Overlap=0.000
[05:16:23] DEBUG: Generated='2014' vs Expected='1185'
[05:16:23] DEBUG: Overlap=0, Precision=0.000, Recall=0.000
[05:16:23] DEBUG: F1=0.000, EM=0.0, Overlap=0.000
[05:16:23] DEBUG: Generated='guantanamo bay' vs Expected='dyrrachium'
[05:16:23] DEBUG: Overlap=0, Precision=0.000, Recall=0.000
[05:16:23] DEBUG: F1=0.000, EM=0.0, Overlap=0.000
[05:16:24] DEBUG: Generated='north america' vs Expected='the adriatic'
[05:16:24] DEBUG: Overlap=0, Precision=0.000, Recall=0.000
[05:16:24] DEBUG: F1=0.000, EM=0.0, Overlap=0.000
[05:16:24] DEBUG: Generated='matt willis' vs Expected='king ethelred ii'
[05:16:24] DEBUG: Overlap=0, Precision=0.000, Recall=0.000
[05:16:24] DEBUG: F1=0.000, EM=0.0, Overlap=0.000
[05:16:24] DEBUG: Generated='elliot reeve' vs Expected='duke richard ii'
[05:16:24] DEBUG: Overlap=0, Precision=0.000, Recall=0.000
[05:16:24] DEBUG: F1=0.000, EM=0.0, Overlap=0.000
[05:16:25] DEBUG: Generated='to return to england' vs Expected='normandy'
[05:16:25] DEBUG: Overlap=0, Precision=0.000, Recall=0.000
[05:16:25] DEBUG: F1=0.000, EM=0.0, Overlap=0.000
[05:16:25] DEBUG: Generated='the old man' vs Expected='sweyn forkbeard'
[05:16:25] DEBUG: Overlap=0, Precision=0.000, Recall=0.000
[05:16:25] DEBUG: F1=0.000, EM=0.0, Overlap=0.000
[05:16:25]   Progress: 50/50 - Recent F1: 0.000
[05:16:25]    confident_direct completed: F1=0.138, EM=0.080
[05:16:25] 
 Testing template: structured_response
[05:16:25] DEBUG: Generated='paris' vs Expected='paris'
[05:16:25] DEBUG: Overlap=1, Precision=1.000, Recall=1.000
[05:16:25] DEBUG: F1=1.000, EM=1.0, Overlap=1.000
[05:16:26] DEBUG: Generated='william shakespeare' vs Expected='william shakespeare'
[05:16:26] DEBUG: Overlap=2, Precision=1.000, Recall=1.000
[05:16:26] DEBUG: F1=1.000, EM=1.0, Overlap=1.000
[05:16:26] DEBUG: Generated='the binary interpretation of the numbers' vs Expected='4'
[05:16:26] DEBUG: Overlap=0, Precision=0.000, Recall=0.000
[05:16:26] DEBUG: F1=0.000, EM=0.0, Overlap=0.000
[05:16:26] DEBUG: Generated='what turns you on?' vs Expected='process where plants make food from sunlight'
[05:16:26] DEBUG: Overlap=0, Precision=0.000, Recall=0.000
[05:16:26] DEBUG: F1=0.000, EM=0.0, Overlap=0.000
[05:16:26] DEBUG: Generated='what turns you on?' vs Expected='they process information using electrical circuits'
[05:16:26] DEBUG: Overlap=0, Precision=0.000, Recall=0.000
[05:16:26] DEBUG: F1=0.000, EM=0.0, Overlap=0.000
[05:16:26] DEBUG: Generated='red' vs Expected='red blue green'
[05:16:26] DEBUG: Overlap=1, Precision=1.000, Recall=0.333
[05:16:26] DEBUG: F1=0.500, EM=0.0, Overlap=0.333
[05:16:27] DEBUG: Generated='cat' vs Expected='cat dog'
[05:16:27] DEBUG: Overlap=1, Precision=1.000, Recall=0.500
[05:16:27] DEBUG: F1=0.667, EM=0.0, Overlap=0.500
[05:16:27] DEBUG: Generated='water infinity' vs Expected='essential for life and survival'
[05:16:27] DEBUG: Overlap=0, Precision=0.000, Recall=0.000
[05:16:27] DEBUG: F1=0.000, EM=0.0, Overlap=0.000
[05:16:27] DEBUG: Generated='what turns you on' vs Expected='chlorophyll'
[05:16:27] DEBUG: Overlap=0, Precision=0.000, Recall=0.000
[05:16:27] DEBUG: F1=0.000, EM=0.0, Overlap=0.000
[05:16:27] DEBUG: Generated='the question' vs Expected='yes'
[05:16:27] DEBUG: Overlap=0, Precision=0.000, Recall=0.000
[05:16:27] DEBUG: F1=0.000, EM=0.0, Overlap=0.000
[05:16:27]   Progress: 10/50 - Recent F1: 0.317
[05:16:27] DEBUG: Generated='' vs Expected='yes'
[05:16:27] DEBUG: F1=0.000, EM=0.0, Overlap=0.000
[05:16:28] DEBUG: Generated='blue' vs Expected='red yellow blue'
[05:16:28] DEBUG: Overlap=1, Precision=1.000, Recall=0.333
[05:16:28] DEBUG: F1=0.500, EM=0.0, Overlap=0.333
[05:16:29] DEBUG: Generated='france' vs Expected='france'
[05:16:29] DEBUG: Overlap=1, Precision=1.000, Recall=1.000
[05:16:29] DEBUG: F1=1.000, EM=1.0, Overlap=1.000
[05:16:29] DEBUG: Generated='between the 10th and 13th centuries' vs Expected='10th and 11th centuries'
[05:16:29] DEBUG: Overlap=3, Precision=0.500, Recall=0.750
[05:16:29] DEBUG: F1=0.600, EM=0.0, Overlap=0.750
[05:16:29] DEBUG: Generated='iceland' vs Expected='denmark, iceland and norway'
[05:16:29] DEBUG: Overlap=1, Precision=1.000, Recall=0.250
[05:16:29] DEBUG: F1=0.400, EM=0.0, Overlap=0.250
[05:16:30] DEBUG: Generated='the norse leader' vs Expected='rollo'
[05:16:30] DEBUG: Overlap=0, Precision=0.000, Recall=0.000
[05:16:30] DEBUG: F1=0.000, EM=0.0, Overlap=0.000
[05:16:30] DEBUG: Generated='the european renaissance' vs Expected='10th century'
[05:16:30] DEBUG: Overlap=0, Precision=0.000, Recall=0.000
[05:16:30] DEBUG: F1=0.000, EM=0.0, Overlap=0.000
[05:16:30] DEBUG: Generated='the duke of normandy' vs Expected='william the conqueror'
[05:16:30] DEBUG: Overlap=1, Precision=0.250, Recall=0.333
[05:16:30] DEBUG: F1=0.286, EM=0.0, Overlap=0.333
[05:16:30] DEBUG: Generated='king' vs Expected='richard i'
[05:16:30] DEBUG: Overlap=0, Precision=0.000, Recall=0.000
[05:16:30] DEBUG: F1=0.000, EM=0.0, Overlap=0.000
[05:16:30] DEBUG: Generated='islam' vs Expected='catholic'
[05:16:30] DEBUG: Overlap=0, Precision=0.000, Recall=0.000
[05:16:30] DEBUG: F1=0.000, EM=0.0, Overlap=0.000
[05:16:30]   Progress: 20/50 - Recent F1: 0.279
[05:16:31] DEBUG: Generated='what turns you on?' vs Expected='viking'
[05:16:31] DEBUG: Overlap=0, Precision=0.000, Recall=0.000
[05:16:31] DEBUG: F1=0.000, EM=0.0, Overlap=0.000
[05:16:31] DEBUG: Generated='in 1024' vs Expected='9th century'
[05:16:31] DEBUG: Overlap=0, Precision=0.000, Recall=0.000
[05:16:31] DEBUG: F1=0.000, EM=0.0, Overlap=0.000
[05:16:31] DEBUG: Generated='987' vs Expected='911'
[05:16:31] DEBUG: Overlap=0, Precision=0.000, Recall=0.000
[05:16:31] DEBUG: F1=0.000, EM=0.0, Overlap=0.000
[05:16:32] DEBUG: Generated='the franks' vs Expected='king charles iii'
[05:16:32] DEBUG: Overlap=0, Precision=0.000, Recall=0.000
[05:16:32] DEBUG: F1=0.000, EM=0.0, Overlap=0.000
[05:16:32] DEBUG: Generated='the rio de janeiro' vs Expected='seine'
[05:16:32] DEBUG: Overlap=0, Precision=0.000, Recall=0.000
[05:16:32] DEBUG: F1=0.000, EM=0.0, Overlap=0.000
[05:16:32] DEBUG: Generated='the question' vs Expected='rollo'
[05:16:32] DEBUG: Overlap=0, Precision=0.000, Recall=0.000
[05:16:32] DEBUG: F1=0.000, EM=0.0, Overlap=0.000
[05:16:33] DEBUG: Generated='islam' vs Expected='catholicism'
[05:16:33] DEBUG: Overlap=0, Precision=0.000, Recall=0.000
[05:16:33] DEBUG: F1=0.000, EM=0.0, Overlap=0.000
[05:16:34] DEBUG: Generated='northern france' vs Expected='north'
[05:16:34] DEBUG: Overlap=0, Precision=0.000, Recall=0.000
[05:16:34] DEBUG: F1=0.000, EM=0.0, Overlap=0.000
[05:16:35] DEBUG: Generated='foodstuffs' vs Expected='fighting horsemen'
[05:16:35] DEBUG: Overlap=0, Precision=0.000, Recall=0.000
[05:16:35] DEBUG: F1=0.000, EM=0.0, Overlap=0.000
[05:16:36] DEBUG: Generated='byzantine empire' vs Expected='seljuk turks'
[05:16:36] DEBUG: Overlap=0, Precision=0.000, Recall=0.000
[05:16:36] DEBUG: F1=0.000, EM=0.0, Overlap=0.000
[05:16:36]   Progress: 30/50 - Recent F1: 0.000
[05:16:37] DEBUG: Generated='1984 -- 86' vs Expected='1050s'
[05:16:37] DEBUG: Overlap=0, Precision=0.000, Recall=0.000
[05:16:37] DEBUG: F1=0.000, EM=0.0, Overlap=0.000
[05:16:37] DEBUG: Generated='2017' vs Expected='1060s'
[05:16:37] DEBUG: Overlap=0, Precision=0.000, Recall=0.000
[05:16:37] DEBUG: F1=0.000, EM=0.0, Overlap=0.000
[05:16:38] DEBUG: Generated='his idea of kingship' vs Expected='alexius komnenos'
[05:16:38] DEBUG: Overlap=0, Precision=0.000, Recall=0.000
[05:16:38] DEBUG: F1=0.000, EM=0.0, Overlap=0.000
[05:16:38] DEBUG: Generated='the classic roman republic' vs Expected='afranji'
[05:16:38] DEBUG: Overlap=0, Precision=0.000, Recall=0.000
[05:16:38] DEBUG: F1=0.000, EM=0.0, Overlap=0.000
[05:16:38] DEBUG: Generated='charles martel' vs Expected='oursel'
[05:16:38] DEBUG: Overlap=0, Precision=0.000, Recall=0.000
[05:16:38] DEBUG: F1=0.000, EM=0.0, Overlap=0.000
[05:16:39] DEBUG: Generated='turkey' vs Expected='turkish forces'
[05:16:39] DEBUG: Overlap=0, Precision=0.000, Recall=0.000
[05:16:39] DEBUG: F1=0.000, EM=0.0, Overlap=0.000
[05:16:39] DEBUG: Generated='norman origin' vs Expected='norman mercenary'
[05:16:39] DEBUG: Overlap=1, Precision=0.500, Recall=0.500
[05:16:39] DEBUG: F1=0.500, EM=0.0, Overlap=0.500
[05:16:39] DEBUG: Generated='( last ) frederick iii' vs Expected='robert guiscard'
[05:16:39] DEBUG: Overlap=0, Precision=0.000, Recall=0.000
[05:16:39] DEBUG: F1=0.000, EM=0.0, Overlap=0.000
[05:16:39] DEBUG: Generated='what turns you on?' vs Expected='1082'
[05:16:39] DEBUG: Overlap=0, Precision=0.000, Recall=0.000
[05:16:39] DEBUG: F1=0.000, EM=0.0, Overlap=0.000
[05:16:40] DEBUG: Generated='3,000 infantry and 300 horsemen' vs Expected='30,000'
[05:16:40] DEBUG: Overlap=0, Precision=0.000, Recall=0.000
[05:16:40] DEBUG: F1=0.000, EM=0.0, Overlap=0.000
[05:16:40]   Progress: 40/50 - Recent F1: 0.050
[05:16:40] DEBUG: Generated='constantinople' vs Expected='deabolis'
[05:16:40] DEBUG: Overlap=0, Precision=0.000, Recall=0.000
[05:16:40] DEBUG: F1=0.000, EM=0.0, Overlap=0.000
[05:16:41] DEBUG: Generated='robert's son' vs Expected='bohemond'
[05:16:41] DEBUG: Overlap=0, Precision=0.000, Recall=0.000
[05:16:41] DEBUG: F1=0.000, EM=0.0, Overlap=0.000
[05:16:41] DEBUG: Generated='river sitka' vs Expected='deabolis'
[05:16:41] DEBUG: Overlap=0, Precision=0.000, Recall=0.000
[05:16:41] DEBUG: F1=0.000, EM=0.0, Overlap=0.000
[05:16:42] DEBUG: Generated='the battle of dyrrachium' vs Expected='1185'
[05:16:42] DEBUG: Overlap=0, Precision=0.000, Recall=0.000
[05:16:42] DEBUG: F1=0.000, EM=0.0, Overlap=0.000
[05:16:43] DEBUG: Generated='naval base or fort' vs Expected='dyrrachium'
[05:16:43] DEBUG: Overlap=0, Precision=0.000, Recall=0.000
[05:16:43] DEBUG: F1=0.000, EM=0.0, Overlap=0.000
[05:16:43] DEBUG: Generated='the fundamental question' vs Expected='the adriatic'
[05:16:43] DEBUG: Overlap=1, Precision=0.333, Recall=0.500
[05:16:43] DEBUG: F1=0.400, EM=0.0, Overlap=0.500
[05:16:44] DEBUG: Generated='the question' vs Expected='king ethelred ii'
[05:16:44] DEBUG: Overlap=0, Precision=0.000, Recall=0.000
[05:16:44] DEBUG: F1=0.000, EM=0.0, Overlap=0.000
[05:16:44] DEBUG: Generated='the fundamental question' vs Expected='duke richard ii'
[05:16:44] DEBUG: Overlap=0, Precision=0.000, Recall=0.000
[05:16:44] DEBUG: F1=0.000, EM=0.0, Overlap=0.000
[05:16:45] DEBUG: Generated='the king's question' vs Expected='normandy'
[05:16:45] DEBUG: Overlap=0, Precision=0.000, Recall=0.000
[05:16:45] DEBUG: F1=0.000, EM=0.0, Overlap=0.000
[05:16:45] DEBUG: Generated='ethelred' vs Expected='sweyn forkbeard'
[05:16:45] DEBUG: Overlap=0, Precision=0.000, Recall=0.000
[05:16:45] DEBUG: F1=0.000, EM=0.0, Overlap=0.000
[05:16:45]   Progress: 50/50 - Recent F1: 0.040
[05:16:45]    structured_response completed: F1=0.137, EM=0.060
[05:16:45] 
 Testing template: basic
[05:16:45] DEBUG: Generated='paris' vs Expected='paris'
[05:16:45] DEBUG: Overlap=1, Precision=1.000, Recall=1.000
[05:16:45] DEBUG: F1=1.000, EM=1.0, Overlap=1.000
[05:16:45] DEBUG: Generated='william shakespeare' vs Expected='william shakespeare'
[05:16:45] DEBUG: Overlap=2, Precision=1.000, Recall=1.000
[05:16:45] DEBUG: F1=1.000, EM=1.0, Overlap=1.000
[05:16:46] DEBUG: Generated='factorials n!' vs Expected='4'
[05:16:46] DEBUG: Overlap=0, Precision=0.000, Recall=0.000
[05:16:46] DEBUG: F1=0.000, EM=0.0, Overlap=0.000
[05:16:46] DEBUG: Generated='to convert light energy into chemical energy' vs Expected='process where plants make food from sunlight'
[05:16:46] DEBUG: Overlap=0, Precision=0.000, Recall=0.000
[05:16:46] DEBUG: F1=0.000, EM=0.0, Overlap=0.000
[05:16:46] DEBUG: Generated='numerical interpretation of numbers' vs Expected='they process information using electrical circuits'
[05:16:46] DEBUG: Overlap=0, Precision=0.000, Recall=0.000
[05:16:46] DEBUG: F1=0.000, EM=0.0, Overlap=0.000
[05:16:47] DEBUG: Generated='white' vs Expected='red blue green'
[05:16:47] DEBUG: Overlap=0, Precision=0.000, Recall=0.000
[05:16:47] DEBUG: F1=0.000, EM=0.0, Overlap=0.000
[05:16:47] DEBUG: Generated='amphibians' vs Expected='cat dog'
[05:16:47] DEBUG: Overlap=0, Precision=0.000, Recall=0.000
[05:16:47] DEBUG: F1=0.000, EM=0.0, Overlap=0.000
[05:16:47] DEBUG: Generated='all living things require water' vs Expected='essential for life and survival'
[05:16:47] DEBUG: Overlap=0, Precision=0.000, Recall=0.000
[05:16:47] DEBUG: F1=0.000, EM=0.0, Overlap=0.000
[05:16:48] DEBUG: Generated='chlorophyll' vs Expected='chlorophyll'
[05:16:48] DEBUG: Overlap=1, Precision=1.000, Recall=1.000
[05:16:48] DEBUG: F1=1.000, EM=1.0, Overlap=1.000
[05:16:49] DEBUG: Generated='ellipse' vs Expected='yes'
[05:16:49] DEBUG: Overlap=0, Precision=0.000, Recall=0.000
[05:16:49] DEBUG: F1=0.000, EM=0.0, Overlap=0.000
[05:16:49]   Progress: 10/50 - Recent F1: 0.300
[05:16:50] DEBUG: Generated='bird flight' vs Expected='yes'
[05:16:50] DEBUG: Overlap=0, Precision=0.000, Recall=0.000
[05:16:50] DEBUG: F1=0.000, EM=0.0, Overlap=0.000
[05:16:51] DEBUG: Generated='blue' vs Expected='red yellow blue'
[05:16:51] DEBUG: Overlap=1, Precision=1.000, Recall=0.333
[05:16:51] DEBUG: F1=0.500, EM=0.0, Overlap=0.333
[05:16:51] DEBUG: Generated='france' vs Expected='france'
[05:16:51] DEBUG: Overlap=1, Precision=1.000, Recall=1.000
[05:16:51] DEBUG: F1=1.000, EM=1.0, Overlap=1.000
[05:16:52] DEBUG: Generated='9th century -- 9th century' vs Expected='10th and 11th centuries'
[05:16:52] DEBUG: Overlap=0, Precision=0.000, Recall=0.000
[05:16:52] DEBUG: F1=0.000, EM=0.0, Overlap=0.000
[05:16:52] DEBUG: Generated='sweden' vs Expected='denmark, iceland and norway'
[05:16:52] DEBUG: Overlap=0, Precision=0.000, Recall=0.000
[05:16:52] DEBUG: F1=0.000, EM=0.0, Overlap=0.000
[05:16:53] DEBUG: Generated='cnut' vs Expected='rollo'
[05:16:53] DEBUG: Overlap=0, Precision=0.000, Recall=0.000
[05:16:53] DEBUG: F1=0.000, EM=0.0, Overlap=0.000
[05:16:53] DEBUG: Generated='the ninth century' vs Expected='10th century'
[05:16:53] DEBUG: Overlap=1, Precision=0.333, Recall=0.500
[05:16:53] DEBUG: F1=0.400, EM=0.0, Overlap=0.500
[05:16:53] DEBUG: Generated='william' vs Expected='william the conqueror'
[05:16:53] DEBUG: Overlap=1, Precision=1.000, Recall=0.333
[05:16:53] DEBUG: F1=0.500, EM=0.0, Overlap=0.333
[05:16:54] DEBUG: Generated='king charles iii of west francia' vs Expected='richard i'
[05:16:54] DEBUG: Overlap=0, Precision=0.000, Recall=0.000
[05:16:54] DEBUG: F1=0.000, EM=0.0, Overlap=0.000
[05:16:54] DEBUG: Generated='catholicism' vs Expected='catholic'
[05:16:54] DEBUG: Overlap=0, Precision=0.000, Recall=0.000
[05:16:54] DEBUG: F1=0.000, EM=0.0, Overlap=0.000
[05:16:54]   Progress: 20/50 - Recent F1: 0.240
[05:16:54] DEBUG: Generated='north' vs Expected='viking'
[05:16:54] DEBUG: Overlap=0, Precision=0.000, Recall=0.000
[05:16:54] DEBUG: F1=0.000, EM=0.0, Overlap=0.000
[05:16:54] DEBUG: Generated='1024' vs Expected='9th century'
[05:16:54] DEBUG: Overlap=0, Precision=0.000, Recall=0.000
[05:16:54] DEBUG: F1=0.000, EM=0.0, Overlap=0.000
[05:16:55] DEBUG: Generated='1066' vs Expected='911'
[05:16:55] DEBUG: Overlap=0, Precision=0.000, Recall=0.000
[05:16:55] DEBUG: F1=0.000, EM=0.0, Overlap=0.000
[05:16:55] DEBUG: Generated='charles the simple' vs Expected='king charles iii'
[05:16:55] DEBUG: Overlap=1, Precision=0.333, Recall=0.333
[05:16:55] DEBUG: F1=0.333, EM=0.0, Overlap=0.333
[05:16:55] DEBUG: Generated='elbe' vs Expected='seine'
[05:16:55] DEBUG: Overlap=0, Precision=0.000, Recall=0.000
[05:16:55] DEBUG: F1=0.000, EM=0.0, Overlap=0.000
[05:16:56] DEBUG: Generated='the byzantines' vs Expected='rollo'
[05:16:56] DEBUG: Overlap=0, Precision=0.000, Recall=0.000
[05:16:56] DEBUG: F1=0.000, EM=0.0, Overlap=0.000
[05:16:56] DEBUG: Generated='catholicism' vs Expected='catholicism'
[05:16:56] DEBUG: Overlap=1, Precision=1.000, Recall=1.000
[05:16:56] DEBUG: F1=1.000, EM=1.0, Overlap=1.000
[05:16:56] DEBUG: Generated='west france' vs Expected='north'
[05:16:56] DEBUG: Overlap=0, Precision=0.000, Recall=0.000
[05:16:56] DEBUG: F1=0.000, EM=0.0, Overlap=0.000
[05:16:57] DEBUG: Generated='cloth' vs Expected='fighting horsemen'
[05:16:57] DEBUG: Overlap=0, Precision=0.000, Recall=0.000
[05:16:57] DEBUG: F1=0.000, EM=0.0, Overlap=0.000
[05:16:57] DEBUG: Generated='hohenstaufen' vs Expected='seljuk turks'
[05:16:57] DEBUG: Overlap=0, Precision=0.000, Recall=0.000
[05:16:57] DEBUG: F1=0.000, EM=0.0, Overlap=0.000
[05:16:57]   Progress: 30/50 - Recent F1: 0.133
[05:16:58] DEBUG: Generated='1984 -- 86' vs Expected='1050s'
[05:16:58] DEBUG: Overlap=0, Precision=0.000, Recall=0.000
[05:16:58] DEBUG: F1=0.000, EM=0.0, Overlap=0.000
[05:16:59] DEBUG: Generated='862' vs Expected='1060s'
[05:16:59] DEBUG: Overlap=0, Precision=0.000, Recall=0.000
[05:16:59] DEBUG: F1=0.000, EM=0.0, Overlap=0.000
[05:16:59] DEBUG: Generated='henshaw' vs Expected='alexius komnenos'
[05:16:59] DEBUG: Overlap=0, Precision=0.000, Recall=0.000
[05:16:59] DEBUG: F1=0.000, EM=0.0, Overlap=0.000
[05:17:00] DEBUG: Generated='neath castle' vs Expected='afranji'
[05:17:00] DEBUG: Overlap=0, Precision=0.000, Recall=0.000
[05:17:00] DEBUG: F1=0.000, EM=0.0, Overlap=0.000
[05:17:00] DEBUG: Generated='theudebert i' vs Expected='oursel'
[05:17:00] DEBUG: Overlap=0, Precision=0.000, Recall=0.000
[05:17:00] DEBUG: F1=0.000, EM=0.0, Overlap=0.000
[05:17:01] DEBUG: Generated='turkey' vs Expected='turkish forces'
[05:17:01] DEBUG: Overlap=0, Precision=0.000, Recall=0.000
[05:17:01] DEBUG: F1=0.000, EM=0.0, Overlap=0.000
[05:17:01] DEBUG: Generated='english' vs Expected='norman mercenary'
[05:17:01] DEBUG: Overlap=0, Precision=0.000, Recall=0.000
[05:17:01] DEBUG: F1=0.000, EM=0.0, Overlap=0.000
[05:17:02] DEBUG: Generated='( last ) frederick iii' vs Expected='robert guiscard'
[05:17:02] DEBUG: Overlap=0, Precision=0.000, Recall=0.000
[05:17:02] DEBUG: F1=0.000, EM=0.0, Overlap=0.000
[05:17:02] DEBUG: Generated='10th century' vs Expected='1082'
[05:17:02] DEBUG: Overlap=0, Precision=0.000, Recall=0.000
[05:17:02] DEBUG: F1=0.000, EM=0.0, Overlap=0.000
[05:17:03] DEBUG: Generated='1,000,000' vs Expected='30,000'
[05:17:03] DEBUG: Overlap=0, Precision=0.000, Recall=0.000
[05:17:03] DEBUG: F1=0.000, EM=0.0, Overlap=0.000
[05:17:03]   Progress: 40/50 - Recent F1: 0.000
[05:17:03] DEBUG: Generated='constantinople' vs Expected='deabolis'
[05:17:03] DEBUG: Overlap=0, Precision=0.000, Recall=0.000
[05:17:03] DEBUG: F1=0.000, EM=0.0, Overlap=0.000
[05:17:04] DEBUG: Generated='steffon' vs Expected='bohemond'
[05:17:04] DEBUG: Overlap=0, Precision=0.000, Recall=0.000
[05:17:04] DEBUG: F1=0.000, EM=0.0, Overlap=0.000
[05:17:04] DEBUG: Generated='river irwell' vs Expected='deabolis'
[05:17:04] DEBUG: Overlap=0, Precision=0.000, Recall=0.000
[05:17:04] DEBUG: F1=0.000, EM=0.0, Overlap=0.000
[05:17:05] DEBUG: Generated='october 1174' vs Expected='1185'
[05:17:05] DEBUG: Overlap=0, Precision=0.000, Recall=0.000
[05:17:05] DEBUG: F1=0.000, EM=0.0, Overlap=0.000
[05:17:05] DEBUG: Generated='guantanamo bay naval base' vs Expected='dyrrachium'
[05:17:05] DEBUG: Overlap=0, Precision=0.000, Recall=0.000
[05:17:05] DEBUG: F1=0.000, EM=0.0, Overlap=0.000
[05:17:06] DEBUG: Generated='canada' vs Expected='the adriatic'
[05:17:06] DEBUG: Overlap=0, Precision=0.000, Recall=0.000
[05:17:06] DEBUG: F1=0.000, EM=0.0, Overlap=0.000
[05:17:07] DEBUG: Generated='will arnett' vs Expected='king ethelred ii'
[05:17:07] DEBUG: Overlap=0, Precision=0.000, Recall=0.000
[05:17:07] DEBUG: F1=0.000, EM=0.0, Overlap=0.000
[05:17:08] DEBUG: Generated='bradley spencer' vs Expected='duke richard ii'
[05:17:08] DEBUG: Overlap=0, Precision=0.000, Recall=0.000
[05:17:08] DEBUG: F1=0.000, EM=0.0, Overlap=0.000
[05:17:08] DEBUG: Generated='fled to be with ethelred' vs Expected='normandy'
[05:17:08] DEBUG: Overlap=0, Precision=0.000, Recall=0.000
[05:17:08] DEBUG: F1=0.000, EM=0.0, Overlap=0.000
[05:17:09] DEBUG: Generated='howard' vs Expected='sweyn forkbeard'
[05:17:09] DEBUG: Overlap=0, Precision=0.000, Recall=0.000
[05:17:09] DEBUG: F1=0.000, EM=0.0, Overlap=0.000
[05:17:09]   Progress: 50/50 - Recent F1: 0.000
[05:17:09]    basic completed: F1=0.135, EM=0.100
[05:17:09] 
 Experiment completed! Total results: 350
[05:17:09] 
 ANALYZING RESULTS...
[05:17:09] 
 TEMPLATE PERFORMANCE RANKING:
[05:17:09] --------------------------------------------------------------------------------
[05:17:09] Template             F1 Score   EM Score   Samples  Improvement 
[05:17:09] --------------------------------------------------------------------------------
[05:17:09] retrieval_focused    0.139     0.080     50       ++3.5%      
[05:17:09] confident_direct     0.138     0.080     50       ++2.2%      
[05:17:09] structured_response  0.137     0.060     50       ++1.8%      
[05:17:09] basic                0.135     0.100     50       BASELINE    
[05:17:09] instructional_clear  0.132     0.060     50       +-1.7%      
[05:17:09] context_guided       0.109     0.040     50       +-18.8%     
[05:17:09] knowledge_synthesis  0.084     0.040     50       +-37.4%     
[05:17:09] 
 SUCCESS ANALYSIS:
[05:17:09]    Best Template: retrieval_focused (F1: 0.139)
[05:17:09]    SUCCESS! Basic template relegated to rank 4
[05:17:09]    Template engineering shows measurable impact!
[05:17:09] 
 SAMPLE RESULTS:
[05:17:09] ======================================================================
[05:17:09] 
 Template: retrieval_focused (Rank 1)
[05:17:09]    Q: What is the capital of France?...
[05:17:09]    Expected: Paris
[05:17:09]    Generated: paris
[05:17:09]    Score: F1=1.000
[05:17:09]    Q: Who wrote Romeo and Juliet?...
[05:17:09]    Expected: William Shakespeare
[05:17:09]    Generated: william shakespeare
[05:17:09]    Score: F1=1.000
[05:17:09] 
 Template: confident_direct (Rank 2)
[05:17:09]    Q: What is the capital of France?...
[05:17:09]    Expected: Paris
[05:17:09]    Generated: paris
[05:17:09]    Score: F1=1.000
[05:17:09]    Q: Who wrote Romeo and Juliet?...
[05:17:09]    Expected: William Shakespeare
[05:17:09]    Generated: william shakespeare
[05:17:09]    Score: F1=1.000
[05:17:09] 
 Template: structured_response (Rank 3)
[05:17:09]    Q: What is the capital of France?...
[05:17:09]    Expected: Paris
[05:17:09]    Generated: paris
[05:17:09]    Score: F1=1.000
[05:17:09]    Q: Who wrote Romeo and Juliet?...
[05:17:09]    Expected: William Shakespeare
[05:17:09]    Generated: william shakespeare
[05:17:09]    Score: F1=1.000
