[05:17:41]  Setting up GPU configuration...
[05:17:41]  Using device: cuda:1
[05:17:41]  Loading RAG models...
[05:23:10]  RAG system ready!
[05:23:10]  Loading targeted evaluation dataset...
[05:23:10] Loading 150 questions to get 50 with answers
[05:23:14]  Dataset loaded: 50 questions
[05:23:14]    - SQuAD questions: 69
[05:23:14]  Starting targeted RAG experiment...
[05:23:14]  Testing 7 templates on 50 questions
[05:23:14] 
 Testing template: retrieval_focused
[05:23:15] DEBUG: Generated='paris' vs Expected='paris'
[05:23:15] DEBUG: Overlap=1, Precision=1.000, Recall=1.000
[05:23:15] DEBUG: F1=1.000, EM=1.0, Overlap=1.000
[05:23:16] DEBUG: Generated='william shakespeare' vs Expected='william shakespeare'
[05:23:16] DEBUG: Overlap=2, Precision=1.000, Recall=1.000
[05:23:16] DEBUG: F1=1.000, EM=1.0, Overlap=1.000
[05:23:16] DEBUG: Generated='factorials n!' vs Expected='4'
[05:23:16] DEBUG: Overlap=0, Precision=0.000, Recall=0.000
[05:23:16] DEBUG: F1=0.000, EM=0.0, Overlap=0.000
[05:23:16] DEBUG: Generated='' vs Expected='process where plants make food from sunlight'
[05:23:16] DEBUG: F1=0.000, EM=0.0, Overlap=0.000
[05:23:17] DEBUG: Generated='what turns you on?' vs Expected='they process information using electrical circuits'
[05:23:17] DEBUG: Overlap=0, Precision=0.000, Recall=0.000
[05:23:17] DEBUG: F1=0.000, EM=0.0, Overlap=0.000
[05:23:17] DEBUG: Generated='red' vs Expected='red blue green'
[05:23:17] DEBUG: Overlap=1, Precision=1.000, Recall=0.333
[05:23:17] DEBUG: F1=0.500, EM=0.0, Overlap=0.333
[05:23:18] DEBUG: Generated='cat' vs Expected='cat dog'
[05:23:18] DEBUG: Overlap=1, Precision=1.000, Recall=0.500
[05:23:18] DEBUG: F1=0.667, EM=0.0, Overlap=0.500
[05:23:18] DEBUG: Generated='health' vs Expected='essential for life and survival'
[05:23:18] DEBUG: Overlap=0, Precision=0.000, Recall=0.000
[05:23:18] DEBUG: F1=0.000, EM=0.0, Overlap=0.000
[05:23:19] DEBUG: Generated='chlorophyll' vs Expected='chlorophyll'
[05:23:19] DEBUG: Overlap=1, Precision=1.000, Recall=1.000
[05:23:19] DEBUG: F1=1.000, EM=1.0, Overlap=1.000
[05:23:20] DEBUG: Generated='factorials n!' vs Expected='yes'
[05:23:20] DEBUG: Overlap=0, Precision=0.000, Recall=0.000
[05:23:20] DEBUG: F1=0.000, EM=0.0, Overlap=0.000
[05:23:20]   Progress: 10/50 - Recent F1: 0.417
[05:23:21] DEBUG: Generated='' vs Expected='yes'
[05:23:21] DEBUG: F1=0.000, EM=0.0, Overlap=0.000
[05:23:21] DEBUG: Generated='blue' vs Expected='red yellow blue'
[05:23:21] DEBUG: Overlap=1, Precision=1.000, Recall=0.333
[05:23:21] DEBUG: F1=0.500, EM=0.0, Overlap=0.333
[05:23:22] DEBUG: Generated='france' vs Expected='france'
[05:23:22] DEBUG: Overlap=1, Precision=1.000, Recall=1.000
[05:23:22] DEBUG: F1=1.000, EM=1.0, Overlap=1.000
[05:23:22] DEBUG: Generated='9th century -- 9th century' vs Expected='10th and 11th centuries'
[05:23:22] DEBUG: Overlap=0, Precision=0.000, Recall=0.000
[05:23:22] DEBUG: F1=0.000, EM=0.0, Overlap=0.000
[05:23:23] DEBUG: Generated='iceland' vs Expected='denmark, iceland and norway'
[05:23:23] DEBUG: Overlap=1, Precision=1.000, Recall=0.250
[05:23:23] DEBUG: F1=0.400, EM=0.0, Overlap=0.250
[05:23:23] DEBUG: Generated='bjorn ulvaeus' vs Expected='rollo'
[05:23:23] DEBUG: Overlap=0, Precision=0.000, Recall=0.000
[05:23:23] DEBUG: F1=0.000, EM=0.0, Overlap=0.000
[05:23:24] DEBUG: Generated='the ninth century' vs Expected='10th century'
[05:23:24] DEBUG: Overlap=1, Precision=0.333, Recall=0.500
[05:23:24] DEBUG: F1=0.400, EM=0.0, Overlap=0.500
[05:23:24] DEBUG: Generated='william' vs Expected='william the conqueror'
[05:23:24] DEBUG: Overlap=1, Precision=1.000, Recall=0.333
[05:23:24] DEBUG: F1=0.500, EM=0.0, Overlap=0.333
[05:23:25] DEBUG: Generated='king charles iii' vs Expected='richard i'
[05:23:25] DEBUG: Overlap=0, Precision=0.000, Recall=0.000
[05:23:25] DEBUG: F1=0.000, EM=0.0, Overlap=0.000
[05:23:25] DEBUG: Generated='catholicism' vs Expected='catholic'
[05:23:25] DEBUG: Overlap=0, Precision=0.000, Recall=0.000
[05:23:25] DEBUG: F1=0.000, EM=0.0, Overlap=0.000
[05:23:25]   Progress: 20/50 - Recent F1: 0.280
[05:23:26] DEBUG: Generated='north' vs Expected='viking'
[05:23:26] DEBUG: Overlap=0, Precision=0.000, Recall=0.000
[05:23:26] DEBUG: F1=0.000, EM=0.0, Overlap=0.000
[05:23:26] DEBUG: Generated='in 1024' vs Expected='9th century'
[05:23:26] DEBUG: Overlap=0, Precision=0.000, Recall=0.000
[05:23:26] DEBUG: F1=0.000, EM=0.0, Overlap=0.000
[05:23:26] DEBUG: Generated='1066' vs Expected='911'
[05:23:26] DEBUG: Overlap=0, Precision=0.000, Recall=0.000
[05:23:26] DEBUG: F1=0.000, EM=0.0, Overlap=0.000
[05:23:27] DEBUG: Generated='the franks' vs Expected='king charles iii'
[05:23:27] DEBUG: Overlap=0, Precision=0.000, Recall=0.000
[05:23:27] DEBUG: F1=0.000, EM=0.0, Overlap=0.000
[05:23:27] DEBUG: Generated='tennessee river' vs Expected='seine'
[05:23:27] DEBUG: Overlap=0, Precision=0.000, Recall=0.000
[05:23:27] DEBUG: F1=0.000, EM=0.0, Overlap=0.000
[05:23:27] DEBUG: Generated='the inuit' vs Expected='rollo'
[05:23:27] DEBUG: Overlap=0, Precision=0.000, Recall=0.000
[05:23:27] DEBUG: F1=0.000, EM=0.0, Overlap=0.000
[05:23:27] DEBUG: Generated='islam' vs Expected='catholicism'
[05:23:27] DEBUG: Overlap=0, Precision=0.000, Recall=0.000
[05:23:27] DEBUG: F1=0.000, EM=0.0, Overlap=0.000
[05:23:28] DEBUG: Generated='normandy' vs Expected='north'
[05:23:28] DEBUG: Overlap=0, Precision=0.000, Recall=0.000
[05:23:28] DEBUG: F1=0.000, EM=0.0, Overlap=0.000
[05:23:28] DEBUG: Generated='foodstuffs' vs Expected='fighting horsemen'
[05:23:28] DEBUG: Overlap=0, Precision=0.000, Recall=0.000
[05:23:28] DEBUG: F1=0.000, EM=0.0, Overlap=0.000
[05:23:28] DEBUG: Generated='byzantine empire' vs Expected='seljuk turks'
[05:23:28] DEBUG: Overlap=0, Precision=0.000, Recall=0.000
[05:23:28] DEBUG: F1=0.000, EM=0.0, Overlap=0.000
[05:23:28]   Progress: 30/50 - Recent F1: 0.000
[05:23:29] DEBUG: Generated='1984 -- 86' vs Expected='1050s'
[05:23:29] DEBUG: Overlap=0, Precision=0.000, Recall=0.000
[05:23:29] DEBUG: F1=0.000, EM=0.0, Overlap=0.000
[05:23:30] DEBUG: Generated='1984' vs Expected='1060s'
[05:23:30] DEBUG: Overlap=0, Precision=0.000, Recall=0.000
[05:23:30] DEBUG: F1=0.000, EM=0.0, Overlap=0.000
[05:23:31] DEBUG: Generated='factorials' vs Expected='alexius komnenos'
[05:23:31] DEBUG: Overlap=0, Precision=0.000, Recall=0.000
[05:23:31] DEBUG: F1=0.000, EM=0.0, Overlap=0.000
[05:23:32] DEBUG: Generated='the château de caen' vs Expected='afranji'
[05:23:32] DEBUG: Overlap=0, Precision=0.000, Recall=0.000
[05:23:32] DEBUG: F1=0.000, EM=0.0, Overlap=0.000
[05:23:32] DEBUG: Generated='' vs Expected='oursel'
[05:23:32] DEBUG: F1=0.000, EM=0.0, Overlap=0.000
[05:23:33] DEBUG: Generated='turkey' vs Expected='turkish forces'
[05:23:33] DEBUG: Overlap=0, Precision=0.000, Recall=0.000
[05:23:33] DEBUG: F1=0.000, EM=0.0, Overlap=0.000
[05:23:34] DEBUG: Generated='byzantine origin' vs Expected='norman mercenary'
[05:23:34] DEBUG: Overlap=0, Precision=0.000, Recall=0.000
[05:23:34] DEBUG: F1=0.000, EM=0.0, Overlap=0.000
[05:23:34] DEBUG: Generated='( last ) frederick iii' vs Expected='robert guiscard'
[05:23:34] DEBUG: Overlap=0, Precision=0.000, Recall=0.000
[05:23:34] DEBUG: F1=0.000, EM=0.0, Overlap=0.000
[05:23:35] DEBUG: Generated='true' vs Expected='1082'
[05:23:35] DEBUG: Overlap=0, Precision=0.000, Recall=0.000
[05:23:35] DEBUG: F1=0.000, EM=0.0, Overlap=0.000
[05:23:35] DEBUG: Generated='about 100,000 and 150,000' vs Expected='30,000'
[05:23:35] DEBUG: Overlap=0, Precision=0.000, Recall=0.000
[05:23:35] DEBUG: F1=0.000, EM=0.0, Overlap=0.000
[05:23:35]   Progress: 40/50 - Recent F1: 0.000
[05:23:36] DEBUG: Generated='constantinople' vs Expected='deabolis'
[05:23:36] DEBUG: Overlap=0, Precision=0.000, Recall=0.000
[05:23:36] DEBUG: F1=0.000, EM=0.0, Overlap=0.000
[05:23:37] DEBUG: Generated='robert's son' vs Expected='bohemond'
[05:23:37] DEBUG: Overlap=0, Precision=0.000, Recall=0.000
[05:23:37] DEBUG: F1=0.000, EM=0.0, Overlap=0.000
[05:23:37] DEBUG: Generated='river sita' vs Expected='deabolis'
[05:23:37] DEBUG: Overlap=0, Precision=0.000, Recall=0.000
[05:23:37] DEBUG: F1=0.000, EM=0.0, Overlap=0.000
[05:23:37] DEBUG: Generated='2003' vs Expected='1185'
[05:23:37] DEBUG: Overlap=0, Precision=0.000, Recall=0.000
[05:23:37] DEBUG: F1=0.000, EM=0.0, Overlap=0.000
[05:23:38] DEBUG: Generated='naval station guantanamo bay' vs Expected='dyrrachium'
[05:23:38] DEBUG: Overlap=0, Precision=0.000, Recall=0.000
[05:23:38] DEBUG: F1=0.000, EM=0.0, Overlap=0.000
[05:23:38] DEBUG: Generated='north - western asia' vs Expected='the adriatic'
[05:23:38] DEBUG: Overlap=0, Precision=0.000, Recall=0.000
[05:23:38] DEBUG: F1=0.000, EM=0.0, Overlap=0.000
[05:23:39] DEBUG: Generated='matt willis' vs Expected='king ethelred ii'
[05:23:39] DEBUG: Overlap=0, Precision=0.000, Recall=0.000
[05:23:39] DEBUG: F1=0.000, EM=0.0, Overlap=0.000
[05:23:39] DEBUG: Generated='bryce gheisar' vs Expected='duke richard ii'
[05:23:39] DEBUG: Overlap=0, Precision=0.000, Recall=0.000
[05:23:39] DEBUG: F1=0.000, EM=0.0, Overlap=0.000
[05:23:40] DEBUG: Generated='britain' vs Expected='normandy'
[05:23:40] DEBUG: Overlap=0, Precision=0.000, Recall=0.000
[05:23:40] DEBUG: F1=0.000, EM=0.0, Overlap=0.000
[05:23:40] DEBUG: Generated='the undertaker' vs Expected='sweyn forkbeard'
[05:23:40] DEBUG: Overlap=0, Precision=0.000, Recall=0.000
[05:23:40] DEBUG: F1=0.000, EM=0.0, Overlap=0.000
[05:23:40]   Progress: 50/50 - Recent F1: 0.000
[05:23:40]    retrieval_focused completed: F1=0.139, EM=0.080
[05:23:40] 
 Testing template: knowledge_synthesis
[05:23:41] DEBUG: Generated='paris' vs Expected='paris'
[05:23:41] DEBUG: Overlap=1, Precision=1.000, Recall=1.000
[05:23:41] DEBUG: F1=1.000, EM=1.0, Overlap=1.000
[05:23:41] DEBUG: Generated='who?' vs Expected='william shakespeare'
[05:23:41] DEBUG: Overlap=0, Precision=0.000, Recall=0.000
[05:23:41] DEBUG: F1=0.000, EM=0.0, Overlap=0.000
[05:23:42] DEBUG: Generated='factorials n!' vs Expected='4'
[05:23:42] DEBUG: Overlap=0, Precision=0.000, Recall=0.000
[05:23:42] DEBUG: F1=0.000, EM=0.0, Overlap=0.000
[05:23:43] DEBUG: Generated='plants, algae and cyanobacteria' vs Expected='process where plants make food from sunlight'
[05:23:43] DEBUG: Overlap=0, Precision=0.000, Recall=0.000
[05:23:43] DEBUG: F1=0.000, EM=0.0, Overlap=0.000
[05:23:44] DEBUG: Generated='problem / problem / solution' vs Expected='they process information using electrical circuits'
[05:23:44] DEBUG: Overlap=0, Precision=0.000, Recall=0.000
[05:23:44] DEBUG: F1=0.000, EM=0.0, Overlap=0.000
[05:23:44] DEBUG: Generated='' vs Expected='red blue green'
[05:23:44] DEBUG: F1=0.000, EM=0.0, Overlap=0.000
[05:23:45] DEBUG: Generated='cat' vs Expected='cat dog'
[05:23:45] DEBUG: Overlap=1, Precision=1.000, Recall=0.500
[05:23:45] DEBUG: F1=0.667, EM=0.0, Overlap=0.500
[05:23:45] DEBUG: Generated='data visuali zation' vs Expected='essential for life and survival'
[05:23:45] DEBUG: Overlap=0, Precision=0.000, Recall=0.000
[05:23:45] DEBUG: F1=0.000, EM=0.0, Overlap=0.000
[05:23:46] DEBUG: Generated='what makes plants green' vs Expected='chlorophyll'
[05:23:46] DEBUG: Overlap=0, Precision=0.000, Recall=0.000
[05:23:46] DEBUG: F1=0.000, EM=0.0, Overlap=0.000
[05:23:46] DEBUG: Generated='what turns you on?' vs Expected='yes'
[05:23:46] DEBUG: Overlap=0, Precision=0.000, Recall=0.000
[05:23:46] DEBUG: F1=0.000, EM=0.0, Overlap=0.000
[05:23:46]   Progress: 10/50 - Recent F1: 0.167
[05:23:47] DEBUG: Generated='do you like sex?' vs Expected='yes'
[05:23:47] DEBUG: Overlap=0, Precision=0.000, Recall=0.000
[05:23:47] DEBUG: F1=0.000, EM=0.0, Overlap=0.000
[05:23:47] DEBUG: Generated='blue' vs Expected='red yellow blue'
[05:23:47] DEBUG: Overlap=1, Precision=1.000, Recall=0.333
[05:23:47] DEBUG: F1=0.500, EM=0.0, Overlap=0.333
[05:23:48] DEBUG: Generated='france' vs Expected='france'
[05:23:48] DEBUG: Overlap=1, Precision=1.000, Recall=1.000
[05:23:48] DEBUG: F1=1.000, EM=1.0, Overlap=1.000
[05:23:48] DEBUG: Generated='10th century -- 15th century' vs Expected='10th and 11th centuries'
[05:23:48] DEBUG: Overlap=1, Precision=0.250, Recall=0.250
[05:23:48] DEBUG: F1=0.250, EM=0.0, Overlap=0.250
[05:23:48] DEBUG: Generated='scandinavia' vs Expected='denmark, iceland and norway'
[05:23:48] DEBUG: Overlap=0, Precision=0.000, Recall=0.000
[05:23:48] DEBUG: F1=0.000, EM=0.0, Overlap=0.000
[05:23:49] DEBUG: Generated='who was the norse leader' vs Expected='rollo'
[05:23:49] DEBUG: Overlap=0, Precision=0.000, Recall=0.000
[05:23:49] DEBUG: F1=0.000, EM=0.0, Overlap=0.000
[05:23:49] DEBUG: Generated='the ninth century' vs Expected='10th century'
[05:23:49] DEBUG: Overlap=1, Precision=0.333, Recall=0.500
[05:23:49] DEBUG: F1=0.400, EM=0.0, Overlap=0.500
[05:23:49] DEBUG: Generated='normandy duke of normandy' vs Expected='william the conqueror'
[05:23:49] DEBUG: Overlap=0, Precision=0.000, Recall=0.000
[05:23:49] DEBUG: F1=0.000, EM=0.0, Overlap=0.000
[05:23:50] DEBUG: Generated='king charles iii' vs Expected='richard i'
[05:23:50] DEBUG: Overlap=0, Precision=0.000, Recall=0.000
[05:23:50] DEBUG: F1=0.000, EM=0.0, Overlap=0.000
[05:23:50] DEBUG: Generated='catholicism' vs Expected='catholic'
[05:23:50] DEBUG: Overlap=0, Precision=0.000, Recall=0.000
[05:23:50] DEBUG: F1=0.000, EM=0.0, Overlap=0.000
[05:23:50]   Progress: 20/50 - Recent F1: 0.215
[05:23:51] DEBUG: Generated='data visuali zation' vs Expected='viking'
[05:23:51] DEBUG: Overlap=0, Precision=0.000, Recall=0.000
[05:23:51] DEBUG: F1=0.000, EM=0.0, Overlap=0.000
[05:23:51] DEBUG: Generated='in 1024' vs Expected='9th century'
[05:23:51] DEBUG: Overlap=0, Precision=0.000, Recall=0.000
[05:23:51] DEBUG: F1=0.000, EM=0.0, Overlap=0.000
[05:23:52] DEBUG: Generated='1066' vs Expected='911'
[05:23:52] DEBUG: Overlap=0, Precision=0.000, Recall=0.000
[05:23:52] DEBUG: F1=0.000, EM=0.0, Overlap=0.000
[05:23:53] DEBUG: Generated='patrick alexander russell' vs Expected='king charles iii'
[05:23:53] DEBUG: Overlap=0, Precision=0.000, Recall=0.000
[05:23:53] DEBUG: F1=0.000, EM=0.0, Overlap=0.000
[05:23:54] DEBUG: Generated='tennessee river' vs Expected='seine'
[05:23:54] DEBUG: Overlap=0, Precision=0.000, Recall=0.000
[05:23:54] DEBUG: F1=0.000, EM=0.0, Overlap=0.000
[05:23:55] DEBUG: Generated='the normans' vs Expected='rollo'
[05:23:55] DEBUG: Overlap=0, Precision=0.000, Recall=0.000
[05:23:55] DEBUG: F1=0.000, EM=0.0, Overlap=0.000
[05:23:55] DEBUG: Generated='islam' vs Expected='catholicism'
[05:23:55] DEBUG: Overlap=0, Precision=0.000, Recall=0.000
[05:23:55] DEBUG: F1=0.000, EM=0.0, Overlap=0.000
[05:23:56] DEBUG: Generated='normandy' vs Expected='north'
[05:23:56] DEBUG: Overlap=0, Precision=0.000, Recall=0.000
[05:23:56] DEBUG: F1=0.000, EM=0.0, Overlap=0.000
[05:23:56] DEBUG: Generated='266,827' vs Expected='fighting horsemen'
[05:23:56] DEBUG: Overlap=0, Precision=0.000, Recall=0.000
[05:23:56] DEBUG: F1=0.000, EM=0.0, Overlap=0.000
[05:23:57] DEBUG: Generated='byzantine empire' vs Expected='seljuk turks'
[05:23:57] DEBUG: Overlap=0, Precision=0.000, Recall=0.000
[05:23:57] DEBUG: F1=0.000, EM=0.0, Overlap=0.000
[05:23:57]   Progress: 30/50 - Recent F1: 0.000
[05:23:57] DEBUG: Generated='1984 -- 86' vs Expected='1050s'
[05:23:57] DEBUG: Overlap=0, Precision=0.000, Recall=0.000
[05:23:57] DEBUG: F1=0.000, EM=0.0, Overlap=0.000
[05:23:58] DEBUG: Generated='robert crispin's diary' vs Expected='1060s'
[05:23:58] DEBUG: Overlap=0, Precision=0.000, Recall=0.000
[05:23:58] DEBUG: F1=0.000, EM=0.0, Overlap=0.000
[05:23:58] DEBUG: Generated='british empire' vs Expected='alexius komnenos'
[05:23:58] DEBUG: Overlap=0, Precision=0.000, Recall=0.000
[05:23:58] DEBUG: F1=0.000, EM=0.0, Overlap=0.000
[05:23:58] DEBUG: Generated='' vs Expected='afranji'
[05:23:58] DEBUG: F1=0.000, EM=0.0, Overlap=0.000
[05:23:59] DEBUG: Generated='2018' vs Expected='oursel'
[05:23:59] DEBUG: Overlap=0, Precision=0.000, Recall=0.000
[05:23:59] DEBUG: F1=0.000, EM=0.0, Overlap=0.000
[05:23:59] DEBUG: Generated='turkey' vs Expected='turkish forces'
[05:23:59] DEBUG: Overlap=0, Precision=0.000, Recall=0.000
[05:23:59] DEBUG: F1=0.000, EM=0.0, Overlap=0.000
[05:23:59] DEBUG: Generated='byzantine origin' vs Expected='norman mercenary'
[05:23:59] DEBUG: Overlap=0, Precision=0.000, Recall=0.000
[05:23:59] DEBUG: F1=0.000, EM=0.0, Overlap=0.000
[05:23:59] DEBUG: Generated='' vs Expected='robert guiscard'
[05:23:59] DEBUG: F1=0.000, EM=0.0, Overlap=0.000
[05:24:00] DEBUG: Generated='1970s' vs Expected='1082'
[05:24:00] DEBUG: Overlap=0, Precision=0.000, Recall=0.000
[05:24:00] DEBUG: F1=0.000, EM=0.0, Overlap=0.000
[05:24:01] DEBUG: Generated='1,250,000 men' vs Expected='30,000'
[05:24:01] DEBUG: Overlap=0, Precision=0.000, Recall=0.000
[05:24:01] DEBUG: F1=0.000, EM=0.0, Overlap=0.000
[05:24:01]   Progress: 40/50 - Recent F1: 0.000
[05:24:02] DEBUG: Generated='constantinople' vs Expected='deabolis'
[05:24:02] DEBUG: Overlap=0, Precision=0.000, Recall=0.000
[05:24:02] DEBUG: F1=0.000, EM=0.0, Overlap=0.000
[05:24:02] DEBUG: Generated='' vs Expected='bohemond'
[05:24:02] DEBUG: F1=0.000, EM=0.0, Overlap=0.000
[05:24:03] DEBUG: Generated='river sita' vs Expected='deabolis'
[05:24:03] DEBUG: Overlap=0, Precision=0.000, Recall=0.000
[05:24:03] DEBUG: F1=0.000, EM=0.0, Overlap=0.000
[05:24:04] DEBUG: Generated='2018' vs Expected='1185'
[05:24:04] DEBUG: Overlap=0, Precision=0.000, Recall=0.000
[05:24:04] DEBUG: F1=0.000, EM=0.0, Overlap=0.000
[05:24:04] DEBUG: Generated='guantanamo bay naval base' vs Expected='dyrrachium'
[05:24:04] DEBUG: Overlap=0, Precision=0.000, Recall=0.000
[05:24:04] DEBUG: F1=0.000, EM=0.0, Overlap=0.000
[05:24:05] DEBUG: Generated='the earth's crust' vs Expected='the adriatic'
[05:24:05] DEBUG: Overlap=1, Precision=0.333, Recall=0.500
[05:24:05] DEBUG: F1=0.400, EM=0.0, Overlap=0.500
[05:24:05] DEBUG: Generated='theo' vs Expected='king ethelred ii'
[05:24:05] DEBUG: Overlap=0, Precision=0.000, Recall=0.000
[05:24:05] DEBUG: F1=0.000, EM=0.0, Overlap=0.000
[05:24:06] DEBUG: Generated='madhavrao' vs Expected='duke richard ii'
[05:24:06] DEBUG: Overlap=0, Precision=0.000, Recall=0.000
[05:24:06] DEBUG: F1=0.000, EM=0.0, Overlap=0.000
[05:24:06] DEBUG: Generated='to the netherlands' vs Expected='normandy'
[05:24:06] DEBUG: Overlap=0, Precision=0.000, Recall=0.000
[05:24:06] DEBUG: F1=0.000, EM=0.0, Overlap=0.000
[05:24:07] DEBUG: Generated='ethelred' vs Expected='sweyn forkbeard'
[05:24:07] DEBUG: Overlap=0, Precision=0.000, Recall=0.000
[05:24:07] DEBUG: F1=0.000, EM=0.0, Overlap=0.000
[05:24:07]   Progress: 50/50 - Recent F1: 0.040
[05:24:07]    knowledge_synthesis completed: F1=0.084, EM=0.040
[05:24:07] 
 Testing template: instructional_clear
[05:24:08] DEBUG: Generated='paris' vs Expected='paris'
[05:24:08] DEBUG: Overlap=1, Precision=1.000, Recall=1.000
[05:24:08] DEBUG: F1=1.000, EM=1.0, Overlap=1.000
[05:24:08] DEBUG: Generated='william shakespeare' vs Expected='william shakespeare'
[05:24:08] DEBUG: Overlap=2, Precision=1.000, Recall=1.000
[05:24:08] DEBUG: F1=1.000, EM=1.0, Overlap=1.000
[05:24:08] DEBUG: Generated='the question' vs Expected='4'
[05:24:08] DEBUG: Overlap=0, Precision=0.000, Recall=0.000
[05:24:08] DEBUG: F1=0.000, EM=0.0, Overlap=0.000
[05:24:09] DEBUG: Generated='photosynthesis' vs Expected='process where plants make food from sunlight'
[05:24:09] DEBUG: Overlap=0, Precision=0.000, Recall=0.000
[05:24:09] DEBUG: F1=0.000, EM=0.0, Overlap=0.000
[05:24:09] DEBUG: Generated='what turns you on?' vs Expected='they process information using electrical circuits'
[05:24:09] DEBUG: Overlap=0, Precision=0.000, Recall=0.000
[05:24:09] DEBUG: F1=0.000, EM=0.0, Overlap=0.000
[05:24:09] DEBUG: Generated='blue' vs Expected='red blue green'
[05:24:09] DEBUG: Overlap=1, Precision=1.000, Recall=0.333
[05:24:09] DEBUG: F1=0.500, EM=0.0, Overlap=0.333
[05:24:10] DEBUG: Generated='cat' vs Expected='cat dog'
[05:24:10] DEBUG: Overlap=1, Precision=1.000, Recall=0.500
[05:24:10] DEBUG: F1=0.667, EM=0.0, Overlap=0.500
[05:24:10] DEBUG: Generated='for all known forms of life' vs Expected='essential for life and survival'
[05:24:10] DEBUG: Overlap=2, Precision=0.333, Recall=0.400
[05:24:10] DEBUG: F1=0.364, EM=0.0, Overlap=0.400
[05:24:10] DEBUG: Generated='what turns you on?' vs Expected='chlorophyll'
[05:24:10] DEBUG: Overlap=0, Precision=0.000, Recall=0.000
[05:24:10] DEBUG: F1=0.000, EM=0.0, Overlap=0.000
[05:24:11] DEBUG: Generated='the question' vs Expected='yes'
[05:24:11] DEBUG: Overlap=0, Precision=0.000, Recall=0.000
[05:24:11] DEBUG: F1=0.000, EM=0.0, Overlap=0.000
[05:24:11]   Progress: 10/50 - Recent F1: 0.353
[05:24:12] DEBUG: Generated='' vs Expected='yes'
[05:24:12] DEBUG: F1=0.000, EM=0.0, Overlap=0.000
[05:24:12] DEBUG: Generated='red' vs Expected='red yellow blue'
[05:24:12] DEBUG: Overlap=1, Precision=1.000, Recall=0.333
[05:24:12] DEBUG: F1=0.500, EM=0.0, Overlap=0.333
[05:24:13] DEBUG: Generated='france' vs Expected='france'
[05:24:13] DEBUG: Overlap=1, Precision=1.000, Recall=1.000
[05:24:13] DEBUG: F1=1.000, EM=1.0, Overlap=1.000
[05:24:14] DEBUG: Generated='during the trojan war' vs Expected='10th and 11th centuries'
[05:24:14] DEBUG: Overlap=0, Precision=0.000, Recall=0.000
[05:24:14] DEBUG: F1=0.000, EM=0.0, Overlap=0.000
[05:24:14] DEBUG: Generated='iceland' vs Expected='denmark, iceland and norway'
[05:24:14] DEBUG: Overlap=1, Precision=1.000, Recall=0.250
[05:24:14] DEBUG: F1=0.400, EM=0.0, Overlap=0.250
[05:24:15] DEBUG: Generated='the question' vs Expected='rollo'
[05:24:15] DEBUG: Overlap=0, Precision=0.000, Recall=0.000
[05:24:15] DEBUG: F1=0.000, EM=0.0, Overlap=0.000
[05:24:16] DEBUG: Generated='the ninth century' vs Expected='10th century'
[05:24:16] DEBUG: Overlap=1, Precision=0.333, Recall=0.500
[05:24:16] DEBUG: F1=0.400, EM=0.0, Overlap=0.500
[05:24:16] DEBUG: Generated='the duke of normandy' vs Expected='william the conqueror'
[05:24:16] DEBUG: Overlap=1, Precision=0.250, Recall=0.333
[05:24:16] DEBUG: F1=0.286, EM=0.0, Overlap=0.333
[05:24:17] DEBUG: Generated='king charles iii' vs Expected='richard i'
[05:24:17] DEBUG: Overlap=0, Precision=0.000, Recall=0.000
[05:24:17] DEBUG: F1=0.000, EM=0.0, Overlap=0.000
[05:24:18] DEBUG: Generated='islam' vs Expected='catholic'
[05:24:18] DEBUG: Overlap=0, Precision=0.000, Recall=0.000
[05:24:18] DEBUG: F1=0.000, EM=0.0, Overlap=0.000
[05:24:18]   Progress: 20/50 - Recent F1: 0.259
[05:24:18] DEBUG: Generated='norman' vs Expected='viking'
[05:24:18] DEBUG: Overlap=0, Precision=0.000, Recall=0.000
[05:24:18] DEBUG: F1=0.000, EM=0.0, Overlap=0.000
[05:24:18] DEBUG: Generated='in 1024' vs Expected='9th century'
[05:24:18] DEBUG: Overlap=0, Precision=0.000, Recall=0.000
[05:24:18] DEBUG: F1=0.000, EM=0.0, Overlap=0.000
[05:24:19] DEBUG: Generated='1066' vs Expected='911'
[05:24:19] DEBUG: Overlap=0, Precision=0.000, Recall=0.000
[05:24:19] DEBUG: F1=0.000, EM=0.0, Overlap=0.000
[05:24:19] DEBUG: Generated='charles' vs Expected='king charles iii'
[05:24:19] DEBUG: Overlap=1, Precision=1.000, Recall=0.333
[05:24:19] DEBUG: F1=0.500, EM=0.0, Overlap=0.333
[05:24:20] DEBUG: Generated='what turns you on?' vs Expected='seine'
[05:24:20] DEBUG: Overlap=0, Precision=0.000, Recall=0.000
[05:24:20] DEBUG: F1=0.000, EM=0.0, Overlap=0.000
[05:24:20] DEBUG: Generated='the normans' vs Expected='rollo'
[05:24:20] DEBUG: Overlap=0, Precision=0.000, Recall=0.000
[05:24:20] DEBUG: F1=0.000, EM=0.0, Overlap=0.000
[05:24:21] DEBUG: Generated='what turns you on?' vs Expected='catholicism'
[05:24:21] DEBUG: Overlap=0, Precision=0.000, Recall=0.000
[05:24:21] DEBUG: F1=0.000, EM=0.0, Overlap=0.000
[05:24:22] DEBUG: Generated='normandy' vs Expected='north'
[05:24:22] DEBUG: Overlap=0, Precision=0.000, Recall=0.000
[05:24:22] DEBUG: F1=0.000, EM=0.0, Overlap=0.000
[05:24:22] DEBUG: Generated='what turns you on?' vs Expected='fighting horsemen'
[05:24:22] DEBUG: Overlap=0, Precision=0.000, Recall=0.000
[05:24:22] DEBUG: F1=0.000, EM=0.0, Overlap=0.000
[05:24:23] DEBUG: Generated='byzantine empire' vs Expected='seljuk turks'
[05:24:23] DEBUG: Overlap=0, Precision=0.000, Recall=0.000
[05:24:23] DEBUG: F1=0.000, EM=0.0, Overlap=0.000
[05:24:23]   Progress: 30/50 - Recent F1: 0.050
[05:24:24] DEBUG: Generated='602 -- 603' vs Expected='1050s'
[05:24:24] DEBUG: Overlap=0, Precision=0.000, Recall=0.000
[05:24:24] DEBUG: F1=0.000, EM=0.0, Overlap=0.000
[05:24:25] DEBUG: Generated='robert crispin and the turks' vs Expected='1060s'
[05:24:25] DEBUG: Overlap=0, Precision=0.000, Recall=0.000
[05:24:25] DEBUG: F1=0.000, EM=0.0, Overlap=0.000
[05:24:25] DEBUG: Generated='can you please provide a clear answer' vs Expected='alexius komnenos'
[05:24:25] DEBUG: Overlap=0, Precision=0.000, Recall=0.000
[05:24:25] DEBUG: F1=0.000, EM=0.0, Overlap=0.000
[05:24:26] DEBUG: Generated='what turns you on?' vs Expected='afranji'
[05:24:26] DEBUG: Overlap=0, Precision=0.000, Recall=0.000
[05:24:26] DEBUG: F1=0.000, EM=0.0, Overlap=0.000
[05:24:27] DEBUG: Generated='roosevelt' vs Expected='oursel'
[05:24:27] DEBUG: Overlap=0, Precision=0.000, Recall=0.000
[05:24:27] DEBUG: F1=0.000, EM=0.0, Overlap=0.000
[05:24:28] DEBUG: Generated='turkey' vs Expected='turkish forces'
[05:24:28] DEBUG: Overlap=0, Precision=0.000, Recall=0.000
[05:24:28] DEBUG: F1=0.000, EM=0.0, Overlap=0.000
[05:24:28] DEBUG: Generated='normandy, france' vs Expected='norman mercenary'
[05:24:28] DEBUG: Overlap=0, Precision=0.000, Recall=0.000
[05:24:28] DEBUG: F1=0.000, EM=0.0, Overlap=0.000
[05:24:28] DEBUG: Generated='lord canning' vs Expected='robert guiscard'
[05:24:28] DEBUG: Overlap=0, Precision=0.000, Recall=0.000
[05:24:28] DEBUG: F1=0.000, EM=0.0, Overlap=0.000
[05:24:29] DEBUG: Generated='what happened to dyrrachium?' vs Expected='1082'
[05:24:29] DEBUG: Overlap=0, Precision=0.000, Recall=0.000
[05:24:29] DEBUG: F1=0.000, EM=0.0, Overlap=0.000
[05:24:29] DEBUG: Generated='1,000,000' vs Expected='30,000'
[05:24:29] DEBUG: Overlap=0, Precision=0.000, Recall=0.000
[05:24:29] DEBUG: F1=0.000, EM=0.0, Overlap=0.000
[05:24:29]   Progress: 40/50 - Recent F1: 0.000
[05:24:30] DEBUG: Generated='constantinople' vs Expected='deabolis'
[05:24:30] DEBUG: Overlap=0, Precision=0.000, Recall=0.000
[05:24:30] DEBUG: F1=0.000, EM=0.0, Overlap=0.000
[05:24:30] DEBUG: Generated=', andrew' vs Expected='bohemond'
[05:24:30] DEBUG: Overlap=0, Precision=0.000, Recall=0.000
[05:24:30] DEBUG: F1=0.000, EM=0.0, Overlap=0.000
[05:24:31] DEBUG: Generated='river sitka' vs Expected='deabolis'
[05:24:31] DEBUG: Overlap=0, Precision=0.000, Recall=0.000
[05:24:31] DEBUG: F1=0.000, EM=0.0, Overlap=0.000
[05:24:32] DEBUG: Generated='2003' vs Expected='1185'
[05:24:32] DEBUG: Overlap=0, Precision=0.000, Recall=0.000
[05:24:32] DEBUG: F1=0.000, EM=0.0, Overlap=0.000
[05:24:32] DEBUG: Generated='what turns you on?' vs Expected='dyrrachium'
[05:24:32] DEBUG: Overlap=0, Precision=0.000, Recall=0.000
[05:24:32] DEBUG: F1=0.000, EM=0.0, Overlap=0.000
[05:24:32] DEBUG: Generated='what turns you on?' vs Expected='the adriatic'
[05:24:32] DEBUG: Overlap=0, Precision=0.000, Recall=0.000
[05:24:32] DEBUG: F1=0.000, EM=0.0, Overlap=0.000
[05:24:33] DEBUG: Generated='admiral horatio nelson' vs Expected='king ethelred ii'
[05:24:33] DEBUG: Overlap=0, Precision=0.000, Recall=0.000
[05:24:33] DEBUG: F1=0.000, EM=0.0, Overlap=0.000
[05:24:33] DEBUG: Generated='the question' vs Expected='duke richard ii'
[05:24:33] DEBUG: Overlap=0, Precision=0.000, Recall=0.000
[05:24:33] DEBUG: F1=0.000, EM=0.0, Overlap=0.000
[05:24:33] DEBUG: Generated='to return to england' vs Expected='normandy'
[05:24:33] DEBUG: Overlap=0, Precision=0.000, Recall=0.000
[05:24:33] DEBUG: F1=0.000, EM=0.0, Overlap=0.000
[05:24:34] DEBUG: Generated='parliament' vs Expected='sweyn forkbeard'
[05:24:34] DEBUG: Overlap=0, Precision=0.000, Recall=0.000
[05:24:34] DEBUG: F1=0.000, EM=0.0, Overlap=0.000
[05:24:34]   Progress: 50/50 - Recent F1: 0.000
[05:24:34]    instructional_clear completed: F1=0.132, EM=0.060
[05:24:34] 
 Testing template: context_guided
[05:24:34] DEBUG: Generated='paris' vs Expected='paris'
[05:24:34] DEBUG: Overlap=1, Precision=1.000, Recall=1.000
[05:24:34] DEBUG: F1=1.000, EM=1.0, Overlap=1.000
[05:24:34] DEBUG: Generated='' vs Expected='william shakespeare'
[05:24:34] DEBUG: F1=0.000, EM=0.0, Overlap=0.000
[05:24:34] DEBUG: Generated='what turns you on?' vs Expected='4'
[05:24:34] DEBUG: Overlap=0, Precision=0.000, Recall=0.000
[05:24:34] DEBUG: F1=0.000, EM=0.0, Overlap=0.000
[05:24:35] DEBUG: Generated='' vs Expected='process where plants make food from sunlight'
[05:24:35] DEBUG: F1=0.000, EM=0.0, Overlap=0.000
[05:24:35] DEBUG: Generated='what turns you on?' vs Expected='they process information using electrical circuits'
[05:24:35] DEBUG: Overlap=0, Precision=0.000, Recall=0.000
[05:24:35] DEBUG: F1=0.000, EM=0.0, Overlap=0.000
[05:24:35] DEBUG: Generated='green' vs Expected='red blue green'
[05:24:35] DEBUG: Overlap=1, Precision=1.000, Recall=0.333
[05:24:35] DEBUG: F1=0.500, EM=0.0, Overlap=0.333
[05:24:35] DEBUG: Generated='cat' vs Expected='cat dog'
[05:24:35] DEBUG: Overlap=1, Precision=1.000, Recall=0.500
[05:24:35] DEBUG: F1=0.667, EM=0.0, Overlap=0.500
[05:24:36] DEBUG: Generated='why is water important?' vs Expected='essential for life and survival'
[05:24:36] DEBUG: Overlap=0, Precision=0.000, Recall=0.000
[05:24:36] DEBUG: F1=0.000, EM=0.0, Overlap=0.000
[05:24:36] DEBUG: Generated='what makes plants green' vs Expected='chlorophyll'
[05:24:36] DEBUG: Overlap=0, Precision=0.000, Recall=0.000
[05:24:36] DEBUG: F1=0.000, EM=0.0, Overlap=0.000
[05:24:36] DEBUG: Generated='what turns you on?' vs Expected='yes'
[05:24:36] DEBUG: Overlap=0, Precision=0.000, Recall=0.000
[05:24:36] DEBUG: F1=0.000, EM=0.0, Overlap=0.000
[05:24:36]   Progress: 10/50 - Recent F1: 0.217
[05:24:37] DEBUG: Generated='the basic question' vs Expected='yes'
[05:24:37] DEBUG: Overlap=0, Precision=0.000, Recall=0.000
[05:24:37] DEBUG: F1=0.000, EM=0.0, Overlap=0.000
[05:24:37] DEBUG: Generated='red' vs Expected='red yellow blue'
[05:24:37] DEBUG: Overlap=1, Precision=1.000, Recall=0.333
[05:24:37] DEBUG: F1=0.500, EM=0.0, Overlap=0.333
[05:24:37] DEBUG: Generated='france' vs Expected='france'
[05:24:37] DEBUG: Overlap=1, Precision=1.000, Recall=1.000
[05:24:37] DEBUG: F1=1.000, EM=1.0, Overlap=1.000
[05:24:37] DEBUG: Generated='the 10th and 13th centuries' vs Expected='10th and 11th centuries'
[05:24:37] DEBUG: Overlap=3, Precision=0.600, Recall=0.750
[05:24:37] DEBUG: F1=0.667, EM=0.0, Overlap=0.750
[05:24:38] DEBUG: Generated='scandinavia' vs Expected='denmark, iceland and norway'
[05:24:38] DEBUG: Overlap=0, Precision=0.000, Recall=0.000
[05:24:38] DEBUG: F1=0.000, EM=0.0, Overlap=0.000
[05:24:39] DEBUG: Generated='who was the norse leader' vs Expected='rollo'
[05:24:39] DEBUG: Overlap=0, Precision=0.000, Recall=0.000
[05:24:39] DEBUG: F1=0.000, EM=0.0, Overlap=0.000
[05:24:39] DEBUG: Generated='the ninth century' vs Expected='10th century'
[05:24:39] DEBUG: Overlap=1, Precision=0.333, Recall=0.500
[05:24:39] DEBUG: F1=0.400, EM=0.0, Overlap=0.500
[05:24:39] DEBUG: Generated='normandy duke of normandy' vs Expected='william the conqueror'
[05:24:39] DEBUG: Overlap=0, Precision=0.000, Recall=0.000
[05:24:39] DEBUG: F1=0.000, EM=0.0, Overlap=0.000
[05:24:40] DEBUG: Generated='king charles iii' vs Expected='richard i'
[05:24:40] DEBUG: Overlap=0, Precision=0.000, Recall=0.000
[05:24:40] DEBUG: F1=0.000, EM=0.0, Overlap=0.000
[05:24:40] DEBUG: Generated='catholicism' vs Expected='catholic'
[05:24:40] DEBUG: Overlap=0, Precision=0.000, Recall=0.000
[05:24:40] DEBUG: F1=0.000, EM=0.0, Overlap=0.000
[05:24:40]   Progress: 20/50 - Recent F1: 0.257
[05:24:40] DEBUG: Generated='norman' vs Expected='viking'
[05:24:40] DEBUG: Overlap=0, Precision=0.000, Recall=0.000
[05:24:40] DEBUG: F1=0.000, EM=0.0, Overlap=0.000
[05:24:41] DEBUG: Generated='in 1024' vs Expected='9th century'
[05:24:41] DEBUG: Overlap=0, Precision=0.000, Recall=0.000
[05:24:41] DEBUG: F1=0.000, EM=0.0, Overlap=0.000
[05:24:41] DEBUG: Generated='1066' vs Expected='911'
[05:24:41] DEBUG: Overlap=0, Precision=0.000, Recall=0.000
[05:24:41] DEBUG: F1=0.000, EM=0.0, Overlap=0.000
[05:24:41] DEBUG: Generated='charles the simple' vs Expected='king charles iii'
[05:24:41] DEBUG: Overlap=1, Precision=0.333, Recall=0.333
[05:24:41] DEBUG: F1=0.333, EM=0.0, Overlap=0.333
[05:24:41] DEBUG: Generated='tennessee river' vs Expected='seine'
[05:24:41] DEBUG: Overlap=0, Precision=0.000, Recall=0.000
[05:24:41] DEBUG: F1=0.000, EM=0.0, Overlap=0.000
[05:24:42] DEBUG: Generated='the normans' vs Expected='rollo'
[05:24:42] DEBUG: Overlap=0, Precision=0.000, Recall=0.000
[05:24:42] DEBUG: F1=0.000, EM=0.0, Overlap=0.000
[05:24:42] DEBUG: Generated='normanism' vs Expected='catholicism'
[05:24:42] DEBUG: Overlap=0, Precision=0.000, Recall=0.000
[05:24:42] DEBUG: F1=0.000, EM=0.0, Overlap=0.000
[05:24:42] DEBUG: Generated='normandy' vs Expected='north'
[05:24:42] DEBUG: Overlap=0, Precision=0.000, Recall=0.000
[05:24:42] DEBUG: F1=0.000, EM=0.0, Overlap=0.000
[05:24:42] DEBUG: Generated='foodstuffs' vs Expected='fighting horsemen'
[05:24:42] DEBUG: Overlap=0, Precision=0.000, Recall=0.000
[05:24:42] DEBUG: F1=0.000, EM=0.0, Overlap=0.000
[05:24:42] DEBUG: Generated='the byzantine empire' vs Expected='seljuk turks'
[05:24:42] DEBUG: Overlap=0, Precision=0.000, Recall=0.000
[05:24:42] DEBUG: F1=0.000, EM=0.0, Overlap=0.000
[05:24:42]   Progress: 30/50 - Recent F1: 0.033
[05:24:43] DEBUG: Generated='during the byzantine war' vs Expected='1050s'
[05:24:43] DEBUG: Overlap=0, Precision=0.000, Recall=0.000
[05:24:43] DEBUG: F1=0.000, EM=0.0, Overlap=0.000
[05:24:43] DEBUG: Generated='2003' vs Expected='1060s'
[05:24:43] DEBUG: Overlap=0, Precision=0.000, Recall=0.000
[05:24:43] DEBUG: F1=0.000, EM=0.0, Overlap=0.000
[05:24:43] DEBUG: Generated='ask the question' vs Expected='alexius komnenos'
[05:24:43] DEBUG: Overlap=0, Precision=0.000, Recall=0.000
[05:24:43] DEBUG: F1=0.000, EM=0.0, Overlap=0.000
[05:24:43] DEBUG: Generated='neuschwanstein castle' vs Expected='afranji'
[05:24:43] DEBUG: Overlap=0, Precision=0.000, Recall=0.000
[05:24:43] DEBUG: F1=0.000, EM=0.0, Overlap=0.000
[05:24:43] DEBUG: Generated='roosevelt' vs Expected='oursel'
[05:24:43] DEBUG: Overlap=0, Precision=0.000, Recall=0.000
[05:24:43] DEBUG: F1=0.000, EM=0.0, Overlap=0.000
[05:24:44] DEBUG: Generated='turkey' vs Expected='turkish forces'
[05:24:44] DEBUG: Overlap=0, Precision=0.000, Recall=0.000
[05:24:44] DEBUG: F1=0.000, EM=0.0, Overlap=0.000
[05:24:44] DEBUG: Generated='normandy' vs Expected='norman mercenary'
[05:24:44] DEBUG: Overlap=0, Precision=0.000, Recall=0.000
[05:24:44] DEBUG: F1=0.000, EM=0.0, Overlap=0.000
[05:24:45] DEBUG: Generated='( last ) frederick iii' vs Expected='robert guiscard'
[05:24:45] DEBUG: Overlap=0, Precision=0.000, Recall=0.000
[05:24:45] DEBUG: F1=0.000, EM=0.0, Overlap=0.000
[05:24:45] DEBUG: Generated='180 bc' vs Expected='1082'
[05:24:45] DEBUG: Overlap=0, Precision=0.000, Recall=0.000
[05:24:45] DEBUG: F1=0.000, EM=0.0, Overlap=0.000
[05:24:46] DEBUG: Generated='about a million men' vs Expected='30,000'
[05:24:46] DEBUG: Overlap=0, Precision=0.000, Recall=0.000
[05:24:46] DEBUG: F1=0.000, EM=0.0, Overlap=0.000
[05:24:46]   Progress: 40/50 - Recent F1: 0.000
[05:24:46] DEBUG: Generated='in jaffa' vs Expected='deabolis'
[05:24:46] DEBUG: Overlap=0, Precision=0.000, Recall=0.000
[05:24:46] DEBUG: F1=0.000, EM=0.0, Overlap=0.000
[05:24:46] DEBUG: Generated='robert's son' vs Expected='bohemond'
[05:24:46] DEBUG: Overlap=0, Precision=0.000, Recall=0.000
[05:24:46] DEBUG: F1=0.000, EM=0.0, Overlap=0.000
[05:24:46] DEBUG: Generated='river sita' vs Expected='deabolis'
[05:24:46] DEBUG: Overlap=0, Precision=0.000, Recall=0.000
[05:24:46] DEBUG: F1=0.000, EM=0.0, Overlap=0.000
[05:24:47] DEBUG: Generated='2018' vs Expected='1185'
[05:24:47] DEBUG: Overlap=0, Precision=0.000, Recall=0.000
[05:24:47] DEBUG: F1=0.000, EM=0.0, Overlap=0.000
[05:24:47] DEBUG: Generated='naval air station' vs Expected='dyrrachium'
[05:24:47] DEBUG: Overlap=0, Precision=0.000, Recall=0.000
[05:24:47] DEBUG: F1=0.000, EM=0.0, Overlap=0.000
[05:24:47] DEBUG: Generated='the fundamental question' vs Expected='the adriatic'
[05:24:47] DEBUG: Overlap=1, Precision=0.333, Recall=0.500
[05:24:47] DEBUG: F1=0.400, EM=0.0, Overlap=0.500
[05:24:48] DEBUG: Generated='mr. knightley' vs Expected='king ethelred ii'
[05:24:48] DEBUG: Overlap=0, Precision=0.000, Recall=0.000
[05:24:48] DEBUG: F1=0.000, EM=0.0, Overlap=0.000
[05:24:48] DEBUG: Generated='ellen' vs Expected='duke richard ii'
[05:24:48] DEBUG: Overlap=0, Precision=0.000, Recall=0.000
[05:24:48] DEBUG: F1=0.000, EM=0.0, Overlap=0.000
[05:24:49] DEBUG: Generated='to return to england' vs Expected='normandy'
[05:24:49] DEBUG: Overlap=0, Precision=0.000, Recall=0.000
[05:24:49] DEBUG: F1=0.000, EM=0.0, Overlap=0.000
[05:24:50] DEBUG: Generated='what turns you on?' vs Expected='sweyn forkbeard'
[05:24:50] DEBUG: Overlap=0, Precision=0.000, Recall=0.000
[05:24:50] DEBUG: F1=0.000, EM=0.0, Overlap=0.000
[05:24:50]   Progress: 50/50 - Recent F1: 0.040
[05:24:50]    context_guided completed: F1=0.109, EM=0.040
[05:24:50] 
 Testing template: confident_direct
[05:24:50] DEBUG: Generated='paris' vs Expected='paris'
[05:24:50] DEBUG: Overlap=1, Precision=1.000, Recall=1.000
[05:24:50] DEBUG: F1=1.000, EM=1.0, Overlap=1.000
[05:24:50] DEBUG: Generated='william shakespeare' vs Expected='william shakespeare'
[05:24:50] DEBUG: Overlap=2, Precision=1.000, Recall=1.000
[05:24:50] DEBUG: F1=1.000, EM=1.0, Overlap=1.000
[05:24:51] DEBUG: Generated='what turns you on?' vs Expected='4'
[05:24:51] DEBUG: Overlap=0, Precision=0.000, Recall=0.000
[05:24:51] DEBUG: F1=0.000, EM=0.0, Overlap=0.000
[05:24:51] DEBUG: Generated='to convert light energy into chemical energy' vs Expected='process where plants make food from sunlight'
[05:24:51] DEBUG: Overlap=0, Precision=0.000, Recall=0.000
[05:24:51] DEBUG: F1=0.000, EM=0.0, Overlap=0.000
[05:24:52] DEBUG: Generated='what turns you on?' vs Expected='they process information using electrical circuits'
[05:24:52] DEBUG: Overlap=0, Precision=0.000, Recall=0.000
[05:24:52] DEBUG: F1=0.000, EM=0.0, Overlap=0.000
[05:24:52] DEBUG: Generated='red' vs Expected='red blue green'
[05:24:52] DEBUG: Overlap=1, Precision=1.000, Recall=0.333
[05:24:52] DEBUG: F1=0.500, EM=0.0, Overlap=0.333
[05:24:52] DEBUG: Generated='rodents' vs Expected='cat dog'
[05:24:52] DEBUG: Overlap=0, Precision=0.000, Recall=0.000
[05:24:52] DEBUG: F1=0.000, EM=0.0, Overlap=0.000
[05:24:52] DEBUG: Generated='why is water important?' vs Expected='essential for life and survival'
[05:24:52] DEBUG: Overlap=0, Precision=0.000, Recall=0.000
[05:24:52] DEBUG: F1=0.000, EM=0.0, Overlap=0.000
[05:24:53] DEBUG: Generated='chlorophyll' vs Expected='chlorophyll'
[05:24:53] DEBUG: Overlap=1, Precision=1.000, Recall=1.000
[05:24:53] DEBUG: F1=1.000, EM=1.0, Overlap=1.000
[05:24:53] DEBUG: Generated='is the earth round' vs Expected='yes'
[05:24:53] DEBUG: Overlap=0, Precision=0.000, Recall=0.000
[05:24:53] DEBUG: F1=0.000, EM=0.0, Overlap=0.000
[05:24:53]   Progress: 10/50 - Recent F1: 0.350
[05:24:53] DEBUG: Generated='' vs Expected='yes'
[05:24:53] DEBUG: F1=0.000, EM=0.0, Overlap=0.000
[05:24:54] DEBUG: Generated='red' vs Expected='red yellow blue'
[05:24:54] DEBUG: Overlap=1, Precision=1.000, Recall=0.333
[05:24:54] DEBUG: F1=0.500, EM=0.0, Overlap=0.333
[05:24:54] DEBUG: Generated='france' vs Expected='france'
[05:24:54] DEBUG: Overlap=1, Precision=1.000, Recall=1.000
[05:24:54] DEBUG: F1=1.000, EM=1.0, Overlap=1.000
[05:24:54] DEBUG: Generated='10th century -- 15th century' vs Expected='10th and 11th centuries'
[05:24:54] DEBUG: Overlap=1, Precision=0.250, Recall=0.250
[05:24:54] DEBUG: F1=0.250, EM=0.0, Overlap=0.250
[05:24:55] DEBUG: Generated='iceland' vs Expected='denmark, iceland and norway'
[05:24:55] DEBUG: Overlap=1, Precision=1.000, Recall=0.250
[05:24:55] DEBUG: F1=0.400, EM=0.0, Overlap=0.250
[05:24:55] DEBUG: Generated='who was the norse leader' vs Expected='rollo'
[05:24:55] DEBUG: Overlap=0, Precision=0.000, Recall=0.000
[05:24:55] DEBUG: F1=0.000, EM=0.0, Overlap=0.000
[05:24:55] DEBUG: Generated='the ninth century' vs Expected='10th century'
[05:24:55] DEBUG: Overlap=1, Precision=0.333, Recall=0.500
[05:24:55] DEBUG: F1=0.400, EM=0.0, Overlap=0.500
[05:24:56] DEBUG: Generated='william' vs Expected='william the conqueror'
[05:24:56] DEBUG: Overlap=1, Precision=1.000, Recall=0.333
[05:24:56] DEBUG: F1=0.500, EM=0.0, Overlap=0.333
[05:24:57] DEBUG: Generated='the king of england' vs Expected='richard i'
[05:24:57] DEBUG: Overlap=0, Precision=0.000, Recall=0.000
[05:24:57] DEBUG: F1=0.000, EM=0.0, Overlap=0.000
[05:24:57] DEBUG: Generated='catholicism' vs Expected='catholic'
[05:24:57] DEBUG: Overlap=0, Precision=0.000, Recall=0.000
[05:24:57] DEBUG: F1=0.000, EM=0.0, Overlap=0.000
[05:24:57]   Progress: 20/50 - Recent F1: 0.305
[05:24:58] DEBUG: Generated='north' vs Expected='viking'
[05:24:58] DEBUG: Overlap=0, Precision=0.000, Recall=0.000
[05:24:58] DEBUG: F1=0.000, EM=0.0, Overlap=0.000
[05:24:59] DEBUG: Generated='in 1024' vs Expected='9th century'
[05:24:59] DEBUG: Overlap=0, Precision=0.000, Recall=0.000
[05:24:59] DEBUG: F1=0.000, EM=0.0, Overlap=0.000
[05:24:59] DEBUG: Generated='1066' vs Expected='911'
[05:24:59] DEBUG: Overlap=0, Precision=0.000, Recall=0.000
[05:24:59] DEBUG: F1=0.000, EM=0.0, Overlap=0.000
[05:24:59] DEBUG: Generated='charles the simple' vs Expected='king charles iii'
[05:24:59] DEBUG: Overlap=1, Precision=0.333, Recall=0.333
[05:24:59] DEBUG: F1=0.333, EM=0.0, Overlap=0.333
[05:25:00] DEBUG: Generated='river of british columbia' vs Expected='seine'
[05:25:00] DEBUG: Overlap=0, Precision=0.000, Recall=0.000
[05:25:00] DEBUG: F1=0.000, EM=0.0, Overlap=0.000
[05:25:00] DEBUG: Generated='the normans' vs Expected='rollo'
[05:25:00] DEBUG: Overlap=0, Precision=0.000, Recall=0.000
[05:25:00] DEBUG: F1=0.000, EM=0.0, Overlap=0.000
[05:25:00] DEBUG: Generated='islam' vs Expected='catholicism'
[05:25:00] DEBUG: Overlap=0, Precision=0.000, Recall=0.000
[05:25:00] DEBUG: F1=0.000, EM=0.0, Overlap=0.000
[05:25:01] DEBUG: Generated='normandy' vs Expected='north'
[05:25:01] DEBUG: Overlap=0, Precision=0.000, Recall=0.000
[05:25:01] DEBUG: F1=0.000, EM=0.0, Overlap=0.000
[05:25:01] DEBUG: Generated='cloth' vs Expected='fighting horsemen'
[05:25:01] DEBUG: Overlap=0, Precision=0.000, Recall=0.000
[05:25:01] DEBUG: F1=0.000, EM=0.0, Overlap=0.000
[05:25:01] DEBUG: Generated='byzantine empire' vs Expected='seljuk turks'
[05:25:01] DEBUG: Overlap=0, Precision=0.000, Recall=0.000
[05:25:01] DEBUG: F1=0.000, EM=0.0, Overlap=0.000
[05:25:01]   Progress: 30/50 - Recent F1: 0.033
[05:25:02] DEBUG: Generated='during the byzantine war' vs Expected='1050s'
[05:25:02] DEBUG: Overlap=0, Precision=0.000, Recall=0.000
[05:25:02] DEBUG: F1=0.000, EM=0.0, Overlap=0.000
[05:25:02] DEBUG: Generated='2003' vs Expected='1060s'
[05:25:02] DEBUG: Overlap=0, Precision=0.000, Recall=0.000
[05:25:02] DEBUG: F1=0.000, EM=0.0, Overlap=0.000
[05:25:02] DEBUG: Generated='oliver cromwell' vs Expected='alexius komnenos'
[05:25:02] DEBUG: Overlap=0, Precision=0.000, Recall=0.000
[05:25:02] DEBUG: F1=0.000, EM=0.0, Overlap=0.000
[05:25:03] DEBUG: Generated='château paris' vs Expected='afranji'
[05:25:03] DEBUG: Overlap=0, Precision=0.000, Recall=0.000
[05:25:03] DEBUG: F1=0.000, EM=0.0, Overlap=0.000
[05:25:03] DEBUG: Generated='theudebert i' vs Expected='oursel'
[05:25:03] DEBUG: Overlap=0, Precision=0.000, Recall=0.000
[05:25:03] DEBUG: F1=0.000, EM=0.0, Overlap=0.000
[05:25:04] DEBUG: Generated='turkey' vs Expected='turkish forces'
[05:25:04] DEBUG: Overlap=0, Precision=0.000, Recall=0.000
[05:25:04] DEBUG: F1=0.000, EM=0.0, Overlap=0.000
[05:25:04] DEBUG: Generated='answers the question' vs Expected='norman mercenary'
[05:25:04] DEBUG: Overlap=0, Precision=0.000, Recall=0.000
[05:25:04] DEBUG: F1=0.000, EM=0.0, Overlap=0.000
[05:25:04] DEBUG: Generated='tobey' vs Expected='robert guiscard'
[05:25:04] DEBUG: Overlap=0, Precision=0.000, Recall=0.000
[05:25:04] DEBUG: F1=0.000, EM=0.0, Overlap=0.000
[05:25:05] DEBUG: Generated='2011' vs Expected='1082'
[05:25:05] DEBUG: Overlap=0, Precision=0.000, Recall=0.000
[05:25:05] DEBUG: F1=0.000, EM=0.0, Overlap=0.000
[05:25:05] DEBUG: Generated='350,000 and 150,000' vs Expected='30,000'
[05:25:05] DEBUG: Overlap=0, Precision=0.000, Recall=0.000
[05:25:05] DEBUG: F1=0.000, EM=0.0, Overlap=0.000
[05:25:05]   Progress: 40/50 - Recent F1: 0.000
[05:25:06] DEBUG: Generated='constantinople' vs Expected='deabolis'
[05:25:06] DEBUG: Overlap=0, Precision=0.000, Recall=0.000
[05:25:06] DEBUG: F1=0.000, EM=0.0, Overlap=0.000
[05:25:07] DEBUG: Generated='steffon' vs Expected='bohemond'
[05:25:07] DEBUG: Overlap=0, Precision=0.000, Recall=0.000
[05:25:07] DEBUG: F1=0.000, EM=0.0, Overlap=0.000
[05:25:08] DEBUG: Generated='river sita' vs Expected='deabolis'
[05:25:08] DEBUG: Overlap=0, Precision=0.000, Recall=0.000
[05:25:08] DEBUG: F1=0.000, EM=0.0, Overlap=0.000
[05:25:08] DEBUG: Generated='2014' vs Expected='1185'
[05:25:08] DEBUG: Overlap=0, Precision=0.000, Recall=0.000
[05:25:08] DEBUG: F1=0.000, EM=0.0, Overlap=0.000
[05:25:09] DEBUG: Generated='guantanamo bay' vs Expected='dyrrachium'
[05:25:09] DEBUG: Overlap=0, Precision=0.000, Recall=0.000
[05:25:09] DEBUG: F1=0.000, EM=0.0, Overlap=0.000
[05:25:09] DEBUG: Generated='north america' vs Expected='the adriatic'
[05:25:09] DEBUG: Overlap=0, Precision=0.000, Recall=0.000
[05:25:09] DEBUG: F1=0.000, EM=0.0, Overlap=0.000
[05:25:09] DEBUG: Generated='matt willis' vs Expected='king ethelred ii'
[05:25:09] DEBUG: Overlap=0, Precision=0.000, Recall=0.000
[05:25:09] DEBUG: F1=0.000, EM=0.0, Overlap=0.000
[05:25:10] DEBUG: Generated='elliot reeve' vs Expected='duke richard ii'
[05:25:10] DEBUG: Overlap=0, Precision=0.000, Recall=0.000
[05:25:10] DEBUG: F1=0.000, EM=0.0, Overlap=0.000
[05:25:10] DEBUG: Generated='to return to england' vs Expected='normandy'
[05:25:10] DEBUG: Overlap=0, Precision=0.000, Recall=0.000
[05:25:10] DEBUG: F1=0.000, EM=0.0, Overlap=0.000
[05:25:10] DEBUG: Generated='the old man' vs Expected='sweyn forkbeard'
[05:25:10] DEBUG: Overlap=0, Precision=0.000, Recall=0.000
[05:25:10] DEBUG: F1=0.000, EM=0.0, Overlap=0.000
[05:25:10]   Progress: 50/50 - Recent F1: 0.000
[05:25:10]    confident_direct completed: F1=0.138, EM=0.080
[05:25:10] 
 Testing template: structured_response
[05:25:11] DEBUG: Generated='paris' vs Expected='paris'
[05:25:11] DEBUG: Overlap=1, Precision=1.000, Recall=1.000
[05:25:11] DEBUG: F1=1.000, EM=1.0, Overlap=1.000
[05:25:11] DEBUG: Generated='william shakespeare' vs Expected='william shakespeare'
[05:25:11] DEBUG: Overlap=2, Precision=1.000, Recall=1.000
[05:25:11] DEBUG: F1=1.000, EM=1.0, Overlap=1.000
[05:25:11] DEBUG: Generated='the binary interpretation of the numbers' vs Expected='4'
[05:25:11] DEBUG: Overlap=0, Precision=0.000, Recall=0.000
[05:25:11] DEBUG: F1=0.000, EM=0.0, Overlap=0.000
[05:25:12] DEBUG: Generated='what turns you on?' vs Expected='process where plants make food from sunlight'
[05:25:12] DEBUG: Overlap=0, Precision=0.000, Recall=0.000
[05:25:12] DEBUG: F1=0.000, EM=0.0, Overlap=0.000
[05:25:13] DEBUG: Generated='what turns you on?' vs Expected='they process information using electrical circuits'
[05:25:13] DEBUG: Overlap=0, Precision=0.000, Recall=0.000
[05:25:13] DEBUG: F1=0.000, EM=0.0, Overlap=0.000
[05:25:13] DEBUG: Generated='red' vs Expected='red blue green'
[05:25:13] DEBUG: Overlap=1, Precision=1.000, Recall=0.333
[05:25:13] DEBUG: F1=0.500, EM=0.0, Overlap=0.333
[05:25:13] DEBUG: Generated='cat' vs Expected='cat dog'
[05:25:13] DEBUG: Overlap=1, Precision=1.000, Recall=0.500
[05:25:13] DEBUG: F1=0.667, EM=0.0, Overlap=0.500
[05:25:13] DEBUG: Generated='water infinity' vs Expected='essential for life and survival'
[05:25:13] DEBUG: Overlap=0, Precision=0.000, Recall=0.000
[05:25:13] DEBUG: F1=0.000, EM=0.0, Overlap=0.000
[05:25:14] DEBUG: Generated='what turns you on' vs Expected='chlorophyll'
[05:25:14] DEBUG: Overlap=0, Precision=0.000, Recall=0.000
[05:25:14] DEBUG: F1=0.000, EM=0.0, Overlap=0.000
[05:25:15] DEBUG: Generated='the question' vs Expected='yes'
[05:25:15] DEBUG: Overlap=0, Precision=0.000, Recall=0.000
[05:25:15] DEBUG: F1=0.000, EM=0.0, Overlap=0.000
[05:25:15]   Progress: 10/50 - Recent F1: 0.317
[05:25:15] DEBUG: Generated='' vs Expected='yes'
[05:25:15] DEBUG: F1=0.000, EM=0.0, Overlap=0.000
[05:25:15] DEBUG: Generated='blue' vs Expected='red yellow blue'
[05:25:15] DEBUG: Overlap=1, Precision=1.000, Recall=0.333
[05:25:15] DEBUG: F1=0.500, EM=0.0, Overlap=0.333
[05:25:16] DEBUG: Generated='france' vs Expected='france'
[05:25:16] DEBUG: Overlap=1, Precision=1.000, Recall=1.000
[05:25:16] DEBUG: F1=1.000, EM=1.0, Overlap=1.000
[05:25:16] DEBUG: Generated='between the 10th and 13th centuries' vs Expected='10th and 11th centuries'
[05:25:16] DEBUG: Overlap=3, Precision=0.500, Recall=0.750
[05:25:16] DEBUG: F1=0.600, EM=0.0, Overlap=0.750
[05:25:17] DEBUG: Generated='iceland' vs Expected='denmark, iceland and norway'
[05:25:17] DEBUG: Overlap=1, Precision=1.000, Recall=0.250
[05:25:17] DEBUG: F1=0.400, EM=0.0, Overlap=0.250
[05:25:17] DEBUG: Generated='the norse leader' vs Expected='rollo'
[05:25:17] DEBUG: Overlap=0, Precision=0.000, Recall=0.000
[05:25:17] DEBUG: F1=0.000, EM=0.0, Overlap=0.000
[05:25:18] DEBUG: Generated='the european renaissance' vs Expected='10th century'
[05:25:18] DEBUG: Overlap=0, Precision=0.000, Recall=0.000
[05:25:18] DEBUG: F1=0.000, EM=0.0, Overlap=0.000
[05:25:19] DEBUG: Generated='the duke of normandy' vs Expected='william the conqueror'
[05:25:19] DEBUG: Overlap=1, Precision=0.250, Recall=0.333
[05:25:19] DEBUG: F1=0.286, EM=0.0, Overlap=0.333
[05:25:19] DEBUG: Generated='king' vs Expected='richard i'
[05:25:19] DEBUG: Overlap=0, Precision=0.000, Recall=0.000
[05:25:19] DEBUG: F1=0.000, EM=0.0, Overlap=0.000
[05:25:19] DEBUG: Generated='islam' vs Expected='catholic'
[05:25:19] DEBUG: Overlap=0, Precision=0.000, Recall=0.000
[05:25:19] DEBUG: F1=0.000, EM=0.0, Overlap=0.000
[05:25:19]   Progress: 20/50 - Recent F1: 0.279
[05:25:20] DEBUG: Generated='what turns you on?' vs Expected='viking'
[05:25:20] DEBUG: Overlap=0, Precision=0.000, Recall=0.000
[05:25:20] DEBUG: F1=0.000, EM=0.0, Overlap=0.000
[05:25:20] DEBUG: Generated='in 1024' vs Expected='9th century'
[05:25:20] DEBUG: Overlap=0, Precision=0.000, Recall=0.000
[05:25:20] DEBUG: F1=0.000, EM=0.0, Overlap=0.000
[05:25:20] DEBUG: Generated='987' vs Expected='911'
[05:25:20] DEBUG: Overlap=0, Precision=0.000, Recall=0.000
[05:25:20] DEBUG: F1=0.000, EM=0.0, Overlap=0.000
[05:25:20] DEBUG: Generated='the franks' vs Expected='king charles iii'
[05:25:20] DEBUG: Overlap=0, Precision=0.000, Recall=0.000
[05:25:20] DEBUG: F1=0.000, EM=0.0, Overlap=0.000
[05:25:21] DEBUG: Generated='the rio de janeiro' vs Expected='seine'
[05:25:21] DEBUG: Overlap=0, Precision=0.000, Recall=0.000
[05:25:21] DEBUG: F1=0.000, EM=0.0, Overlap=0.000
[05:25:21] DEBUG: Generated='the question' vs Expected='rollo'
[05:25:21] DEBUG: Overlap=0, Precision=0.000, Recall=0.000
[05:25:21] DEBUG: F1=0.000, EM=0.0, Overlap=0.000
[05:25:22] DEBUG: Generated='islam' vs Expected='catholicism'
[05:25:22] DEBUG: Overlap=0, Precision=0.000, Recall=0.000
[05:25:22] DEBUG: F1=0.000, EM=0.0, Overlap=0.000
[05:25:23] DEBUG: Generated='northern france' vs Expected='north'
[05:25:23] DEBUG: Overlap=0, Precision=0.000, Recall=0.000
[05:25:23] DEBUG: F1=0.000, EM=0.0, Overlap=0.000
[05:25:24] DEBUG: Generated='foodstuffs' vs Expected='fighting horsemen'
[05:25:24] DEBUG: Overlap=0, Precision=0.000, Recall=0.000
[05:25:24] DEBUG: F1=0.000, EM=0.0, Overlap=0.000
[05:25:24] DEBUG: Generated='byzantine empire' vs Expected='seljuk turks'
[05:25:24] DEBUG: Overlap=0, Precision=0.000, Recall=0.000
[05:25:24] DEBUG: F1=0.000, EM=0.0, Overlap=0.000
[05:25:24]   Progress: 30/50 - Recent F1: 0.000
[05:25:25] DEBUG: Generated='1984 -- 86' vs Expected='1050s'
[05:25:25] DEBUG: Overlap=0, Precision=0.000, Recall=0.000
[05:25:25] DEBUG: F1=0.000, EM=0.0, Overlap=0.000
[05:25:25] DEBUG: Generated='2017' vs Expected='1060s'
[05:25:25] DEBUG: Overlap=0, Precision=0.000, Recall=0.000
[05:25:25] DEBUG: F1=0.000, EM=0.0, Overlap=0.000
[05:25:25] DEBUG: Generated='his idea of kingship' vs Expected='alexius komnenos'
[05:25:25] DEBUG: Overlap=0, Precision=0.000, Recall=0.000
[05:25:25] DEBUG: F1=0.000, EM=0.0, Overlap=0.000
[05:25:26] DEBUG: Generated='the classic roman republic' vs Expected='afranji'
[05:25:26] DEBUG: Overlap=0, Precision=0.000, Recall=0.000
[05:25:26] DEBUG: F1=0.000, EM=0.0, Overlap=0.000
[05:25:26] DEBUG: Generated='charles martel' vs Expected='oursel'
[05:25:26] DEBUG: Overlap=0, Precision=0.000, Recall=0.000
[05:25:26] DEBUG: F1=0.000, EM=0.0, Overlap=0.000
[05:25:26] DEBUG: Generated='turkey' vs Expected='turkish forces'
[05:25:26] DEBUG: Overlap=0, Precision=0.000, Recall=0.000
[05:25:26] DEBUG: F1=0.000, EM=0.0, Overlap=0.000
[05:25:27] DEBUG: Generated='norman origin' vs Expected='norman mercenary'
[05:25:27] DEBUG: Overlap=1, Precision=0.500, Recall=0.500
[05:25:27] DEBUG: F1=0.500, EM=0.0, Overlap=0.500
[05:25:27] DEBUG: Generated='( last ) frederick iii' vs Expected='robert guiscard'
[05:25:27] DEBUG: Overlap=0, Precision=0.000, Recall=0.000
[05:25:27] DEBUG: F1=0.000, EM=0.0, Overlap=0.000
[05:25:28] DEBUG: Generated='what turns you on?' vs Expected='1082'
[05:25:28] DEBUG: Overlap=0, Precision=0.000, Recall=0.000
[05:25:28] DEBUG: F1=0.000, EM=0.0, Overlap=0.000
[05:25:28] DEBUG: Generated='3,000 infantry and 300 horsemen' vs Expected='30,000'
[05:25:28] DEBUG: Overlap=0, Precision=0.000, Recall=0.000
[05:25:28] DEBUG: F1=0.000, EM=0.0, Overlap=0.000
[05:25:28]   Progress: 40/50 - Recent F1: 0.050
[05:25:29] DEBUG: Generated='constantinople' vs Expected='deabolis'
[05:25:29] DEBUG: Overlap=0, Precision=0.000, Recall=0.000
[05:25:29] DEBUG: F1=0.000, EM=0.0, Overlap=0.000
[05:25:29] DEBUG: Generated='robert's son' vs Expected='bohemond'
[05:25:29] DEBUG: Overlap=0, Precision=0.000, Recall=0.000
[05:25:29] DEBUG: F1=0.000, EM=0.0, Overlap=0.000
[05:25:31] DEBUG: Generated='river sitka' vs Expected='deabolis'
[05:25:31] DEBUG: Overlap=0, Precision=0.000, Recall=0.000
[05:25:31] DEBUG: F1=0.000, EM=0.0, Overlap=0.000
[05:25:31] DEBUG: Generated='the battle of dyrrachium' vs Expected='1185'
[05:25:31] DEBUG: Overlap=0, Precision=0.000, Recall=0.000
[05:25:31] DEBUG: F1=0.000, EM=0.0, Overlap=0.000
[05:25:32] DEBUG: Generated='naval base or fort' vs Expected='dyrrachium'
[05:25:32] DEBUG: Overlap=0, Precision=0.000, Recall=0.000
[05:25:32] DEBUG: F1=0.000, EM=0.0, Overlap=0.000
[05:25:32] DEBUG: Generated='the fundamental question' vs Expected='the adriatic'
[05:25:32] DEBUG: Overlap=1, Precision=0.333, Recall=0.500
[05:25:32] DEBUG: F1=0.400, EM=0.0, Overlap=0.500
[05:25:32] DEBUG: Generated='the question' vs Expected='king ethelred ii'
[05:25:32] DEBUG: Overlap=0, Precision=0.000, Recall=0.000
[05:25:32] DEBUG: F1=0.000, EM=0.0, Overlap=0.000
[05:25:33] DEBUG: Generated='the fundamental question' vs Expected='duke richard ii'
[05:25:33] DEBUG: Overlap=0, Precision=0.000, Recall=0.000
[05:25:33] DEBUG: F1=0.000, EM=0.0, Overlap=0.000
[05:25:33] DEBUG: Generated='the king's question' vs Expected='normandy'
[05:25:33] DEBUG: Overlap=0, Precision=0.000, Recall=0.000
[05:25:33] DEBUG: F1=0.000, EM=0.0, Overlap=0.000
[05:25:33] DEBUG: Generated='ethelred' vs Expected='sweyn forkbeard'
[05:25:33] DEBUG: Overlap=0, Precision=0.000, Recall=0.000
[05:25:33] DEBUG: F1=0.000, EM=0.0, Overlap=0.000
[05:25:33]   Progress: 50/50 - Recent F1: 0.040
[05:25:33]    structured_response completed: F1=0.137, EM=0.060
[05:25:33] 
 Testing template: basic
[05:25:34] DEBUG: Generated='paris' vs Expected='paris'
[05:25:34] DEBUG: Overlap=1, Precision=1.000, Recall=1.000
[05:25:34] DEBUG: F1=1.000, EM=1.0, Overlap=1.000
[05:25:34] DEBUG: Generated='william shakespeare' vs Expected='william shakespeare'
[05:25:34] DEBUG: Overlap=2, Precision=1.000, Recall=1.000
[05:25:34] DEBUG: F1=1.000, EM=1.0, Overlap=1.000
[05:25:34] DEBUG: Generated='factorials n!' vs Expected='4'
[05:25:34] DEBUG: Overlap=0, Precision=0.000, Recall=0.000
[05:25:34] DEBUG: F1=0.000, EM=0.0, Overlap=0.000
[05:25:35] DEBUG: Generated='to convert light energy into chemical energy' vs Expected='process where plants make food from sunlight'
[05:25:35] DEBUG: Overlap=0, Precision=0.000, Recall=0.000
[05:25:35] DEBUG: F1=0.000, EM=0.0, Overlap=0.000
[05:25:35] DEBUG: Generated='numerical interpretation of numbers' vs Expected='they process information using electrical circuits'
[05:25:35] DEBUG: Overlap=0, Precision=0.000, Recall=0.000
[05:25:35] DEBUG: F1=0.000, EM=0.0, Overlap=0.000
[05:25:36] DEBUG: Generated='white' vs Expected='red blue green'
[05:25:36] DEBUG: Overlap=0, Precision=0.000, Recall=0.000
[05:25:36] DEBUG: F1=0.000, EM=0.0, Overlap=0.000
[05:25:36] DEBUG: Generated='amphibians' vs Expected='cat dog'
[05:25:36] DEBUG: Overlap=0, Precision=0.000, Recall=0.000
[05:25:36] DEBUG: F1=0.000, EM=0.0, Overlap=0.000
[05:25:37] DEBUG: Generated='all living things require water' vs Expected='essential for life and survival'
[05:25:37] DEBUG: Overlap=0, Precision=0.000, Recall=0.000
[05:25:37] DEBUG: F1=0.000, EM=0.0, Overlap=0.000
[05:25:38] DEBUG: Generated='chlorophyll' vs Expected='chlorophyll'
[05:25:38] DEBUG: Overlap=1, Precision=1.000, Recall=1.000
[05:25:38] DEBUG: F1=1.000, EM=1.0, Overlap=1.000
[05:25:39] DEBUG: Generated='ellipse' vs Expected='yes'
[05:25:39] DEBUG: Overlap=0, Precision=0.000, Recall=0.000
[05:25:39] DEBUG: F1=0.000, EM=0.0, Overlap=0.000
[05:25:39]   Progress: 10/50 - Recent F1: 0.300
[05:25:39] DEBUG: Generated='bird flight' vs Expected='yes'
[05:25:39] DEBUG: Overlap=0, Precision=0.000, Recall=0.000
[05:25:39] DEBUG: F1=0.000, EM=0.0, Overlap=0.000
[05:25:39] DEBUG: Generated='blue' vs Expected='red yellow blue'
[05:25:39] DEBUG: Overlap=1, Precision=1.000, Recall=0.333
[05:25:39] DEBUG: F1=0.500, EM=0.0, Overlap=0.333
[05:25:40] DEBUG: Generated='france' vs Expected='france'
[05:25:40] DEBUG: Overlap=1, Precision=1.000, Recall=1.000
[05:25:40] DEBUG: F1=1.000, EM=1.0, Overlap=1.000
[05:25:40] DEBUG: Generated='9th century -- 9th century' vs Expected='10th and 11th centuries'
[05:25:40] DEBUG: Overlap=0, Precision=0.000, Recall=0.000
[05:25:40] DEBUG: F1=0.000, EM=0.0, Overlap=0.000
[05:25:40] DEBUG: Generated='sweden' vs Expected='denmark, iceland and norway'
[05:25:40] DEBUG: Overlap=0, Precision=0.000, Recall=0.000
[05:25:40] DEBUG: F1=0.000, EM=0.0, Overlap=0.000
[05:25:41] DEBUG: Generated='cnut' vs Expected='rollo'
[05:25:41] DEBUG: Overlap=0, Precision=0.000, Recall=0.000
[05:25:41] DEBUG: F1=0.000, EM=0.0, Overlap=0.000
[05:25:41] DEBUG: Generated='the ninth century' vs Expected='10th century'
[05:25:41] DEBUG: Overlap=1, Precision=0.333, Recall=0.500
[05:25:41] DEBUG: F1=0.400, EM=0.0, Overlap=0.500
[05:25:41] DEBUG: Generated='william' vs Expected='william the conqueror'
[05:25:41] DEBUG: Overlap=1, Precision=1.000, Recall=0.333
[05:25:41] DEBUG: F1=0.500, EM=0.0, Overlap=0.333
[05:25:42] DEBUG: Generated='king charles iii of west francia' vs Expected='richard i'
[05:25:42] DEBUG: Overlap=0, Precision=0.000, Recall=0.000
[05:25:42] DEBUG: F1=0.000, EM=0.0, Overlap=0.000
[05:25:42] DEBUG: Generated='catholicism' vs Expected='catholic'
[05:25:42] DEBUG: Overlap=0, Precision=0.000, Recall=0.000
[05:25:42] DEBUG: F1=0.000, EM=0.0, Overlap=0.000
[05:25:42]   Progress: 20/50 - Recent F1: 0.240
[05:25:42] DEBUG: Generated='north' vs Expected='viking'
[05:25:42] DEBUG: Overlap=0, Precision=0.000, Recall=0.000
[05:25:42] DEBUG: F1=0.000, EM=0.0, Overlap=0.000
[05:25:42] DEBUG: Generated='1024' vs Expected='9th century'
[05:25:42] DEBUG: Overlap=0, Precision=0.000, Recall=0.000
[05:25:42] DEBUG: F1=0.000, EM=0.0, Overlap=0.000
[05:25:43] DEBUG: Generated='1066' vs Expected='911'
[05:25:43] DEBUG: Overlap=0, Precision=0.000, Recall=0.000
[05:25:43] DEBUG: F1=0.000, EM=0.0, Overlap=0.000
[05:25:43] DEBUG: Generated='charles the simple' vs Expected='king charles iii'
[05:25:43] DEBUG: Overlap=1, Precision=0.333, Recall=0.333
[05:25:43] DEBUG: F1=0.333, EM=0.0, Overlap=0.333
[05:25:44] DEBUG: Generated='elbe' vs Expected='seine'
[05:25:44] DEBUG: Overlap=0, Precision=0.000, Recall=0.000
[05:25:44] DEBUG: F1=0.000, EM=0.0, Overlap=0.000
[05:25:44] DEBUG: Generated='the byzantines' vs Expected='rollo'
[05:25:44] DEBUG: Overlap=0, Precision=0.000, Recall=0.000
[05:25:44] DEBUG: F1=0.000, EM=0.0, Overlap=0.000
[05:25:44] DEBUG: Generated='catholicism' vs Expected='catholicism'
[05:25:44] DEBUG: Overlap=1, Precision=1.000, Recall=1.000
[05:25:44] DEBUG: F1=1.000, EM=1.0, Overlap=1.000
[05:25:45] DEBUG: Generated='west france' vs Expected='north'
[05:25:45] DEBUG: Overlap=0, Precision=0.000, Recall=0.000
[05:25:45] DEBUG: F1=0.000, EM=0.0, Overlap=0.000
[05:25:45] DEBUG: Generated='cloth' vs Expected='fighting horsemen'
[05:25:45] DEBUG: Overlap=0, Precision=0.000, Recall=0.000
[05:25:45] DEBUG: F1=0.000, EM=0.0, Overlap=0.000
[05:25:46] DEBUG: Generated='hohenstaufen' vs Expected='seljuk turks'
[05:25:46] DEBUG: Overlap=0, Precision=0.000, Recall=0.000
[05:25:46] DEBUG: F1=0.000, EM=0.0, Overlap=0.000
[05:25:46]   Progress: 30/50 - Recent F1: 0.133
[05:25:47] DEBUG: Generated='1984 -- 86' vs Expected='1050s'
[05:25:47] DEBUG: Overlap=0, Precision=0.000, Recall=0.000
[05:25:47] DEBUG: F1=0.000, EM=0.0, Overlap=0.000
[05:25:47] DEBUG: Generated='862' vs Expected='1060s'
[05:25:47] DEBUG: Overlap=0, Precision=0.000, Recall=0.000
[05:25:47] DEBUG: F1=0.000, EM=0.0, Overlap=0.000
[05:25:47] DEBUG: Generated='henshaw' vs Expected='alexius komnenos'
[05:25:47] DEBUG: Overlap=0, Precision=0.000, Recall=0.000
[05:25:47] DEBUG: F1=0.000, EM=0.0, Overlap=0.000
[05:25:48] DEBUG: Generated='neath castle' vs Expected='afranji'
[05:25:48] DEBUG: Overlap=0, Precision=0.000, Recall=0.000
[05:25:48] DEBUG: F1=0.000, EM=0.0, Overlap=0.000
[05:25:48] DEBUG: Generated='theudebert i' vs Expected='oursel'
[05:25:48] DEBUG: Overlap=0, Precision=0.000, Recall=0.000
[05:25:48] DEBUG: F1=0.000, EM=0.0, Overlap=0.000
[05:25:48] DEBUG: Generated='turkey' vs Expected='turkish forces'
[05:25:48] DEBUG: Overlap=0, Precision=0.000, Recall=0.000
[05:25:48] DEBUG: F1=0.000, EM=0.0, Overlap=0.000
[05:25:49] DEBUG: Generated='english' vs Expected='norman mercenary'
[05:25:49] DEBUG: Overlap=0, Precision=0.000, Recall=0.000
[05:25:49] DEBUG: F1=0.000, EM=0.0, Overlap=0.000
[05:25:49] DEBUG: Generated='( last ) frederick iii' vs Expected='robert guiscard'
[05:25:49] DEBUG: Overlap=0, Precision=0.000, Recall=0.000
[05:25:49] DEBUG: F1=0.000, EM=0.0, Overlap=0.000
[05:25:50] DEBUG: Generated='10th century' vs Expected='1082'
[05:25:50] DEBUG: Overlap=0, Precision=0.000, Recall=0.000
[05:25:50] DEBUG: F1=0.000, EM=0.0, Overlap=0.000
[05:25:50] DEBUG: Generated='1,000,000' vs Expected='30,000'
[05:25:50] DEBUG: Overlap=0, Precision=0.000, Recall=0.000
[05:25:50] DEBUG: F1=0.000, EM=0.0, Overlap=0.000
[05:25:50]   Progress: 40/50 - Recent F1: 0.000
[05:25:50] DEBUG: Generated='constantinople' vs Expected='deabolis'
[05:25:50] DEBUG: Overlap=0, Precision=0.000, Recall=0.000
[05:25:50] DEBUG: F1=0.000, EM=0.0, Overlap=0.000
[05:25:51] DEBUG: Generated='steffon' vs Expected='bohemond'
[05:25:51] DEBUG: Overlap=0, Precision=0.000, Recall=0.000
[05:25:51] DEBUG: F1=0.000, EM=0.0, Overlap=0.000
[05:25:51] DEBUG: Generated='river irwell' vs Expected='deabolis'
[05:25:51] DEBUG: Overlap=0, Precision=0.000, Recall=0.000
[05:25:51] DEBUG: F1=0.000, EM=0.0, Overlap=0.000
[05:25:51] DEBUG: Generated='october 1174' vs Expected='1185'
[05:25:51] DEBUG: Overlap=0, Precision=0.000, Recall=0.000
[05:25:51] DEBUG: F1=0.000, EM=0.0, Overlap=0.000
[05:25:52] DEBUG: Generated='guantanamo bay naval base' vs Expected='dyrrachium'
[05:25:52] DEBUG: Overlap=0, Precision=0.000, Recall=0.000
[05:25:52] DEBUG: F1=0.000, EM=0.0, Overlap=0.000
[05:25:52] DEBUG: Generated='canada' vs Expected='the adriatic'
[05:25:52] DEBUG: Overlap=0, Precision=0.000, Recall=0.000
[05:25:52] DEBUG: F1=0.000, EM=0.0, Overlap=0.000
[05:25:53] DEBUG: Generated='will arnett' vs Expected='king ethelred ii'
[05:25:53] DEBUG: Overlap=0, Precision=0.000, Recall=0.000
[05:25:53] DEBUG: F1=0.000, EM=0.0, Overlap=0.000
[05:25:53] DEBUG: Generated='bradley spencer' vs Expected='duke richard ii'
[05:25:53] DEBUG: Overlap=0, Precision=0.000, Recall=0.000
[05:25:53] DEBUG: F1=0.000, EM=0.0, Overlap=0.000
[05:25:54] DEBUG: Generated='fled to be with ethelred' vs Expected='normandy'
[05:25:54] DEBUG: Overlap=0, Precision=0.000, Recall=0.000
[05:25:54] DEBUG: F1=0.000, EM=0.0, Overlap=0.000
[05:25:54] DEBUG: Generated='howard' vs Expected='sweyn forkbeard'
[05:25:54] DEBUG: Overlap=0, Precision=0.000, Recall=0.000
[05:25:54] DEBUG: F1=0.000, EM=0.0, Overlap=0.000
[05:25:54]   Progress: 50/50 - Recent F1: 0.000
[05:25:54]    basic completed: F1=0.135, EM=0.100
[05:25:54] 
 Experiment completed! Total results: 350
[05:25:54] 
 ANALYZING RESULTS...
[05:25:54] 
 TEMPLATE PERFORMANCE RANKING:
[05:25:54] --------------------------------------------------------------------------------
[05:25:54] Template             F1 Score   EM Score   Samples  Improvement 
[05:25:54] --------------------------------------------------------------------------------
[05:25:54] retrieval_focused    0.139     0.080     50       ++3.5%      
[05:25:54] confident_direct     0.138     0.080     50       ++2.2%      
[05:25:54] structured_response  0.137     0.060     50       ++1.8%      
[05:25:54] basic                0.135     0.100     50       BASELINE    
[05:25:54] instructional_clear  0.132     0.060     50       +-1.7%      
[05:25:54] context_guided       0.109     0.040     50       +-18.8%     
[05:25:54] knowledge_synthesis  0.084     0.040     50       +-37.4%     
[05:25:54] 
 SUCCESS ANALYSIS:
[05:25:54]    Best Template: retrieval_focused (F1: 0.139)
[05:25:54]    SUCCESS! Basic template relegated to rank 4
[05:25:54]    Template engineering shows measurable impact!
[05:25:54] 
 SAMPLE RESULTS:
[05:25:54] ======================================================================
[05:25:54] 
 Template: retrieval_focused (Rank 1)
[05:25:54]    Q: What is the capital of France?...
[05:25:54]    Expected: Paris
[05:25:54]    Generated: paris
[05:25:54]    Score: F1=1.000
[05:25:54]    Q: Who wrote Romeo and Juliet?...
[05:25:54]    Expected: William Shakespeare
[05:25:54]    Generated: william shakespeare
[05:25:54]    Score: F1=1.000
[05:25:54] 
 Template: confident_direct (Rank 2)
[05:25:54]    Q: What is the capital of France?...
[05:25:54]    Expected: Paris
[05:25:54]    Generated: paris
[05:25:54]    Score: F1=1.000
[05:25:54]    Q: Who wrote Romeo and Juliet?...
[05:25:54]    Expected: William Shakespeare
[05:25:54]    Generated: william shakespeare
[05:25:54]    Score: F1=1.000
[05:25:54] 
 Template: structured_response (Rank 3)
[05:25:54]    Q: What is the capital of France?...
[05:25:54]    Expected: Paris
[05:25:54]    Generated: paris
[05:25:54]    Score: F1=1.000
[05:25:54]    Q: Who wrote Romeo and Juliet?...
[05:25:54]    Expected: William Shakespeare
[05:25:54]    Generated: william shakespeare
[05:25:54]    Score: F1=1.000
[05:25:54] 
 Saving results...
[05:25:54]    Detailed results: ../results/Exp-250.csv
[05:25:54]    Summary: ../results/summary_20250814_052554.csv
[05:25:54]    Metadata: ../results/metadata_20250814_052554.json
[05:25:54] 
 TARGETED EXPERIMENT COMPLETED!
